tcpdump: verbose output suppressed, use -v or -vv for full protocol decode
listening on wlan0, link-type EN10MB (Ethernet), capture size 262144 bytes
00:54:15.583954 IP 192.168.1.10.41328 > sea15s07-in-f74.1e100.net.https: Flags [S], seq 1732501200, win 65535, options [mss 1460,sackOK,TS val 557499 ecr 0,nop,wscale 6], length 0
00:54:15.615729 IP sea15s07-in-f74.1e100.net.https > 192.168.1.10.41328: Flags [S.], seq 927824818, ack 1732501201, win 42408, options [mss 1360,sackOK,TS val 533505369 ecr 557499,nop,wscale 8], length 0
00:54:15.626298 IP 192.168.1.10.41328 > sea15s07-in-f74.1e100.net.https: Flags [.], ack 1, win 1369, options [nop,nop,TS val 557503 ecr 533505369], length 0
00:54:15.626324 IP 192.168.1.10.41328 > sea15s07-in-f74.1e100.net.https: Flags [P.], seq 1:170, ack 1, win 1369, options [nop,nop,TS val 557504 ecr 533505369], length 169
00:54:15.657874 IP sea15s07-in-f74.1e100.net.https > 192.168.1.10.41328: Flags [.], ack 170, win 170, options [nop,nop,TS val 533505411 ecr 557504], length 0
00:54:15.665230 IP sea15s07-in-f74.1e100.net.https > 192.168.1.10.41328: Flags [.], seq 1:1349, ack 170, win 170, options [nop,nop,TS val 533505418 ecr 557504], length 1348
00:54:15.665363 IP sea15s07-in-f74.1e100.net.https > 192.168.1.10.41328: Flags [.], seq 1349:2697, ack 170, win 170, options [nop,nop,TS val 533505418 ecr 557504], length 1348
00:54:15.665402 IP sea15s07-in-f74.1e100.net.https > 192.168.1.10.41328: Flags [P.], seq 2697:3269, ack 170, win 170, options [nop,nop,TS val 533505418 ecr 557504], length 572
00:54:15.686528 IP 192.168.1.10.41328 > sea15s07-in-f74.1e100.net.https: Flags [.], ack 1349, win 1411, options [nop,nop,TS val 557509 ecr 533505418], length 0
00:54:15.686543 IP 192.168.1.10.41328 > sea15s07-in-f74.1e100.net.https: Flags [.], ack 2697, win 1453, options [nop,nop,TS val 557509 ecr 533505418], length 0
00:54:15.686569 IP 192.168.1.10.41328 > sea15s07-in-f74.1e100.net.https: Flags [.], ack 3269, win 1496, options [nop,nop,TS val 557509 ecr 533505418], length 0
00:54:15.710189 IP 192.168.1.10.41328 > sea15s07-in-f74.1e100.net.https: Flags [P.], seq 170:412, ack 3269, win 1496, options [nop,nop,TS val 557511 ecr 533505418], length 242
00:54:15.742942 IP sea15s07-in-f74.1e100.net.https > 192.168.1.10.41328: Flags [P.], seq 3269:3312, ack 412, win 175, options [nop,nop,TS val 533505496 ecr 557511], length 43
00:54:15.750246 IP 192.168.1.10.41328 > sea15s07-in-f74.1e100.net.https: Flags [P.], seq 412:1318, ack 3312, win 1496, options [nop,nop,TS val 557516 ecr 533505496], length 906
00:54:15.822848 IP sea15s07-in-f74.1e100.net.https > 192.168.1.10.41328: Flags [.], ack 1318, win 182, options [nop,nop,TS val 533505535 ecr 557516], length 0
00:54:15.881238 IP sea15s07-in-f74.1e100.net.https > 192.168.1.10.41328: Flags [P.], seq 3312:3854, ack 1318, win 182, options [nop,nop,TS val 533505635 ecr 557516], length 542
00:54:15.881458 IP sea15s07-in-f74.1e100.net.https > 192.168.1.10.41328: Flags [P.], seq 3854:4088, ack 1318, win 182, options [nop,nop,TS val 533505635 ecr 557516], length 234
00:54:15.881562 IP sea15s07-in-f74.1e100.net.https > 192.168.1.10.41328: Flags [P.], seq 4088:4114, ack 1318, win 182, options [nop,nop,TS val 533505635 ecr 557516], length 26
00:54:15.915536 IP 192.168.1.10.41328 > sea15s07-in-f74.1e100.net.https: Flags [.], ack 4114, win 1538, options [nop,nop,TS val 557532 ecr 533505635], length 0
00:54:16.185263 IP 192.168.1.10.41328 > sea15s07-in-f74.1e100.net.https: Flags [P.], seq 1318:2226, ack 4114, win 1538, options [nop,nop,TS val 557560 ecr 533505635], length 908
00:54:16.217045 IP sea15s07-in-f74.1e100.net.https > 192.168.1.10.41328: Flags [.], ack 2226, win 189, options [nop,nop,TS val 533505970 ecr 557560], length 0
00:54:16.311631 IP sea15s07-in-f74.1e100.net.https > 192.168.1.10.41328: Flags [P.], seq 4114:4656, ack 2226, win 189, options [nop,nop,TS val 533506065 ecr 557560], length 542
00:54:16.311776 IP sea15s07-in-f74.1e100.net.https > 192.168.1.10.41328: Flags [P.], seq 4656:4908, ack 2226, win 189, options [nop,nop,TS val 533506065 ecr 557560], length 252
00:54:16.311857 IP sea15s07-in-f74.1e100.net.https > 192.168.1.10.41328: Flags [P.], seq 4908:4934, ack 2226, win 189, options [nop,nop,TS val 533506065 ecr 557560], length 26
00:54:16.409269 IP sea15s07-in-f74.1e100.net.https > 192.168.1.10.41328: Flags [P.], seq 4908:4934, ack 2226, win 189, options [nop,nop,TS val 533506163 ecr 557560], length 26
00:54:16.420292 IP 192.168.1.10.41328 > sea15s07-in-f74.1e100.net.https: Flags [P.], seq 1318:2226, ack 4114, win 1538, options [nop,nop,TS val 557584 ecr 533505635], length 908
00:54:16.424921 IP 192.168.1.10.41328 > sea15s07-in-f74.1e100.net.https: Flags [.], ack 4934, win 1580, options [nop,nop,TS val 557584 ecr 533506065,nop,nop,sack 1 {4908:4934}], length 0
00:54:16.452119 IP sea15s07-in-f74.1e100.net.https > 192.168.1.10.41328: Flags [.], ack 2226, win 189, options [nop,nop,TS val 533506205 ecr 557584,nop,nop,sack 1 {1318:2226}], length 0
00:54:16.661049 IP 192.168.1.10.41328 > sea15s07-in-f74.1e100.net.https: Flags [P.], seq 2226:3135, ack 4934, win 1580, options [nop,nop,TS val 557608 ecr 533506205], length 909
00:54:16.692629 IP sea15s07-in-f74.1e100.net.https > 192.168.1.10.41328: Flags [.], ack 3135, win 196, options [nop,nop,TS val 533506446 ecr 557608], length 0
00:54:16.788481 IP sea15s07-in-f74.1e100.net.https > 192.168.1.10.41328: Flags [P.], seq 4934:5476, ack 3135, win 196, options [nop,nop,TS val 533506542 ecr 557608], length 542
00:54:16.788774 IP sea15s07-in-f74.1e100.net.https > 192.168.1.10.41328: Flags [P.], seq 5476:5728, ack 3135, win 196, options [nop,nop,TS val 533506542 ecr 557608], length 252
00:54:16.788984 IP sea15s07-in-f74.1e100.net.https > 192.168.1.10.41328: Flags [P.], seq 5728:5754, ack 3135, win 196, options [nop,nop,TS val 533506542 ecr 557608], length 26
00:54:16.790292 IP 192.168.1.10.41328 > sea15s07-in-f74.1e100.net.https: Flags [.], ack 5476, win 1622, options [nop,nop,TS val 557621 ecr 533506542], length 0
00:54:16.790308 IP 192.168.1.10.41328 > sea15s07-in-f74.1e100.net.https: Flags [.], ack 5728, win 1622, options [nop,nop,TS val 557621 ecr 533506542], length 0
00:54:16.790328 IP 192.168.1.10.41328 > sea15s07-in-f74.1e100.net.https: Flags [.], ack 5754, win 1622, options [nop,nop,TS val 557621 ecr 533506542], length 0
00:54:20.576599 IP 192.168.1.10.41328 > sea15s07-in-f74.1e100.net.https: Flags [P.], seq 3135:4064, ack 5754, win 1622, options [nop,nop,TS val 557998 ecr 533506542], length 929
00:54:20.608343 IP sea15s07-in-f74.1e100.net.https > 192.168.1.10.41328: Flags [.], ack 4064, win 203, options [nop,nop,TS val 533510362 ecr 557998], length 0
00:54:20.709874 IP sea15s07-in-f74.1e100.net.https > 192.168.1.10.41328: Flags [P.], seq 5754:6296, ack 4064, win 203, options [nop,nop,TS val 533510463 ecr 557998], length 542
00:54:20.710168 IP sea15s07-in-f74.1e100.net.https > 192.168.1.10.41328: Flags [P.], seq 6296:6471, ack 4064, win 203, options [nop,nop,TS val 533510463 ecr 557998], length 175
00:54:20.710279 IP sea15s07-in-f74.1e100.net.https > 192.168.1.10.41328: Flags [P.], seq 6471:6497, ack 4064, win 203, options [nop,nop,TS val 533510463 ecr 557998], length 26
00:54:20.712216 IP 192.168.1.10.41328 > sea15s07-in-f74.1e100.net.https: Flags [.], ack 6296, win 1664, options [nop,nop,TS val 558013 ecr 533510463], length 0
00:54:20.712230 IP 192.168.1.10.41328 > sea15s07-in-f74.1e100.net.https: Flags [.], ack 6471, win 1664, options [nop,nop,TS val 558013 ecr 533510463], length 0
00:54:20.712249 IP 192.168.1.10.41328 > sea15s07-in-f74.1e100.net.https: Flags [.], ack 6497, win 1664, options [nop,nop,TS val 558013 ecr 533510463], length 0
00:54:20.770998 IP 192.168.1.10.36189 > sea15s12-in-f14.1e100.net.https: Flags [.], seq 560839397:560840745, ack 3296856830, win 2085, options [nop,nop,TS val 558018 ecr 3461358107], length 1348
00:54:20.771028 IP 192.168.1.10.36189 > sea15s12-in-f14.1e100.net.https: Flags [P.], seq 1348:1554, ack 1, win 2085, options [nop,nop,TS val 558018 ecr 3461358107], length 206
00:54:20.802698 IP sea15s12-in-f14.1e100.net.https > 192.168.1.10.36189: Flags [.], ack 1554, win 806, options [nop,nop,TS val 3461382353 ecr 558018], length 0
00:54:20.901951 IP 192.168.1.10.41328 > sea15s07-in-f74.1e100.net.https: Flags [P.], seq 4064:4993, ack 6497, win 1664, options [nop,nop,TS val 558032 ecr 533510463], length 929
00:54:20.924501 IP sea15s12-in-f14.1e100.net.https > 192.168.1.10.36189: Flags [P.], seq 1:505, ack 1554, win 811, options [nop,nop,TS val 3461382475 ecr 558018], length 504
00:54:20.924677 IP sea15s12-in-f14.1e100.net.https > 192.168.1.10.36189: Flags [P.], seq 505:940, ack 1554, win 811, options [nop,nop,TS val 3461382475 ecr 558018], length 435
00:54:20.924783 IP sea15s12-in-f14.1e100.net.https > 192.168.1.10.36189: Flags [P.], seq 940:966, ack 1554, win 811, options [nop,nop,TS val 3461382475 ecr 558018], length 26
00:54:20.933516 IP sea15s07-in-f74.1e100.net.https > 192.168.1.10.41328: Flags [.], ack 4993, win 210, options [nop,nop,TS val 533510687 ecr 558032], length 0
00:54:21.005997 IP 192.168.1.10.36189 > sea15s12-in-f14.1e100.net.https: Flags [.], ack 505, win 2085, options [nop,nop,TS val 558035 ecr 3461382475], length 0
00:54:21.006011 IP 192.168.1.10.36189 > sea15s12-in-f14.1e100.net.https: Flags [.], ack 940, win 2085, options [nop,nop,TS val 558035 ecr 3461382475], length 0
00:54:21.006032 IP 192.168.1.10.36189 > sea15s12-in-f14.1e100.net.https: Flags [.], ack 966, win 2085, options [nop,nop,TS val 558035 ecr 3461382475], length 0
00:54:21.031993 IP sea15s07-in-f74.1e100.net.https > 192.168.1.10.41328: Flags [P.], seq 6497:7039, ack 4993, win 210, options [nop,nop,TS val 533510785 ecr 558032], length 542
00:54:21.032275 IP sea15s07-in-f74.1e100.net.https > 192.168.1.10.41328: Flags [P.], seq 7039:7190, ack 4993, win 210, options [nop,nop,TS val 533510786 ecr 558032], length 151
00:54:21.032378 IP sea15s07-in-f74.1e100.net.https > 192.168.1.10.41328: Flags [P.], seq 7190:7216, ack 4993, win 210, options [nop,nop,TS val 533510786 ecr 558032], length 26
00:54:21.063024 IP 192.168.1.10.41328 > sea15s07-in-f74.1e100.net.https: Flags [.], ack 7039, win 1706, options [nop,nop,TS val 558046 ecr 533510785], length 0
00:54:21.063037 IP 192.168.1.10.41328 > sea15s07-in-f74.1e100.net.https: Flags [.], ack 7190, win 1706, options [nop,nop,TS val 558046 ecr 533510786], length 0
00:54:21.063053 IP 192.168.1.10.41328 > sea15s07-in-f74.1e100.net.https: Flags [.], ack 7216, win 1706, options [nop,nop,TS val 558046 ecr 533510786], length 0
00:54:23.208752 IP 192.168.1.10.41328 > sea15s07-in-f74.1e100.net.https: Flags [P.], seq 4993:5934, ack 7216, win 1706, options [nop,nop,TS val 558262 ecr 533510786], length 941
00:54:23.240527 IP sea15s07-in-f74.1e100.net.https > 192.168.1.10.41328: Flags [.], ack 5934, win 218, options [nop,nop,TS val 533512994 ecr 558262], length 0
00:54:23.340557 IP sea15s07-in-f74.1e100.net.https > 192.168.1.10.41328: Flags [P.], seq 7216:7758, ack 5934, win 218, options [nop,nop,TS val 533513094 ecr 558262], length 542
00:54:23.340787 IP sea15s07-in-f74.1e100.net.https > 192.168.1.10.41328: Flags [P.], seq 7758:7825, ack 5934, win 218, options [nop,nop,TS val 533513094 ecr 558262], length 67
00:54:23.340897 IP sea15s07-in-f74.1e100.net.https > 192.168.1.10.41328: Flags [P.], seq 7825:7851, ack 5934, win 218, options [nop,nop,TS val 533513094 ecr 558262], length 26
00:54:23.345157 IP 192.168.1.10.41328 > sea15s07-in-f74.1e100.net.https: Flags [.], ack 7758, win 1748, options [nop,nop,TS val 558276 ecr 533513094], length 0
00:54:23.345173 IP 192.168.1.10.41328 > sea15s07-in-f74.1e100.net.https: Flags [.], ack 7825, win 1748, options [nop,nop,TS val 558276 ecr 533513094], length 0
00:54:23.345194 IP 192.168.1.10.41328 > sea15s07-in-f74.1e100.net.https: Flags [.], ack 7851, win 1748, options [nop,nop,TS val 558276 ecr 533513094], length 0
00:54:24.723992 IP 192.168.1.10.41328 > sea15s07-in-f74.1e100.net.https: Flags [P.], seq 5934:6881, ack 7851, win 1748, options [nop,nop,TS val 558414 ecr 533513094], length 947
00:54:24.755676 IP sea15s07-in-f74.1e100.net.https > 192.168.1.10.41328: Flags [.], ack 6881, win 225, options [nop,nop,TS val 533514509 ecr 558414], length 0
00:54:24.853893 IP sea15s07-in-f74.1e100.net.https > 192.168.1.10.41328: Flags [P.], seq 7851:8393, ack 6881, win 225, options [nop,nop,TS val 533514607 ecr 558414], length 542
00:54:24.854274 IP sea15s07-in-f74.1e100.net.https > 192.168.1.10.41328: Flags [P.], seq 8393:8623, ack 6881, win 225, options [nop,nop,TS val 533514608 ecr 558414], length 230
00:54:24.854455 IP sea15s07-in-f74.1e100.net.https > 192.168.1.10.41328: Flags [P.], seq 8623:8649, ack 6881, win 225, options [nop,nop,TS val 533514608 ecr 558414], length 26
00:54:24.856870 IP 192.168.1.10.41328 > sea15s07-in-f74.1e100.net.https: Flags [.], ack 8393, win 1790, options [nop,nop,TS val 558427 ecr 533514607], length 0
00:54:24.856890 IP 192.168.1.10.41328 > sea15s07-in-f74.1e100.net.https: Flags [.], ack 8623, win 1790, options [nop,nop,TS val 558427 ecr 533514608], length 0
00:54:24.856910 IP 192.168.1.10.41328 > sea15s07-in-f74.1e100.net.https: Flags [.], ack 8649, win 1790, options [nop,nop,TS val 558427 ecr 533514608], length 0
00:54:26.035324 IP 192.168.1.10.41328 > sea15s07-in-f74.1e100.net.https: Flags [P.], seq 6881:7839, ack 8649, win 1790, options [nop,nop,TS val 558545 ecr 533514608], length 958
00:54:26.067175 IP sea15s07-in-f74.1e100.net.https > 192.168.1.10.41328: Flags [.], ack 7839, win 233, options [nop,nop,TS val 533515821 ecr 558545], length 0
00:54:26.190352 IP sea15s07-in-f74.1e100.net.https > 192.168.1.10.41328: Flags [P.], seq 8649:9191, ack 7839, win 233, options [nop,nop,TS val 533515944 ecr 558545], length 542
00:54:26.191189 IP sea15s07-in-f74.1e100.net.https > 192.168.1.10.41328: Flags [P.], seq 9191:9443, ack 7839, win 233, options [nop,nop,TS val 533515945 ecr 558545], length 252
00:54:26.191328 IP sea15s07-in-f74.1e100.net.https > 192.168.1.10.41328: Flags [P.], seq 9443:9469, ack 7839, win 233, options [nop,nop,TS val 533515945 ecr 558545], length 26
00:54:26.192986 IP 192.168.1.10.41328 > sea15s07-in-f74.1e100.net.https: Flags [.], ack 9191, win 1833, options [nop,nop,TS val 558561 ecr 533515944], length 0
00:54:26.193001 IP 192.168.1.10.41328 > sea15s07-in-f74.1e100.net.https: Flags [.], ack 9443, win 1833, options [nop,nop,TS val 558561 ecr 533515945], length 0
00:54:26.193021 IP 192.168.1.10.41328 > sea15s07-in-f74.1e100.net.https: Flags [.], ack 9469, win 1833, options [nop,nop,TS val 558561 ecr 533515945], length 0
00:54:29.243966 IP 192.168.1.10.41328 > sea15s07-in-f74.1e100.net.https: Flags [P.], seq 7839:8818, ack 9469, win 1833, options [nop,nop,TS val 558866 ecr 533515945], length 979
00:54:29.275866 IP sea15s07-in-f74.1e100.net.https > 192.168.1.10.41328: Flags [.], ack 8818, win 240, options [nop,nop,TS val 533519029 ecr 558866], length 0
00:54:29.373238 IP sea15s07-in-f74.1e100.net.https > 192.168.1.10.41328: Flags [P.], seq 9469:10011, ack 8818, win 240, options [nop,nop,TS val 533519127 ecr 558866], length 542
00:54:29.373423 IP sea15s07-in-f74.1e100.net.https > 192.168.1.10.41328: Flags [P.], seq 10011:10109, ack 8818, win 240, options [nop,nop,TS val 533519127 ecr 558866], length 98
00:54:29.373534 IP sea15s07-in-f74.1e100.net.https > 192.168.1.10.41328: Flags [P.], seq 10109:10135, ack 8818, win 240, options [nop,nop,TS val 533519127 ecr 558866], length 26
00:54:29.378696 IP 192.168.1.10.41328 > sea15s07-in-f74.1e100.net.https: Flags [.], ack 10011, win 1875, options [nop,nop,TS val 558879 ecr 533519127], length 0
00:54:29.378715 IP 192.168.1.10.41328 > sea15s07-in-f74.1e100.net.https: Flags [.], ack 10109, win 1875, options [nop,nop,TS val 558879 ecr 533519127], length 0
00:54:29.378735 IP 192.168.1.10.41328 > sea15s07-in-f74.1e100.net.https: Flags [.], ack 10135, win 1875, options [nop,nop,TS val 558879 ecr 533519127], length 0
00:54:30.867240 IP 192.168.1.10.60789 > sea15s07-in-f14.1e100.net.https: Flags [S], seq 3550944628, win 65535, options [mss 1460,sackOK,TS val 559028 ecr 0,nop,wscale 6], length 0
00:54:30.899959 IP sea15s07-in-f14.1e100.net.https > 192.168.1.10.60789: Flags [S.], seq 1791597780, ack 3550944629, win 42408, options [mss 1360,sackOK,TS val 593248162 ecr 559028,nop,wscale 8], length 0
00:54:30.903503 IP 192.168.1.10.60789 > sea15s07-in-f14.1e100.net.https: Flags [.], ack 1, win 1369, options [nop,nop,TS val 559032 ecr 593248162], length 0
00:54:30.903530 IP 192.168.1.10.60789 > sea15s07-in-f14.1e100.net.https: Flags [P.], seq 1:186, ack 1, win 1369, options [nop,nop,TS val 559032 ecr 593248162], length 185
00:54:30.936027 IP sea15s07-in-f14.1e100.net.https > 192.168.1.10.60789: Flags [.], ack 186, win 170, options [nop,nop,TS val 593248198 ecr 559032], length 0
00:54:30.945652 IP sea15s07-in-f14.1e100.net.https > 192.168.1.10.60789: Flags [.], seq 1:1349, ack 186, win 170, options [nop,nop,TS val 593248207 ecr 559032], length 1348
00:54:30.945715 IP sea15s07-in-f14.1e100.net.https > 192.168.1.10.60789: Flags [.], seq 1349:2697, ack 186, win 170, options [nop,nop,TS val 593248207 ecr 559032], length 1348
00:54:30.945749 IP sea15s07-in-f14.1e100.net.https > 192.168.1.10.60789: Flags [P.], seq 2697:2888, ack 186, win 170, options [nop,nop,TS val 593248207 ecr 559032], length 191
00:54:30.953742 IP 192.168.1.10.60789 > sea15s07-in-f14.1e100.net.https: Flags [.], ack 1349, win 1411, options [nop,nop,TS val 559036 ecr 593248207], length 0
00:54:30.953755 IP 192.168.1.10.60789 > sea15s07-in-f14.1e100.net.https: Flags [.], ack 2697, win 1453, options [nop,nop,TS val 559036 ecr 593248207], length 0
00:54:30.953770 IP 192.168.1.10.60789 > sea15s07-in-f14.1e100.net.https: Flags [.], ack 2888, win 1453, options [nop,nop,TS val 559036 ecr 593248207], length 0
00:54:30.985800 IP 192.168.1.10.60789 > sea15s07-in-f14.1e100.net.https: Flags [P.], seq 186:271, ack 2888, win 1453, options [nop,nop,TS val 559040 ecr 593248207], length 85
00:54:31.018620 IP sea15s07-in-f14.1e100.net.https > 192.168.1.10.60789: Flags [P.], seq 2888:3164, ack 271, win 170, options [nop,nop,TS val 593248281 ecr 559040], length 276
00:54:31.040422 IP 192.168.1.10.60789 > sea15s07-in-f14.1e100.net.https: Flags [P.], seq 271:596, ack 3164, win 1496, options [nop,nop,TS val 559044 ecr 593248281], length 325
00:54:31.097749 IP sea15s07-in-f14.1e100.net.https > 192.168.1.10.60789: Flags [P.], seq 3164:3826, ack 596, win 175, options [nop,nop,TS val 593248360 ecr 559044], length 662
00:54:31.166053 IP 192.168.1.10.60789 > sea15s07-in-f14.1e100.net.https: Flags [.], ack 3826, win 1538, options [nop,nop,TS val 559056 ecr 593248360], length 0
00:54:31.236834 IP 192.168.1.10.60789 > sea15s07-in-f14.1e100.net.https: Flags [P.], seq 596:1336, ack 3826, win 1538, options [nop,nop,TS val 559065 ecr 593248360], length 740
00:54:31.277097 IP sea15s07-in-f14.1e100.net.https > 192.168.1.10.60789: Flags [P.], seq 3826:4232, ack 1336, win 180, options [nop,nop,TS val 593248539 ecr 559065], length 406
00:54:31.282299 IP 192.168.1.10.60789 > sea15s07-in-f14.1e100.net.https: Flags [.], ack 4232, win 1580, options [nop,nop,TS val 559069 ecr 593248539], length 0
00:54:34.405968 IP 192.168.1.10.41328 > sea15s07-in-f74.1e100.net.https: Flags [P.], seq 8818:9812, ack 10135, win 1875, options [nop,nop,TS val 559382 ecr 533519127], length 994
00:54:34.438707 IP sea15s07-in-f74.1e100.net.https > 192.168.1.10.41328: Flags [.], ack 9812, win 248, options [nop,nop,TS val 533524192 ecr 559382], length 0
00:54:34.535568 IP sea15s07-in-f74.1e100.net.https > 192.168.1.10.41328: Flags [P.], seq 10135:10677, ack 9812, win 248, options [nop,nop,TS val 533524289 ecr 559382], length 542
00:54:34.536299 IP sea15s07-in-f74.1e100.net.https > 192.168.1.10.41328: Flags [P.], seq 10677:10776, ack 9812, win 248, options [nop,nop,TS val 533524290 ecr 559382], length 99
00:54:34.536471 IP sea15s07-in-f74.1e100.net.https > 192.168.1.10.41328: Flags [P.], seq 10776:10802, ack 9812, win 248, options [nop,nop,TS val 533524290 ecr 559382], length 26
00:54:34.548436 IP 192.168.1.10.41328 > sea15s07-in-f74.1e100.net.https: Flags [.], ack 10677, win 1917, options [nop,nop,TS val 559395 ecr 533524289], length 0
00:54:34.548452 IP 192.168.1.10.41328 > sea15s07-in-f74.1e100.net.https: Flags [.], ack 10776, win 1917, options [nop,nop,TS val 559395 ecr 533524290], length 0
00:54:34.548471 IP 192.168.1.10.41328 > sea15s07-in-f74.1e100.net.https: Flags [.], ack 10802, win 1917, options [nop,nop,TS val 559395 ecr 533524290], length 0
00:54:36.058183 IP 192.168.1.10.41328 > sea15s07-in-f74.1e100.net.https: Flags [P.], seq 9812:10810, ack 10802, win 1917, options [nop,nop,TS val 559547 ecr 533524290], length 998
00:54:36.089956 IP sea15s07-in-f74.1e100.net.https > 192.168.1.10.41328: Flags [.], ack 10810, win 256, options [nop,nop,TS val 533525843 ecr 559547], length 0
00:54:36.186658 IP sea15s07-in-f74.1e100.net.https > 192.168.1.10.41328: Flags [P.], seq 10802:11344, ack 10810, win 256, options [nop,nop,TS val 533525940 ecr 559547], length 542
00:54:36.187592 IP sea15s07-in-f74.1e100.net.https > 192.168.1.10.41328: Flags [P.], seq 11344:11655, ack 10810, win 256, options [nop,nop,TS val 533525941 ecr 559547], length 311
00:54:36.187694 IP sea15s07-in-f74.1e100.net.https > 192.168.1.10.41328: Flags [P.], seq 11655:11681, ack 10810, win 256, options [nop,nop,TS val 533525941 ecr 559547], length 26
00:54:36.218906 IP 192.168.1.10.41328 > sea15s07-in-f74.1e100.net.https: Flags [.], ack 11344, win 1959, options [nop,nop,TS val 559560 ecr 533525940], length 0
00:54:36.218924 IP 192.168.1.10.41328 > sea15s07-in-f74.1e100.net.https: Flags [.], ack 11655, win 2001, options [nop,nop,TS val 559561 ecr 533525941], length 0
00:54:36.218946 IP 192.168.1.10.41328 > sea15s07-in-f74.1e100.net.https: Flags [.], ack 11681, win 2001, options [nop,nop,TS val 559561 ecr 533525941], length 0
00:54:39.604244 IP 192.168.1.10.41328 > sea15s07-in-f74.1e100.net.https: Flags [P.], seq 10810:11829, ack 11681, win 2001, options [nop,nop,TS val 559902 ecr 533525941], length 1019
00:54:39.635834 IP sea15s07-in-f74.1e100.net.https > 192.168.1.10.41328: Flags [.], ack 11829, win 264, options [nop,nop,TS val 533529389 ecr 559902], length 0
00:54:39.732628 IP sea15s07-in-f74.1e100.net.https > 192.168.1.10.41328: Flags [P.], seq 11681:12223, ack 11829, win 264, options [nop,nop,TS val 533529486 ecr 559902], length 542
00:54:39.732869 IP sea15s07-in-f74.1e100.net.https > 192.168.1.10.41328: Flags [P.], seq 12223:12536, ack 11829, win 264, options [nop,nop,TS val 533529486 ecr 559902], length 313
00:54:39.732976 IP sea15s07-in-f74.1e100.net.https > 192.168.1.10.41328: Flags [P.], seq 12536:12562, ack 11829, win 264, options [nop,nop,TS val 533529486 ecr 559902], length 26
00:54:39.736912 IP 192.168.1.10.41328 > sea15s07-in-f74.1e100.net.https: Flags [.], ack 12223, win 2043, options [nop,nop,TS val 559915 ecr 533529486], length 0
00:54:39.736930 IP 192.168.1.10.41328 > sea15s07-in-f74.1e100.net.https: Flags [.], ack 12536, win 2085, options [nop,nop,TS val 559915 ecr 533529486], length 0
00:54:39.736954 IP 192.168.1.10.41328 > sea15s07-in-f74.1e100.net.https: Flags [.], ack 12562, win 2085, options [nop,nop,TS val 559915 ecr 533529486], length 0
00:54:39.889580 IP 192.168.1.10.41328 > sea15s07-in-f74.1e100.net.https: Flags [P.], seq 11829:12849, ack 12562, win 2085, options [nop,nop,TS val 559931 ecr 533529486], length 1020
00:54:39.921206 IP sea15s07-in-f74.1e100.net.https > 192.168.1.10.41328: Flags [.], ack 12849, win 272, options [nop,nop,TS val 533529675 ecr 559931], length 0
00:54:40.019483 IP sea15s07-in-f74.1e100.net.https > 192.168.1.10.41328: Flags [P.], seq 12562:13104, ack 12849, win 272, options [nop,nop,TS val 533529773 ecr 559931], length 542
00:54:40.019671 IP sea15s07-in-f74.1e100.net.https > 192.168.1.10.41328: Flags [P.], seq 13104:13262, ack 12849, win 272, options [nop,nop,TS val 533529773 ecr 559931], length 158
00:54:40.019791 IP sea15s07-in-f74.1e100.net.https > 192.168.1.10.41328: Flags [P.], seq 13262:13288, ack 12849, win 272, options [nop,nop,TS val 533529773 ecr 559931], length 26
00:54:40.022476 IP 192.168.1.10.41328 > sea15s07-in-f74.1e100.net.https: Flags [.], ack 13104, win 2127, options [nop,nop,TS val 559944 ecr 533529773], length 0
00:54:40.022493 IP 192.168.1.10.41328 > sea15s07-in-f74.1e100.net.https: Flags [.], ack 13262, win 2127, options [nop,nop,TS val 559944 ecr 533529773], length 0
00:54:40.022511 IP 192.168.1.10.41328 > sea15s07-in-f74.1e100.net.https: Flags [.], ack 13288, win 2127, options [nop,nop,TS val 559944 ecr 533529773], length 0
00:54:40.114785 IP 192.168.1.10.41328 > sea15s07-in-f74.1e100.net.https: Flags [P.], seq 12849:13869, ack 13288, win 2127, options [nop,nop,TS val 559953 ecr 533529773], length 1020
00:54:40.146598 IP sea15s07-in-f74.1e100.net.https > 192.168.1.10.41328: Flags [.], ack 13869, win 280, options [nop,nop,TS val 533529900 ecr 559953], length 0
00:54:40.241823 IP sea15s07-in-f74.1e100.net.https > 192.168.1.10.41328: Flags [P.], seq 13288:13830, ack 13869, win 280, options [nop,nop,TS val 533529995 ecr 559953], length 542
00:54:40.242159 IP sea15s07-in-f74.1e100.net.https > 192.168.1.10.41328: Flags [P.], seq 13830:14131, ack 13869, win 280, options [nop,nop,TS val 533529996 ecr 559953], length 301
00:54:40.242333 IP sea15s07-in-f74.1e100.net.https > 192.168.1.10.41328: Flags [P.], seq 14131:14157, ack 13869, win 280, options [nop,nop,TS val 533529996 ecr 559953], length 26
00:54:40.252798 IP 192.168.1.10.41328 > sea15s07-in-f74.1e100.net.https: Flags [.], ack 13830, win 2170, options [nop,nop,TS val 559966 ecr 533529995], length 0
00:54:40.252813 IP 192.168.1.10.41328 > sea15s07-in-f74.1e100.net.https: Flags [.], ack 14131, win 2170, options [nop,nop,TS val 559966 ecr 533529996], length 0
00:54:40.252846 IP 192.168.1.10.41328 > sea15s07-in-f74.1e100.net.https: Flags [.], ack 14157, win 2170, options [nop,nop,TS val 559966 ecr 533529996], length 0
00:54:42.658900 IP 192.168.1.10.41328 > sea15s07-in-f74.1e100.net.https: Flags [P.], seq 13869:14900, ack 14157, win 2170, options [nop,nop,TS val 560207 ecr 533529996], length 1031
00:54:42.690787 IP sea15s07-in-f74.1e100.net.https > 192.168.1.10.41328: Flags [.], ack 14900, win 290, options [nop,nop,TS val 533532444 ecr 560207], length 0
00:54:42.788816 IP sea15s07-in-f74.1e100.net.https > 192.168.1.10.41328: Flags [P.], seq 14157:14699, ack 14900, win 290, options [nop,nop,TS val 533532542 ecr 560207], length 542
00:54:42.789005 IP sea15s07-in-f74.1e100.net.https > 192.168.1.10.41328: Flags [P.], seq 14699:14825, ack 14900, win 290, options [nop,nop,TS val 533532542 ecr 560207], length 126
00:54:42.789121 IP sea15s07-in-f74.1e100.net.https > 192.168.1.10.41328: Flags [P.], seq 14825:14851, ack 14900, win 290, options [nop,nop,TS val 533532542 ecr 560207], length 26
00:54:42.796342 IP 192.168.1.10.41328 > sea15s07-in-f74.1e100.net.https: Flags [.], ack 14699, win 2212, options [nop,nop,TS val 560221 ecr 533532542], length 0
00:54:42.796378 IP 192.168.1.10.41328 > sea15s07-in-f74.1e100.net.https: Flags [.], ack 14825, win 2212, options [nop,nop,TS val 560221 ecr 533532542], length 0
00:54:42.796399 IP 192.168.1.10.41328 > sea15s07-in-f74.1e100.net.https: Flags [.], ack 14851, win 2212, options [nop,nop,TS val 560221 ecr 533532542], length 0
00:54:45.935018 IP 192.168.1.10.41328 > sea15s07-in-f74.1e100.net.https: Flags [P.], seq 14900:15949, ack 14851, win 2212, options [nop,nop,TS val 560535 ecr 533532542], length 1049
00:54:45.966676 IP sea15s07-in-f74.1e100.net.https > 192.168.1.10.41328: Flags [.], ack 15949, win 301, options [nop,nop,TS val 533535720 ecr 560535], length 0
00:54:46.066192 IP sea15s07-in-f74.1e100.net.https > 192.168.1.10.41328: Flags [P.], seq 14851:15393, ack 15949, win 301, options [nop,nop,TS val 533535820 ecr 560535], length 542
00:54:46.066666 IP sea15s07-in-f74.1e100.net.https > 192.168.1.10.41328: Flags [P.], seq 15393:15460, ack 15949, win 301, options [nop,nop,TS val 533535820 ecr 560535], length 67
00:54:46.066797 IP sea15s07-in-f74.1e100.net.https > 192.168.1.10.41328: Flags [P.], seq 15460:15486, ack 15949, win 301, options [nop,nop,TS val 533535820 ecr 560535], length 26
00:54:46.067835 IP 192.168.1.10.41328 > sea15s07-in-f74.1e100.net.https: Flags [.], ack 15393, win 2254, options [nop,nop,TS val 560548 ecr 533535820], length 0
00:54:46.067865 IP 192.168.1.10.41328 > sea15s07-in-f74.1e100.net.https: Flags [.], ack 15460, win 2254, options [nop,nop,TS val 560548 ecr 533535820], length 0
00:54:46.069030 IP 192.168.1.10.41328 > sea15s07-in-f74.1e100.net.https: Flags [.], ack 15486, win 2254, options [nop,nop,TS val 560549 ecr 533535820], length 0
00:54:47.112183 IP 192.168.1.10.41328 > sea15s07-in-f74.1e100.net.https: Flags [P.], seq 15949:17003, ack 15486, win 2254, options [nop,nop,TS val 560652 ecr 533535820], length 1054
00:54:47.143967 IP sea15s07-in-f74.1e100.net.https > 192.168.1.10.41328: Flags [.], ack 17003, win 312, options [nop,nop,TS val 533536897 ecr 560652], length 0
00:54:47.242919 IP sea15s07-in-f74.1e100.net.https > 192.168.1.10.41328: Flags [P.], seq 15486:16028, ack 17003, win 312, options [nop,nop,TS val 533536996 ecr 560652], length 542
00:54:47.243109 IP sea15s07-in-f74.1e100.net.https > 192.168.1.10.41328: Flags [P.], seq 16028:16253, ack 17003, win 312, options [nop,nop,TS val 533536997 ecr 560652], length 225
00:54:47.243288 IP sea15s07-in-f74.1e100.net.https > 192.168.1.10.41328: Flags [P.], seq 16253:16279, ack 17003, win 312, options [nop,nop,TS val 533536997 ecr 560652], length 26
00:54:47.247728 IP 192.168.1.10.41328 > sea15s07-in-f74.1e100.net.https: Flags [.], ack 16028, win 2296, options [nop,nop,TS val 560666 ecr 533536996], length 0
00:54:47.247744 IP 192.168.1.10.41328 > sea15s07-in-f74.1e100.net.https: Flags [.], ack 16253, win 2296, options [nop,nop,TS val 560666 ecr 533536997], length 0
00:54:47.247764 IP 192.168.1.10.41328 > sea15s07-in-f74.1e100.net.https: Flags [.], ack 16279, win 2296, options [nop,nop,TS val 560666 ecr 533536997], length 0
00:54:49.310327 IP 192.168.1.10.41328 > sea15s07-in-f74.1e100.net.https: Flags [P.], seq 17003:18075, ack 16279, win 2296, options [nop,nop,TS val 560872 ecr 533536997], length 1072
00:54:49.342201 IP sea15s07-in-f74.1e100.net.https > 192.168.1.10.41328: Flags [.], ack 18075, win 322, options [nop,nop,TS val 533539096 ecr 560872], length 0
00:54:49.440167 IP sea15s07-in-f74.1e100.net.https > 192.168.1.10.41328: Flags [P.], seq 16279:16821, ack 18075, win 322, options [nop,nop,TS val 533539194 ecr 560872], length 542
00:54:49.440354 IP sea15s07-in-f74.1e100.net.https > 192.168.1.10.41328: Flags [P.], seq 16821:16952, ack 18075, win 322, options [nop,nop,TS val 533539194 ecr 560872], length 131
00:54:49.443030 IP 192.168.1.10.41328 > sea15s07-in-f74.1e100.net.https: Flags [.], ack 16821, win 2338, options [nop,nop,TS val 560886 ecr 533539194], length 0
00:54:49.443055 IP 192.168.1.10.41328 > sea15s07-in-f74.1e100.net.https: Flags [.], ack 16952, win 2338, options [nop,nop,TS val 560886 ecr 533539194], length 0
00:54:51.517521 IP 192.168.1.10.41328 > sea15s07-in-f74.1e100.net.https: Flags [P.], seq 18075:19155, ack 16952, win 2338, options [nop,nop,TS val 561092 ecr 533539194], length 1080
00:54:51.549385 IP sea15s07-in-f74.1e100.net.https > 192.168.1.10.41328: Flags [.], ack 19155, win 333, options [nop,nop,TS val 533541303 ecr 561092], length 0
00:54:51.648705 IP sea15s07-in-f74.1e100.net.https > 192.168.1.10.41328: Flags [P.], seq 16952:17494, ack 19155, win 333, options [nop,nop,TS val 533541402 ecr 561092], length 542
00:54:51.648908 IP sea15s07-in-f74.1e100.net.https > 192.168.1.10.41328: Flags [P.], seq 17494:17695, ack 19155, win 333, options [nop,nop,TS val 533541402 ecr 561092], length 201
00:54:51.649037 IP sea15s07-in-f74.1e100.net.https > 192.168.1.10.41328: Flags [P.], seq 17695:17721, ack 19155, win 333, options [nop,nop,TS val 533541402 ecr 561092], length 26
00:54:51.651881 IP 192.168.1.10.41328 > sea15s07-in-f74.1e100.net.https: Flags [.], ack 17494, win 2380, options [nop,nop,TS val 561107 ecr 533541402], length 0
00:54:51.651897 IP 192.168.1.10.41328 > sea15s07-in-f74.1e100.net.https: Flags [.], ack 17695, win 2380, options [nop,nop,TS val 561107 ecr 533541402], length 0
00:54:51.651916 IP 192.168.1.10.41328 > sea15s07-in-f74.1e100.net.https: Flags [.], ack 17721, win 2380, options [nop,nop,TS val 561107 ecr 533541402], length 0
00:54:56.573960 IP 192.168.1.10.41328 > sea15s07-in-f74.1e100.net.https: Flags [P.], seq 19155:20241, ack 17721, win 2380, options [nop,nop,TS val 561599 ecr 533541402], length 1086
00:54:56.605699 IP sea15s07-in-f74.1e100.net.https > 192.168.1.10.41328: Flags [.], ack 20241, win 344, options [nop,nop,TS val 533546359 ecr 561599], length 0
00:54:56.705304 IP sea15s07-in-f74.1e100.net.https > 192.168.1.10.41328: Flags [P.], seq 17721:18263, ack 20241, win 344, options [nop,nop,TS val 533546459 ecr 561599], length 542
00:54:56.705567 IP sea15s07-in-f74.1e100.net.https > 192.168.1.10.41328: Flags [P.], seq 18263:18562, ack 20241, win 344, options [nop,nop,TS val 533546459 ecr 561599], length 299
00:54:56.705769 IP sea15s07-in-f74.1e100.net.https > 192.168.1.10.41328: Flags [P.], seq 18562:18588, ack 20241, win 344, options [nop,nop,TS val 533546459 ecr 561599], length 26
00:54:56.710132 IP 192.168.1.10.41328 > sea15s07-in-f74.1e100.net.https: Flags [.], ack 18263, win 2422, options [nop,nop,TS val 561612 ecr 533546459], length 0
00:54:56.710148 IP 192.168.1.10.41328 > sea15s07-in-f74.1e100.net.https: Flags [.], ack 18562, win 2422, options [nop,nop,TS val 561612 ecr 533546459], length 0
00:54:56.710170 IP 192.168.1.10.41328 > sea15s07-in-f74.1e100.net.https: Flags [.], ack 18588, win 2422, options [nop,nop,TS val 561612 ecr 533546459], length 0
00:54:57.443029 IP 192.168.1.10.41328 > sea15s07-in-f74.1e100.net.https: Flags [P.], seq 20241:21327, ack 18588, win 2422, options [nop,nop,TS val 561685 ecr 533546459], length 1086
00:54:57.474704 IP sea15s07-in-f74.1e100.net.https > 192.168.1.10.41328: Flags [.], ack 21327, win 354, options [nop,nop,TS val 533547228 ecr 561685], length 0
00:54:57.576239 IP sea15s07-in-f74.1e100.net.https > 192.168.1.10.41328: Flags [P.], seq 18588:19130, ack 21327, win 354, options [nop,nop,TS val 533547330 ecr 561685], length 542
00:54:57.576500 IP sea15s07-in-f74.1e100.net.https > 192.168.1.10.41328: Flags [P.], seq 19130:19249, ack 21327, win 354, options [nop,nop,TS val 533547330 ecr 561685], length 119
00:54:57.576602 IP sea15s07-in-f74.1e100.net.https > 192.168.1.10.41328: Flags [P.], seq 19249:19275, ack 21327, win 354, options [nop,nop,TS val 533547330 ecr 561685], length 26
00:54:57.588394 IP 192.168.1.10.41328 > sea15s07-in-f74.1e100.net.https: Flags [.], ack 19130, win 2464, options [nop,nop,TS val 561700 ecr 533547330], length 0
00:54:57.588410 IP 192.168.1.10.41328 > sea15s07-in-f74.1e100.net.https: Flags [.], ack 19249, win 2464, options [nop,nop,TS val 561700 ecr 533547330], length 0
00:54:57.588429 IP 192.168.1.10.41328 > sea15s07-in-f74.1e100.net.https: Flags [.], ack 19275, win 2464, options [nop,nop,TS val 561700 ecr 533547330], length 0
00:54:59.037304 IP sea15s07-in-f3.1e100.net.www > 192.168.1.10.53475: Flags [F.], seq 2165858414, ack 3722829647, win 219, options [nop,nop,TS val 3157390580 ecr 549847], length 0
00:54:59.151279 IP 192.168.1.10.41328 > sea15s07-in-f74.1e100.net.https: Flags [P.], seq 21327:22416, ack 19275, win 2464, options [nop,nop,TS val 561857 ecr 533547330], length 1089
00:54:59.171336 IP 192.168.1.10.53475 > sea15s07-in-f3.1e100.net.www: Flags [.], ack 1, win 1369, options [nop,nop,TS val 561859 ecr 3157390580], length 0
00:54:59.182978 IP sea15s07-in-f74.1e100.net.https > 192.168.1.10.41328: Flags [.], ack 22416, win 365, options [nop,nop,TS val 533548936 ecr 561857], length 0
00:54:59.280512 IP sea15s07-in-f74.1e100.net.https > 192.168.1.10.41328: Flags [P.], seq 19275:19817, ack 22416, win 365, options [nop,nop,TS val 533549034 ecr 561857], length 542
00:54:59.280728 IP sea15s07-in-f74.1e100.net.https > 192.168.1.10.41328: Flags [P.], seq 19817:20039, ack 22416, win 365, options [nop,nop,TS val 533549034 ecr 561857], length 222
00:54:59.280856 IP sea15s07-in-f74.1e100.net.https > 192.168.1.10.41328: Flags [P.], seq 20039:20065, ack 22416, win 365, options [nop,nop,TS val 533549034 ecr 561857], length 26
00:54:59.283992 IP 192.168.1.10.41328 > sea15s07-in-f74.1e100.net.https: Flags [.], ack 19817, win 2507, options [nop,nop,TS val 561870 ecr 533549034], length 0
00:54:59.284009 IP 192.168.1.10.41328 > sea15s07-in-f74.1e100.net.https: Flags [.], ack 20039, win 2507, options [nop,nop,TS val 561870 ecr 533549034], length 0
00:54:59.284028 IP 192.168.1.10.41328 > sea15s07-in-f74.1e100.net.https: Flags [.], ack 20065, win 2507, options [nop,nop,TS val 561870 ecr 533549034], length 0
00:55:00.289261 IP 192.168.1.10.41328 > sea15s07-in-f74.1e100.net.https: Flags [P.], seq 22416:23510, ack 20065, win 2507, options [nop,nop,TS val 561970 ecr 533549034], length 1094
00:55:00.321055 IP sea15s07-in-f74.1e100.net.https > 192.168.1.10.41328: Flags [.], ack 23510, win 376, options [nop,nop,TS val 533550075 ecr 561970], length 0
00:55:00.417973 IP sea15s07-in-f74.1e100.net.https > 192.168.1.10.41328: Flags [P.], seq 20065:20607, ack 23510, win 376, options [nop,nop,TS val 533550172 ecr 561970], length 542
00:55:00.418197 IP sea15s07-in-f74.1e100.net.https > 192.168.1.10.41328: Flags [P.], seq 20607:20747, ack 23510, win 376, options [nop,nop,TS val 533550172 ecr 561970], length 140
00:55:00.418299 IP sea15s07-in-f74.1e100.net.https > 192.168.1.10.41328: Flags [P.], seq 20747:20773, ack 23510, win 376, options [nop,nop,TS val 533550172 ecr 561970], length 26
00:55:00.420223 IP 192.168.1.10.41328 > sea15s07-in-f74.1e100.net.https: Flags [.], ack 20607, win 2549, options [nop,nop,TS val 561984 ecr 533550172], length 0
00:55:00.420236 IP 192.168.1.10.41328 > sea15s07-in-f74.1e100.net.https: Flags [.], ack 20747, win 2549, options [nop,nop,TS val 561984 ecr 533550172], length 0
00:55:00.420255 IP 192.168.1.10.41328 > sea15s07-in-f74.1e100.net.https: Flags [.], ack 20773, win 2549, options [nop,nop,TS val 561984 ecr 533550172], length 0
00:55:04.016090 IP 192.168.1.10.41328 > sea15s07-in-f74.1e100.net.https: Flags [P.], seq 23510:24627, ack 20773, win 2549, options [nop,nop,TS val 562343 ecr 533550172], length 1117
00:55:04.047816 IP sea15s07-in-f74.1e100.net.https > 192.168.1.10.41328: Flags [.], ack 24627, win 387, options [nop,nop,TS val 533553801 ecr 562343], length 0
00:55:04.145120 IP sea15s07-in-f74.1e100.net.https > 192.168.1.10.41328: Flags [P.], seq 20773:21315, ack 24627, win 387, options [nop,nop,TS val 533553899 ecr 562343], length 542
00:55:04.145520 IP sea15s07-in-f74.1e100.net.https > 192.168.1.10.41328: Flags [P.], seq 21315:21473, ack 24627, win 387, options [nop,nop,TS val 533553899 ecr 562343], length 158
00:55:04.146291 IP sea15s07-in-f74.1e100.net.https > 192.168.1.10.41328: Flags [P.], seq 21473:21499, ack 24627, win 387, options [nop,nop,TS val 533553900 ecr 562343], length 26
00:55:04.146636 IP 192.168.1.10.41328 > sea15s07-in-f74.1e100.net.https: Flags [.], ack 21315, win 2591, options [nop,nop,TS val 562356 ecr 533553899], length 0
00:55:04.146994 IP 192.168.1.10.41328 > sea15s07-in-f74.1e100.net.https: Flags [.], ack 21473, win 2591, options [nop,nop,TS val 562356 ecr 533553899], length 0
00:55:04.147417 IP 192.168.1.10.41328 > sea15s07-in-f74.1e100.net.https: Flags [.], ack 21499, win 2591, options [nop,nop,TS val 562356 ecr 533553900], length 0
00:55:04.655308 IP 192.168.1.10.41328 > sea15s07-in-f74.1e100.net.https: Flags [P.], seq 24627:25746, ack 21499, win 2591, options [nop,nop,TS val 562406 ecr 533553900], length 1119
00:55:04.687094 IP sea15s07-in-f74.1e100.net.https > 192.168.1.10.41328: Flags [.], ack 25746, win 397, options [nop,nop,TS val 533554440 ecr 562406], length 0
00:55:04.782224 IP sea15s07-in-f74.1e100.net.https > 192.168.1.10.41328: Flags [P.], seq 21499:22041, ack 25746, win 397, options [nop,nop,TS val 533554536 ecr 562406], length 542
00:55:04.782476 IP sea15s07-in-f74.1e100.net.https > 192.168.1.10.41328: Flags [P.], seq 22041:22173, ack 25746, win 397, options [nop,nop,TS val 533554536 ecr 562406], length 132
00:55:04.782614 IP sea15s07-in-f74.1e100.net.https > 192.168.1.10.41328: Flags [P.], seq 22173:22199, ack 25746, win 397, options [nop,nop,TS val 533554536 ecr 562406], length 26
00:55:04.784295 IP 192.168.1.10.41328 > sea15s07-in-f74.1e100.net.https: Flags [.], ack 22041, win 2633, options [nop,nop,TS val 562420 ecr 533554536], length 0
00:55:04.784313 IP 192.168.1.10.41328 > sea15s07-in-f74.1e100.net.https: Flags [.], ack 22173, win 2633, options [nop,nop,TS val 562420 ecr 533554536], length 0
00:55:04.784332 IP 192.168.1.10.41328 > sea15s07-in-f74.1e100.net.https: Flags [.], ack 22199, win 2633, options [nop,nop,TS val 562420 ecr 533554536], length 0
00:55:17.962363 IP 192.168.1.10.41328 > sea15s07-in-f74.1e100.net.https: Flags [P.], seq 25746:26809, ack 22199, win 2633, options [nop,nop,TS val 563737 ecr 533554536], length 1063
00:55:17.993999 IP sea15s07-in-f74.1e100.net.https > 192.168.1.10.41328: Flags [.], ack 26809, win 408, options [nop,nop,TS val 533567748 ecr 563737], length 0
00:55:18.092208 IP sea15s07-in-f74.1e100.net.https > 192.168.1.10.41328: Flags [P.], seq 22199:22741, ack 26809, win 408, options [nop,nop,TS val 533567846 ecr 563737], length 542
00:55:18.092436 IP sea15s07-in-f74.1e100.net.https > 192.168.1.10.41328: Flags [P.], seq 22741:22961, ack 26809, win 408, options [nop,nop,TS val 533567846 ecr 563737], length 220
00:55:18.092554 IP sea15s07-in-f74.1e100.net.https > 192.168.1.10.41328: Flags [P.], seq 22961:22987, ack 26809, win 408, options [nop,nop,TS val 533567846 ecr 563737], length 26
00:55:18.094906 IP 192.168.1.10.41328 > sea15s07-in-f74.1e100.net.https: Flags [.], ack 22741, win 2675, options [nop,nop,TS val 563751 ecr 533567846], length 0
00:55:18.094923 IP 192.168.1.10.41328 > sea15s07-in-f74.1e100.net.https: Flags [.], ack 22961, win 2675, options [nop,nop,TS val 563751 ecr 533567846], length 0
00:55:18.094942 IP 192.168.1.10.41328 > sea15s07-in-f74.1e100.net.https: Flags [.], ack 22987, win 2675, options [nop,nop,TS val 563751 ecr 533567846], length 0
00:55:20.597229 IP 192.168.1.10.41328 > sea15s07-in-f74.1e100.net.https: Flags [P.], seq 26809:27890, ack 22987, win 2675, options [nop,nop,TS val 564001 ecr 533567846], length 1081
00:55:20.628944 IP sea15s07-in-f74.1e100.net.https > 192.168.1.10.41328: Flags [.], ack 27890, win 419, options [nop,nop,TS val 533570382 ecr 564001], length 0
00:55:20.727033 IP sea15s07-in-f74.1e100.net.https > 192.168.1.10.41328: Flags [P.], seq 22987:23529, ack 27890, win 419, options [nop,nop,TS val 533570481 ecr 564001], length 542
00:55:20.727280 IP sea15s07-in-f74.1e100.net.https > 192.168.1.10.41328: Flags [P.], seq 23529:23818, ack 27890, win 419, options [nop,nop,TS val 533570481 ecr 564001], length 289
00:55:20.727396 IP sea15s07-in-f74.1e100.net.https > 192.168.1.10.41328: Flags [P.], seq 23818:23844, ack 27890, win 419, options [nop,nop,TS val 533570481 ecr 564001], length 26
00:55:20.734080 IP 192.168.1.10.41328 > sea15s07-in-f74.1e100.net.https: Flags [.], ack 23529, win 2717, options [nop,nop,TS val 564015 ecr 533570481], length 0
00:55:20.734096 IP 192.168.1.10.41328 > sea15s07-in-f74.1e100.net.https: Flags [.], ack 23818, win 2717, options [nop,nop,TS val 564015 ecr 533570481], length 0
00:55:20.734113 IP 192.168.1.10.41328 > sea15s07-in-f74.1e100.net.https: Flags [.], ack 23844, win 2717, options [nop,nop,TS val 564015 ecr 533570481], length 0
00:55:26.772985 IP 192.168.1.10.41328 > sea15s07-in-f74.1e100.net.https: Flags [P.], seq 27890:29007, ack 23844, win 2717, options [nop,nop,TS val 564618 ecr 533570481], length 1117
00:55:26.804932 IP sea15s07-in-f74.1e100.net.https > 192.168.1.10.41328: Flags [.], ack 29007, win 429, options [nop,nop,TS val 533576558 ecr 564618], length 0
00:55:26.905287 IP sea15s07-in-f74.1e100.net.https > 192.168.1.10.41328: Flags [P.], seq 23844:24386, ack 29007, win 429, options [nop,nop,TS val 533576659 ecr 564618], length 542
00:55:26.906267 IP sea15s07-in-f74.1e100.net.https > 192.168.1.10.41328: Flags [P.], seq 24386:24468, ack 29007, win 429, options [nop,nop,TS val 533576660 ecr 564618], length 82
00:55:26.906415 IP sea15s07-in-f74.1e100.net.https > 192.168.1.10.41328: Flags [P.], seq 24468:24494, ack 29007, win 429, options [nop,nop,TS val 533576660 ecr 564618], length 26
00:55:26.907521 IP 192.168.1.10.41328 > sea15s07-in-f74.1e100.net.https: Flags [.], ack 24386, win 2759, options [nop,nop,TS val 564632 ecr 533576659], length 0
00:55:26.907535 IP 192.168.1.10.41328 > sea15s07-in-f74.1e100.net.https: Flags [.], ack 24468, win 2759, options [nop,nop,TS val 564632 ecr 533576660], length 0
00:55:26.907555 IP 192.168.1.10.41328 > sea15s07-in-f74.1e100.net.https: Flags [.], ack 24494, win 2759, options [nop,nop,TS val 564632 ecr 533576660], length 0
00:55:27.786010 IP 192.168.1.10.41328 > sea15s07-in-f74.1e100.net.https: Flags [P.], seq 29007:30130, ack 24494, win 2759, options [nop,nop,TS val 564720 ecr 533576660], length 1123
00:55:27.817709 IP sea15s07-in-f74.1e100.net.https > 192.168.1.10.41328: Flags [.], ack 30130, win 440, options [nop,nop,TS val 533577571 ecr 564720], length 0
00:55:27.913469 IP sea15s07-in-f74.1e100.net.https > 192.168.1.10.41328: Flags [P.], seq 24494:25036, ack 30130, win 440, options [nop,nop,TS val 533577667 ecr 564720], length 542
00:55:27.913668 IP sea15s07-in-f74.1e100.net.https > 192.168.1.10.41328: Flags [P.], seq 25036:25290, ack 30130, win 440, options [nop,nop,TS val 533577667 ecr 564720], length 254
00:55:27.913801 IP sea15s07-in-f74.1e100.net.https > 192.168.1.10.41328: Flags [P.], seq 25290:25316, ack 30130, win 440, options [nop,nop,TS val 533577667 ecr 564720], length 26
00:55:27.929529 IP 192.168.1.10.41328 > sea15s07-in-f74.1e100.net.https: Flags [.], ack 25036, win 2801, options [nop,nop,TS val 564734 ecr 533577667], length 0
00:55:27.929545 IP 192.168.1.10.41328 > sea15s07-in-f74.1e100.net.https: Flags [.], ack 25290, win 2801, options [nop,nop,TS val 564734 ecr 533577667], length 0
00:55:27.929566 IP 192.168.1.10.41328 > sea15s07-in-f74.1e100.net.https: Flags [.], ack 25316, win 2801, options [nop,nop,TS val 564734 ecr 533577667], length 0
00:55:28.867477 IP 192.168.1.10.41328 > sea15s07-in-f74.1e100.net.https: Flags [P.], seq 30130:31256, ack 25316, win 2801, options [nop,nop,TS val 564828 ecr 533577667], length 1126
00:55:28.899093 IP sea15s07-in-f74.1e100.net.https > 192.168.1.10.41328: Flags [.], ack 31256, win 451, options [nop,nop,TS val 533578653 ecr 564828], length 0
00:55:28.999890 IP sea15s07-in-f74.1e100.net.https > 192.168.1.10.41328: Flags [P.], seq 25316:25858, ack 31256, win 451, options [nop,nop,TS val 533578753 ecr 564828], length 542
00:55:29.000056 IP sea15s07-in-f74.1e100.net.https > 192.168.1.10.41328: Flags [P.], seq 25858:26026, ack 31256, win 451, options [nop,nop,TS val 533578754 ecr 564828], length 168
00:55:29.000171 IP sea15s07-in-f74.1e100.net.https > 192.168.1.10.41328: Flags [P.], seq 26026:26052, ack 31256, win 451, options [nop,nop,TS val 533578754 ecr 564828], length 26
00:55:29.031799 IP 192.168.1.10.41328 > sea15s07-in-f74.1e100.net.https: Flags [.], ack 25858, win 2844, options [nop,nop,TS val 564844 ecr 533578753], length 0
00:55:29.031827 IP 192.168.1.10.41328 > sea15s07-in-f74.1e100.net.https: Flags [.], ack 26026, win 2844, options [nop,nop,TS val 564844 ecr 533578754], length 0
00:55:29.031847 IP 192.168.1.10.41328 > sea15s07-in-f74.1e100.net.https: Flags [.], ack 26052, win 2844, options [nop,nop,TS val 564844 ecr 533578754], length 0
00:55:32.737191 IP 192.168.1.10.41328 > sea15s07-in-f74.1e100.net.https: Flags [P.], seq 31256:32415, ack 26052, win 2844, options [nop,nop,TS val 565215 ecr 533578754], length 1159
00:55:32.768745 IP sea15s07-in-f74.1e100.net.https > 192.168.1.10.41328: Flags [.], ack 32415, win 461, options [nop,nop,TS val 533582522 ecr 565215], length 0
00:55:32.866367 IP sea15s07-in-f74.1e100.net.https > 192.168.1.10.41328: Flags [P.], seq 26052:26594, ack 32415, win 461, options [nop,nop,TS val 533582620 ecr 565215], length 542
00:55:32.866571 IP sea15s07-in-f74.1e100.net.https > 192.168.1.10.41328: Flags [P.], seq 26594:26780, ack 32415, win 461, options [nop,nop,TS val 533582620 ecr 565215], length 186
00:55:32.866699 IP sea15s07-in-f74.1e100.net.https > 192.168.1.10.41328: Flags [P.], seq 26780:26806, ack 32415, win 461, options [nop,nop,TS val 533582620 ecr 565215], length 26
00:55:32.896787 IP 192.168.1.10.41328 > sea15s07-in-f74.1e100.net.https: Flags [.], ack 26594, win 2886, options [nop,nop,TS val 565228 ecr 533582620], length 0
00:55:32.896805 IP 192.168.1.10.41328 > sea15s07-in-f74.1e100.net.https: Flags [.], ack 26780, win 2886, options [nop,nop,TS val 565228 ecr 533582620], length 0
00:55:32.896826 IP 192.168.1.10.41328 > sea15s07-in-f74.1e100.net.https: Flags [.], ack 26806, win 2886, options [nop,nop,TS val 565228 ecr 533582620], length 0
00:55:34.336345 IP 192.168.1.10.41328 > sea15s07-in-f74.1e100.net.https: Flags [P.], seq 32415:33580, ack 26806, win 2886, options [nop,nop,TS val 565375 ecr 533582620], length 1165
00:55:34.367955 IP sea15s07-in-f74.1e100.net.https > 192.168.1.10.41328: Flags [.], ack 33580, win 472, options [nop,nop,TS val 533584122 ecr 565375], length 0
00:55:34.466222 IP sea15s07-in-f74.1e100.net.https > 192.168.1.10.41328: Flags [P.], seq 26806:27348, ack 33580, win 472, options [nop,nop,TS val 533584220 ecr 565375], length 542
00:55:34.466446 IP sea15s07-in-f74.1e100.net.https > 192.168.1.10.41328: Flags [P.], seq 27348:27538, ack 33580, win 472, options [nop,nop,TS val 533584220 ecr 565375], length 190
00:55:34.466536 IP sea15s07-in-f74.1e100.net.https > 192.168.1.10.41328: Flags [P.], seq 27538:27564, ack 33580, win 472, options [nop,nop,TS val 533584220 ecr 565375], length 26
00:55:34.478988 IP 192.168.1.10.41328 > sea15s07-in-f74.1e100.net.https: Flags [.], ack 27348, win 2928, options [nop,nop,TS val 565389 ecr 533584220], length 0
00:55:34.479006 IP 192.168.1.10.41328 > sea15s07-in-f74.1e100.net.https: Flags [.], ack 27538, win 2928, options [nop,nop,TS val 565389 ecr 533584220], length 0
00:55:34.479026 IP 192.168.1.10.41328 > sea15s07-in-f74.1e100.net.https: Flags [.], ack 27564, win 2928, options [nop,nop,TS val 565389 ecr 533584220], length 0
00:55:34.958325 IP 192.168.1.10.41328 > sea15s07-in-f74.1e100.net.https: Flags [P.], seq 33580:34749, ack 27564, win 2928, options [nop,nop,TS val 565435 ecr 533584220], length 1169
00:55:34.989946 IP sea15s07-in-f74.1e100.net.https > 192.168.1.10.41328: Flags [.], ack 34749, win 483, options [nop,nop,TS val 533584744 ecr 565435], length 0
00:55:35.092605 IP sea15s07-in-f74.1e100.net.https > 192.168.1.10.41328: Flags [P.], seq 27564:28106, ack 34749, win 483, options [nop,nop,TS val 533584846 ecr 565435], length 542
00:55:35.094342 IP sea15s07-in-f74.1e100.net.https > 192.168.1.10.41328: Flags [P.], seq 28106:28172, ack 34749, win 483, options [nop,nop,TS val 533584848 ecr 565435], length 66
00:55:35.094484 IP sea15s07-in-f74.1e100.net.https > 192.168.1.10.41328: Flags [P.], seq 28172:28198, ack 34749, win 483, options [nop,nop,TS val 533584848 ecr 565435], length 26
00:55:35.098278 IP 192.168.1.10.41328 > sea15s07-in-f74.1e100.net.https: Flags [.], ack 28106, win 2970, options [nop,nop,TS val 565451 ecr 533584846], length 0
00:55:35.098294 IP 192.168.1.10.41328 > sea15s07-in-f74.1e100.net.https: Flags [.], ack 28172, win 2970, options [nop,nop,TS val 565451 ecr 533584848], length 0
00:55:35.098313 IP 192.168.1.10.41328 > sea15s07-in-f74.1e100.net.https: Flags [.], ack 28198, win 2970, options [nop,nop,TS val 565451 ecr 533584848], length 0
00:55:35.817565 IP 192.168.1.10.41328 > sea15s07-in-f74.1e100.net.https: Flags [P.], seq 34749:35921, ack 28198, win 2970, options [nop,nop,TS val 565523 ecr 533584848], length 1172
00:55:35.849359 IP sea15s07-in-f74.1e100.net.https > 192.168.1.10.41328: Flags [.], ack 35921, win 493, options [nop,nop,TS val 533585603 ecr 565523], length 0
00:55:35.947097 IP sea15s07-in-f74.1e100.net.https > 192.168.1.10.41328: Flags [P.], seq 28198:28740, ack 35921, win 493, options [nop,nop,TS val 533585701 ecr 565523], length 542
00:55:35.947577 IP sea15s07-in-f74.1e100.net.https > 192.168.1.10.41328: Flags [P.], seq 28740:28945, ack 35921, win 493, options [nop,nop,TS val 533585701 ecr 565523], length 205
00:55:35.947678 IP sea15s07-in-f74.1e100.net.https > 192.168.1.10.41328: Flags [P.], seq 28945:28971, ack 35921, win 493, options [nop,nop,TS val 533585701 ecr 565523], length 26
00:55:35.957022 IP 192.168.1.10.41328 > sea15s07-in-f74.1e100.net.https: Flags [.], ack 28740, win 3012, options [nop,nop,TS val 565536 ecr 533585701], length 0
00:55:35.957038 IP 192.168.1.10.41328 > sea15s07-in-f74.1e100.net.https: Flags [.], ack 28945, win 3012, options [nop,nop,TS val 565536 ecr 533585701], length 0
00:55:35.957057 IP 192.168.1.10.41328 > sea15s07-in-f74.1e100.net.https: Flags [.], ack 28971, win 3012, options [nop,nop,TS val 565537 ecr 533585701], length 0
00:55:39.162746 IP 192.168.1.10.41328 > sea15s07-in-f74.1e100.net.https: Flags [P.], seq 35921:3