tcpdump: verbose output suppressed, use -v or -vv for full protocol decode
listening on wlan0, link-type EN10MB (Ethernet), capture size 262144 bytes
18:34:15.367110 IP 192.168.1.10.48879 > sea15s07-in-f78.1e100.net.https: Flags [.], seq 94668222:94669570, ack 2695483100, win 701, options [nop,nop,TS val 540456 ecr 2095797067], length 1348
18:34:15.367533 IP 192.168.1.10.48879 > sea15s07-in-f78.1e100.net.https: Flags [P.], seq 1348:1555, ack 1, win 701, options [nop,nop,TS val 540456 ecr 2095797067], length 207
18:34:15.398253 IP sea15s07-in-f78.1e100.net.https > 192.168.1.10.48879: Flags [.], ack 1348, win 541, options [nop,nop,TS val 2095807777 ecr 540456], length 0
18:34:15.398467 IP sea15s07-in-f78.1e100.net.https > 192.168.1.10.48879: Flags [.], ack 1555, win 552, options [nop,nop,TS val 2095807777 ecr 540456], length 0
18:34:15.475173 IP 192.168.1.10.48879 > sea15s07-in-f78.1e100.net.https: Flags [P.], seq 1348:1555, ack 1, win 701, options [nop,nop,TS val 540466 ecr 2095797067], length 207
18:34:15.506096 IP sea15s07-in-f78.1e100.net.https > 192.168.1.10.48879: Flags [.], ack 1555, win 552, options [nop,nop,TS val 2095807885 ecr 540466,nop,nop,sack 1 {1348:1555}], length 0
18:34:15.569275 IP sea15s07-in-f78.1e100.net.https > 192.168.1.10.48879: Flags [P.], seq 1:505, ack 1555, win 552, options [nop,nop,TS val 2095807948 ecr 540466], length 504
18:34:15.569463 IP sea15s07-in-f78.1e100.net.https > 192.168.1.10.48879: Flags [P.], seq 505:815, ack 1555, win 552, options [nop,nop,TS val 2095807948 ecr 540466], length 310
18:34:15.569581 IP sea15s07-in-f78.1e100.net.https > 192.168.1.10.48879: Flags [P.], seq 815:841, ack 1555, win 552, options [nop,nop,TS val 2095807948 ecr 540466], length 26
18:34:15.742898 IP 192.168.1.10.48879 > sea15s07-in-f78.1e100.net.https: Flags [.], ack 505, win 711, options [nop,nop,TS val 540494 ecr 2095807948], length 0
18:34:15.743154 IP 192.168.1.10.48879 > sea15s07-in-f78.1e100.net.https: Flags [.], ack 815, win 722, options [nop,nop,TS val 540494 ecr 2095807948], length 0
18:34:15.743172 IP 192.168.1.10.48879 > sea15s07-in-f78.1e100.net.https: Flags [.], ack 841, win 722, options [nop,nop,TS val 540494 ecr 2095807948], length 0
18:34:23.000079 IP 192.168.1.10.53348 > sea15s12-in-f194.1e100.net.https: Flags [F.], seq 276990958, ack 2545008887, win 385, options [nop,nop,TS val 541218 ecr 2545206885], length 0
18:34:23.031182 IP sea15s12-in-f194.1e100.net.https > 192.168.1.10.53348: Flags [F.], seq 1, ack 1, win 175, options [nop,nop,TS val 2545232698 ecr 541218], length 0
18:34:23.132058 IP 192.168.1.10.53348 > sea15s12-in-f194.1e100.net.https: Flags [.], ack 2, win 385, options [nop,nop,TS val 541233 ecr 2545232698], length 0
18:34:23.755959 IP 192.168.1.10.49525 > sea15s12-in-f10.1e100.net.https: Flags [F.], seq 2218495365, ack 4014252597, win 785, options [nop,nop,TS val 541294 ecr 3918566820], length 0
18:34:23.788137 IP sea15s12-in-f10.1e100.net.https > 192.168.1.10.49525: Flags [F.], seq 1, ack 1, win 178, options [nop,nop,TS val 3918596852 ecr 541294], length 0
18:34:23.816801 IP 192.168.1.10.49778 > sea15s12-in-f10.1e100.net.https: Flags [.], seq 563121129:563122477, ack 3045858189, win 501, options [nop,nop,TS val 541301 ecr 2828449190], length 1348
18:34:23.816817 IP 192.168.1.10.49778 > sea15s12-in-f10.1e100.net.https: Flags [.], seq 1348:2696, ack 1, win 501, options [nop,nop,TS val 541301 ecr 2828449190], length 1348
18:34:23.816829 IP 192.168.1.10.49778 > sea15s12-in-f10.1e100.net.https: Flags [.], seq 2696:4044, ack 1, win 501, options [nop,nop,TS val 541301 ecr 2828449190], length 1348
18:34:23.816841 IP 192.168.1.10.49778 > sea15s12-in-f10.1e100.net.https: Flags [.], seq 4044:5392, ack 1, win 501, options [nop,nop,TS val 541301 ecr 2828449190], length 1348
18:34:23.817385 IP 192.168.1.10.49778 > sea15s12-in-f10.1e100.net.https: Flags [.], seq 5392:6740, ack 1, win 501, options [nop,nop,TS val 541301 ecr 2828449190], length 1348
18:34:23.817399 IP 192.168.1.10.49778 > sea15s12-in-f10.1e100.net.https: Flags [.], seq 6740:8088, ack 1, win 501, options [nop,nop,TS val 541301 ecr 2828449190], length 1348
18:34:23.817411 IP 192.168.1.10.49778 > sea15s12-in-f10.1e100.net.https: Flags [.], seq 8088:9436, ack 1, win 501, options [nop,nop,TS val 541301 ecr 2828449190], length 1348
18:34:23.817425 IP 192.168.1.10.49778 > sea15s12-in-f10.1e100.net.https: Flags [.], seq 9436:10784, ack 1, win 501, options [nop,nop,TS val 541301 ecr 2828449190], length 1348
18:34:23.817884 IP 192.168.1.10.49778 > sea15s12-in-f10.1e100.net.https: Flags [.], seq 10784:12132, ack 1, win 501, options [nop,nop,TS val 541301 ecr 2828449190], length 1348
18:34:23.817910 IP 192.168.1.10.49778 > sea15s12-in-f10.1e100.net.https: Flags [.], seq 12132:13480, ack 1, win 501, options [nop,nop,TS val 541301 ecr 2828449190], length 1348
18:34:23.847783 IP sea15s12-in-f10.1e100.net.https > 192.168.1.10.49778: Flags [.], ack 2696, win 671, options [nop,nop,TS val 2828506779 ecr 541301], length 0
18:34:23.849332 IP sea15s12-in-f10.1e100.net.https > 192.168.1.10.49778: Flags [.], ack 5392, win 692, options [nop,nop,TS val 2828506781 ecr 541301], length 0
18:34:23.851008 IP sea15s12-in-f10.1e100.net.https > 192.168.1.10.49778: Flags [.], ack 8088, win 714, options [nop,nop,TS val 2828506783 ecr 541301], length 0
18:34:23.852746 IP sea15s12-in-f10.1e100.net.https > 192.168.1.10.49778: Flags [.], ack 10784, win 735, options [nop,nop,TS val 2828506784 ecr 541301], length 0
18:34:23.854630 IP sea15s12-in-f10.1e100.net.https > 192.168.1.10.49778: Flags [.], ack 13480, win 756, options [nop,nop,TS val 2828506786 ecr 541301], length 0
18:34:23.893866 IP 192.168.1.10.49525 > sea15s12-in-f10.1e100.net.https: Flags [.], ack 2, win 785, options [nop,nop,TS val 541309 ecr 3918596852], length 0
18:34:23.893887 IP 192.168.1.10.49778 > sea15s12-in-f10.1e100.net.https: Flags [.], seq 13480:14828, ack 1, win 501, options [nop,nop,TS val 541309 ecr 2828506779], length 1348
18:34:23.893899 IP 192.168.1.10.49778 > sea15s12-in-f10.1e100.net.https: Flags [.], seq 14828:16176, ack 1, win 501, options [nop,nop,TS val 541309 ecr 2828506779], length 1348
18:34:23.893913 IP 192.168.1.10.49778 > sea15s12-in-f10.1e100.net.https: Flags [.], seq 16176:17524, ack 1, win 501, options [nop,nop,TS val 541309 ecr 2828506779], length 1348
18:34:23.893925 IP 192.168.1.10.49778 > sea15s12-in-f10.1e100.net.https: Flags [.], seq 17524:18872, ack 1, win 501, options [nop,nop,TS val 541309 ecr 2828506781], length 1348
18:34:23.893949 IP 192.168.1.10.49778 > sea15s12-in-f10.1e100.net.https: Flags [.], seq 18872:20220, ack 1, win 501, options [nop,nop,TS val 541309 ecr 2828506781], length 1348
18:34:23.894833 IP 192.168.1.10.49778 > sea15s12-in-f10.1e100.net.https: Flags [.], seq 20220:21568, ack 1, win 501, options [nop,nop,TS val 541309 ecr 2828506781], length 1348
18:34:23.894853 IP 192.168.1.10.49778 > sea15s12-in-f10.1e100.net.https: Flags [.], seq 21568:22916, ack 1, win 501, options [nop,nop,TS val 541309 ecr 2828506783], length 1348
18:34:23.894869 IP 192.168.1.10.49778 > sea15s12-in-f10.1e100.net.https: Flags [.], seq 22916:24264, ack 1, win 501, options [nop,nop,TS val 541309 ecr 2828506783], length 1348
18:34:23.894882 IP 192.168.1.10.49778 > sea15s12-in-f10.1e100.net.https: Flags [.], seq 24264:25612, ack 1, win 501, options [nop,nop,TS val 541309 ecr 2828506783], length 1348
18:34:23.895581 IP 192.168.1.10.49778 > sea15s12-in-f10.1e100.net.https: Flags [.], seq 25612:26960, ack 1, win 501, options [nop,nop,TS val 541309 ecr 2828506784], length 1348
18:34:23.895604 IP 192.168.1.10.49778 > sea15s12-in-f10.1e100.net.https: Flags [.], seq 26960:28308, ack 1, win 501, options [nop,nop,TS val 541309 ecr 2828506784], length 1348
18:34:23.895617 IP 192.168.1.10.49778 > sea15s12-in-f10.1e100.net.https: Flags [.], seq 28308:29656, ack 1, win 501, options [nop,nop,TS val 541309 ecr 2828506784], length 1348
18:34:23.895631 IP 192.168.1.10.49778 > sea15s12-in-f10.1e100.net.https: Flags [.], seq 29656:31004, ack 1, win 501, options [nop,nop,TS val 541309 ecr 2828506786], length 1348
18:34:23.896100 IP 192.168.1.10.49778 > sea15s12-in-f10.1e100.net.https: Flags [.], seq 31004:32352, ack 1, win 501, options [nop,nop,TS val 541309 ecr 2828506786], length 1348
18:34:23.896126 IP 192.168.1.10.49778 > sea15s12-in-f10.1e100.net.https: Flags [.], seq 32352:33700, ack 1, win 501, options [nop,nop,TS val 541309 ecr 2828506786], length 1348
18:34:23.925152 IP sea15s12-in-f10.1e100.net.https > 192.168.1.10.49778: Flags [.], ack 16176, win 778, options [nop,nop,TS val 2828506857 ecr 541309], length 0
18:34:23.926733 IP sea15s12-in-f10.1e100.net.https > 192.168.1.10.49778: Flags [.], ack 18872, win 799, options [nop,nop,TS val 2828506858 ecr 541309], length 0
18:34:23.928269 IP sea15s12-in-f10.1e100.net.https > 192.168.1.10.49778: Flags [.], ack 21568, win 806, options [nop,nop,TS val 2828506860 ecr 541309], length 0
18:34:23.929977 IP sea15s12-in-f10.1e100.net.https > 192.168.1.10.49778: Flags [.], ack 24264, win 810, options [nop,nop,TS val 2828506861 ecr 541309], length 0
18:34:23.931734 IP sea15s12-in-f10.1e100.net.https > 192.168.1.10.49778: Flags [.], ack 26960, win 810, options [nop,nop,TS val 2828506863 ecr 541309], length 0
18:34:23.933451 IP sea15s12-in-f10.1e100.net.https > 192.168.1.10.49778: Flags [.], ack 29656, win 810, options [nop,nop,TS val 2828506865 ecr 541309], length 0
18:34:23.935158 IP sea15s12-in-f10.1e100.net.https > 192.168.1.10.49778: Flags [.], ack 32352, win 810, options [nop,nop,TS val 2828506867 ecr 541309], length 0
18:34:23.975583 IP sea15s12-in-f10.1e100.net.https > 192.168.1.10.49778: Flags [.], ack 33700, win 811, options [nop,nop,TS val 2828506868 ecr 541309], length 0
18:34:24.027251 IP 192.168.1.10.49778 > sea15s12-in-f10.1e100.net.https: Flags [P.], seq 33700:33905, ack 1, win 501, options [nop,nop,TS val 541322 ecr 2828506857], length 205
18:34:24.058149 IP sea15s12-in-f10.1e100.net.https > 192.168.1.10.49778: Flags [.], ack 33905, win 811, options [nop,nop,TS val 2828506990 ecr 541322], length 0
18:34:24.089033 IP sea15s12-in-f10.1e100.net.https > 192.168.1.10.49778: Flags [P.], seq 1:676, ack 33905, win 811, options [nop,nop,TS val 2828507021 ecr 541322], length 675
18:34:24.089220 IP sea15s12-in-f10.1e100.net.https > 192.168.1.10.49778: Flags [P.], seq 676:2024, ack 33905, win 811, options [nop,nop,TS val 2828507021 ecr 541322], length 1348
18:34:24.089393 IP sea15s12-in-f10.1e100.net.https > 192.168.1.10.49778: Flags [.], seq 2024:3372, ack 33905, win 811, options [nop,nop,TS val 2828507021 ecr 541322], length 1348
18:34:24.089453 IP sea15s12-in-f10.1e100.net.https > 192.168.1.10.49778: Flags [P.], seq 3372:4720, ack 33905, win 811, options [nop,nop,TS val 2828507021 ecr 541322], length 1348
18:34:24.091106 IP sea15s12-in-f10.1e100.net.https > 192.168.1.10.49778: Flags [P.], seq 4720:4968, ack 33905, win 811, options [nop,nop,TS val 2828507021 ecr 541322], length 248
18:34:24.091284 IP sea15s12-in-f10.1e100.net.https > 192.168.1.10.49778: Flags [P.], seq 4968:6316, ack 33905, win 811, options [nop,nop,TS val 2828507021 ecr 541322], length 1348
18:34:24.092149 IP sea15s12-in-f10.1e100.net.https > 192.168.1.10.49778: Flags [P.], seq 6316:6594, ack 33905, win 811, options [nop,nop,TS val 2828507021 ecr 541322], length 278
18:34:24.162311 IP 192.168.1.10.49778 > sea15s12-in-f10.1e100.net.https: Flags [.], ack 676, win 511, options [nop,nop,TS val 541336 ecr 2828507021], length 0
18:34:24.162613 IP 192.168.1.10.49778 > sea15s12-in-f10.1e100.net.https: Flags [.], ack 2024, win 522, options [nop,nop,TS val 541336 ecr 2828507021], length 0
18:34:24.162627 IP 192.168.1.10.49778 > sea15s12-in-f10.1e100.net.https: Flags [.], ack 3372, win 532, options [nop,nop,TS val 541336 ecr 2828507021], length 0
18:34:24.162869 IP 192.168.1.10.49778 > sea15s12-in-f10.1e100.net.https: Flags [.], ack 4720, win 543, options [nop,nop,TS val 541336 ecr 2828507021], length 0
18:34:24.162881 IP 192.168.1.10.49778 > sea15s12-in-f10.1e100.net.https: Flags [.], ack 4968, win 553, options [nop,nop,TS val 541336 ecr 2828507021], length 0
18:34:24.162892 IP 192.168.1.10.49778 > sea15s12-in-f10.1e100.net.https: Flags [.], ack 6316, win 564, options [nop,nop,TS val 541336 ecr 2828507021], length 0
18:34:24.162904 IP 192.168.1.10.49778 > sea15s12-in-f10.1e100.net.https: Flags [.], ack 6594, win 574, options [nop,nop,TS val 541336 ecr 2828507021], length 0
18:34:28.657490 IP 192.168.1.10.57491 > sea15s07-in-f78.1e100.net.https: Flags [F.], seq 1305163229, ack 4205866834, win 368, options [nop,nop,TS val 541784 ecr 631402291], length 0
18:34:28.687670 IP sea15s07-in-f78.1e100.net.https > 192.168.1.10.57491: Flags [F.], seq 1, ack 1, win 175, options [nop,nop,TS val 631420154 ecr 541784], length 0
18:34:28.781951 IP 192.168.1.10.57491 > sea15s07-in-f78.1e100.net.https: Flags [.], ack 2, win 368, options [nop,nop,TS val 541798 ecr 631420154], length 0
18:34:30.839713 IP 192.168.1.10.49196 > sea15s01-in-f138.1e100.net.https: Flags [S], seq 1914324514, win 65535, options [mss 1460,sackOK,TS val 542003 ecr 0,nop,wscale 8], length 0
18:34:30.871698 IP sea15s01-in-f138.1e100.net.https > 192.168.1.10.49196: Flags [S.], seq 4134755305, ack 1914324515, win 42408, options [mss 1360,sackOK,TS val 1481341344 ecr 542003,nop,wscale 8], length 0
18:34:30.972213 IP 192.168.1.10.49196 > sea15s01-in-f138.1e100.net.https: Flags [.], ack 1, win 343, options [nop,nop,TS val 542017 ecr 1481341344], length 0
18:34:30.975412 IP 192.168.1.10.49196 > sea15s01-in-f138.1e100.net.https: Flags [P.], seq 1:167, ack 1, win 343, options [nop,nop,TS val 542017 ecr 1481341344], length 166
18:34:31.007178 IP sea15s01-in-f138.1e100.net.https > 192.168.1.10.49196: Flags [.], ack 167, win 170, options [nop,nop,TS val 1481341479 ecr 542017], length 0
18:34:31.014695 IP sea15s01-in-f138.1e100.net.https > 192.168.1.10.49196: Flags [.], seq 1:1349, ack 167, win 170, options [nop,nop,TS val 1481341486 ecr 542017], length 1348
18:34:31.014801 IP sea15s01-in-f138.1e100.net.https > 192.168.1.10.49196: Flags [.], seq 1349:2697, ack 167, win 170, options [nop,nop,TS val 1481341486 ecr 542017], length 1348
18:34:31.014836 IP sea15s01-in-f138.1e100.net.https > 192.168.1.10.49196: Flags [P.], seq 2697:3263, ack 167, win 170, options [nop,nop,TS val 1481341486 ecr 542017], length 566
18:34:31.111961 IP 192.168.1.10.49196 > sea15s01-in-f138.1e100.net.https: Flags [.], ack 1349, win 353, options [nop,nop,TS val 542030 ecr 1481341486], length 0
18:34:31.112246 IP 192.168.1.10.49196 > sea15s01-in-f138.1e100.net.https: Flags [.], ack 2697, win 364, options [nop,nop,TS val 542030 ecr 1481341486], length 0
18:34:31.112263 IP 192.168.1.10.49196 > sea15s01-in-f138.1e100.net.https: Flags [.], ack 3263, win 374, options [nop,nop,TS val 542030 ecr 1481341486], length 0
18:34:31.177955 IP 192.168.1.10.49196 > sea15s01-in-f138.1e100.net.https: Flags [P.], seq 167:252, ack 3263, win 374, options [nop,nop,TS val 542037 ecr 1481341486], length 85
18:34:31.210000 IP sea15s01-in-f138.1e100.net.https > 192.168.1.10.49196: Flags [P.], seq 3263:3306, ack 252, win 170, options [nop,nop,TS val 1481341682 ecr 542037], length 43
18:34:31.304588 IP 192.168.1.10.49196 > sea15s01-in-f138.1e100.net.https: Flags [.], ack 3306, win 374, options [nop,nop,TS val 542050 ecr 1481341682], length 0
18:34:31.322311 IP 192.168.1.10.49196 > sea15s01-in-f138.1e100.net.https: Flags [.], seq 252:1600, ack 3306, win 374, options [nop,nop,TS val 542051 ecr 1481341682], length 1348
18:34:31.322316 IP 192.168.1.10.49196 > sea15s01-in-f138.1e100.net.https: Flags [P.], seq 1600:1915, ack 3306, win 374, options [nop,nop,TS val 542051 ecr 1481341682], length 315
18:34:31.354341 IP sea15s01-in-f138.1e100.net.https > 192.168.1.10.49196: Flags [.], ack 1915, win 183, options [nop,nop,TS val 1481341826 ecr 542051], length 0
18:34:31.452347 IP 192.168.1.10.49196 > sea15s01-in-f138.1e100.net.https: Flags [P.], seq 1915:1941, ack 3306, win 374, options [nop,nop,TS val 542065 ecr 1481341826], length 26
18:34:31.497611 IP sea15s01-in-f138.1e100.net.https > 192.168.1.10.49196: Flags [P.], seq 3306:3963, ack 1941, win 183, options [nop,nop,TS val 1481341969 ecr 542065], length 657
18:34:31.497805 IP sea15s01-in-f138.1e100.net.https > 192.168.1.10.49196: Flags [P.], seq 3963:3989, ack 1941, win 183, options [nop,nop,TS val 1481341970 ecr 542065], length 26
18:34:31.658251 IP 192.168.1.10.49196 > sea15s01-in-f138.1e100.net.https: Flags [.], ack 3989, win 385, options [nop,nop,TS val 542085 ecr 1481341969], length 0
18:34:31.658932 IP 192.168.1.10.45226 > sea15s11-in-f170.1e100.net.https: Flags [P.], seq 648372764:648372787, ack 1845798925, win 406, options [nop,nop,TS val 542085 ecr 1732260276], length 23
18:34:31.659145 IP 192.168.1.10.45226 > sea15s11-in-f170.1e100.net.https: Flags [F.], seq 23, ack 1, win 406, options [nop,nop,TS val 542085 ecr 1732260276], length 0
18:34:31.690674 IP sea15s11-in-f170.1e100.net.https > 192.168.1.10.45226: Flags [F.], seq 1, ack 24, win 176, options [nop,nop,TS val 1732303031 ecr 542085], length 0
18:34:31.782217 IP 192.168.1.10.45226 > sea15s11-in-f170.1e100.net.https: Flags [.], ack 2, win 406, options [nop,nop,TS val 542098 ecr 1732303031], length 0
18:34:31.825707 IP 192.168.1.10.49196 > sea15s01-in-f138.1e100.net.https: Flags [.], seq 1941:3289, ack 3989, win 385, options [nop,nop,TS val 542102 ecr 1481341969], length 1348
18:34:31.825735 IP 192.168.1.10.49196 > sea15s01-in-f138.1e100.net.https: Flags [.], seq 3289:4637, ack 3989, win 385, options [nop,nop,TS val 542102 ecr 1481341969], length 1348
18:34:31.826110 IP 192.168.1.10.49196 > sea15s01-in-f138.1e100.net.https: Flags [P.], seq 4637:4690, ack 3989, win 385, options [nop,nop,TS val 542102 ecr 1481341969], length 53
18:34:31.857849 IP sea15s01-in-f138.1e100.net.https > 192.168.1.10.49196: Flags [.], ack 4637, win 205, options [nop,nop,TS val 1481342330 ecr 542102], length 0
18:34:31.897450 IP sea15s01-in-f138.1e100.net.https > 192.168.1.10.49196: Flags [.], ack 4690, win 205, options [nop,nop,TS val 1481342330 ecr 542102], length 0
18:34:31.953079 IP 192.168.1.10.49196 > sea15s01-in-f138.1e100.net.https: Flags [P.], seq 4690:4716, ack 3989, win 385, options [nop,nop,TS val 542115 ecr 1481342330], length 26
18:34:31.984916 IP sea15s01-in-f138.1e100.net.https > 192.168.1.10.49196: Flags [.], ack 4716, win 205, options [nop,nop,TS val 1481342457 ecr 542115], length 0
18:34:32.007851 IP sea15s01-in-f138.1e100.net.https > 192.168.1.10.49196: Flags [P.], seq 3989:4562, ack 4716, win 205, options [nop,nop,TS val 1481342480 ecr 542115], length 573
18:34:32.008081 IP sea15s01-in-f138.1e100.net.https > 192.168.1.10.49196: Flags [P.], seq 4562:4588, ack 4716, win 205, options [nop,nop,TS val 1481342480 ecr 542115], length 26
18:34:32.092136 IP 192.168.1.10.49196 > sea15s01-in-f138.1e100.net.https: Flags [.], ack 4588, win 395, options [nop,nop,TS val 542128 ecr 1481342480], length 0
18:34:32.172719 IP 192.168.1.10.45965 > sea15s01-in-f138.1e100.net.https: Flags [S], seq 561007857, win 65535, options [mss 1460,sackOK,TS val 542137 ecr 0,nop,wscale 8], length 0
18:34:32.203605 IP sea15s01-in-f138.1e100.net.https > 192.168.1.10.45965: Flags [S.], seq 626382085, ack 561007858, win 42408, options [mss 1360,sackOK,TS val 1593956565 ecr 542137,nop,wscale 8], length 0
18:34:32.302965 IP 192.168.1.10.45965 > sea15s01-in-f138.1e100.net.https: Flags [.], ack 1, win 343, options [nop,nop,TS val 542150 ecr 1593956565], length 0
18:34:32.311204 IP 192.168.1.10.45965 > sea15s01-in-f138.1e100.net.https: Flags [P.], seq 1:199, ack 1, win 343, options [nop,nop,TS val 542150 ecr 1593956565], length 198
18:34:32.342044 IP sea15s01-in-f138.1e100.net.https > 192.168.1.10.45965: Flags [.], ack 199, win 170, options [nop,nop,TS val 1593956704 ecr 542150], length 0
18:34:32.343541 IP sea15s01-in-f138.1e100.net.https > 192.168.1.10.45965: Flags [P.], seq 1:140, ack 199, win 170, options [nop,nop,TS val 1593956705 ecr 542150], length 139
18:34:32.442623 IP 192.168.1.10.45965 > sea15s01-in-f138.1e100.net.https: Flags [.], ack 140, win 347, options [nop,nop,TS val 542164 ecr 1593956705], length 0
18:34:32.445665 IP 192.168.1.10.45965 > sea15s01-in-f138.1e100.net.https: Flags [P.], seq 199:242, ack 140, win 347, options [nop,nop,TS val 542164 ecr 1593956705], length 43
18:34:32.515395 IP sea15s01-in-f138.1e100.net.https > 192.168.1.10.45965: Flags [.], ack 242, win 170, options [nop,nop,TS val 1593956838 ecr 542164], length 0
18:34:32.612473 IP 192.168.1.10.45965 > sea15s01-in-f138.1e100.net.https: Flags [P.], seq 242:1492, ack 140, win 347, options [nop,nop,TS val 542181 ecr 1593956838], length 1250
18:34:32.643360 IP sea15s01-in-f138.1e100.net.https > 192.168.1.10.45965: Flags [.], ack 1492, win 181, options [nop,nop,TS val 1593957005 ecr 542181], length 0
18:34:32.656988 IP sea15s01-in-f138.1e100.net.https > 192.168.1.10.45965: Flags [P.], seq 140:733, ack 1492, win 181, options [nop,nop,TS val 1593957019 ecr 542181], length 593
18:34:32.657197 IP sea15s01-in-f138.1e100.net.https > 192.168.1.10.45965: Flags [P.], seq 733:759, ack 1492, win 181, options [nop,nop,TS val 1593957019 ecr 542181], length 26
18:34:32.744894 IP 192.168.1.10.47512 > sea15s12-in-f10.1e100.net.https: Flags [P.], seq 2869264495:2869264518, ack 3081548992, win 351, options [nop,nop,TS val 542194 ecr 4241938903], length 23
18:34:32.745244 IP 192.168.1.10.47512 > sea15s12-in-f10.1e100.net.https: Flags [F.], seq 23, ack 1, win 351, options [nop,nop,TS val 542194 ecr 4241938903], length 0
18:34:32.775763 IP sea15s12-in-f10.1e100.net.https > 192.168.1.10.47512: Flags [.], ack 23, win 213, options [nop,nop,TS val 4241979506 ecr 542194], length 0
18:34:32.775949 IP sea15s12-in-f10.1e100.net.https > 192.168.1.10.47512: Flags [F.], seq 1, ack 23, win 213, options [nop,nop,TS val 4241979506 ecr 542194], length 0
18:34:32.776064 IP sea15s12-in-f10.1e100.net.https > 192.168.1.10.47512: Flags [.], ack 24, win 213, options [nop,nop,TS val 4241979506 ecr 542194], length 0
18:34:32.781968 IP 192.168.1.10.45965 > sea15s01-in-f138.1e100.net.https: Flags [.], ack 759, win 352, options [nop,nop,TS val 542198 ecr 1593957019], length 0
18:34:32.812470 IP 192.168.1.10.45965 > sea15s01-in-f138.1e100.net.https: Flags [.], seq 1492:2840, ack 759, win 352, options [nop,nop,TS val 542201 ecr 1593957019], length 1348
18:34:32.814757 IP 192.168.1.10.45965 > sea15s01-in-f138.1e100.net.https: Flags [.], seq 2840:4188, ack 759, win 352, options [nop,nop,TS val 542201 ecr 1593957019], length 1348
18:34:32.814780 IP 192.168.1.10.45965 > sea15s01-in-f138.1e100.net.https: Flags [P.], seq 4188:4357, ack 759, win 352, options [nop,nop,TS val 542201 ecr 1593957019], length 169
18:34:32.845685 IP sea15s01-in-f138.1e100.net.https > 192.168.1.10.45965: Flags [.], ack 4357, win 204, options [nop,nop,TS val 1593957207 ecr 542201], length 0
18:34:32.872469 IP 192.168.1.10.47512 > sea15s12-in-f10.1e100.net.https: Flags [.], ack 2, win 351, options [nop,nop,TS val 542207 ecr 4241979506], length 0
18:34:32.872759 IP 192.168.1.10.45965 > sea15s01-in-f138.1e100.net.https: Flags [P.], seq 4357:4383, ack 759, win 352, options [nop,nop,TS val 542207 ecr 1593957207], length 26
18:34:32.927975 IP sea15s01-in-f138.1e100.net.https > 192.168.1.10.45965: Flags [P.], seq 759:1376, ack 4383, win 204, options [nop,nop,TS val 1593957290 ecr 542207], length 617
18:34:32.928158 IP sea15s01-in-f138.1e100.net.https > 192.168.1.10.45965: Flags [P.], seq 1376:1402, ack 4383, win 204, options [nop,nop,TS val 1593957290 ecr 542207], length 26
18:34:33.022341 IP 192.168.1.10.45965 > sea15s01-in-f138.1e100.net.https: Flags [.], ack 1376, win 356, options [nop,nop,TS val 542222 ecr 1593957290], length 0
18:34:33.022630 IP 192.168.1.10.45965 > sea15s01-in-f138.1e100.net.https: Flags [.], ack 1402, win 356, options [nop,nop,TS val 542222 ecr 1593957290], length 0
18:34:35.624513 IP 192.168.1.10.48875 > sea15s12-in-f10.1e100.net.https: Flags [S], seq 452892451, win 65535, options [mss 1460,sackOK,TS val 542481 ecr 0,nop,wscale 8], length 0
18:34:35.655511 IP sea15s12-in-f10.1e100.net.https > 192.168.1.10.48875: Flags [S.], seq 3030090470, ack 452892452, win 42408, options [mss 1360,sackOK,TS val 1645575704 ecr 542481,nop,wscale 8], length 0
18:34:35.773350 IP 192.168.1.10.48875 > sea15s12-in-f10.1e100.net.https: Flags [.], ack 1, win 343, options [nop,nop,TS val 542497 ecr 1645575704], length 0
18:34:35.775470 IP 192.168.1.10.48875 > sea15s12-in-f10.1e100.net.https: Flags [P.], seq 1:170, ack 1, win 343, options [nop,nop,TS val 542497 ecr 1645575704], length 169
18:34:35.806286 IP sea15s12-in-f10.1e100.net.https > 192.168.1.10.48875: Flags [.], ack 170, win 170, options [nop,nop,TS val 1645575854 ecr 542497], length 0
18:34:35.817461 IP sea15s12-in-f10.1e100.net.https > 192.168.1.10.48875: Flags [.], seq 1:1349, ack 170, win 170, options [nop,nop,TS val 1645575865 ecr 542497], length 1348
18:34:35.817563 IP sea15s12-in-f10.1e100.net.https > 192.168.1.10.48875: Flags [.], seq 1349:2697, ack 170, win 170, options [nop,nop,TS val 1645575865 ecr 542497], length 1348
18:34:35.817619 IP sea15s12-in-f10.1e100.net.https > 192.168.1.10.48875: Flags [P.], seq 2697:3236, ack 170, win 170, options [nop,nop,TS val 1645575865 ecr 542497], length 539
18:34:35.915331 IP 192.168.1.10.48875 > sea15s12-in-f10.1e100.net.https: Flags [.], ack 1349, win 353, options [nop,nop,TS val 542511 ecr 1645575865], length 0
18:34:35.915346 IP 192.168.1.10.48875 > sea15s12-in-f10.1e100.net.https: Flags [.], ack 2697, win 364, options [nop,nop,TS val 542511 ecr 1645575865], length 0
18:34:35.915367 IP 192.168.1.10.48875 > sea15s12-in-f10.1e100.net.https: Flags [.], ack 3236, win 374, options [nop,nop,TS val 542511 ecr 1645575865], length 0
18:34:35.993919 IP 192.168.1.10.48875 > sea15s12-in-f10.1e100.net.https: Flags [P.], seq 170:255, ack 3236, win 374, options [nop,nop,TS val 542516 ecr 1645575865], length 85
18:34:36.025171 IP sea15s12-in-f10.1e100.net.https > 192.168.1.10.48875: Flags [P.], seq 3236:3512, ack 255, win 170, options [nop,nop,TS val 1645576073 ecr 542516], length 276
18:34:36.123354 IP 192.168.1.10.48875 > sea15s12-in-f10.1e100.net.https: Flags [.], ack 3512, win 385, options [nop,nop,TS val 542532 ecr 1645576073], length 0
18:34:36.124943 IP 192.168.1.10.48875 > sea15s12-in-f10.1e100.net.https: Flags [P.], seq 255:1348, ack 3512, win 385, options [nop,nop,TS val 542532 ecr 1645576073], length 1093
18:34:36.195868 IP sea15s12-in-f10.1e100.net.https > 192.168.1.10.48875: Flags [.], ack 1348, win 181, options [nop,nop,TS val 1645576204 ecr 542532], length 0
18:34:36.210874 IP sea15s12-in-f10.1e100.net.https > 192.168.1.10.48875: Flags [P.], seq 3512:4187, ack 1348, win 181, options [nop,nop,TS val 1645576259 ecr 542532], length 675
18:34:36.211065 IP sea15s12-in-f10.1e100.net.https > 192.168.1.10.48875: Flags [P.], seq 4187:4452, ack 1348, win 181, options [nop,nop,TS val 1645576259 ecr 542532], length 265
18:34:36.211183 IP sea15s12-in-f10.1e100.net.https > 192.168.1.10.48875: Flags [P.], seq 4452:4478, ack 1348, win 181, options [nop,nop,TS val 1645576259 ecr 542532], length 26
18:34:36.299858 IP 192.168.1.10.48875 > sea15s12-in-f10.1e100.net.https: Flags [.], ack 4478, win 406, options [nop,nop,TS val 542549 ecr 1645576259], length 0
18:34:53.113574 IP 192.168.1.10.44431 > sea15s12-in-f10.1e100.net.https: Flags [S], seq 1141482214, win 65535, options [mss 1460,sackOK,TS val 544230 ecr 0,nop,wscale 8], length 0
18:34:53.144480 IP sea15s12-in-f10.1e100.net.https > 192.168.1.10.44431: Flags [S.], seq 2914241390, ack 1141482215, win 42408, options [mss 1360,sackOK,TS val 1125221958 ecr 544230,nop,wscale 8], length 0
18:34:53.242565 IP 192.168.1.10.44431 > sea15s12-in-f10.1e100.net.https: Flags [.], ack 1, win 343, options [nop,nop,TS val 544244 ecr 1125221958], length 0
18:34:53.257174 IP 192.168.1.10.44431 > sea15s12-in-f10.1e100.net.https: Flags [P.], seq 1:198, ack 1, win 343, options [nop,nop,TS val 544244 ecr 1125221958], length 197
18:34:53.287970 IP sea15s12-in-f10.1e100.net.https > 192.168.1.10.44431: Flags [.], ack 198, win 170, options [nop,nop,TS val 1125222102 ecr 544244], length 0
18:34:53.302258 IP sea15s12-in-f10.1e100.net.https > 192.168.1.10.44431: Flags [.], seq 1:1349, ack 198, win 170, options [nop,nop,TS val 1125222116 ecr 544244], length 1348
18:34:53.302385 IP sea15s12-in-f10.1e100.net.https > 192.168.1.10.44431: Flags [.], seq 1349:2697, ack 198, win 170, options [nop,nop,TS val 1125222116 ecr 544244], length 1348
18:34:53.302434 IP sea15s12-in-f10.1e100.net.https > 192.168.1.10.44431: Flags [P.], seq 2697:3264, ack 198, win 170, options [nop,nop,TS val 1125222116 ecr 544244], length 567
18:34:53.383227 IP 192.168.1.10.44431 > sea15s12-in-f10.1e100.net.https: Flags [.], ack 1349, win 353, options [nop,nop,TS val 544258 ecr 1125222116], length 0
18:34:53.383515 IP 192.168.1.10.44431 > sea15s12-in-f10.1e100.net.https: Flags [.], ack 2697, win 364, options [nop,nop,TS val 544258 ecr 1125222116], length 0
18:34:53.383532 IP 192.168.1.10.44431 > sea15s12-in-f10.1e100.net.https: Flags [.], ack 3264, win 374, options [nop,nop,TS val 544258 ecr 1125222116], length 0
18:34:53.438031 IP 192.168.1.10.44431 > sea15s12-in-f10.1e100.net.https: Flags [P.], seq 198:283, ack 3264, win 374, options [nop,nop,TS val 544263 ecr 1125222116], length 85
18:34:53.468878 IP sea15s12-in-f10.1e100.net.https > 192.168.1.10.44431: Flags [P.], seq 3264:3307, ack 283, win 170, options [nop,nop,TS val 1125222283 ecr 544263], length 43
18:34:53.563445 IP 192.168.1.10.44431 > sea15s12-in-f10.1e100.net.https: Flags [.], ack 3307, win 374, options [nop,nop,TS val 544276 ecr 1125222283], length 0
18:34:53.570827 IP 192.168.1.10.44431 > sea15s12-in-f10.1e100.net.https: Flags [.], seq 283:1631, ack 3307, win 374, options [nop,nop,TS val 544276 ecr 1125222283], length 1348
18:34:53.571401 IP 192.168.1.10.44431 > sea15s12-in-f10.1e100.net.https: Flags [.], seq 1631:2979, ack 3307, win 374, options [nop,nop,TS val 544276 ecr 1125222283], length 1348
18:34:53.571793 IP 192.168.1.10.44431 > sea15s12-in-f10.1e100.net.https: Flags [.], seq 2979:4327, ack 3307, win 374, options [nop,nop,TS val 544276 ecr 1125222283], length 1348
18:34:53.576820 IP 192.168.1.10.44431 > sea15s12-in-f10.1e100.net.https: Flags [P.], seq 4327:4943, ack 3307, win 374, options [nop,nop,TS val 544276 ecr 1125222283], length 616
18:34:53.602220 IP sea15s12-in-f10.1e100.net.https > 192.168.1.10.44431: Flags [.], ack 2979, win 192, options [nop,nop,TS val 1125222416 ecr 544276], length 0
18:34:53.607751 IP sea15s12-in-f10.1e100.net.https > 192.168.1.10.44431: Flags [.], ack 4943, win 213, options [nop,nop,TS val 1125222421 ecr 544276], length 0
18:34:53.633974 IP sea15s12-in-f10.1e100.net.https > 192.168.1.10.44431: Flags [P.], seq 3307:4655, ack 4943, win 213, options [nop,nop,TS val 1125222447 ecr 544276], length 1348
18:34:53.634210 IP sea15s12-in-f10.1e100.net.https > 192.168.1.10.44431: Flags [P.], seq 4655:6003, ack 4943, win 213, options [nop,nop,TS val 1125222447 ecr 544276], length 1348
18:34:53.634799 IP sea15s12-in-f10.1e100.net.https > 192.168.1.10.44431: Flags [.], seq 6003:7351, ack 4943, win 213, options [nop,nop,TS val 1125222447 ecr 544276], length 1348
18:34:53.634896 IP sea15s12-in-f10.1e100.net.https > 192.168.1.10.44431: Flags [P.], seq 7351:7891, ack 4943, win 213, options [nop,nop,TS val 1125222447 ecr 544276], length 540
18:34:53.635972 IP sea15s12-in-f10.1e100.net.https > 192.168.1.10.44431: Flags [P.], seq 7891:7917, ack 4943, win 213, options [nop,nop,TS val 1125222448 ecr 544276], length 26
18:34:53.706043 IP 192.168.1.10.44431 > sea15s12-in-f10.1e100.net.https: Flags [.], ack 7917, win 416, options [nop,nop,TS val 544290 ecr 1125222447], length 0
18:34:53.710614 IP 192.168.1.10.42664 > sea15s07-in-f78.1e100.net.https: Flags [P.], seq 1339470726:1339470749, ack 881438385, win 355, options [nop,nop,TS val 544290 ecr 3927725601], length 23
18:34:53.741318 IP sea15s07-in-f78.1e100.net.https > 192.168.1.10.42664: Flags [F.], seq 1, ack 23, win 260, options [nop,nop,TS val 3927783179 ecr 544290], length 0
18:34:53.882299 IP 192.168.1.10.42664 > sea15s07-in-f78.1e100.net.https: Flags [.], ack 2, win 355, options [nop,nop,TS val 544308 ecr 3927783179], length 0
18:34:54.198549 IP 192.168.1.10.43022 > sea15s12-in-f10.1e100.net.https: Flags [S], seq 2044277153, win 65535, options [mss 1460,sackOK,TS val 544339 ecr 0,nop,wscale 8], length 0
18:34:54.229298 IP sea15s12-in-f10.1e100.net.https > 192.168.1.10.43022: Flags [S.], seq 1009867211, ack 2044277154, win 42408, options [mss 1360,sackOK,TS val 4246242415 ecr 544339,nop,wscale 8], length 0
18:34:54.322424 IP 192.168.1.10.43022 > sea15s12-in-f10.1e100.net.https: Flags [.], ack 1, win 343, options [nop,nop,TS val 544352 ecr 4246242415], length 0
18:34:54.329381 IP 192.168.1.10.43022 > sea15s12-in-f10.1e100.net.https: Flags [P.], seq 1:192, ack 1, win 343, options [nop,nop,TS val 544352 ecr 4246242415], length 191
18:34:54.360061 IP sea15s12-in-f10.1e100.net.https > 192.168.1.10.43022: Flags [.], ack 192, win 170, options [nop,nop,TS val 4246242545 ecr 544352], length 0
18:34:54.367523 IP sea15s12-in-f10.1e100.net.https > 192.168.1.10.43022: Flags [.], seq 1:1349, ack 192, win 170, options [nop,nop,TS val 4246242553 ecr 544352], length 1348
18:34:54.367682 IP sea15s12-in-f10.1e100.net.https > 192.168.1.10.43022: Flags [.], seq 1349:2697, ack 192, win 170, options [nop,nop,TS val 4246242553 ecr 544352], length 1348
18:34:54.367726 IP sea15s12-in-f10.1e100.net.https > 192.168.1.10.43022: Flags [P.], seq 2697:3274, ack 192, win 170, options [nop,nop,TS val 4246242553 ecr 544352], length 577
18:34:54.453038 IP 192.168.1.10.43022 > sea15s12-in-f10.1e100.net.https: Flags [.], ack 1349, win 353, options [nop,nop,TS val 544365 ecr 4246242553], length 0
18:34:54.453052 IP 192.168.1.10.43022 > sea15s12-in-f10.1e100.net.https: Flags [.], ack 2697, win 364, options [nop,nop,TS val 544365 ecr 4246242553], length 0
18:34:54.453070 IP 192.168.1.10.43022 > sea15s12-in-f10.1e100.net.https: Flags [.], ack 3274, win 374, options [nop,nop,TS val 544365 ecr 4246242553], length 0
18:34:54.507520 IP 192.168.1.10.43022 > sea15s12-in-f10.1e100.net.https: Flags [P.], seq 192:277, ack 3274, win 374, options [nop,nop,TS val 544370 ecr 4246242553], length 85
18:34:54.520405 IP 192.168.1.10.43022 > sea15s12-in-f10.1e100.net.https: Flags [P.], seq 277:322, ack 3274, win 374, options [nop,nop,TS val 544371 ecr 4246242553], length 45
18:34:54.520881 IP 192.168.1.10.43022 > sea15s12-in-f10.1e100.net.https: Flags [P.], seq 322:352, ack 3274, win 374, options [nop,nop,TS val 544371 ecr 4246242553], length 30
18:34:54.538415 IP sea15s12-in-f10.1e100.net.https > 192.168.1.10.43022: Flags [P.], seq 3274:3317, ack 277, win 170, options [nop,nop,TS val 4246242724 ecr 544370], length 43
18:34:54.538599 IP sea15s12-in-f10.1e100.net.https > 192.168.1.10.43022: Flags [P.], seq 3317:3378, ack 277, win 170, options [nop,nop,TS val 4246242724 ecr 544370], length 61
18:34:54.551485 IP sea15s12-in-f10.1e100.net.https > 192.168.1.10.43022: Flags [.], ack 352, win 170, options [nop,nop,TS val 4246242737 ecr 544371], length 0
18:34:54.551670 IP sea15s12-in-f10.1e100.net.https > 192.168.1.10.43022: Flags [P.], seq 3378:3408, ack 352, win 170, options [nop,nop,TS val 4246242737 ecr 544371], length 30
18:34:54.571312 IP 192.168.1.10.43022 > sea15s12-in-f10.1e100.net.https: Flags [.], ack 3317, win 374, options [nop,nop,TS val 544376 ecr 4246242724], length 0
18:34:54.572686 IP 192.168.1.10.43022 > sea15s12-in-f10.1e100.net.https: Flags [.], ack 3378, win 374, options [nop,nop,TS val 544376 ecr 4246242724], length 0
18:34:54.572961 IP 192.168.1.10.43022 > sea15s12-in-f10.1e100.net.https: Flags [.], ack 3408, win 374, options [nop,nop,TS val 544377 ecr 4246242737], length 0
18:34:54.596685 IP 192.168.1.10.43022 > sea15s12-in-f10.1e100.net.https: Flags [P.], seq 352:382, ack 3408, win 374, options [nop,nop,TS val 544379 ecr 4246242737], length 30
18:34:54.613942 IP 192.168.1.10.43022 > sea15s12-in-f10.1e100.net.https: Flags [P.], seq 382:1153, ack 3408, win 374, options [nop,nop,TS val 544381 ecr 4246242737], length 771
18:34:54.644672 IP sea15s12-in-f10.1e100.net.https > 192.168.1.10.43022: Flags [.], ack 1153, win 176, options [nop,nop,TS val 4246242830 ecr 544379], length 0
18:34:54.661308 IP sea15s12-in-f10.1e100.net.https > 192.168.1.10.43022: Flags [P.], seq 3408:3601, ack 1153, win 176, options [nop,nop,TS val 4246242847 ecr 544379], length 193
18:34:54.661539 IP sea15s12-in-f10.1e100.net.https > 192.168.1.10.43022: Flags [P.], seq 3601:3962, ack 1153, win 176, options [nop,nop,TS val 4246242847 ecr 544379], length 361
18:34:54.661731 IP sea15s12-in-f10.1e100.net.https > 192.168.1.10.43022: Flags [P.], seq 3962:4000, ack 1153, win 176, options [nop,nop,TS val 4246242847 ecr 544379], length 38
18:34:54.681740 IP 192.168.1.10.43022 > sea15s12-in-f10.1e100.net.https: Flags [.], ack 4000, win 395, options [nop,nop,TS val 544387 ecr 4246242847], length 0
18:34:54.681762 IP 192.168.1.10.43022 > sea15s12-in-f10.1e100.net.https: Flags [P.], seq 1153:1191, ack 4000, win 395, options [nop,nop,TS val 544387 ecr 4246242847], length 38
18:34:54.752637 IP sea15s12-in-f10.1e100.net.https > 192.168.1.10.43022: Flags [.], ack 1191, win 176, options [nop,nop,TS val 4246242898 ecr 544387], length 0
18:34:55.848313 IP 192.168.1.10.51809 > ec2-54-171-29-251.eu-west-1.compute.amazonaws.com.www: Flags [S], seq 683008831, win 65535, options [mss 1460,sackOK,TS val 544502 ecr 0,nop,wscale 8], length 0
18:34:55.855457 IP ec2-54-171-29-251.eu-west-1.compute.amazonaws.com.www > 192.168.1.10.51809: Flags [S.], seq 2524197661, ack 683008832, win 26960, options [mss 1360,sackOK,TS val 3173289689 ecr 544502,nop,wscale 7], length 0
18:34:55.857200 IP 192.168.1.10.51809 > ec2-54-171-29-251.eu-west-1.compute.amazonaws.com.www: Flags [.], ack 1, win 343, options [nop,nop,TS val 544505 ecr 3173289689], length 0
18:34:55.865553 IP 192.168.1.10.51809 > ec2-54-171-29-251.eu-west-1.compute.amazonaws.com.www: Flags [P.], seq 1:243, ack 1, win 343, options [nop,nop,TS val 544506 ecr 3173289689], length 242: HTTP
18:34:55.872614 IP ec2-54-171-29-251.eu-west-1.compute.amazonaws.com.www > 192.168.1.10.51809: Flags [.], ack 243, win 219, options [nop,nop,TS val 3173289693 ecr 544506], length 0
18:34:55.872955 IP ec2-54-171-29-251.eu-west-1.compute.amazonaws.com.www > 192.168.1.10.51809: Flags [.], seq 1:1349, ack 243, win 219, options [nop,nop,TS val 3173289693 ecr 544506], length 1348: HTTP: HTTP/1.1 400 Bad Request
18:34:55.873010 IP ec2-54-171-29-251.eu-west-1.compute.amazonaws.com.www > 192.168.1.10.51809: Flags [.], seq 1349:2697, ack 243, win 219, options [nop,nop,TS val 3173289693 ecr 544506], length 1348: HTTP
18:34:55.873043 IP ec2-54-171-29-251.eu-west-1.compute.amazonaws.com.www > 192.168.1.10.51809: Flags [.], seq 2697:4045, ack 243, win 219, options [nop,nop,TS val 3173289693 ecr 544506], length 1348: HTTP
18:34:55.873072 IP ec2-54-171-29-251.eu-west-1.compute.amazonaws.com.www > 192.168.1.10.51809: Flags [P.], seq 4045:4056, ack 243, win 219, options [nop,nop,TS val 3173289693 ecr 544506], length 11: HTTP
18:34:55.874593 IP ec2-54-171-29-251.eu-west-1.compute.amazonaws.com.www > 192.168.1.10.51809: Flags [F.], seq 4056, ack 243, win 219, options [nop,nop,TS val 3173289694 ecr 544506], length 0
18:34:55.877896 IP 192.168.1.10.51809 > ec2-54-171-29-251.eu-west-1.compute.amazonaws.com.www: Flags [.], ack 1349, win 353, options [nop,nop,TS val 544507 ecr 3173289693], length 0
18:34:55.877912 IP 192.168.1.10.51809 > ec2-54-171-29-251.eu-west-1.compute.amazonaws.com.www: Flags [.], ack 2697, win 364, options [nop,nop,TS val 544507 ecr 3173289693], length 0
18:34:55.877930 IP 192.168.1.10.51809 > ec2-54-171-29-251.eu-west-1.compute.amazonaws.com.www: Flags [R.], seq 243, ack 2697, win 364, options [nop,nop,TS val 544507 ecr 3173289693], length 0
18:34:55.878399 IP 192.168.1.10.51809 > ec2-54-171-29-251.eu-west-1.compute.amazonaws.com.www: Flags [R], seq 683009074, win 0, length 0
18:34:55.878415 IP 192.168.1.10.51809 > ec2-54-171-29-251.eu-west-1.compute.amazonaws.com.www: Flags [R], seq 683009074, win 0, length 0
18:34:55.878426 IP 192.168.1.10.51809 > ec2-54-171-29-251.eu-west-1.compute.amazonaws.com.www: Flags [R], seq 683009074, win 0, length 0
18:34:55.880261 IP 192.168.1.10.35167 > ec2-54-171-29-251.eu-west-1.compute.amazonaws.com.www: Flags [S], seq 1400306774, win 65535, options [mss 1460,sackOK,TS val 544507 ecr 0,nop,wscale 8], length 0
18:34:55.887200 IP ec2-54-171-29-251.eu-west-1.compute.amazonaws.com.www > 192.168.1.10.35167: Flags [S.], seq 354760592, ack 1400306775, win 26960, options [mss 1360,sackOK,TS val 3173289697 ecr 544507,nop,wscale 7], length 0
18:34:55.888256 IP 192.168.1.10.35167 > ec2-54-171-29-251.eu-west-1.compute.amazonaws.com.www: Flags [.], ack 1, win 343, options [nop,nop,TS val 544508 ecr 3173289697], length 0
18:34:55.890391 IP 192.168.1.10.35167 > ec2-54-171-29-251.eu-west-1.compute.amazonaws.com.www: Flags [P.], seq 1:79, ack 1, win 343, options [nop,nop,TS val 544508 ecr 3173289697], length 78: HTTP
18:34:55.897365 IP ec2-54-171-29-251.eu-west-1.compute.amazonaws.com.www > 192.168.1.10.35167: Flags [.], ack 79, win 211, options [nop,nop,TS val 3173289700 ecr 544508], length 0
18:34:55.897633 IP ec2-54-171-29-251.eu-west-1.compute.amazonaws.com.www > 192.168.1.10.35167: Flags [.], seq 1:1349, ack 79, win 211, options [nop,nop,TS val 3173289700 ecr 544508], length 1348: HTTP: HTTP/1.1 400 Bad Request
18:34:55.897683 IP ec2-54-171-29-251.eu-west-1.compute.amazonaws.com.www > 192.168.1.10.35167: Flags [.], seq 1349:2697, ack 79, win 211, options [nop,nop,TS val 3173289700 ecr 544508], length 1348: HTTP
18:34:55.897714 IP ec2-54-171-29-251.eu-west-1.compute.amazonaws.com.www > 192.168.1.10.35167: Flags [.], seq 2697:4045, ack 79, win 211, options [nop,nop,TS val 3173289700 ecr 544508], length 1348: HTTP
18:34:55.897742 IP ec2-54-171-29-251.eu-west-1.compute.amazonaws.com.www > 192.168.1.10.35167: Flags [P.], seq 4045:4050, ack 79, win 211, options [nop,nop,TS val 3173289700 ecr 544508], length 5: HTTP
18:34:55.899239 IP ec2-54-171-29-251.eu-west-1.compute.amazonaws.com.www > 192.168.1.10.35167: Flags [F.], seq 4050, ack 79, win 211, options [nop,nop,TS val 3173289700 ecr 544508], length 0
18:34:55.909790 IP 192.168.1.10.35167 > ec2-54-171-29-251.eu-west-1.compute.amazonaws.com.www: Flags [.], ack 1349, win 353, options [nop,nop,TS val 544509 ecr 3173289700], length 0
18:34:55.909803 IP 192.168.1.10.35167 > ec2-54-171-29-251.eu-west-1.compute.amazonaws.com.www: Flags [R.], seq 79, ack 1349, win 353, options [nop,nop,TS val 544509 ecr 3173289700], length 0
18:34:55.909812 IP 192.168.1.10.35167 > ec2-54-171-29-251.eu-west-1.compute.amazonaws.com.www: Flags [R], seq 1400306853, win 0, length 0
18:34:55.909821 IP 192.168.1.10.35167 > ec2-54-171-29-251.eu-west-1.compute.amazonaws.com.www: Flags [R], seq 1400306853, win 0, length 0
18:34:55.909830 IP 192.168.1.10.35167 > ec2-54-171-29-251.eu-west-1.compute.amazonaws.com.www: Flags [R], seq 1400306853, win 0, length 0
18:34:55.909838 IP 192.168.1.10.35167 > ec2-54-171-29-251.eu-west-1.compute.amazonaws.com.www: Flags [R], seq 1400306853, win 0, length 0
18:34:55.909856 IP 192.168.1.10.55547 > ec2-54-229-101-77.eu-west-1.compute.amazonaws.com.www: Flags [S], seq 3484687075, win 65535, options [mss 1460,sackOK,TS val 544510 ecr 0,nop,wscale 8], length 0
18:34:55.917103 IP ec2-54-229-101-77.eu-west-1.compute.amazonaws.com.www > 192.168.1.10.55547: Flags [S.], seq 3418994040, ack 3484687076, win 26960, options [mss 1360,sackOK,TS val 3173289705 ecr 544510,nop,wscale 7], length 0
18:34:55.918383 IP 192.168.1.10.55547 > ec2-54-229-101-77.eu-west-1.compute.amazonaws.com.www: Flags [.], ack 1, win 343, options [nop,nop,TS val 544511 ecr 3173289705], length 0
18:34:55.923266 IP 192.168.1.10.55547 > ec2-54-229-101-77.eu-west-1.compute.amazonaws.com.www: Flags [P.], seq 1:243, ack 1, win 343, options [nop,nop,TS val 544512 ecr 3173289705], length 242: HTTP
18:34:55.930197 IP ec2-54-229-101-77.eu-west-1.compute.amazonaws.com.www > 192.168.1.10.55547: Flags [.], ack 243, win 219, options [nop,nop,TS val 3173289708 ecr 544512], length 0
18:34:55.930469 IP ec2-54-229-101-77.eu-west-1.compute.amazonaws.com.www > 192.168.1.10.55547: Flags [.], seq 1:1349, ack 243, win 219, options [nop,nop,TS val 3173289708 ecr 544512], length 1348: HTTP: HTTP/1.1 400 Bad Request
18:34:55.930525 IP ec2-54-229-101-77.eu-west-1.compute.amazonaws.com.www > 192.168.1.10.55547: Flags [.], seq 1349:2697, ack 243, win 219, options [nop,nop,TS val 3173289708 ecr 544512], length 1348: HTTP
18:34:55.930556 IP ec2-54-229-101-77.eu-west-1.compute.amazonaws.com.www > 192.168.1.10.55547: Flags [P.], seq 2697:3606, ack 243, win 219, options [nop,nop,TS val 3173289708 ecr 544512], length 909: HTTP
18:34:55.931758 IP ec2-54-229-101-77.eu-west-1.compute.amazonaws.com.www > 192.168.1.10.55547: Flags [F.], seq 3606, ack 243, win 219, options [nop,nop,TS val 3173289708 ecr 544512], length 0
18:34:55.933882 IP 192.168.1.10.55547 > ec2-54-229-101-77.eu-west-1.compute.amazonaws.com.www: Flags [.], ack 1349, win 353, options [nop,nop,TS val 544513 ecr 3173289708], length 0
18:34:55.933897 IP 192.168.1.10.55547 > ec2-54-229-101-77.eu-west-1.compute.amazonaws.com.www: Flags [R.], seq 243, ack 1349, win 353, options [nop,nop,TS val 544513 ecr 3173289708], length 0
18:34:55.933914 IP 192.168.1.10.55547 > ec2-54-229-101-77.eu-west-1.compute.amazonaws.com.www: Flags [R], seq 3484687318, win 0, length 0
18:34:55.934233 IP 192.168.1.10.55547 > ec2-54-229-101-77.eu-west-1.compute.amazonaws.com.www: Flags [R], seq 3484687318, win 0, length 0
18:34:55.934356 IP 192.168.1.10.55547 > ec2-54-229-101-77.eu-west-1.compute.amazonaws.com.www: Flags [R], seq 3484687318, win 0, length 0
18:34:55.939257 IP 192.168.1.10.46597 > ec2-54-229-101-77.eu-west-1.compute.amazonaws.com.www: Flags [S], seq 4161924867, win 65535, options [mss 1460,sackOK,TS val 544513 ecr 0,nop,wscale 8], length 0
18:34:55.946279 IP ec2-54-229-101-77.eu-west-1.compute.amazonaws.com.www > 192.168.1.10.46597: Flags [S.], seq 799552424, ack 4161924868, win 26960, options [mss 1360,sackOK,TS val 3173289712 ecr 544513,nop,wscale 7], length 0
18:34:55.948161 IP 192.168.1.10.46597 > ec2-54-229-101-77.eu-west-1.compute.amazonaws.com.www: Flags [.], ack 1, win 343, options [nop,nop,TS val 544514 ecr 3173289712], length 0
18:34:55.951627 IP 192.168.1.10.46597 > ec2-54-229-101-77.eu-west-1.compute.amazonaws.com.www: Flags [P.], seq 1:79, ack 1, win 343, options [nop,nop,TS val 544514 ecr 3173289712], length 78: HTTP
18:34:55.958500 IP ec2-54-229-101-77.eu-west-1.compute.amazonaws.com.www > 192.168.1.10.46597: Flags [.], ack 79, win 211, options [nop,nop,TS val 3173289715 ecr 544514], length 0
18:34:55.958845 IP ec2-54-229-101-77.eu-west-1.compute.amazonaws.com.www > 192.168.1.10.46597: Flags [.], seq 1:1349, ack 79, win 211, options [nop,nop,TS val 3173289715 ecr 544514], length 1348: HTTP: HTTP/1.1 400 Bad Request
18:34:55.958901 IP ec2-54-229-101-77.eu-west-1.compute.amazonaws.com.www > 192.168.1.10.46597: Flags [.], seq 1349:2697, ack 79, win 211, options [nop,nop,TS val 3173289715 ecr 544514], length 1348: HTTP
18:34:55.958933 IP ec2-54-229-101-77.eu-west-1.compute.amazonaws.com.www > 192.168.1.10.46597: Flags [.], seq 2697:4045, ack 79, win 211, options [nop,nop,TS val 3173289715 ecr 544514], length 1348: HTTP
18:34:55.958961 IP ec2-54-229-101-77.eu-west-1.compute.amazonaws.com.www > 192.168.1.10.46597: Flags [P.], seq 4045:4050, ack 79, win 211, options [nop,nop,TS val 3173289715 ecr 544514], length 5: HTTP
18:34:55.960474 IP ec2-54-229-101-77.eu-west-1.compute.amazonaws.com.www > 192.168.1.10.46597: Flags [F.], seq 4050, ack 79, win 211, options [nop,nop,TS val 3173289715 ecr 544514], length 0
18:34:55.961626 IP 192.168.1.10.46597 > ec2-54-229-101-77.eu-west-1.compute.amazonaws.com.www: Flags [.], ack 1349, win 353, options [nop,nop,TS val 544515 ecr 3173289715], length 0
18:34:55.961640 IP 192.168.1.10.46597 > ec2-54-229-101-77.eu-west-1.compute.amazonaws.com.www: Flags [R.], seq 79, ack 1349, win 353, options [nop,nop,TS val 544515 ecr 3173289715], length 0
18:34:55.961660 IP 192.168.1.10.46597 > ec2-54-229-101-77.eu-west-1.compute.amazonaws.com.www: Flags [R], seq 4161924946, win 0, length 0
18:34:55.963689 IP 192.168.1.10.46597 > ec2-54-229-101-77.eu-west-1.compute.amazonaws.com.www: Flags [R], seq 4161924946, win 0, length 0
18:34:55.963701 IP 192.168.1.10.46597 > ec2-54-229-101-77.eu-west-1.compute.amazonaws.com.www: Flags [R], seq 4161924946, win 0, length 0
18:34:55.963715 IP 192.168.1.10.46597 > ec2-54-229-101-77.eu-west-1.compute.amazonaws.com.www: Flags [R], seq 4161924946, win 0, length 0
18:34:55.964267 IP 192.168.1.10.39179 > ec2-52-30-58-171.eu-west-1.compute.amazonaws.com.www: Flags [S], seq 864890061, win 65535, options [mss 1460,sackOK,TS val 544516 ecr 0,nop,wscale 8], length 0
18:34:55.971285 IP ec2-52-30-58-171.eu-west-1.compute.amazonaws.com.www > 192.168.1.10.39179: Flags [S.], seq 2002175503, ack 864890062, win 26960, options [mss 1360,sackOK,TS val 3173289718 ecr 544516,nop,wscale 7], length 0
18:34:55.972632 IP 192.168.1.10.39179 > ec2-52-30-58-171.eu-west-1.compute.amazonaws.com.www: Flags [.], ack 1, win 343, options [nop,nop,TS val 544517 ecr 3173289718], length 0
18:34:55.977386 IP 192.168.1.10.39179 > ec2-52-30-58-171.eu-west-1.compute.amazonaws.com.www: Flags [P.], seq 1:243, ack 1, win 343, options [nop,nop,TS val 544517 ecr 3173289718], length 242: HTTP
18:34:55.984400 IP ec2-52-30-58-171.eu-west-1.compute.amazonaws.com.www > 192.168.1.10.39179: Flags [.], ack 243, win 219, options [nop,nop,TS val 3173289721 ecr 544517], length 0
18:34:55.984681 IP ec2-52-30-58-171.eu-west-1.compute.amazonaws.com.www > 192.168.1.10.39179: Flags [.], seq 1:1349, ack 243, win 219, options [nop,nop,TS val 3173289721 ecr 544517], length 1348: HTTP: HTTP/1.1 400 Bad Request
18:34:55.984735 IP ec2-52-30-58-171.eu-west-1.compute.amazonaws.com.www > 192.168.1.10.39179: Flags [.], seq 1349:2697, ack 243, win 219, options [nop,nop,TS val 3173289721 ecr 544517], length 1348: HTTP
18:34:55.984766 IP ec2-52-30-58-171.eu-west-1.compute.amazonaws.com.www > 192.168.1.10.39179: Flags [P.], seq 2697:3554, ack 243, win 219, options [nop,nop,TS val 3173289721 ecr 544517], length 857: HTTP
18:34:55.985986 IP ec2-52-30-58-171.eu-west-1.compute.amazonaws.com.www > 192.168.1.10.39179: Flags [F.], seq 3554, ack 243, win 219, options [nop,nop,TS val 3173289721 ecr 544517], length 0
18:34:55.987136 IP 192.168.1.10.39179 > ec2-52-30-58-171.eu-west-1.compute.amazonaws.com.www: Flags [.], ack 1349, win 353, options [nop,nop,TS val 544518 ecr 3173289721], length 0
18:34:55.987164 IP 192.168.1.10.39179 > ec2-52-30-58-171.eu-west-1.compute.amazonaws.com.www: Flags [.], ack 2697, win 364, options [nop,nop,TS val 544518 ecr 3173289721], length 0
18:34:55.990737 IP 192.168.1.10.39179 > ec2-52-30-58-171.eu-west-1.compute.amazonaws.com.www: Flags [R.], seq 243, ack 2697, win 364, options [nop,nop,TS val 544518 ecr 3173289721], length 0
18:34:55.993690 IP 192.168.1.10.39179 > ec2-52-30-58-171.eu-west-1.compute.amazonaws.com.www: Flags [R], seq 864890304, win 0, length 0
18:34:55.994000 IP 192.168.1.10.39179 > ec2-52-30-58-171.eu-west-1.compute.amazonaws.com.www: Flags [R], seq 864890304, win 0, length 0
18:34:55.994526 IP 192.168.1.10.60756 > ec2-52-30-58-171.eu-west-1.compute.amazonaws.com.www: Flags [S], seq 4107214372, win 65535, options [mss 1460,sackOK,TS val 544519 ecr 0,nop,wscale 8], length 0
18:34:56.001526 IP ec2-52-30-58-171.eu-west-1.compute.amazonaws.com.www > 192.168.1.10.60756: Flags [S.], seq 3926577947, ack 4107214373, win 26960, options [mss 1360,sackOK,TS val 3173289726 ecr 544519,nop,wscale 7], length 0
18:34:56.003162 IP 192.168.1.10.60756 > ec2-52-30-58-171.eu-west-1.compute.amazonaws.com.www: Flags [.], ack 1, win 343, options [nop,nop,TS val 544520 ecr 3173289726], length 0
18:34:56.006402 IP 192.168.1.10.60756 > ec2-52-30-58-171.eu-west-1.compute.amazonaws.com.www: Flags [P.], seq 1:79, ack 1, win 343, options [nop,nop,TS val 544520 ecr 3173289726], length 78: HTTP
18:34:56.013360 IP ec2-52-30-58-171.eu-west-1.compute.amazonaws.com.www > 192.168.1.10.60756: Flags [.], ack 79, win 211, options [nop,nop,TS val 3173289729 ecr 544520], length 0
18:34:56.013634 IP ec2-52-30-58-171.eu-west-1.compute.amazonaws.com.www > 192.168.1.10.60756: Flags [.], seq 1:1349, ack 79, win 211, options [nop,nop,TS val 3173289729 ecr 544520], length 1348: HTTP: HTTP/1.1 400 Bad Request
18:34:56.013686 IP ec2-52-30-58-171.eu-west-1.compute.amazonaws.com.www > 192.168.1.10.60756: Flags [.], seq 1349:2697, ack 79, win 211, options [nop,nop,TS val 3173289729 ecr 544520], length 1348: HTTP
18:34:56.013716 IP ec2-52-30-58-171.eu-west-1.compute.amazonaws.com.www > 192.168.1.10.60756: Flags [.], seq 2697:4045, ack 79, win 211, options [nop,nop,TS val 3173289729 ecr 544520], length 1348: HTTP
18:34:56.013744 IP ec2-52-30-58-171.eu-west-1.compute.amazonaws.com.www > 192.168.1.10.60756: Flags [P.], seq 4045:4050, ack 79, win 211, options [nop,nop,TS val 3173289729 ecr 544520], length 5: HTTP
18:34:56.015237 IP ec2-52-30-58-171.eu-west-1.compute.amazonaws.com.www > 192.168.1.10.60756: Flags [F.], seq 4050, ack 79, win 211, options [nop,nop,TS val 3173289729 ecr 544520], length 0
18:34:56.016524 IP 192.168.1.10.60756 > ec2-52-30-58-171.eu-west-1.compute.amazonaws.com.www: Flags [.], ack 1349, win 353, options [nop,nop,TS val 544521 ecr 3173289729], length 0
18:34:56.016540 IP 192.168.1.10.60756 > ec2-52-30-58-171.eu-west-1.compute.amazonaws.com.www: Flags [.], ack 2697, win 364, options [nop,nop,TS val 544521 ecr 3173289729], length 0
18:34:56.016584 IP 192.168.1.10.60756 > ec2-52-30-58-171.eu-west-1.compute.amazonaws.com.www: Flags [R.], seq 79, ack 2697, win 364, options [nop,nop,TS val 544521 ecr 3173289729], length 0
18:34:56.016937 IP 192.168.1.10.60756 > ec2-52-30-58-171.eu-west-1.compute.amazonaws.com.www: Flags [R], seq 4107214451, win 0, length 0
18:34:56.017030 IP 192.168.1.10.60756 > ec2-52-30-58-171.eu-west-1.compute.amazonaws.com.www: Flags [R], seq 4107214451, win 0, length 0
18:34:56.018012 IP 192.168.1.10.60756 > ec2-52-30-58-171.eu-west-1.compute.amazonaws.com.www: Flags [R], seq 4107214451, win 0, length 0
18:34:56.019406 IP 192.168.1.10.57021 > ec2-52-17-154-125.eu-west-1.compute.amazonaws.com.www: Flags [S], seq 1024388543, win 65535, options [mss 1460,sackOK,TS val 544521 ecr 0,nop,wscale 8], length 0
18:34:56.026406 IP ec2-52-17-154-125.eu-west-1.compute.amazonaws.com.www > 192.168.1.10.57021: Flags [S.], seq 1194725956, ack 1024388544, win 26960, options [mss 1360,sackOK,TS val 3173289732 ecr 544521,nop,wscale 7], length 0
18:34:56.028030 IP 192.168.1.10.57021 > ec2-52-17-154-125.eu-west-1.compute.amazonaws.com.www: Flags [.], ack 1, win 343, options [nop,nop,TS val 544522 ecr 3173289732], length 0
18:34:56.031541 IP 192.168.1.10.57021 > ec2-52-17-154-125.eu-west-1.compute.amazonaws.com.www: Flags [P.], seq 1:243, ack 1, win 343, options [nop,nop,TS val 544522 ecr 3173289732], length 242: HTTP
18:34:56.038546 IP ec2-52-17-154-125.eu-west-1.compute.amazonaws.com.www > 192.168.1.10.57021: Flags [.], ack 243, win 219, options [nop,nop,TS val 3173289735 ecr 544522], length 0
18:34:56.038840 IP ec2-52-17-154-125.eu-west-1.compute.amazonaws.com.www > 192.168.1.10.57021: Flags [.], seq 1:1349, ack 243, win 219, options [nop,nop,TS val 3173289735 ecr 544522], length 1348: HTTP: HTTP/1.1 400 Bad Request
18:34:56.038894 IP ec2-52-17-154-125.eu-west-1.compute.amazonaws.com.www > 192.168.1.10.57021: Flags [.], seq 1349:2697, ack 243, win 219, options [nop,nop,TS val 3173289735 ecr 544522], length 1348: HTTP
18:34:56.038924 IP ec2-52-17-154-125.eu-west-1.compute.amazonaws.com.www > 192.168.1.10.57021: Flags [.], seq 2697:4045, ack 243, win 219, options [nop,nop,TS val 3173289735 ecr 544522], length 1348: HTTP
18:34:56.038955 IP ec2-52-17-154-125.eu-west-1.compute.amazonaws.com.www > 192.168.1.10.57021: Flags [P.], seq 4045:4056, ack 243, win 219, options [nop,nop,TS val 3173289735 ecr 544522], length 11: HTTP
18:34:56.040489 IP ec2-52-17-154-125.eu-west-1.compute.amazonaws.com.www > 192.168.1.10.57021: Flags [F.], seq 4056, ack 243, win 219, options [nop,nop,TS val 3173289735 ecr 544522], length 0
18:34:56.054126 IP 192.168.1.10.57021 > ec2-52-17-154-125.eu-west-1.compute.amazonaws.com.www: Flags [.], ack 1349, win 353, options [nop,nop,TS val 544524 ecr 3173289735], length 0
18:34:56.054152 IP 192.168.1.10.57021 > ec2-52-17-154-125.eu-west-1.compute.amazonaws.com.www: Flags [R.], seq 243, ack 1349, win 353, options [nop,nop,TS val 544525 ecr 3173289735], length 0
18:34:56.054636 IP 192.168.1.10.55594 > ec2-52-17-154-125.eu-west-1.compute.amazonaws.com.www: Flags [S], seq 2341302306, win 65535, options [mss 1460,sackOK,TS val 544525 ecr 0,nop,wscale 8], length 0
18:34:56.061430 IP 192.168.1.10.57021 > ec2-52-17-154-125.eu-west-1.compute.amazonaws.com.www: Flags [R], seq 1024388786, win 0, length 0
18:34:56.061797 IP ec2-52-17-154-125.eu-west-1.compute.amazonaws.com.www > 192.168.1.10.55594: Flags [S.], seq 1196407854, ack 2341302307, win 26960, options [mss 1360,sackOK,TS val 3173289741 ecr 544525,nop,wscale 7], length 0
18:34:56.062158 IP 192.168.1.10.57021 > ec2-52-17-154-125.eu-west-1.compute.amazonaws.com.www: Flags [R], seq 1024388786, win 0, length 0
18:34:56.062175 IP 192.168.1.10.57021 > ec2-52-17-154-125.eu-west-1.compute.amazonaws.com.www: Flags [R], seq 1024388786, win 0, length 0
18:34:56.062187 IP 192.168.1.10.57021 > ec2-52-17-154-125.eu-west-1.compute.amazonaws.com.www: Flags [R], seq 1024388786, win 0, length 0
18:34:56.062907 IP 192.168.1.10.55594 > ec2-52-17-154-125.eu-west-1.compute.amazonaws.com.www: Flags [.], ack 1, win 343, options [nop,nop,TS val 544526 ecr 3173289741], length 0
18:34:56.065910 IP 192.168.1.10.55594 > ec2-52-17-154-125.eu-west-1.compute.amazonaws.com.www: Flags [P.], seq 1:79, ack 1, win 343, options [nop,nop,TS val 544526 ecr 3173289741], length 78: HTTP
18:34:56.072847 IP ec2-52-17-154-125.eu-west-1.compute.amazonaws.com.www > 192.168.1.10.55594: Flags [.], ack 79, win 211, options [nop,nop,TS val 3173289743 ecr 544526], length 0
18:34:56.073126 IP ec2-52-17-154-125.eu-west-1.compute.amazonaws.com.www > 192.168.1.10.55594: Flags [.], seq 1:1349, ack 79, win 211, options [nop,nop,TS val 3173289744 ecr 544526], length 1348: HTTP: HTTP/1.1 400 Bad Request
18:34:56.073179 IP ec2-52-17-154-125.eu-west-1.compute.amazonaws.com.www > 192.168.1.10.55594: Flags [.], seq 1349:2697, ack 79, win 211, options [nop,nop,TS val 3173289744 ecr 544526], length 1348: HTTP
18:34:56.073210 IP ec2-52-17-154-125.eu-west-1.compute.amazonaws.com.www > 192.168.1.10.55594: Flags [.], seq 2697:4045, ack 79, win 211, options [nop,nop,TS val 3173289744 ecr 544526], length 1348: HTTP
18:34:56.073239 IP ec2-52-17-154-125.eu-west-1.compute.amazonaws.com.www > 192.168.1.10.55594: Flags [P.], seq 4045:4050, ack 79, win 211, options [nop,nop,TS val 3173289744 ecr 544526], length 5: HTTP
18:34:56.074734 IP ec2-52-17-154-125.eu-west-1.compute.amazonaws.com.www > 192.168.1.10.55594: Flags [F.], seq 4050, ack 79, win 211, options [nop,nop,TS val 3173289744 ecr 544526], length 0
18:34:56.076052 IP 192.168.1.10.55594 > ec2-52-17-154-125.eu-west-1.compute.amazonaws.com.www: Flags [.], ack 1349, win 353, options [nop,nop,TS val 544527 ecr 3173289744], length 0
18:34:56.076077 IP 192.168.1.10.55594 > ec2-52-17-154-125.eu-west-1.compute.amazonaws.com.www: Flags [R.], seq 79, ack 1349, win 353, options [nop,nop,TS val 544527 ecr 3173289744], length 0
18:34:56.076095 IP 192.168.1.10.55594 > ec2-52-17-154-125.eu-west-1.compute.amazonaws.com.www: Flags [R], seq 2341302385, win 0, length 0
18:34:56.076524 IP 192.168.1.10.55594 > ec2-52-17-154-125.eu-west-1.compute.amazonaws.com.www: Flags [R], seq 2341302385, win 0, length 0
18:34:56.076615 IP 192.168.1.10.55594 > ec2-52-17-154-125.eu-west-1.compute.amazonaws.com.www: Flags [R], seq 2341302385, win 0, length 0
18:34:56.076928 IP 192.168.1.10.55594 > ec2-52-17-154-125.eu-west-1.compute.amazonaws.com.www: Flags [R], seq 2341302385, win 0, length 0
18:34:56.078263 IP 192.168.1.10.51334 > ec2-34-249-143-14.eu-west-1.compute.amazonaws.com.www: Flags [S], seq 1197620413, win 65535, options [mss 1460,sackOK,TS val 544527 ecr 0,nop,wscale 8], length 0
18:34:56.085265 IP ec2-34-249-143-14.eu-west-1.compute.amazonaws.com.www > 192.168.1.10.51334: Flags [S.], seq 2881928601, ack 1197620414, win 26960, options [mss 1360,sackOK,TS val 3173289747 ecr 544527,nop,wscale 7], length 0
18:34:56.089417 IP 192.168.1.10.51334 > ec2-34-249-143-14.eu-west-1.compute.amazonaws.com.www: Flags [.], ack 1, win 343, options [nop,nop,TS val 544528 ecr 3173289747], length 0
18:34:56.092374 IP 192.168.1.10.51334 > ec2-34-249-143-14.eu-west-1.compute.amazonaws.com.www: Flags [P.], seq 1:243, ack 1, win 343, options [nop,nop,TS val 544529 ecr 3173289747], length 242: HTTP
18:34:56.099235 IP ec2-34-249-143-14.eu-west-1.compute.amazonaws.com.www > 192.168.1.10.51334: Flags [.], ack 243, win 219, options [nop,nop,TS val 3173289750 ecr 544529], length 0
18:34:56.099518 IP ec2-34-249-143-14.eu-west-1.compute.amazonaws.com.www > 192.168.1.10.51334: Flags [.], seq 1:1349, ack 243, win 219, options [nop,nop,TS val 3173289750 ecr 544529], length 1348: HTTP: HTTP/1.1 400 Bad Request
18:34:56.099569 IP ec2-34-249-143-14.eu-west-1.compute.amazonaws.com.www > 192.168.1.10.51334: Flags [.], seq 1349:2697, ack 243, win 219, options [nop,nop,TS val 3173289750 ecr 544529], length 1348: HTTP
18:34:56.099599 IP ec2-34-249-143-14.eu-west-1.compute.amazonaws.com.www > 192.168.1.10.51334: Flags [.], seq 2697:4045, ack 243, win 219, options [nop,nop,TS val 3173289750 ecr 544529], length 1348: HTTP
18:34:56.099626 IP ec2-34-249-143-14.eu-west-1.compute.amazonaws.com.www > 192.168.1.10.51334: Flags [P.], seq 4045:4056, ack 243, win 219, options [nop,nop,TS val 3173289750 ecr 544529], length 11: HTTP
18:34:56.101164 IP ec2-34-249-143-14.eu-west-1.compute.amazonaws.com.www > 192.168.1.10.51334: Flags [F.], seq 4056, ack 243, win 219, options [nop,nop,TS val 3173289750 ecr 544529], length 0
18:34:56.103420 IP 192.168.1.10.51334 > ec2-34-249-143-14.eu-west-1.compute.amazonaws.com.www: Flags [.], ack 1349, win 353, options [nop,nop,TS val 544530 ecr 3173289750], length 0
18:34:56.103792 IP 192.168.1.10.51334 > ec2-34-249-143-14.eu-west-1.compute.amazonaws.com.www: Flags [.], ack 2697, win 364, options [nop,nop,TS val 544530 ecr 3173289750], length 0
18:34:56.103951 IP 192.168.1.10.51334 > ec2-34-249-143-14.eu-west-1.compute.amazonaws.com.www: Flags [R.], seq 243, ack 2697, win 364, options [nop,nop,TS val 544530 ecr 3173289750], length 0
18:34:56.104109 IP 192.168.1.10.51334 > ec2-34-249-143-14.eu-west-1.compute.amazonaws.com.www: Flags [R], seq 1197620656, win 0, length 0
18:34:56.104233 IP 192.168.1.10.51334 > ec2-34-249-143-14.eu-west-1.compute.amazonaws.com.www: Flags [R], seq 1197620656, win 0, length 0
18:34:56.104538 IP 192.168.1.10.51334 > ec2-34-249-143-14.eu-west-1.compute.amazonaws.com.www: Flags [R], seq 1197620656, win 0, length 0
18:34:56.107149 IP 192.168.1.10.52528 > ec2-34-249-143-14.eu-west-1.compute.amazonaws.com.www: Flags [S], seq 2170161897, win 65535, options [mss 1460,sackOK,TS val 544530 ecr 0,nop,wscale 8], length 0
18:34:56.114127 IP ec2-34-249-143-14.eu-west-1.compute.amazonaws.com.www > 192.168.1.10.52528: Flags [S.], seq 3280843110, ack 2170161898, win 26960, options [mss 1360,sackOK,TS val 3173289754 ecr 544530,nop,wscale 7], length 0
18:34:56.116021 IP 192.168.1.10.52528 > ec2-34-249-143-14.eu-west-1.compute.amazonaws.com.www: Flags [.], ack 1, win 343, options [nop,nop,TS val 544531 ecr 3173289754], length 0
18:34:56.119909 IP 192.168.1.10.52528 > ec2-34-249-143-14.eu-west-1.compute.amazonaws.com.www: Flags [P.], seq 1:79, ack 1, win 343, options [nop,nop,TS val 544531 ecr 3173289754], length 78: HTTP
18:34:56.126782 IP ec2-34-249-143-14.eu-west-1.compute.amazonaws.com.www > 192.168.1.10.52528: Flags [.], ack 79, win 211, options [nop,nop,TS val 3173289757 ecr 544531], length 0
18:34:56.127102 IP ec2-34-249-143-14.eu-west-1.compute.amazonaws.com.www > 192.168.1.10.52528: Flags [.], seq 1:1349, ack 79, win 211, options [nop,nop,TS val 3173289757 ecr 544531], length 1348: HTTP: HTTP/1.1 400 Bad Request
18:34:56.127165 IP ec2-34-249-143-14.eu-west-1.compute.amazonaws.com.www > 192.168.1.10.52528: Flags [.], seq 1349:2697, ack 79, win 211, options [nop,nop,TS val 3173289757 ecr 544531], length 1348: HTTP
18:34:56.127211 IP ec2-34-249-143-14.eu-west-1.compute.amazonaws.com.www > 192.168.1.10.52528: Flags [.], seq 2697:4045, ack 79, win 211, options [nop,nop,TS val 3173289757 ecr 544531], length 1348: HTTP
18:34:56.127246 IP ec2-34-249-143-14.eu-west-1.compute.amazonaws.com.www > 192.168.1.10.52528: Flags [P.], seq 4045:4050, ack 79, win 211, options [nop,nop,TS val 3173289757 ecr 544531], length 5: HTTP
18:34:56.128740 IP ec2-34-249-143-14.eu-west-1.compute.amazonaws.com.www > 192.168.1.10.52528: Flags [F.], seq 4050, ack 79, win 211, options [nop,nop,TS val 3173289757 ecr 544531], length 0
18:34:56.130399 IP 192.168.1.10.52528 > ec2-34-249-143-14.eu-west-1.compute.amazonaws.com.www: Flags [.], ack 1349, win 353, options [nop,nop,TS val 544532 ecr 3173289757], length 0
18:34:56.130421 IP 192.168.1.10.52528 > ec2-34-249-143-14.eu-west-1.compute.amazonaws.com.www: Flags [.], ack 2697, win 364, options [nop,nop,TS val 544532 ecr 3173289757], length 0
18:34:56.130728 IP 192.168.1.10.52528 > ec2-34-249-143-14.eu-west-1.compute.amazonaws.com.www: Flags [R.], seq 79, ack 2697, win 364, options [nop,nop,TS val 544532 ecr 3173289757], length 0
18:34:56.130865 IP 192.168.1.10.52528 > ec2-34-249-143-14.eu-west-1.compute.amazonaws.com.www: Flags [R], seq 2170161976, win 0, length 0
18:34:56.131291 IP 192.168.1.10.52528 > ec2-34-249-143-14.eu-west-1.compute.amazonaws.com.www: Flags [R], seq 2170161976, win 0, length 0
18:34:56.131607 IP 192.168.1.10.52528 > ec2-34-249-143-14.eu-west-1.compute.amazonaws.com.www: Flags [R], seq 2170161976, win 0, length 0
18:34:56.134255 IP 192.168.1.10.55889 > ec2-52-210-57-164.eu-west-1.compute.amazonaws.com.www: Flags [S], seq 2440876594, win 65535, options [mss 1460,sackOK,TS val 544533 ecr 0,nop,wscale 8], length 0
18:34:56.141259 IP ec2-52-210-57-164.eu-west-1.compute.amazonaws.com.www > 192.168.1.10.55889: Flags [S.], seq 2597930378, ack 2440876595, win 26960, options [mss 1360,sackOK,TS val 3173289761 ecr 544533,nop,wscale 7], length 0
18:34:56.144170 IP 192.168.1.10.55889 > ec2-52-210-57-164.eu-west-1.compute.amazonaws.com.www: Flags [.], ack 1, win 343, options [nop,nop,TS val 544534 ecr 3173289761], length 0
18:34:56.145540 IP 192.168.1.10.55889 > ec2-52-210-57-164.eu-west-1.compute.amazonaws.com.www: Flags [P.], seq 1:243, ack 1, win 343, options [nop,nop,TS val 544534 ecr 3173289761], length 242: HTTP
18:34:56.152497 IP ec2-52-210-57-164.eu-west-1.compute.amazonaws.com.www > 192.168.1.10.55889: Flags [.], ack 243, win 219, options [nop,nop,TS val 3173289763 ecr 544534], length 0
18:34:56.152896 IP ec2-52-210-57-164.eu-west-1.compute.amazonaws.com.www > 192.168.1.10.55889: Flags [.], seq 1:1349, ack 243, win 219, options [nop,nop,TS val 3173289763 ecr 544534], length 1348: HTTP: HTTP/1.1 400 Bad Request
18:34:56.152959 IP ec2-52-210-57-164.eu-west-1.compute.amazonaws.com.www > 192.168.1.10.55889: Flags [.], seq 1349:2697, ack 243, win 219, options [nop,nop,TS val 3173289763 ecr 544534], length 1348: HTTP
18:34:56.152991 IP ec2-52-210-57-164.eu-west-1.compute.amazonaws.com.www > 192.168.1.10.55889: Flags [.], seq 2697:4045, ack 243, win 219, options [nop,nop,TS val 3173289763 ecr 544534], length 1348: HTTP
18:34:56.153020 IP ec2-52-210-57-164.eu-west-1.compute.amazonaws.com.www > 192.168.1.10.55889: Flags [P.], seq 4045:4056, ack 243, win 219, options [nop,nop,TS val 3173289763 ecr 544534], length 11: HTTP
18:34:56.154531 IP ec2-52-210-57-164.eu-west-1.compute.amazonaws.com.www > 192.168.1.10.55889: Flags [F.], seq 4056, ack 243, win 219, options [nop,nop,TS val 3173289763 ecr 544534], length 0
18:34:56.158393 IP 192.168.1.10.55889 > ec2-52-210-57-164.eu-west-1.compute.amazonaws.com.www: Flags [.], ack 1349, win 353, options [nop,nop,TS val 544535 ecr 3173289763], length 0
18:34:56.158408 IP 192.168.1.10.55889 > ec2-52-210-57-164.eu-west-1.compute.amazonaws.com.www: Flags [.], ack 2697, win 364, options [nop,nop,TS val 544535 ecr 3173289763], length 0
18:34:56.158426 IP 192.168.1.10.55889 > ec2-52-210-57-164.eu-west-1.compute.amazonaws.com.www: Flags [R.], seq 243, ack 2697, win 364, options [nop,nop,TS val 544535 ecr 3173289763], length 0
18:34:56.158972 IP 192.168.1.10.55889 > ec2-52-210-57-164.eu-west-1.compute.amazonaws.com.www: Flags [R], seq 2440876837, win 0, length 0
18:34:56.158990 IP 192.168.1.10.55889 > ec2-52-210-57-164.eu-west-1.compute.amazonaws.com.www: Flags [R], seq 2440876837, win 0, length 0
18:34:56.159175 IP 192.168.1.10.55889 > ec2-52-210-57-164.eu-west-1.compute.amazonaws.com.www: Flags [R], seq 2440876837, win 0, length 0
18:34:56.160155 IP 192.168.1.10.33935 > ec2-52-210-57-164.eu-west-1.compute.amazonaws.com.www: Flags [S], seq 1417267730, win 65535, options [mss 1460,sackOK,TS val 544535 ecr 0,nop,wscale 8], length 0
18:34:56.167151 IP ec2-52-210-57-164.eu-west-1.compute.amazonaws.com.www > 192.168.1.10.33935: Flags [S.], seq 1478055907, ack 1417267731, win 26960, options [mss 1360,sackOK,TS val 3173289767 ecr 544535,nop,wscale 7], length 0
18:34:56.169406 IP 192.168.1.10.33935 > ec2-52-210-57-164.eu-west-1.compute.amazonaws.com.www: Flags [.], ack 1, win 343, options [nop,nop,TS val 544536 ecr 3173289767], length 0
18:34:56.172374 IP 192.168.1.10.33935 > ec2-52-210-57-164.eu-west-1.compute.amazonaws.com.www: Flags [P.], seq 1:79, ack 1, win 343, options [nop,nop,TS val 544536 ecr 3173289767], length 78: HTTP
18:34:56.179304 IP ec2-52-210-57-164.eu-west-1.compute.amazonaws.com.www > 192.168.1.10.33935: Flags [.], ack 79, win 211, options [nop,nop,TS val 3173289770 ecr 544536], length 0
18:34:56.179565 IP ec2-52-210-57-164.eu-west-1.compute.amazonaws.com.www > 192.168.1.10.33935: Flags [.], seq 1:1349, ack 79, win 211, options [nop,nop,TS val 3173289770 ecr 544536], length 1348: HTTP: HTTP/1.1 400 Bad Request
18:34:56.179613 IP ec2-52-210-57-164.eu-west-1.compute.amazonaws.com.www > 192.168.1.10.33935: Flags [.], seq 1349:2697, ack 79, win 211, options [nop,nop,TS val 3173289770 ecr 544536], length 1348: HTTP
18:34:56.179643 IP ec2-52-210-57-164.eu-west-1.compute.amazonaws.com.www > 192.168.1.10.33935: Flags [P.], seq 2697:3622, ack 79, win 211, options [nop,nop,TS val 3173289770 ecr 544536], length 925: HTTP
18:34:56.180911 IP ec2-52-210-57-164.eu-west-1.compute.amazonaws.com.www > 192.168.1.10.33935: Flags [F.], seq 3622, ack 79, win 211, options [nop,nop,TS val 3173289770 ecr 544536], length 0
18:34:56.194536 IP 192.168.1.10.33935 > ec2-52-210-57-164.eu-west-1.compute.amazonaws.com.www: Flags [.], ack 1349, win 353, options [nop,nop,TS val 544539 ecr 3173289770], length 0
18:34:56.194551 IP 192.168.1.10.33935 > ec2-52-210-57-164.eu-west-1.compute.amazonaws.com.www: Flags [R.], seq 79, ack 1349, win 353, options [nop,nop,TS val 544539 ecr 3173289770], length 0
18:34:56.194571 IP 192.168.1.10.46956 > ec2-34-248-248-90.eu-west-1.compute.amazonaws.com.www: Flags [S], seq 2118838883, win 65535, options [mss 1460,sackOK,TS val 544539 ecr 0,nop,wscale 8], length 0
18:34:56.197020 IP 192.168.1.10.33935 > ec2-52-210-57-164.eu-west-1.compute.amazonaws.com.www: Flags [R], seq 1417267809, win 0, length 0
18:34:56.197245 IP 192.168.1.10.33935 > ec2-52-210-57-164.eu-west-1.compute.amazonaws.com.www: Flags [R], seq 1417267809, win 0, length 0
18:34:56.197480 IP 192.168.1.10.33935 > ec2-52-210-57-164.eu-west-1.compute.amazonaws.com.www: Flags [R], seq 1417267809, win 0, length 0
18:34:56.201742 IP ec2-34-248-248-90.eu-west-1.compute.amazonaws.com.www > 192.168.1.10.46956: Flags [S.], seq 3220558539, ack 2118838884, win 26960, options [mss 1360,sackOK,TS val 3173289776 ecr 544539,nop,wscale 7], length 0
18:34:56.203174 IP 192.168.1.10.46956 > ec2-34-248-248-90.eu-west-1.compute.amazonaws.com.www: Flags [.], ack 1, win 343, options [nop,nop,TS val 544540 ecr 3173289776], length 0
18:34:56.205666 IP 192.168.1.10.46956 > ec2-34-248-248-90.eu-west-1.compute.amazonaws.com.www: Flags [P.], seq 1:243, ack 1, win 343, options [nop,nop,TS val 544540 ecr 3173289776], length 242: HTTP
18:34:56.212594 IP ec2-34-248-248-90.eu-west-1.compute.amazonaws.com.www > 192.168.1.10.46956: Flags [.], ack 243, win 219, options [nop,nop,TS val 3173289778 ecr 544540], length 0
18:34:56.212958 IP ec2-34-248-248-90.eu-west-1.compute.amazonaws.com.www > 192.168.1.10.46956: Flags [.], seq 1:1349, ack 243, win 219, options [nop,nop,TS val 3173289778 ecr 544540], length 1348: HTTP: HTTP/1.1 400 Bad Request
18:34:56.213012 IP ec2-34-248-248-90.eu-west-1.compute.amazonaws.com.www > 192.168.1.10.46956: Flags [.], seq 1349:2697, ack 243, win 219, options [nop,nop,TS val 3173289778 ecr 544540], length 1348: HTTP
18:34:56.213043 IP ec2-34-248-248-90.eu-west-1.compute.amazonaws.com.www > 192.168.1.10.46956: Flags [P.], seq 2697:3754, ack 243, win 219, options [nop,nop,TS val 3173289778 ecr 544540], length 1057: HTTP
18:34:56.214386 IP ec2-34-248-248-90.eu-west-1.compute.amazonaws.com.www > 192.168.1.10.46956: Flags [F.], seq 3754, ack 243, win 219, options [nop,nop,TS val 3173289779 ecr 544540], length 0
18:34:56.217154 IP 192.168.1.10.46956 > ec2-34-248-248-90.eu-west-1.compute.amazonaws.com.www: Flags [.], ack 1349, win 353, options [nop,nop,TS val 544541 ecr 3173289778], length 0
18:34:56.217169 IP 192.168.1.10.46956 > ec2-34-248-248-90.eu-west-1.compute.amazonaws.com.www: Flags [.], ack 2697, win 364, options [nop,nop,TS val 544541 ecr 3173289778], length 0
18:34:56.217188 IP 192.168.1.10.46956 > ec2-34-248-248-90.eu-west-1.compute.amazonaws.com.www: Flags [R.], seq 243, ack 2697, win 364, options [nop,nop,TS val 544541 ecr 3173289778], length 0
18:34:56.218503 IP 192.168.1.10.46956 > ec2-34-248-248-90.eu-west-1.compute.amazonaws.com.www: Flags [R], seq 2118839126, win 0, length 0
18:34:56.218856 IP 192.168.1.10.46956 > ec2-34-248-248-90.eu-west-1.compute.amazonaws.com.www: Flags [R], seq 2118839126, win 0, length 0
18:34:56.220355 IP 192.168.1.10.51331 > ec2-34-248-248-90.eu-west-1.compute.amazonaws.com.www: Flags [S], seq 4193562665, win 65535, options [mss 1460,sackOK,TS val 544541 ecr 0,nop,wscale 8], length 0
18:34:56.227298 IP ec2-34-248-248-90.eu-west-1.compute.amazonaws.com.www > 192.168.1.10.51331: Flags [S.], seq 4258706336, ack 4193562666, win 26960, options [mss 1360,sackOK,TS val 3173289782 ecr 544541,nop,wscale 7], length 0
18:34:56.228517 IP 192.168.1.10.51331 > ec2-34-248-248-90.eu-west-1.compute.amazonaws.com.www: Flags [.], ack 1, win 343, options [nop,nop,TS val 544542 ecr 3173289782], length 0
18:34:56.230699 IP 192.168.1.10.51331 > ec2-34-248-248-90.eu-west-1.compute.amazonaws.com.www: Flags [P.], seq 1:79, ack 1, win 343, options [nop,nop,TS val 544542 ecr 3173289782], length 78: HTTP
18:34:56.237828 IP ec2-34-248-248-90.eu-west-1.compute.amazonaws.com.www > 192.168.1.10.51331: Flags [.], ack 79, win 211, options [nop,nop,TS val 3173289785 ecr 544542], length 0
18:34:56.238112 IP ec2-34-248-248-90.eu-west-1.compute.amazonaws.com.www > 192.168.1.10.51331: Flags [.], seq 1:1349, ack 79, win 211, options [nop,nop,TS val 3173289785 ecr 544542], length 1348: HTTP: HTTP/1.1 400 Bad Request
18:34:56.238166 IP ec2-34-248-248-90.eu-west-1.compute.amazonaws.com.www > 192.168.1.10.51331: Flags [.], seq 1349:2697, ack 79, win 211, options [nop,nop,TS val 3173289785 ecr 544542], length 1348: HTTP
18:34:56.238196 IP ec2-34-248-248-90.eu-west-1.compute.amazonaws.com.www > 192.168.1.10.51331: Flags [P.], seq 2697:3648, ack 79, win 211, options [nop,nop,TS val 3173289785 ecr 544542], length 951: HTTP
18:34:56.239436 IP ec2-34-248-248-90.eu-west-1.compute.amazonaws.com.www > 192.168.1.10.51331: Flags [F.], seq 3648, ack 79, win 211, options [nop,nop,TS val 3173289785 ecr 544542], length 0
18:34:56.240790 IP 192.168.1.10.51331 > ec2-34-248-248-90.eu-west-1.compute.amazonaws.com.www: Flags [.], ack 1349, win 353, options [nop,nop,TS val 544543 ecr 3173289785], length 0
18:34:56.240816 IP 192.168.1.10.51331 > ec2-34-248-248-90.eu-west-1.compute.amazonaws.com.www: Flags [R.], seq 79, ack 1349, win 353, options [nop,nop,TS val 544543 ecr 3173289785], length 0
18:34:56.241911 IP 192.168.1.10.51331 > ec2-34-248-248-90.eu-west-1.compute.amazonaws.com.www: Flags [R], seq 4193562744, win 0, length 0
18:34:56.242143 IP 192.168.1.10.51331 > ec2-34-248-248-90.eu-west-1.compute.amazonaws.com.www: Flags [R], seq 4193562744, win 0, length 0
18:34:56.242160 IP 192.168.1.10.51331 > ec2-34-248-248-90.eu-west-1.compute.amazonaws.com.www: Flags [R], seq 4193562744, win 0, length 0
18:34:56.243542 IP 192.168.1.10.33835 > ec2-34-248-224-199.eu-west-1.compute.amazonaws.com.www: Flags [S], seq 3923833759, win 65535, options [mss 1460,sackOK,TS val 544544 ecr 0,nop,wscale 8], length 0
18:34:56.250560 IP ec2-34-248-224-199.eu-west-1.compute.amazonaws.com.www > 192.168.1.10.33835: Flags [S.], seq 3616575536, ack 3923833760, win 26960, options [mss 1360,sackOK,TS val 3173289788 ecr 544544,nop,wscale 7], length 0
18:34:56.255551 IP 192.168.1.10.33835 > ec2-34-248-224-199.eu-west-1.compute.amazonaws.com.www: Flags [.], ack 1, win 343, options [nop,nop,TS val 544545 ecr 3173289788], length 0
18:34:56.260926 IP 192.168.1.10.33835 > ec2-34-248-224-199.eu-west-1.compute.amazonaws.com.www: Flags [P.], seq 1:243, ack 1, win 343, options [nop,nop,TS val 544545 ecr 3173289788], length 242: HTTP
18:34:56.268027 IP ec2-34-248-224-199.eu-west-1.compute.amazonaws.com.www > 192.168.1.10.33835: Flags [.], ack 243, win 219, options [nop,nop,TS val 3173289792 ecr 544545], length 0
18:34:56.268304 IP ec2-34-248-224-199.eu-west-1.compute.amazonaws.com.www > 192.168.1.10.33835: Flags [.], seq 1:1349, ack 243, win 219, options [nop,nop,TS val 3173289792 ecr 544545], length 1348: HTTP: HTTP/1.1 400 Bad Request
18:34:56.268358 IP ec2-34-248-224-199.eu-west-1.compute.amazonaws.com.www > 192.168.1.10.33835: Flags [.], seq 1349:2697, ack 243, win 219, options [nop,nop,TS val 3173289792 ecr 544545], length 1348: HTTP
18:34:56.268389 IP ec2-34-248-224-199.eu-west-1.compute.amazonaws.com.www > 192.168.1.10.33835: Flags [.], seq 2697:4045, ack 243, win 219, options [nop,nop,TS val 3173289792 ecr 544545], length 1348: HTTP
18:34:56.268418 IP ec2-34-248-224-199.eu-west-1.compute.amazonaws.com.www > 192.168.1.10.33835: Flags [P.], seq 4045:4056, ack 243, win 219, options [nop,nop,TS val 3173289792 ecr 544545], length 11: HTTP
18:34:56.269940 IP ec2-34-248-224-199.eu-west-1.compute.amazonaws.com.www > 192.168.1.10.33835: Flags [F.], seq 4056, ack 243, win 219, options [nop,nop,TS val 3173289792 ecr 544545], length 0
18:34:56.276390 IP 192.168.1.10.33835 > ec2-34-248-224-199.eu-west-1.compute.amazonaws.com.www: Flags [.], ack 1349, win 353, options [nop,nop,TS val 544547 ecr 3173289792], length 0
18:34:56.276406 IP 192.168.1.10.33835 > ec2-34-248-224-199.eu-west-1.compute.amazonaws.com.www: Flags [R.], seq 243, ack 1349, win 353, options [nop,nop,TS val 544547 ecr 3173289792], length 0
18:34:56.276416 IP 192.168.1.10.33835 > ec2-34-248-224-199.eu-west-1.compute.amazonaws.com.www: Flags [R], seq 3923834002, win 0, length 0
18:34:56.276434 IP 192.168.1.10.33835 > ec2-34-248-224-199.eu-west-1.compute.amazonaws.com.www: Flags [R], seq 3923834002, win 0, length 0
18:34:56.277129 IP 192.168.1.10.33835 > ec2-34-248-224-199.eu-west-1.compute.amazonaws.com.www: Flags [R], seq 3923834002, win 0, length 0
18:34:56.278609 IP 192.168.1.10.33835 > ec2-34-248-224-199.eu-west-1.compute.amazonaws.com.www: Flags [R], seq 3923834002, win 0, length 0
18:34:56.285904 IP 192.168.1.10.36446 > ec2-34-248-224-199.eu-west-1.compute.amazonaws.com.www: Flags [S], seq 3625063646, win 65535, options [mss 1460,sackOK,TS val 544548 ecr 0,nop,wscale 8], length 0
18:34:56.292941 IP ec2-34-248-224-199.eu-west-1.compute.amazonaws.com.www > 192.168.1.10.36446: Flags [S.], seq 3765961217, ack 3625063647, win 26960, options [mss 1360,sackOK,TS val 3173289798 ecr 544548,nop,wscale 7], length 0
18:34:56.310301 IP 192.168.1.10.36446 > ec2-34-248-224-199.eu-west-1.compute.amazonaws.com.www: Flags [.], ack 1, win 343, options [nop,nop,TS val 544550 ecr 3173289798], length 0
18:34:56.315792 IP 192.168.1.10.36446 > ec2-34-248-224-199.eu-west-1.compute.amazonaws.com.www: Flags [P.], seq 1:79, ack 1, win 343, options [nop,nop,TS val 544551 ecr 3173289798], length 78: HTTP
18:34:56.322737 IP ec2-34-248-224-199.eu-west-1.compute.amazonaws.com.www > 192.168.1.10.36446: Flags [.], ack 79, win 211, options [nop,nop,TS val 3173289806 ecr 544551], length 0
18:34:56.323075 IP ec2-34-248-224-199.eu-west-1.compute.amazonaws.com.www > 192.168.1.10.36446: Flags [.], seq 1:1349, ack 79, win 211, options [nop,nop,TS val 3173289806 ecr 544551], length 1348: HTTP: HTTP/1.1 400 Bad Request
18:34:56.323132 IP ec2-34-248-224-199.eu-west-1.compute.amazonaws.com.www > 192.168.1.10.36446: Flags [.], seq 1349:2697, ack 79, win 211, options [nop,nop,TS val 3173289806 ecr 544551], length 1348: HTTP
18:34:56.323164 IP ec2-34-248-224-199.eu-west-1.compute.amazonaws.com.www > 192.168.1.10.36446: Flags [.], seq 2697:4045, ack 79, win 211, options [nop,nop,TS val 3173289806 ecr 544551], length 1348: HTTP
18:34:56.323192 IP ec2-34-248-224-199.eu-west-1.compute.amazonaws.com.www > 192.168.1.10.36446: Flags [P.], seq 4045:4050, ack 79, win 211, options [nop,nop,TS val 3173289806 ecr 544551], length 5: HTTP
18:34:56.324706 IP ec2-34-248-224-199.eu-west-1.compute.amazonaws.com.www > 192.168.1.10.36446: Flags [F.], seq 4050, ack 79, win 211, options [nop,nop,TS val 3173289806 ecr 544551], length 0
18:34:56.326315 IP 192.168.1.10.36446 > ec2-34-248-224-199.eu-west-1.compute.amazonaws.com.www: Flags [.], ack 1349, win 353, options [nop,nop,TS val 544552 ecr 3173289806], length 0
18:34:56.327023 IP 192.168.1.10.36446 > ec2-34-248-224-199.eu-west-1.compute.amazonaws.com.www: Flags [.], ack 2697, win 364, options [nop,nop,TS val 544552 ecr 3173289806], length 0
18:34:56.328363 IP 192.168.1.10.36446 > ec2-34-248-224-199.eu-west-1.compute.amazonaws.com.www: Flags [.], ack 4045, win 374, options [nop,nop,TS val 544552 ecr 3173289806], length 0
18:34:56.328606 IP 192.168.1.10.36446 > ec2-34-248-224-199.eu-west-1.compute.amazonaws.com.www: Flags [R.], seq 79, ack 4045, win 374, options [nop,nop,TS val 544552 ecr 3173289806], length 0
18:34:56.328619 IP 192.168.1.10.36446 > ec2-34-248-224-199.eu-west-1.compute.amazonaws.com.www: Flags [R], seq 3625063725, win 0, length 0
18:34:56.328631 IP 192.168.1.10.36446 > ec2-34-248-224-199.eu-west-1.compute.amazonaws.com.www: Flags [R], seq 3625063725, win 0, length 0
18:34:56.583529 IP 192.168.1.10.58190 > sea15s07-in-f78.1e100.net.https: Flags [S], seq 1444044697, win 65535, options [mss 1460,sackOK,TS val 544577 ecr 0,nop,wscale 8], length 0
18:34:56.613092 IP sea15s07-in-f78.1e100.net.https > 192.168.1.10.58190: Flags [S.], seq 2477057267, ack 1444044698, win 42408, options [mss 1360,sackOK,TS val 2095848991 ecr 544577,nop,wscale 8], length 0
18:34:56.617923 IP 192.168.1.10.58190 > sea15s07-in-f78.1e100.net.https: Flags [.], ack 1, win 343, options [nop,nop,TS val 544581 ecr 2095848991], length 0
18:34:56.626838 IP 192.168.1.10.58190 > sea15s07-in-f78.1e100.net.https: Flags [P.], seq 1:171, ack 1, win 343, options [nop,nop,TS val 544581 ecr 2095848991], length 170
18:34:56.656409 IP sea15s07-in-f78.1e100.net.https > 192.168.1.10.58190: Flags [.], ack 171, win 170, options [nop,nop,TS val 2095849034 ecr 544581], length 0
18:34:56.665064 IP sea15s07-in-f78.1e100.net.https > 192.168.1.10.58190: Flags [.], seq 1:1349, ack 171, win 170, options [nop,nop,TS val 2095849043 ecr 544581], length 1348
18:34:56.665177 IP sea15s07-in-f78.1e100.net.https > 192.168.1.10.58190: Flags [.], seq 1349:2697, ack 171, win 170, options [nop,nop,TS val 2095849043 ecr 544581], length 1348
18:34:56.665211 IP sea15s07-in-f78.1e100.net.https > 192.168.1.10.58190: Flags [P.], seq 2697:2873, ack 171, win 170, options [nop,nop,TS val 2095849043 ecr 544581], length 176
18:34:56.672423 IP 192.168.1.10.58190 > sea15s07-in-f78.1e100.net.https: Flags [.], ack 1349, win 353, options [nop,nop,TS val 544587 ecr 2095849043], length 0
18:34:56.672872 IP 192.168.1.10.58190 > sea15s07-in-f78.1e100.net.https: Flags [.], ack 2697, win 364, options [nop,nop,TS val 544587 ecr 2095849043], length 0
18:34:56.673779 IP 192.168.1.10.58190 > sea15s07-in-f78.1e100.net.https: Flags [.], ack 2873, win 374, options [nop,nop,TS val 544587 ecr 2095849043], length 0
18:34:56.753152 IP 192.168.1.10.58190 > sea15s07-in-f78.1e100.net.https: Flags [P.], seq 171:256, ack 2873, win 374, options [nop,nop,TS val 544595 ecr 2095849043], length 85
18:34:56.783357 IP sea15s07-in-f78.1e100.net.https > 192.168.1.10.58190: Flags [P.], seq 2873:3149, ack 256, win 170, options [nop,nop,TS val 2095849161 ecr 544595], length 276
18:34:56.784783 IP 192.168.1.10.58190 > sea15s07-in-f78.1e100.net.https: Flags [.], ack 3149, win 385, options [nop,nop,TS val 544598 ecr 2095849161], length 0
18:34:56.786367 IP 192.168.1.10.58190 > sea15s07-in-f78.1e100.net.https: Flags [P.], seq 256:584, ack 3149, win 385, options [nop,nop,TS val 544598 ecr 2095849161], length 328
18:34:56.826363 IP sea15s07-in-f78.1e100.net.https > 192.168.1.10.58190: Flags [P.], seq 3149:3811, ack 584, win 175, options [nop,nop,TS val 2095849204 ecr 544598], length 662
18:34:56.862238 IP 192.168.1.10.58190 > sea15s07-in-f78.1e100.net.https: Flags [.], ack 3811, win 395, options [nop,nop,TS val 544606 ecr 2095849204], length 0
18:34:57.003932 IP 192.168.1.10.58190 > sea15s07-in-f78.1e100.net.https: Flags [P.], seq 584:1335, ack 3811, win 395, options [nop,nop,TS val 544620 ecr 2095849204], length 751
18:34:57.042525 IP sea15s07-in-f78.1e100.net.https > 192.168.1.10.58190: Flags [P.], seq 3811:4217, ack 1335, win 180, options [nop,nop,TS val 2095849420 ecr 544620], length 406
18:34:57.044402 IP 192.168.1.10.58190 > sea15s07-in-f78.1e100.net.https: Flags [.], ack 4217, win 406, options [nop,nop,TS val 544624 ecr 2095849420], length 0
18:34:58.348495 IP sea15s07-in-f78.1e100.net.www > 192.168.1.10.58144: Flags [F.], seq 594984438, ack 1148669641, win 219, options [nop,nop,TS val 3173290312 ecr 532792], length 0
18:34:58.422056 IP 192.168.1.10.58144 > sea15s07-in-f78.1e100.net.www: Flags [.], ack 1, win 347, options [nop,nop,TS val 544762 ecr 3173290312], length 0
18:34:59.286231 IP 192.168.1.10.50380 > sea15s12-in-f10.1e100.net.https: Flags [S], seq 261982902, win 65535, options [mss 1460,sackOK,TS val 544847 ecr 0,nop,wscale 8], length 0
18:34:59.316082 IP sea15s12-in-f10.1e100.net.https > 192.168.1.10.50380: Flags [S.], seq 3695962790, ack 261982903, win 42408, options [mss 1360,sackOK,TS val 2673078166 ecr 544847,nop,wscale 8], length 0
18:34:59.335762 IP 192.168.1.10.50380 > sea15s12-in-f10.1e100.net.https: Flags [.], ack 1, win 343, options [nop,nop,TS val 544853 ecr 2673078166], length 0
18:34:59.341643 IP 192.168.1.10.50380 > sea15s12-in-f10.1e100.net.https: Flags [P.], seq 1:198, ack 1, win 343, options [nop,nop,TS val 544853 ecr 2673078166], length 197
18:34:59.371439 IP sea15s12-in-f10.1e100.net.https > 192.168.1.10.50380: Flags [.], ack 198, win 170, options [nop,nop,TS val 2673078222 ecr 544853], length 0
18:34:59.371935 IP sea15s12-in-f10.1e100.net.https > 192.168.1.10.50380: Flags [P.], seq 1:140, ack 198, win 170, options [nop,nop,TS val 2673078222 ecr 544853], length 139
18:34:59.373027 IP 192.168.1.10.50380 > sea15s12-in-f10.1e100.net.https: Flags [.], ack 140, win 347, options [nop,nop,TS val 544857 ecr 2673078222], length 0
18:34:59.373248 IP 192.168.1.10.50380 > sea15s12-in-f10.1e100.net.https: Flags [P.], seq 198:241, ack 140, win 347, options [nop,nop,TS val 544857 ecr 2673078222], length 43
18:34:59.377679 IP 192.168.1.10.50380 > sea15s12-in-f10.1e100.net.https: Flags [.], seq 241:1589, ack 140, win 347, options [nop,nop,TS val 544857 ecr 2673078222], length 1348
18:34:59.377917 IP 192.168.1.10.50380 > sea15s12-in-f10.1e100.net.https: Flags [.], seq 1589:2937, ack 140, win 347, options [nop,nop,TS val 544857 ecr 2673078222], length 1348
18:34:59.377959 IP 192.168.1.10.50380 > sea15s12-in-f10.1e100.net.https: Flags [.], seq 2937:4285, ack 140, win 347, options [nop,nop,TS val 544857 ecr 2673078222], length 1348
18:34:59.407468 IP sea15s12-in-f10.1e100.net.https > 192.168.1.10.50380: Flags [.], ack 1589, win 181, options [nop,nop,TS val 2673078258 ecr 544857], length 0
18:34:59.408122 IP sea15s12-in-f10.1e100.net.https > 192.168.1.10.50380: Flags [.], ack 4285, win 202, options [nop,nop,TS val 2673078258 ecr 544857], length 0
18:34:59.415411 IP 192.168.1.10.50380 > sea15s12-in-f10.1e100.net.https: Flags [P.], seq 4285:4908, ack 140, win 347, options [nop,nop,TS val 544860 ecr 2673078258], length 623
18:34:59.472468 IP sea15s12-in-f10.1e100.net.https > 192.168.1.10.50380: Flags [P.], seq 140:1488, ack 4908, win 213, options [nop,nop,TS val 2673078323 ecr 544860], length 1348
18:34:59.472767 IP sea15s12-in-f10.1e100.net.https > 192.168.1.10.50380: Flags [P.], seq 1488:2836, ack 4908, win 213, options [nop,nop,TS val 2673078323 ecr 544860], length 1348
18:34:59.473267 IP sea15s12-in-f10.1e100.net.https > 192.168.1.10.50380: Flags [.], seq 2836:4184, ack 4908, win 213, options [nop,nop,TS val 2673078323 ecr 544860], length 1348
18:34:59.473326 IP sea15s12-in-f10.1e100.net.https > 192.168.1.10.50380: Flags [P.], seq 4184:4665, ack 4908, win 213, options [nop,nop,TS val 2673078323 ecr 544860], length 481
18:34:59.474417 IP sea15s12-in-f10.1e100.net.https > 192.168.1.10.50380: Flags [P.], seq 4665:4691, ack 4908, win 213, options [nop,nop,TS val 2673078323 ecr 544860],