tcpdump: verbose output suppressed, use -v or -vv for full protocol decode
listening on wlan0, link-type EN10MB (Ethernet), capture size 262144 bytes
18:32:58.553373 IP 192.168.1.10.58144 > sea15s07-in-f78.1e100.net.www: Flags [S], seq 1148669451, win 65535, options [mss 1460,sackOK,TS val 532775 ecr 0,nop,wscale 8], length 0
18:32:58.562665 IP sea15s07-in-f78.1e100.net.www > 192.168.1.10.58144: Flags [S.], seq 594984211, ack 1148669452, win 26960, options [mss 1360,sackOK,TS val 3173260366 ecr 532775,nop,wscale 7], length 0
18:32:58.588093 IP 192.168.1.10.58144 > sea15s07-in-f78.1e100.net.www: Flags [.], ack 1, win 343, options [nop,nop,TS val 532777 ecr 3173260366], length 0
18:32:58.592453 IP 192.168.1.10.58144 > sea15s07-in-f78.1e100.net.www: Flags [P.], seq 1:190, ack 1, win 343, options [nop,nop,TS val 532778 ecr 3173260366], length 189: HTTP: GET /generate_204 HTTP/1.1
18:32:58.601367 IP sea15s07-in-f78.1e100.net.www > 192.168.1.10.58144: Flags [.], ack 190, win 219, options [nop,nop,TS val 3173260375 ecr 532778], length 0
18:32:58.718831 IP sea15s07-in-f78.1e100.net.www > 192.168.1.10.58144: Flags [P.], seq 1:227, ack 190, win 219, options [nop,nop,TS val 3173260405 ecr 532778], length 226: HTTP: HTTP/1.1 204 No Content
18:32:58.729957 IP 192.168.1.10.58144 > sea15s07-in-f78.1e100.net.www: Flags [.], ack 227, win 347, options [nop,nop,TS val 532792 ecr 3173260405], length 0
18:32:59.016840 IP 192.168.1.10.52149 > pg-in-f188.1e100.net.5228: Flags [S], seq 2373669271, win 65535, options [mss 1460,sackOK,TS val 532820 ecr 0,nop,wscale 8], length 0
18:32:59.040945 IP pg-in-f188.1e100.net.5228 > 192.168.1.10.52149: Flags [S.], seq 4265086012, ack 2373669272, win 42408, options [mss 1360,sackOK,TS val 1061248753 ecr 532820,nop,wscale 8], length 0
18:32:59.066465 IP 192.168.1.10.52149 > pg-in-f188.1e100.net.5228: Flags [.], ack 1, win 343, options [nop,nop,TS val 532825 ecr 1061248753], length 0
18:32:59.077240 IP 192.168.1.10.52149 > pg-in-f188.1e100.net.5228: Flags [P.], seq 1:169, ack 1, win 343, options [nop,nop,TS val 532826 ecr 1061248753], length 168
18:32:59.101460 IP pg-in-f188.1e100.net.5228 > 192.168.1.10.52149: Flags [.], ack 169, win 170, options [nop,nop,TS val 1061248813 ecr 532826], length 0
18:32:59.101889 IP pg-in-f188.1e100.net.5228 > 192.168.1.10.52149: Flags [.], seq 1:1349, ack 169, win 170, options [nop,nop,TS val 1061248814 ecr 532826], length 1348
18:32:59.101940 IP pg-in-f188.1e100.net.5228 > 192.168.1.10.52149: Flags [.], seq 1349:2697, ack 169, win 170, options [nop,nop,TS val 1061248814 ecr 532826], length 1348
18:32:59.101968 IP pg-in-f188.1e100.net.5228 > 192.168.1.10.52149: Flags [.], seq 2697:4045, ack 169, win 170, options [nop,nop,TS val 1061248814 ecr 532826], length 1348
18:32:59.101995 IP pg-in-f188.1e100.net.5228 > 192.168.1.10.52149: Flags [P.], seq 4045:4112, ack 169, win 170, options [nop,nop,TS val 1061248814 ecr 532826], length 67
18:32:59.126382 IP 192.168.1.10.52149 > pg-in-f188.1e100.net.5228: Flags [.], ack 1349, win 353, options [nop,nop,TS val 532831 ecr 1061248814], length 0
18:32:59.130750 IP 192.168.1.10.52149 > pg-in-f188.1e100.net.5228: Flags [.], ack 2697, win 364, options [nop,nop,TS val 532832 ecr 1061248814], length 0
18:32:59.141220 IP 192.168.1.10.52149 > pg-in-f188.1e100.net.5228: Flags [.], ack 4045, win 374, options [nop,nop,TS val 532832 ecr 1061248814], length 0
18:32:59.141236 IP 192.168.1.10.52149 > pg-in-f188.1e100.net.5228: Flags [.], ack 4112, win 374, options [nop,nop,TS val 532833 ecr 1061248814], length 0
18:32:59.484747 IP 192.168.1.10.52149 > pg-in-f188.1e100.net.5228: Flags [P.], seq 169:254, ack 4112, win 374, options [nop,nop,TS val 532867 ecr 1061248814], length 85
18:32:59.509214 IP pg-in-f188.1e100.net.5228 > 192.168.1.10.52149: Flags [P.], seq 4112:4388, ack 254, win 170, options [nop,nop,TS val 1061249221 ecr 532867], length 276
18:32:59.529212 IP 192.168.1.10.52149 > pg-in-f188.1e100.net.5228: Flags [.], ack 4388, win 385, options [nop,nop,TS val 532872 ecr 1061249221], length 0
18:32:59.814601 IP 192.168.1.10.52149 > pg-in-f188.1e100.net.5228: Flags [P.], seq 254:498, ack 4388, win 385, options [nop,nop,TS val 532899 ecr 1061249221], length 244
18:32:59.839314 IP pg-in-f188.1e100.net.5228 > 192.168.1.10.52149: Flags [P.], seq 4388:4410, ack 498, win 175, options [nop,nop,TS val 1061249551 ecr 532899], length 22
18:32:59.849151 IP pg-in-f188.1e100.net.5228 > 192.168.1.10.52149: Flags [P.], seq 4410:4516, ack 498, win 175, options [nop,nop,TS val 1061249561 ecr 532899], length 106
18:32:59.850326 IP pg-in-f188.1e100.net.5228 > 192.168.1.10.52149: Flags [P.], seq 4516:4633, ack 498, win 175, options [nop,nop,TS val 1061249562 ecr 532899], length 117
18:32:59.874975 IP 192.168.1.10.52149 > pg-in-f188.1e100.net.5228: Flags [.], ack 4410, win 385, options [nop,nop,TS val 532905 ecr 1061249551], length 0
18:32:59.874990 IP 192.168.1.10.52149 > pg-in-f188.1e100.net.5228: Flags [.], ack 4516, win 385, options [nop,nop,TS val 532905 ecr 1061249561], length 0
18:32:59.879327 IP 192.168.1.10.52149 > pg-in-f188.1e100.net.5228: Flags [.], ack 4633, win 385, options [nop,nop,TS val 532907 ecr 1061249562], length 0
18:33:00.363350 IP 192.168.1.10.35989 > sea15s12-in-f10.1e100.net.https: Flags [S], seq 339158402, win 65535, options [mss 1460,sackOK,TS val 532955 ecr 0,nop,wscale 8], length 0
18:33:00.394156 IP sea15s12-in-f10.1e100.net.https > 192.168.1.10.35989: Flags [S.], seq 4080256712, ack 339158403, win 42408, options [mss 1360,sackOK,TS val 2141602131 ecr 532955,nop,wscale 8], length 0
18:33:00.402095 IP 192.168.1.10.35989 > sea15s12-in-f10.1e100.net.https: Flags [.], ack 1, win 343, options [nop,nop,TS val 532959 ecr 2141602131], length 0
18:33:00.413386 IP 192.168.1.10.35989 > sea15s12-in-f10.1e100.net.https: Flags [P.], seq 1:170, ack 1, win 343, options [nop,nop,TS val 532961 ecr 2141602131], length 169
18:33:00.444260 IP sea15s12-in-f10.1e100.net.https > 192.168.1.10.35989: Flags [.], ack 170, win 170, options [nop,nop,TS val 2141602181 ecr 532961], length 0
18:33:00.451438 IP sea15s12-in-f10.1e100.net.https > 192.168.1.10.35989: Flags [.], seq 1:1349, ack 170, win 170, options [nop,nop,TS val 2141602188 ecr 532961], length 1348
18:33:00.451549 IP sea15s12-in-f10.1e100.net.https > 192.168.1.10.35989: Flags [.], seq 1349:2697, ack 170, win 170, options [nop,nop,TS val 2141602188 ecr 532961], length 1348
18:33:00.451584 IP sea15s12-in-f10.1e100.net.https > 192.168.1.10.35989: Flags [P.], seq 2697:3237, ack 170, win 170, options [nop,nop,TS val 2141602188 ecr 532961], length 540
18:33:00.472390 IP 192.168.1.10.35989 > sea15s12-in-f10.1e100.net.https: Flags [.], ack 1349, win 353, options [nop,nop,TS val 532966 ecr 2141602188], length 0
18:33:00.476713 IP 192.168.1.10.35989 > sea15s12-in-f10.1e100.net.https: Flags [.], ack 2697, win 364, options [nop,nop,TS val 532967 ecr 2141602188], length 0
18:33:00.476731 IP 192.168.1.10.35989 > sea15s12-in-f10.1e100.net.https: Flags [.], ack 3237, win 374, options [nop,nop,TS val 532967 ecr 2141602188], length 0
18:33:00.627333 IP 192.168.1.10.35989 > sea15s12-in-f10.1e100.net.https: Flags [P.], seq 170:255, ack 3237, win 374, options [nop,nop,TS val 532982 ecr 2141602188], length 85
18:33:00.658401 IP sea15s12-in-f10.1e100.net.https > 192.168.1.10.35989: Flags [P.], seq 3237:3513, ack 255, win 170, options [nop,nop,TS val 2141602395 ecr 532982], length 276
18:33:00.666683 IP 192.168.1.10.35989 > sea15s12-in-f10.1e100.net.https: Flags [.], ack 3513, win 385, options [nop,nop,TS val 532986 ecr 2141602395], length 0
18:33:00.678449 IP 192.168.1.10.35989 > sea15s12-in-f10.1e100.net.https: Flags [P.], seq 255:1239, ack 3513, win 385, options [nop,nop,TS val 532986 ecr 2141602395], length 984
18:33:00.746509 IP sea15s12-in-f10.1e100.net.https > 192.168.1.10.35989: Flags [P.], seq 3513:4861, ack 1239, win 178, options [nop,nop,TS val 2141602483 ecr 532986], length 1348
18:33:00.746721 IP sea15s12-in-f10.1e100.net.https > 192.168.1.10.35989: Flags [P.], seq 4861:6209, ack 1239, win 178, options [nop,nop,TS val 2141602483 ecr 532986], length 1348
18:33:00.746961 IP sea15s12-in-f10.1e100.net.https > 192.168.1.10.35989: Flags [.], seq 6209:7557, ack 1239, win 178, options [nop,nop,TS val 2141602483 ecr 532986], length 1348
18:33:00.747045 IP sea15s12-in-f10.1e100.net.https > 192.168.1.10.35989: Flags [P.], seq 7557:7900, ack 1239, win 178, options [nop,nop,TS val 2141602483 ecr 532986], length 343
18:33:00.747403 IP sea15s12-in-f10.1e100.net.https > 192.168.1.10.35989: Flags [P.], seq 7900:9248, ack 1239, win 178, options [nop,nop,TS val 2141602484 ecr 532986], length 1348
18:33:00.747590 IP sea15s12-in-f10.1e100.net.https > 192.168.1.10.35989: Flags [.], seq 9248:10596, ack 1239, win 178, options [nop,nop,TS val 2141602484 ecr 532986], length 1348
18:33:00.747661 IP sea15s12-in-f10.1e100.net.https > 192.168.1.10.35989: Flags [P.], seq 10596:11944, ack 1239, win 178, options [nop,nop,TS val 2141602484 ecr 532986], length 1348
18:33:00.747798 IP sea15s12-in-f10.1e100.net.https > 192.168.1.10.35989: Flags [P.], seq 11944:12318, ack 1239, win 178, options [nop,nop,TS val 2141602484 ecr 532986], length 374
18:33:00.747888 IP sea15s12-in-f10.1e100.net.https > 192.168.1.10.35989: Flags [P.], seq 12318:13666, ack 1239, win 178, options [nop,nop,TS val 2141602484 ecr 532986], length 1348
18:33:00.747995 IP sea15s12-in-f10.1e100.net.https > 192.168.1.10.35989: Flags [.], seq 13666:15014, ack 1239, win 178, options [nop,nop,TS val 2141602484 ecr 532986], length 1348
18:33:00.748014 IP sea15s12-in-f10.1e100.net.https > 192.168.1.10.35989: Flags [P.], seq 15014:16362, ack 1239, win 178, options [nop,nop,TS val 2141602484 ecr 532986], length 1348
18:33:00.750753 IP sea15s12-in-f10.1e100.net.https > 192.168.1.10.35989: Flags [P.], seq 16362:16573, ack 1239, win 178, options [nop,nop,TS val 2141602484 ecr 532986], length 211
18:33:00.750956 IP sea15s12-in-f10.1e100.net.https > 192.168.1.10.35989: Flags [P.], seq 16573:17921, ack 1239, win 178, options [nop,nop,TS val 2141602485 ecr 532986], length 1348
18:33:00.751124 IP sea15s12-in-f10.1e100.net.https > 192.168.1.10.35989: Flags [.], seq 17921:19269, ack 1239, win 178, options [nop,nop,TS val 2141602485 ecr 532986], length 1348
18:33:00.772880 IP 192.168.1.10.35989 > sea15s12-in-f10.1e100.net.https: Flags [.], ack 17921, win 522, options [nop,nop,TS val 532996 ecr 2141602483], length 0
18:33:00.803977 IP sea15s12-in-f10.1e100.net.https > 192.168.1.10.35989: Flags [.], seq 19269:20617, ack 1239, win 178, options [nop,nop,TS val 2141602541 ecr 532996], length 1348
18:33:00.804092 IP sea15s12-in-f10.1e100.net.https > 192.168.1.10.35989: Flags [.], seq 20617:21965, ack 1239, win 178, options [nop,nop,TS val 2141602541 ecr 532996], length 1348
18:33:00.804126 IP sea15s12-in-f10.1e100.net.https > 192.168.1.10.35989: Flags [.], seq 21965:23313, ack 1239, win 178, options [nop,nop,TS val 2141602541 ecr 532996], length 1348
18:33:00.804154 IP sea15s12-in-f10.1e100.net.https > 192.168.1.10.35989: Flags [.], seq 23313:24661, ack 1239, win 178, options [nop,nop,TS val 2141602541 ecr 532996], length 1348
18:33:00.805455 IP sea15s12-in-f10.1e100.net.https > 192.168.1.10.35989: Flags [.], seq 24661:26009, ack 1239, win 178, options [nop,nop,TS val 2141602541 ecr 532996], length 1348
18:33:00.805539 IP sea15s12-in-f10.1e100.net.https > 192.168.1.10.35989: Flags [.], seq 26009:27357, ack 1239, win 178, options [nop,nop,TS val 2141602541 ecr 532996], length 1348
18:33:00.806592 IP 192.168.1.10.35989 > sea15s12-in-f10.1e100.net.https: Flags [.], ack 19269, win 532, options [nop,nop,TS val 533000 ecr 2141602485], length 0
18:33:00.808637 IP sea15s12-in-f10.1e100.net.https > 192.168.1.10.35989: Flags [.], seq 27357:28705, ack 1239, win 178, options [nop,nop,TS val 2141602541 ecr 532996], length 1348
18:33:00.808719 IP sea15s12-in-f10.1e100.net.https > 192.168.1.10.35989: Flags [.], seq 28705:30053, ack 1239, win 178, options [nop,nop,TS val 2141602541 ecr 532996], length 1348
18:33:00.810929 IP 192.168.1.10.35989 > sea15s12-in-f10.1e100.net.https: Flags [.], ack 20617, win 543, options [nop,nop,TS val 533000 ecr 2141602541], length 0
18:33:00.810945 IP 192.168.1.10.35989 > sea15s12-in-f10.1e100.net.https: Flags [.], ack 21965, win 553, options [nop,nop,TS val 533000 ecr 2141602541], length 0
18:33:00.810955 IP 192.168.1.10.35989 > sea15s12-in-f10.1e100.net.https: Flags [.], ack 23313, win 564, options [nop,nop,TS val 533000 ecr 2141602541], length 0
18:33:00.811673 IP sea15s12-in-f10.1e100.net.https > 192.168.1.10.35989: Flags [.], seq 30053:31401, ack 1239, win 178, options [nop,nop,TS val 2141602542 ecr 532996], length 1348
18:33:00.811727 IP sea15s12-in-f10.1e100.net.https > 192.168.1.10.35989: Flags [.], seq 31401:32749, ack 1239, win 178, options [nop,nop,TS val 2141602542 ecr 532996], length 1348
18:33:00.814792 IP sea15s12-in-f10.1e100.net.https > 192.168.1.10.35989: Flags [.], seq 32749:34097, ack 1239, win 178, options [nop,nop,TS val 2141602549 ecr 532996], length 1348
18:33:00.814839 IP sea15s12-in-f10.1e100.net.https > 192.168.1.10.35989: Flags [.], seq 34097:35445, ack 1239, win 178, options [nop,nop,TS val 2141602549 ecr 532996], length 1348
18:33:00.815414 IP 192.168.1.10.35989 > sea15s12-in-f10.1e100.net.https: Flags [.], ack 24661, win 574, options [nop,nop,TS val 533000 ecr 2141602541], length 0
18:33:00.815437 IP 192.168.1.10.35989 > sea15s12-in-f10.1e100.net.https: Flags [.], ack 26009, win 585, options [nop,nop,TS val 533000 ecr 2141602541], length 0
18:33:00.815447 IP 192.168.1.10.35989 > sea15s12-in-f10.1e100.net.https: Flags [.], ack 27357, win 595, options [nop,nop,TS val 533000 ecr 2141602541], length 0
18:33:00.815458 IP 192.168.1.10.35989 > sea15s12-in-f10.1e100.net.https: Flags [.], ack 28705, win 606, options [nop,nop,TS val 533001 ecr 2141602541], length 0
18:33:00.815469 IP 192.168.1.10.35989 > sea15s12-in-f10.1e100.net.https: Flags [.], ack 30053, win 616, options [nop,nop,TS val 533001 ecr 2141602541], length 0
18:33:00.817890 IP sea15s12-in-f10.1e100.net.https > 192.168.1.10.35989: Flags [.], seq 35445:36793, ack 1239, win 178, options [nop,nop,TS val 2141602549 ecr 532996], length 1348
18:33:00.817938 IP sea15s12-in-f10.1e100.net.https > 192.168.1.10.35989: Flags [.], seq 36793:38141, ack 1239, win 178, options [nop,nop,TS val 2141602549 ecr 532996], length 1348
18:33:00.819789 IP 192.168.1.10.35989 > sea15s12-in-f10.1e100.net.https: Flags [.], ack 31401, win 627, options [nop,nop,TS val 533001 ecr 2141602542], length 0
18:33:00.819802 IP 192.168.1.10.35989 > sea15s12-in-f10.1e100.net.https: Flags [.], ack 32749, win 638, options [nop,nop,TS val 533001 ecr 2141602542], length 0
18:33:00.820989 IP sea15s12-in-f10.1e100.net.https > 192.168.1.10.35989: Flags [.], seq 38141:39489, ack 1239, win 178, options [nop,nop,TS val 2141602552 ecr 532996], length 1348
18:33:00.821036 IP sea15s12-in-f10.1e100.net.https > 192.168.1.10.35989: Flags [.], seq 39489:40837, ack 1239, win 178, options [nop,nop,TS val 2141602552 ecr 532996], length 1348
18:33:00.821140 IP sea15s12-in-f10.1e100.net.https > 192.168.1.10.35989: Flags [.], seq 40837:42185, ack 1239, win 178, options [nop,nop,TS val 2141602555 ecr 532996], length 1348
18:33:00.821177 IP sea15s12-in-f10.1e100.net.https > 192.168.1.10.35989: Flags [.], seq 42185:43533, ack 1239, win 178, options [nop,nop,TS val 2141602555 ecr 532996], length 1348
18:33:00.824143 IP sea15s12-in-f10.1e100.net.https > 192.168.1.10.35989: Flags [.], seq 43533:44881, ack 1239, win 178, options [nop,nop,TS val 2141602558 ecr 532996], length 1348
18:33:00.824196 IP sea15s12-in-f10.1e100.net.https > 192.168.1.10.35989: Flags [.], seq 44881:46229, ack 1239, win 178, options [nop,nop,TS val 2141602558 ecr 532996], length 1348
18:33:00.824285 IP 192.168.1.10.35989 > sea15s12-in-f10.1e100.net.https: Flags [.], ack 34097, win 648, options [nop,nop,TS val 533001 ecr 2141602549], length 0
18:33:00.824300 IP 192.168.1.10.35989 > sea15s12-in-f10.1e100.net.https: Flags [.], ack 35445, win 659, options [nop,nop,TS val 533001 ecr 2141602549], length 0
18:33:00.824310 IP 192.168.1.10.35989 > sea15s12-in-f10.1e100.net.https: Flags [.], ack 36793, win 669, options [nop,nop,TS val 533001 ecr 2141602549], length 0
18:33:00.824321 IP 192.168.1.10.35989 > sea15s12-in-f10.1e100.net.https: Flags [.], ack 38141, win 680, options [nop,nop,TS val 533001 ecr 2141602549], length 0
18:33:00.827247 IP sea15s12-in-f10.1e100.net.https > 192.168.1.10.35989: Flags [.], seq 46229:47577, ack 1239, win 178, options [nop,nop,TS val 2141602558 ecr 532996], length 1348
18:33:00.827297 IP sea15s12-in-f10.1e100.net.https > 192.168.1.10.35989: Flags [.], seq 47577:48925, ack 1239, win 178, options [nop,nop,TS val 2141602558 ecr 532996], length 1348
18:33:00.830371 IP sea15s12-in-f10.1e100.net.https > 192.168.1.10.35989: Flags [.], seq 48925:50273, ack 1239, win 178, options [nop,nop,TS val 2141602561 ecr 532996], length 1348
18:33:00.830414 IP sea15s12-in-f10.1e100.net.https > 192.168.1.10.35989: Flags [.], seq 50273:51621, ack 1239, win 178, options [nop,nop,TS val 2141602561 ecr 532996], length 1348
18:33:00.833422 IP sea15s12-in-f10.1e100.net.https > 192.168.1.10.35989: Flags [.], seq 51621:52969, ack 1239, win 178, options [nop,nop,TS val 2141602564 ecr 532996], length 1348
18:33:00.833519 IP sea15s12-in-f10.1e100.net.https > 192.168.1.10.35989: Flags [.], seq 52969:54317, ack 1239, win 178, options [nop,nop,TS val 2141602564 ecr 532996], length 1348
18:33:00.837391 IP sea15s12-in-f10.1e100.net.https > 192.168.1.10.35989: Flags [.], seq 54317:55665, ack 1239, win 178, options [nop,nop,TS val 2141602574 ecr 533000], length 1348
18:33:00.837441 IP sea15s12-in-f10.1e100.net.https > 192.168.1.10.35989: Flags [.], seq 55665:57013, ack 1239, win 178, options [nop,nop,TS val 2141602574 ecr 533000], length 1348
18:33:00.838319 IP 192.168.1.10.35989 > sea15s12-in-f10.1e100.net.https: Flags [.], ack 39489, win 690, options [nop,nop,TS val 533003 ecr 2141602552], length 0
18:33:00.838344 IP 192.168.1.10.35989 > sea15s12-in-f10.1e100.net.https: Flags [.], ack 40837, win 701, options [nop,nop,TS val 533003 ecr 2141602552], length 0
18:33:00.841763 IP sea15s12-in-f10.1e100.net.https > 192.168.1.10.35989: Flags [.], seq 57013:58361, ack 1239, win 178, options [nop,nop,TS val 2141602579 ecr 533000], length 1348
18:33:00.841862 IP sea15s12-in-f10.1e100.net.https > 192.168.1.10.35989: Flags [.], seq 58361:59709, ack 1239, win 178, options [nop,nop,TS val 2141602579 ecr 533000], length 1348
18:33:00.842697 IP 192.168.1.10.35989 > sea15s12-in-f10.1e100.net.https: Flags [.], ack 42185, win 711, options [nop,nop,TS val 533003 ecr 2141602555], length 0
18:33:00.842714 IP 192.168.1.10.35989 > sea15s12-in-f10.1e100.net.https: Flags [.], ack 43533, win 722, options [nop,nop,TS val 533003 ecr 2141602555], length 0
18:33:00.842726 IP 192.168.1.10.35989 > sea15s12-in-f10.1e100.net.https: Flags [.], ack 44881, win 732, options [nop,nop,TS val 533003 ecr 2141602558], length 0
18:33:00.843337 IP sea15s12-in-f10.1e100.net.https > 192.168.1.10.35989: Flags [.], seq 59709:61057, ack 1239, win 178, options [nop,nop,TS val 2141602579 ecr 533000], length 1348
18:33:00.843407 IP sea15s12-in-f10.1e100.net.https > 192.168.1.10.35989: Flags [.], seq 61057:62405, ack 1239, win 178, options [nop,nop,TS val 2141602579 ecr 533000], length 1348
18:33:00.843437 IP sea15s12-in-f10.1e100.net.https > 192.168.1.10.35989: Flags [.], seq 62405:63753, ack 1239, win 178, options [nop,nop,TS val 2141602579 ecr 533000], length 1348
18:33:00.843466 IP sea15s12-in-f10.1e100.net.https > 192.168.1.10.35989: Flags [.], seq 63753:65101, ack 1239, win 178, options [nop,nop,TS val 2141602579 ecr 533000], length 1348
18:33:00.846489 IP sea15s12-in-f10.1e100.net.https > 192.168.1.10.35989: Flags [.], seq 65101:66449, ack 1239, win 178, options [nop,nop,TS val 2141602583 ecr 533000], length 1348
18:33:00.846583 IP sea15s12-in-f10.1e100.net.https > 192.168.1.10.35989: Flags [.], seq 66449:67797, ack 1239, win 178, options [nop,nop,TS val 2141602583 ecr 533000], length 1348
18:33:00.847058 IP 192.168.1.10.35989 > sea15s12-in-f10.1e100.net.https: Flags [.], ack 46229, win 743, options [nop,nop,TS val 533003 ecr 2141602558], length 0
18:33:00.847073 IP 192.168.1.10.35989 > sea15s12-in-f10.1e100.net.https: Flags [.], ack 47577, win 753, options [nop,nop,TS val 533004 ecr 2141602558], length 0
18:33:00.849498 IP sea15s12-in-f10.1e100.net.https > 192.168.1.10.35989: Flags [.], seq 67797:69145, ack 1239, win 178, options [nop,nop,TS val 2141602583 ecr 533000], length 1348
18:33:00.849559 IP sea15s12-in-f10.1e100.net.https > 192.168.1.10.35989: Flags [.], seq 69145:70493, ack 1239, win 178, options [nop,nop,TS val 2141602583 ecr 533000], length 1348
18:33:00.852610 IP sea15s12-in-f10.1e100.net.https > 192.168.1.10.35989: Flags [.], seq 70493:71841, ack 1239, win 178, options [nop,nop,TS val 2141602583 ecr 533001], length 1348
18:33:00.852668 IP sea15s12-in-f10.1e100.net.https > 192.168.1.10.35989: Flags [.], seq 71841:73189, ack 1239, win 178, options [nop,nop,TS val 2141602583 ecr 533001], length 1348
18:33:00.855768 IP sea15s12-in-f10.1e100.net.https > 192.168.1.10.35989: Flags [.], seq 73189:74537, ack 1239, win 178, options [nop,nop,TS val 2141602587 ecr 533001], length 1348
18:33:00.855968 IP sea15s12-in-f10.1e100.net.https > 192.168.1.10.35989: Flags [.], seq 74537:75885, ack 1239, win 178, options [nop,nop,TS val 2141602592 ecr 533001], length 1348
18:33:00.856012 IP sea15s12-in-f10.1e100.net.https > 192.168.1.10.35989: Flags [.], seq 75885:77233, ack 1239, win 178, options [nop,nop,TS val 2141602592 ecr 533001], length 1348
18:33:00.858875 IP sea15s12-in-f10.1e100.net.https > 192.168.1.10.35989: Flags [.], seq 77233:78581, ack 1239, win 178, options [nop,nop,TS val 2141602592 ecr 533001], length 1348
18:33:00.858935 IP sea15s12-in-f10.1e100.net.https > 192.168.1.10.35989: Flags [.], seq 78581:79929, ack 1239, win 178, options [nop,nop,TS val 2141602592 ecr 533001], length 1348
18:33:00.860845 IP 192.168.1.10.35989 > sea15s12-in-f10.1e100.net.https: Flags [.], ack 48925, win 764, options [nop,nop,TS val 533005 ecr 2141602558], length 0
18:33:00.860861 IP 192.168.1.10.35989 > sea15s12-in-f10.1e100.net.https: Flags [.], ack 50273, win 774, options [nop,nop,TS val 533005 ecr 2141602561], length 0
18:33:00.865251 IP 192.168.1.10.35989 > sea15s12-in-f10.1e100.net.https: Flags [.], ack 51621, win 785, options [nop,nop,TS val 533005 ecr 2141602561], length 0
18:33:00.869090 IP sea15s12-in-f10.1e100.net.https > 192.168.1.10.35989: Flags [.], seq 79929:81277, ack 1239, win 178, options [nop,nop,TS val 2141602606 ecr 533003], length 1348
18:33:00.869321 IP sea15s12-in-f10.1e100.net.https > 192.168.1.10.35989: Flags [.], seq 81277:82625, ack 1239, win 178, options [nop,nop,TS val 2141602606 ecr 533003], length 1348
18:33:00.869581 IP 192.168.1.10.35989 > sea15s12-in-f10.1e100.net.https: Flags [.], ack 52969, win 796, options [nop,nop,TS val 533005 ecr 2141602564], length 0
18:33:00.869598 IP 192.168.1.10.35989 > sea15s12-in-f10.1e100.net.https: Flags [.], ack 54317, win 806, options [nop,nop,TS val 533005 ecr 2141602564], length 0
18:33:00.869608 IP 192.168.1.10.35989 > sea15s12-in-f10.1e100.net.https: Flags [.], ack 55665, win 817, options [nop,nop,TS val 533005 ecr 2141602574], length 0
18:33:00.869618 IP 192.168.1.10.35989 > sea15s12-in-f10.1e100.net.https: Flags [.], ack 57013, win 827, options [nop,nop,TS val 533005 ecr 2141602574], length 0
18:33:00.869628 IP 192.168.1.10.35989 > sea15s12-in-f10.1e100.net.https: Flags [.], ack 58361, win 838, options [nop,nop,TS val 533005 ecr 2141602579], length 0
18:33:00.869638 IP 192.168.1.10.35989 > sea15s12-in-f10.1e100.net.https: Flags [.], ack 59709, win 848, options [nop,nop,TS val 533005 ecr 2141602579], length 0
18:33:00.869648 IP 192.168.1.10.35989 > sea15s12-in-f10.1e100.net.https: Flags [.], ack 61057, win 859, options [nop,nop,TS val 533005 ecr 2141602579], length 0
18:33:00.870630 IP sea15s12-in-f10.1e100.net.https > 192.168.1.10.35989: Flags [.], seq 82625:83973, ack 1239, win 178, options [nop,nop,TS val 2141602606 ecr 533003], length 1348
18:33:00.870786 IP sea15s12-in-f10.1e100.net.https > 192.168.1.10.35989: Flags [.], seq 83973:85321, ack 1239, win 178, options [nop,nop,TS val 2141602606 ecr 533003], length 1348
18:33:00.873804 IP sea15s12-in-f10.1e100.net.https > 192.168.1.10.35989: Flags [.], seq 85321:86669, ack 1239, win 178, options [nop,nop,TS val 2141602610 ecr 533003], length 1348
18:33:00.873869 IP sea15s12-in-f10.1e100.net.https > 192.168.1.10.35989: Flags [.], seq 86669:88017, ack 1239, win 178, options [nop,nop,TS val 2141602610 ecr 533003], length 1348
18:33:00.874084 IP 192.168.1.10.35989 > sea15s12-in-f10.1e100.net.https: Flags [.], ack 62405, win 869, options [nop,nop,TS val 533005 ecr 2141602579], length 0
18:33:00.874099 IP 192.168.1.10.35989 > sea15s12-in-f10.1e100.net.https: Flags [.], ack 63753, win 880, options [nop,nop,TS val 533005 ecr 2141602579], length 0
18:33:00.874110 IP 192.168.1.10.35989 > sea15s12-in-f10.1e100.net.https: Flags [.], ack 65101, win 890, options [nop,nop,TS val 533006 ecr 2141602579], length 0
18:33:00.874130 IP 192.168.1.10.35989 > sea15s12-in-f10.1e100.net.https: Flags [.], ack 66449, win 901, options [nop,nop,TS val 533006 ecr 2141602583], length 0
18:33:00.874141 IP 192.168.1.10.35989 > sea15s12-in-f10.1e100.net.https: Flags [.], ack 67797, win 911, options [nop,nop,TS val 533006 ecr 2141602583], length 0
18:33:00.874151 IP 192.168.1.10.35989 > sea15s12-in-f10.1e100.net.https: Flags [.], ack 69145, win 922, options [nop,nop,TS val 533006 ecr 2141602583], length 0
18:33:00.876804 IP sea15s12-in-f10.1e100.net.https > 192.168.1.10.35989: Flags [.], seq 88017:89365, ack 1239, win 178, options [nop,nop,TS val 2141602610 ecr 533003], length 1348
18:33:00.876864 IP sea15s12-in-f10.1e100.net.https > 192.168.1.10.35989: Flags [.], seq 89365:90713, ack 1239, win 178, options [nop,nop,TS val 2141602610 ecr 533003], length 1348
18:33:00.879745 IP sea15s12-in-f10.1e100.net.https > 192.168.1.10.35989: Flags [.], seq 90713:92061, ack 1239, win 178, options [nop,nop,TS val 2141602611 ecr 533003], length 1348
18:33:00.879788 IP sea15s12-in-f10.1e100.net.https > 192.168.1.10.35989: Flags [.], seq 92061:93409, ack 1239, win 178, options [nop,nop,TS val 2141602611 ecr 533003], length 1348
18:33:00.879903 IP sea15s12-in-f10.1e100.net.https > 192.168.1.10.35989: Flags [.], seq 93409:94757, ack 1239, win 178, options [nop,nop,TS val 2141602615 ecr 533003], length 1348
18:33:00.879942 IP sea15s12-in-f10.1e100.net.https > 192.168.1.10.35989: Flags [.], seq 94757:96105, ack 1239, win 178, options [nop,nop,TS val 2141602615 ecr 533003], length 1348
18:33:00.882478 IP sea15s12-in-f10.1e100.net.https > 192.168.1.10.35989: Flags [.], seq 96105:97453, ack 1239, win 178, options [nop,nop,TS val 2141602617 ecr 533004], length 1348
18:33:00.882519 IP sea15s12-in-f10.1e100.net.https > 192.168.1.10.35989: Flags [.], seq 97453:98801, ack 1239, win 178, options [nop,nop,TS val 2141602617 ecr 533004], length 1348
18:33:00.886838 IP 192.168.1.10.35989 > sea15s12-in-f10.1e100.net.https: Flags [.], ack 70493, win 932, options [nop,nop,TS val 533008 ecr 2141602583], length 0
18:33:00.891191 IP 192.168.1.10.35989 > sea15s12-in-f10.1e100.net.https: Flags [.], ack 71841, win 943, options [nop,nop,TS val 533008 ecr 2141602583], length 0
18:33:00.891236 IP 192.168.1.10.35989 > sea15s12-in-f10.1e100.net.https: Flags [.], ack 73189, win 953, options [nop,nop,TS val 533008 ecr 2141602583], length 0
18:33:00.891767 IP sea15s12-in-f10.1e100.net.https > 192.168.1.10.35989: Flags [.], seq 98801:100149, ack 1239, win 178, options [nop,nop,TS val 2141602629 ecr 533005], length 1348
18:33:00.891862 IP sea15s12-in-f10.1e100.net.https > 192.168.1.10.35989: Flags [.], seq 100149:101497, ack 1239, win 178, options [nop,nop,TS val 2141602629 ecr 533005], length 1348
18:33:00.893065 IP sea15s12-in-f10.1e100.net.https > 192.168.1.10.35989: Flags [.], seq 101497:102845, ack 1239, win 178, options [nop,nop,TS val 2141602629 ecr 533005], length 1348
18:33:00.893140 IP sea15s12-in-f10.1e100.net.https > 192.168.1.10.35989: Flags [.], seq 102845:104193, ack 1239, win 178, options [nop,nop,TS val 2141602629 ecr 533005], length 1348
18:33:00.895627 IP 192.168.1.10.35989 > sea15s12-in-f10.1e100.net.https: Flags [.], ack 74537, win 964, options [nop,nop,TS val 533008 ecr 2141602587], length 0
18:33:00.895643 IP 192.168.1.10.35989 > sea15s12-in-f10.1e100.net.https: Flags [.], ack 75885, win 975, options [nop,nop,TS val 533008 ecr 2141602592], length 0
18:33:00.895655 IP 192.168.1.10.35989 > sea15s12-in-f10.1e100.net.https: Flags [.], ack 77233, win 985, options [nop,nop,TS val 533008 ecr 2141602592], length 0
18:33:00.895665 IP 192.168.1.10.35989 > sea15s12-in-f10.1e100.net.https: Flags [.], ack 78581, win 996, options [nop,nop,TS val 533008 ecr 2141602592], length 0
18:33:00.895712 IP 192.168.1.10.35989 > sea15s12-in-f10.1e100.net.https: Flags [.], ack 79929, win 1006, options [nop,nop,TS val 533008 ecr 2141602592], length 0
18:33:00.896160 IP sea15s12-in-f10.1e100.net.https > 192.168.1.10.35989: Flags [.], seq 104193:105541, ack 1239, win 178, options [nop,nop,TS val 2141602633 ecr 533005], length 1348
18:33:00.899943 IP 192.168.1.10.35989 > sea15s12-in-f10.1e100.net.https: Flags [.], ack 81277, win 1017, options [nop,nop,TS val 533008 ecr 2141602606], length 0
18:33:00.899958 IP 192.168.1.10.35989 > sea15s12-in-f10.1e100.net.https: Flags [.], ack 82625, win 1027, options [nop,nop,TS val 533008 ecr 2141602606], length 0
18:33:00.899968 IP 192.168.1.10.35989 > sea15s12-in-f10.1e100.net.https: Flags [.], ack 83973, win 1038, options [nop,nop,TS val 533008 ecr 2141602606], length 0
18:33:00.899978 IP 192.168.1.10.35989 > sea15s12-in-f10.1e100.net.https: Flags [.], ack 85321, win 1048, options [nop,nop,TS val 533008 ecr 2141602606], length 0
18:33:00.899988 IP 192.168.1.10.35989 > sea15s12-in-f10.1e100.net.https: Flags [.], ack 86669, win 1059, options [nop,nop,TS val 533008 ecr 2141602610], length 0
18:33:00.899999 IP 192.168.1.10.35989 > sea15s12-in-f10.1e100.net.https: Flags [.], ack 88017, win 1069, options [nop,nop,TS val 533008 ecr 2141602610], length 0
18:33:00.900018 IP 192.168.1.10.35989 > sea15s12-in-f10.1e100.net.https: Flags [.], ack 89365, win 1080, options [nop,nop,TS val 533008 ecr 2141602610], length 0
18:33:00.900477 IP sea15s12-in-f10.1e100.net.https > 192.168.1.10.35989: Flags [.], seq 105541:106889, ack 1239, win 178, options [nop,nop,TS val 2141602637 ecr 533005], length 1348
18:33:00.901920 IP sea15s12-in-f10.1e100.net.https > 192.168.1.10.35989: Flags [.], seq 106889:108237, ack 1239, win 178, options [nop,nop,TS val 2141602637 ecr 533005], length 1348
18:33:00.902004 IP sea15s12-in-f10.1e100.net.https > 192.168.1.10.35989: Flags [.], seq 108237:109585, ack 1239, win 178, options [nop,nop,TS val 2141602637 ecr 533005], length 1348
18:33:00.903558 IP sea15s12-in-f10.1e100.net.https > 192.168.1.10.35989: Flags [.], seq 109585:110933, ack 1239, win 178, options [nop,nop,TS val 2141602638 ecr 533005], length 1348
18:33:00.903639 IP sea15s12-in-f10.1e100.net.https > 192.168.1.10.35989: Flags [.], seq 110933:112281, ack 1239, win 178, options [nop,nop,TS val 2141602638 ecr 533005], length 1348
18:33:00.904433 IP 192.168.1.10.35989 > sea15s12-in-f10.1e100.net.https: Flags [.], ack 90713, win 1090, options [nop,nop,TS val 533009 ecr 2141602610], length 0
18:33:00.904448 IP 192.168.1.10.35989 > sea15s12-in-f10.1e100.net.https: Flags [.], ack 92061, win 1101, options [nop,nop,TS val 533009 ecr 2141602611], length 0
18:33:00.904468 IP 192.168.1.10.35989 > sea15s12-in-f10.1e100.net.https: Flags [.], ack 93409, win 1111, options [nop,nop,TS val 533009 ecr 2141602611], length 0
18:33:00.904481 IP 192.168.1.10.35989 > sea15s12-in-f10.1e100.net.https: Flags [.], ack 94757, win 1122, options [nop,nop,TS val 533009 ecr 2141602615], length 0
18:33:00.904492 IP 192.168.1.10.35989 > sea15s12-in-f10.1e100.net.https: Flags [.], ack 96105, win 1133, options [nop,nop,TS val 533009 ecr 2141602615], length 0
18:33:00.904502 IP 192.168.1.10.35989 > sea15s12-in-f10.1e100.net.https: Flags [.], ack 97453, win 1143, options [nop,nop,TS val 533009 ecr 2141602617], length 0
18:33:00.904512 IP 192.168.1.10.35989 > sea15s12-in-f10.1e100.net.https: Flags [.], ack 98801, win 1154, options [nop,nop,TS val 533009 ecr 2141602617], length 0
18:33:00.905163 IP sea15s12-in-f10.1e100.net.https > 192.168.1.10.35989: Flags [.], seq 112281:113629, ack 1239, win 178, options [nop,nop,TS val 2141602639 ecr 533005], length 1348
18:33:00.905267 IP sea15s12-in-f10.1e100.net.https > 192.168.1.10.35989: Flags [.], seq 113629:114977, ack 1239, win 178, options [nop,nop,TS val 2141602639 ecr 533005], length 1348
18:33:00.905357 IP sea15s12-in-f10.1e100.net.https > 192.168.1.10.35989: Flags [.], seq 114977:116325, ack 1239, win 178, options [nop,nop,TS val 2141602640 ecr 533005], length 1348
18:33:00.906733 IP sea15s12-in-f10.1e100.net.https > 192.168.1.10.35989: Flags [.], seq 116325:117673, ack 1239, win 178, options [nop,nop,TS val 2141602640 ecr 533005], length 1348
18:33:00.906822 IP sea15s12-in-f10.1e100.net.https > 192.168.1.10.35989: Flags [.], seq 117673:119021, ack 1239, win 178, options [nop,nop,TS val 2141602640 ecr 533005], length 1348
18:33:00.908190 IP sea15s12-in-f10.1e100.net.https > 192.168.1.10.35989: Flags [.], seq 119021:120369, ack 1239, win 178, options [nop,nop,TS val 2141602642 ecr 533006], length 1348
18:33:00.908265 IP sea15s12-in-f10.1e100.net.https > 192.168.1.10.35989: Flags [.], seq 120369:121717, ack 1239, win 178, options [nop,nop,TS val 2141602642 ecr 533006], length 1348
18:33:00.908834 IP 192.168.1.10.35989 > sea15s12-in-f10.1e100.net.https: Flags [.], ack 100149, win 1164, options [nop,nop,TS val 533009 ecr 2141602629], length 0
18:33:00.908849 IP 192.168.1.10.35989 > sea15s12-in-f10.1e100.net.https: Flags [.], ack 101497, win 1175, options [nop,nop,TS val 533009 ecr 2141602629], length 0
18:33:00.908860 IP 192.168.1.10.35989 > sea15s12-in-f10.1e100.net.https: Flags [.], ack 102845, win 1185, options [nop,nop,TS val 533009 ecr 2141602629], length 0
18:33:00.908871 IP 192.168.1.10.35989 > sea15s12-in-f10.1e100.net.https: Flags [.], ack 104193, win 1196, options [nop,nop,TS val 533009 ecr 2141602629], length 0
18:33:00.909635 IP sea15s12-in-f10.1e100.net.https > 192.168.1.10.35989: Flags [.], seq 121717:123065, ack 1239, win 178, options [nop,nop,TS val 2141602644 ecr 533006], length 1348
18:33:00.909691 IP sea15s12-in-f10.1e100.net.https > 192.168.1.10.35989: Flags [.], seq 123065:124413, ack 1239, win 178, options [nop,nop,TS val 2141602644 ecr 533006], length 1348
18:33:00.909825 IP sea15s12-in-f10.1e100.net.https > 192.168.1.10.35989: Flags [.], seq 124413:125761, ack 1239, win 178, options [nop,nop,TS val 2141602645 ecr 533006], length 1348
18:33:00.909881 IP sea15s12-in-f10.1e100.net.https > 192.168.1.10.35989: Flags [.], seq 125761:127109, ack 1239, win 178, options [nop,nop,TS val 2141602645 ecr 533006], length 1348
18:33:00.911084 IP sea15s12-in-f10.1e100.net.https > 192.168.1.10.35989: Flags [.], seq 127109:128457, ack 1239, win 178, options [nop,nop,TS val 2141602647 ecr 533006], length 1348
18:33:00.911125 IP sea15s12-in-f10.1e100.net.https > 192.168.1.10.35989: Flags [.], seq 128457:129805, ack 1239, win 178, options [nop,nop,TS val 2141602647 ecr 533006], length 1348
18:33:00.912619 IP sea15s12-in-f10.1e100.net.https > 192.168.1.10.35989: Flags [.], seq 129805:131153, ack 1239, win 178, options [nop,nop,TS val 2141602647 ecr 533006], length 1348
18:33:00.912677 IP sea15s12-in-f10.1e100.net.https > 192.168.1.10.35989: Flags [.], seq 131153:132501, ack 1239, win 178, options [nop,nop,TS val 2141602647 ecr 533006], length 1348
18:33:00.914078 IP sea15s12-in-f10.1e100.net.https > 192.168.1.10.35989: Flags [.], seq 132501:133849, ack 1239, win 178, options [nop,nop,TS val 2141602648 ecr 533006], length 1348
18:33:00.914123 IP sea15s12-in-f10.1e100.net.https > 192.168.1.10.35989: Flags [.], seq 133849:135197, ack 1239, win 178, options [nop,nop,TS val 2141602648 ecr 533006], length 1348
18:33:00.917740 IP sea15s12-in-f10.1e100.net.https > 192.168.1.10.35989: Flags [.], seq 135197:136545, ack 1239, win 178, options [nop,nop,TS val 2141602654 ecr 533008], length 1348
18:33:00.917833 IP sea15s12-in-f10.1e100.net.https > 192.168.1.10.35989: Flags [.], seq 136545:137893, ack 1239, win 178, options [nop,nop,TS val 2141602654 ecr 533008], length 1348
18:33:00.918198 IP 192.168.1.10.35989 > sea15s12-in-f10.1e100.net.https: Flags [.], ack 105541, win 1206, options [nop,nop,TS val 533011 ecr 2141602633], length 0
18:33:00.918234 IP 192.168.1.10.35989 > sea15s12-in-f10.1e100.net.https: Flags [.], ack 106889, win 1217, options [nop,nop,TS val 533011 ecr 2141602637], length 0
18:33:00.918246 IP 192.168.1.10.35989 > sea15s12-in-f10.1e100.net.https: Flags [.], ack 108237, win 1227, options [nop,nop,TS val 533011 ecr 2141602637], length 0
18:33:00.918256 IP 192.168.1.10.35989 > sea15s12-in-f10.1e100.net.https: Flags [.], ack 109585, win 1238, options [nop,nop,TS val 533011 ecr 2141602637], length 0
18:33:00.918397 IP sea15s12-in-f10.1e100.net.https > 192.168.1.10.35989: Flags [P.], seq 137893:139184, ack 1239, win 178, options [nop,nop,TS val 2141602654 ecr 533008], length 1291
18:33:00.928093 IP 192.168.1.10.35989 > sea15s12-in-f10.1e100.net.https: Flags [.], ack 110933, win 1248, options [nop,nop,TS val 533011 ecr 2141602638], length 0
18:33:00.932439 IP 192.168.1.10.35989 > sea15s12-in-f10.1e100.net.https: Flags [.], ack 112281, win 1259, options [nop,nop,TS val 533011 ecr 2141602638], length 0
18:33:00.936801 IP 192.168.1.10.35989 > sea15s12-in-f10.1e100.net.https: Flags [.], ack 113629, win 1269, options [nop,nop,TS val 533013 ecr 2141602639], length 0
18:33:00.936815 IP 192.168.1.10.35989 > sea15s12-in-f10.1e100.net.https: Flags [.], ack 114977, win 1280, options [nop,nop,TS val 533013 ecr 2141602639], length 0
18:33:00.936837 IP 192.168.1.10.35989 > sea15s12-in-f10.1e100.net.https: Flags [.], ack 116325, win 1290, options [nop,nop,TS val 533013 ecr 2141602640], length 0
18:33:00.936849 IP 192.168.1.10.35989 > sea15s12-in-f10.1e100.net.https: Flags [.], ack 117673, win 1301, options [nop,nop,TS val 533013 ecr 2141602640], length 0
18:33:00.936859 IP 192.168.1.10.35989 > sea15s12-in-f10.1e100.net.https: Flags [.], ack 119021, win 1312, options [nop,nop,TS val 533013 ecr 2141602640], length 0
18:33:00.936869 IP 192.168.1.10.35989 > sea15s12-in-f10.1e100.net.https: Flags [.], ack 120369, win 1322, options [nop,nop,TS val 533013 ecr 2141602642], length 0
18:33:00.936879 IP 192.168.1.10.35989 > sea15s12-in-f10.1e100.net.https: Flags [.], ack 121717, win 1333, options [nop,nop,TS val 533013 ecr 2141602642], length 0
18:33:00.936890 IP 192.168.1.10.35989 > sea15s12-in-f10.1e100.net.https: Flags [.], ack 123065, win 1343, options [nop,nop,TS val 533013 ecr 2141602644], length 0
18:33:00.947959 IP 192.168.1.10.35989 > sea15s12-in-f10.1e100.net.https: Flags [.], ack 124413, win 1354, options [nop,nop,TS val 533013 ecr 2141602644], length 0
18:33:00.973326 IP 192.168.1.10.35989 > sea15s12-in-f10.1e100.net.https: Flags [.], ack 125761, win 1364, options [nop,nop,TS val 533016 ecr 2141602645], length 0
18:33:00.973353 IP 192.168.1.10.35989 > sea15s12-in-f10.1e100.net.https: Flags [.], ack 127109, win 1375, options [nop,nop,TS val 533016 ecr 2141602645], length 0
18:33:01.031950 IP 192.168.1.10.35989 > sea15s12-in-f10.1e100.net.https: Flags [.], ack 128457, win 1385, options [nop,nop,TS val 533022 ecr 2141602647], length 0
18:33:01.041582 IP 192.168.1.10.35989 > sea15s12-in-f10.1e100.net.https: Flags [.], ack 129805, win 1396, options [nop,nop,TS val 533023 ecr 2141602647], length 0
