tcpdump: verbose output suppressed, use -v or -vv for full protocol decode
listening on wlan0, link-type EN10MB (Ethernet), capture size 262144 bytes
00:55:26.697017 IP 192.168.1.10.47886 > sea15s07-in-f14.1e100.net.www: Flags [F.], seq 1802980234, ack 153169472, win 347, options [nop,nop,TS val 133351 ecr 3160306599], length 0
00:55:26.705063 IP sea15s07-in-f14.1e100.net.www > 192.168.1.10.47886: Flags [F.], seq 1, ack 1, win 219, options [nop,nop,TS val 3160334703 ecr 133351], length 0
00:55:26.709100 IP 192.168.1.10.47886 > sea15s07-in-f14.1e100.net.www: Flags [.], ack 2, win 347, options [nop,nop,TS val 133360 ecr 3160334703], length 0
00:55:28.102098 IP 192.168.1.10.46148 > sea15s07-in-f74.1e100.net.https: Flags [P.], seq 3949691840:3949692264, ack 469647384, win 416, options [nop,nop,TS val 133497 ecr 3307656519], length 424
00:55:28.102134 IP 192.168.1.10.46148 > sea15s07-in-f74.1e100.net.https: Flags [.], seq 424:1772, ack 1, win 416, options [nop,nop,TS val 133498 ecr 3307656519], length 1348
00:55:28.102147 IP 192.168.1.10.46148 > sea15s07-in-f74.1e100.net.https: Flags [.], seq 1772:3120, ack 1, win 416, options [nop,nop,TS val 133498 ecr 3307656519], length 1348
00:55:28.102159 IP 192.168.1.10.46148 > sea15s07-in-f74.1e100.net.https: Flags [.], seq 3120:4468, ack 1, win 416, options [nop,nop,TS val 133498 ecr 3307656519], length 1348
00:55:28.102171 IP 192.168.1.10.46148 > sea15s07-in-f74.1e100.net.https: Flags [.], seq 4468:5816, ack 1, win 416, options [nop,nop,TS val 133498 ecr 3307656519], length 1348
00:55:28.102771 IP 192.168.1.10.46148 > sea15s07-in-f74.1e100.net.https: Flags [.], seq 5816:7164, ack 1, win 416, options [nop,nop,TS val 133498 ecr 3307656519], length 1348
00:55:28.102787 IP 192.168.1.10.46148 > sea15s07-in-f74.1e100.net.https: Flags [.], seq 7164:8512, ack 1, win 416, options [nop,nop,TS val 133498 ecr 3307656519], length 1348
00:55:28.102810 IP 192.168.1.10.46148 > sea15s07-in-f74.1e100.net.https: Flags [.], seq 8512:9860, ack 1, win 416, options [nop,nop,TS val 133498 ecr 3307656519], length 1348
00:55:28.102822 IP 192.168.1.10.46148 > sea15s07-in-f74.1e100.net.https: Flags [.], seq 9860:11208, ack 1, win 416, options [nop,nop,TS val 133498 ecr 3307656519], length 1348
00:55:28.102847 IP 192.168.1.10.46148 > sea15s07-in-f74.1e100.net.https: Flags [.], seq 11208:12556, ack 1, win 416, options [nop,nop,TS val 133498 ecr 3307656519], length 1348
00:55:28.133969 IP sea15s07-in-f74.1e100.net.https > 192.168.1.10.46148: Flags [.], ack 1772, win 355, options [nop,nop,TS val 3307768998 ecr 133497], length 0
00:55:28.134802 IP sea15s07-in-f74.1e100.net.https > 192.168.1.10.46148: Flags [.], ack 4468, win 377, options [nop,nop,TS val 3307768999 ecr 133498], length 0
00:55:28.136497 IP sea15s07-in-f74.1e100.net.https > 192.168.1.10.46148: Flags [.], ack 7164, win 398, options [nop,nop,TS val 3307769000 ecr 133498], length 0
00:55:28.136722 IP 192.168.1.10.46148 > sea15s07-in-f74.1e100.net.https: Flags [.], seq 12556:13904, ack 1, win 416, options [nop,nop,TS val 133503 ecr 3307768998], length 1348
00:55:28.136742 IP 192.168.1.10.46148 > sea15s07-in-f74.1e100.net.https: Flags [.], seq 13904:15252, ack 1, win 416, options [nop,nop,TS val 133503 ecr 3307768998], length 1348
00:55:28.136765 IP 192.168.1.10.46148 > sea15s07-in-f74.1e100.net.https: Flags [P.], seq 15252:15353, ack 1, win 416, options [nop,nop,TS val 133503 ecr 3307768998], length 101
00:55:28.138310 IP sea15s07-in-f74.1e100.net.https > 192.168.1.10.46148: Flags [.], ack 9860, win 419, options [nop,nop,TS val 3307769002 ecr 133498], length 0
00:55:28.139902 IP sea15s07-in-f74.1e100.net.https > 192.168.1.10.46148: Flags [.], ack 12556, win 441, options [nop,nop,TS val 3307769004 ecr 133498], length 0
00:55:28.168340 IP sea15s07-in-f74.1e100.net.https > 192.168.1.10.46148: Flags [.], ack 15252, win 462, options [nop,nop,TS val 3307769032 ecr 133503], length 0
00:55:28.204498 IP sea15s07-in-f74.1e100.net.https > 192.168.1.10.46148: Flags [P.], seq 1:684, ack 15353, win 462, options [nop,nop,TS val 3307769068 ecr 133503], length 683
00:55:28.206761 IP 192.168.1.10.46148 > sea15s07-in-f74.1e100.net.https: Flags [.], ack 684, win 427, options [nop,nop,TS val 133510 ecr 3307769068], length 0
00:55:28.207403 IP sea15s07-in-f74.1e100.net.https > 192.168.1.10.46148: Flags [P.], seq 684:2032, ack 15353, win 462, options [nop,nop,TS val 3307769071 ecr 133503], length 1348
00:55:28.207605 IP sea15s07-in-f74.1e100.net.https > 192.168.1.10.46148: Flags [.], seq 2032:3380, ack 15353, win 462, options [nop,nop,TS val 3307769071 ecr 133503], length 1348
00:55:28.207656 IP sea15s07-in-f74.1e100.net.https > 192.168.1.10.46148: Flags [P.], seq 3380:3795, ack 15353, win 462, options [nop,nop,TS val 3307769071 ecr 133503], length 415
00:55:28.209711 IP sea15s07-in-f74.1e100.net.https > 192.168.1.10.46148: Flags [P.], seq 3795:3829, ack 15353, win 462, options [nop,nop,TS val 3307769073 ecr 133503], length 34
00:55:28.210656 IP 192.168.1.10.46148 > sea15s07-in-f74.1e100.net.https: Flags [.], ack 2032, win 437, options [nop,nop,TS val 133510 ecr 3307769071], length 0
00:55:28.210671 IP 192.168.1.10.46148 > sea15s07-in-f74.1e100.net.https: Flags [.], ack 3380, win 448, options [nop,nop,TS val 133510 ecr 3307769071], length 0
00:55:28.210690 IP 192.168.1.10.46148 > sea15s07-in-f74.1e100.net.https: Flags [.], ack 3795, win 459, options [nop,nop,TS val 133510 ecr 3307769071], length 0
00:55:28.212000 IP 192.168.1.10.46148 > sea15s07-in-f74.1e100.net.https: Flags [.], ack 3829, win 459, options [nop,nop,TS val 133510 ecr 3307769073], length 0
00:55:28.950954 IP 192.168.1.10.40426 > sea15s07-in-f74.1e100.net.https: Flags [S], seq 4072808989, win 65535, options [mss 1460,sackOK,TS val 133584 ecr 0,nop,wscale 8], length 0
00:55:28.980413 IP sea15s07-in-f74.1e100.net.https > 192.168.1.10.40426: Flags [S.], seq 2047906560, ack 4072808990, win 42408, options [mss 1360,sackOK,TS val 3975883722 ecr 133584,nop,wscale 8], length 0
00:55:29.001245 IP 192.168.1.10.40426 > sea15s07-in-f74.1e100.net.https: Flags [.], ack 1, win 343, options [nop,nop,TS val 133589 ecr 3975883722], length 0
00:55:29.010615 IP 192.168.1.10.40426 > sea15s07-in-f74.1e100.net.https: Flags [P.], seq 1:167, ack 1, win 343, options [nop,nop,TS val 133590 ecr 3975883722], length 166
00:55:29.039982 IP sea15s07-in-f74.1e100.net.https > 192.168.1.10.40426: Flags [.], ack 167, win 170, options [nop,nop,TS val 3975883781 ecr 133590], length 0
00:55:29.048682 IP sea15s07-in-f74.1e100.net.https > 192.168.1.10.40426: Flags [.], seq 1:1349, ack 167, win 170, options [nop,nop,TS val 3975883790 ecr 133590], length 1348
00:55:29.048781 IP sea15s07-in-f74.1e100.net.https > 192.168.1.10.40426: Flags [.], seq 1349:2697, ack 167, win 170, options [nop,nop,TS val 3975883790 ecr 133590], length 1348
00:55:29.048816 IP sea15s07-in-f74.1e100.net.https > 192.168.1.10.40426: Flags [P.], seq 2697:3265, ack 167, win 170, options [nop,nop,TS val 3975883790 ecr 133590], length 568
00:55:29.051591 IP 192.168.1.10.40426 > sea15s07-in-f74.1e100.net.https: Flags [.], ack 1349, win 353, options [nop,nop,TS val 133594 ecr 3975883790], length 0
00:55:29.051606 IP 192.168.1.10.40426 > sea15s07-in-f74.1e100.net.https: Flags [.], ack 2697, win 364, options [nop,nop,TS val 133594 ecr 3975883790], length 0
00:55:29.051626 IP 192.168.1.10.40426 > sea15s07-in-f74.1e100.net.https: Flags [.], ack 3265, win 374, options [nop,nop,TS val 133594 ecr 3975883790], length 0
00:55:29.091000 IP 192.168.1.10.40426 > sea15s07-in-f74.1e100.net.https: Flags [P.], seq 167:260, ack 3265, win 374, options [nop,nop,TS val 133597 ecr 3975883790], length 93
00:55:29.121051 IP sea15s07-in-f74.1e100.net.https > 192.168.1.10.40426: Flags [P.], seq 3265:3316, ack 260, win 170, options [nop,nop,TS val 3975883862 ecr 133597], length 51
00:55:29.133905 IP 192.168.1.10.40426 > sea15s07-in-f74.1e100.net.https: Flags [P.], seq 260:1435, ack 3316, win 374, options [nop,nop,TS val 133603 ecr 3975883862], length 1175
00:55:29.176040 IP sea15s07-in-f74.1e100.net.https > 192.168.1.10.40426: Flags [P.], seq 3316:3997, ack 1435, win 181, options [nop,nop,TS val 3975883917 ecr 133603], length 681
00:55:29.176401 IP sea15s07-in-f74.1e100.net.https > 192.168.1.10.40426: Flags [P.], seq 3997:4031, ack 1435, win 181, options [nop,nop,TS val 3975883917 ecr 133603], length 34
00:55:29.194840 IP 192.168.1.10.40426 > sea15s07-in-f74.1e100.net.https: Flags [.], ack 4031, win 385, options [nop,nop,TS val 133609 ecr 3975883917], length 0
00:55:29.197436 IP 192.168.1.10.46140 > sea15s07-in-f74.1e100.net.https: Flags [P.], seq 1131741968:1131741999, ack 3608614673, win 511, options [nop,nop,TS val 133609 ecr 2168497428], length 31
00:55:29.197454 IP 192.168.1.10.46140 > sea15s07-in-f74.1e100.net.https: Flags [F.], seq 31, ack 1, win 511, options [nop,nop,TS val 133609 ecr 2168497428], length 0
00:55:29.227260 IP sea15s07-in-f74.1e100.net.https > 192.168.1.10.46140: Flags [F.], seq 1, ack 32, win 203, options [nop,nop,TS val 2168606729 ecr 133609], length 0
00:55:29.229455 IP 192.168.1.10.46140 > sea15s07-in-f74.1e100.net.https: Flags [.], ack 2, win 511, options [nop,nop,TS val 133612 ecr 2168606729], length 0
00:55:29.488406 IP 192.168.1.10.40426 > sea15s07-in-f74.1e100.net.https: Flags [.], seq 1435:2783, ack 4031, win 385, options [nop,nop,TS val 133638 ecr 3975883917], length 1348
00:55:29.488439 IP 192.168.1.10.40426 > sea15s07-in-f74.1e100.net.https: Flags [P.], seq 2783:3502, ack 4031, win 385, options [nop,nop,TS val 133638 ecr 3975883917], length 719
00:55:29.518191 IP sea15s07-in-f74.1e100.net.https > 192.168.1.10.40426: Flags [.], ack 3502, win 197, options [nop,nop,TS val 3975884259 ecr 133638], length 0
00:55:29.541592 IP sea15s07-in-f74.1e100.net.https > 192.168.1.10.40426: Flags [P.], seq 4031:4786, ack 3502, win 197, options [nop,nop,TS val 3975884283 ecr 133638], length 755
00:55:29.541763 IP sea15s07-in-f74.1e100.net.https > 192.168.1.10.40426: Flags [P.], seq 4786:4820, ack 3502, win 197, options [nop,nop,TS val 3975884283 ecr 133638], length 34
00:55:29.560330 IP 192.168.1.10.40426 > sea15s07-in-f74.1e100.net.https: Flags [.], ack 4820, win 395, options [nop,nop,TS val 133645 ecr 3975884283], length 0
00:55:29.676602 IP 192.168.1.10.40426 > sea15s07-in-f74.1e100.net.https: Flags [P.], seq 3502:4509, ack 4820, win 395, options [nop,nop,TS val 133657 ecr 3975884283], length 1007
00:55:29.718958 IP sea15s07-in-f74.1e100.net.https > 192.168.1.10.40426: Flags [P.], seq 4820:5484, ack 4509, win 208, options [nop,nop,TS val 3975884460 ecr 133657], length 664
00:55:29.719143 IP sea15s07-in-f74.1e100.net.https > 192.168.1.10.40426: Flags [P.], seq 5484:5518, ack 4509, win 208, options [nop,nop,TS val 3975884460 ecr 133657], length 34
00:55:29.725696 IP 192.168.1.10.40426 > sea15s07-in-f74.1e100.net.https: Flags [.], ack 5518, win 406, options [nop,nop,TS val 133662 ecr 3975884460], length 0
00:55:30.026817 IP 192.168.1.10.40426 > sea15s07-in-f74.1e100.net.https: Flags [.], seq 4509:5857, ack 5518, win 406, options [nop,nop,TS val 133692 ecr 3975884460], length 1348
00:55:30.026835 IP 192.168.1.10.40426 > sea15s07-in-f74.1e100.net.https: Flags [P.], seq 5857:6907, ack 5518, win 406, options [nop,nop,TS val 133692 ecr 3975884460], length 1050
00:55:30.056507 IP sea15s07-in-f74.1e100.net.https > 192.168.1.10.40426: Flags [.], ack 6907, win 226, options [nop,nop,TS val 3975884798 ecr 133692], length 0
00:55:30.087240 IP sea15s07-in-f74.1e100.net.https > 192.168.1.10.40426: Flags [P.], seq 5518:6099, ack 6907, win 226, options [nop,nop,TS val 3975884828 ecr 133692], length 581
00:55:30.087445 IP sea15s07-in-f74.1e100.net.https > 192.168.1.10.40426: Flags [P.], seq 6099:6133, ack 6907, win 226, options [nop,nop,TS val 3975884829 ecr 133692], length 34
00:55:30.111849 IP 192.168.1.10.40426 > sea15s07-in-f74.1e100.net.https: Flags [.], ack 6133, win 416, options [nop,nop,TS val 133700 ecr 3975884828], length 0
00:55:30.206364 IP 192.168.1.10.46744 > sea15s07-in-f74.1e100.net.https: Flags [S], seq 4097080979, win 65535, options [mss 1460,sackOK,TS val 133710 ecr 0,nop,wscale 8], length 0
00:55:30.236193 IP sea15s07-in-f74.1e100.net.https > 192.168.1.10.46744: Flags [S.], seq 161716025, ack 4097080980, win 42408, options [mss 1360,sackOK,TS val 2405213220 ecr 133710,nop,wscale 8], length 0
00:55:30.261317 IP 192.168.1.10.46744 > sea15s07-in-f74.1e100.net.https: Flags [.], ack 1, win 343, options [nop,nop,TS val 133715 ecr 2405213220], length 0
00:55:30.266064 IP 192.168.1.10.46744 > sea15s07-in-f74.1e100.net.https: Flags [P.], seq 1:199, ack 1, win 343, options [nop,nop,TS val 133716 ecr 2405213220], length 198
00:55:30.295568 IP sea15s07-in-f74.1e100.net.https > 192.168.1.10.46744: Flags [.], ack 199, win 170, options [nop,nop,TS val 2405213279 ecr 133716], length 0
00:55:30.296287 IP sea15s07-in-f74.1e100.net.https > 192.168.1.10.46744: Flags [P.], seq 1:148, ack 199, win 170, options [nop,nop,TS val 2405213280 ecr 133716], length 147
00:55:30.302836 IP 192.168.1.10.46744 > sea15s07-in-f74.1e100.net.https: Flags [.], ack 148, win 347, options [nop,nop,TS val 133719 ecr 2405213280], length 0
00:55:30.302861 IP 192.168.1.10.46744 > sea15s07-in-f74.1e100.net.https: Flags [P.], seq 199:250, ack 148, win 347, options [nop,nop,TS val 133720 ecr 2405213280], length 51
00:55:30.307580 IP 192.168.1.10.46744 > sea15s07-in-f74.1e100.net.https: Flags [.], seq 250:1598, ack 148, win 347, options [nop,nop,TS val 133720 ecr 2405213280], length 1348
00:55:30.337235 IP sea15s07-in-f74.1e100.net.https > 192.168.1.10.46744: Flags [.], ack 1598, win 181, options [nop,nop,TS val 2405213321 ecr 133720], length 0
00:55:30.351141 IP 192.168.1.10.46744 > sea15s07-in-f74.1e100.net.https: Flags [P.], seq 1598:2309, ack 148, win 347, options [nop,nop,TS val 133724 ecr 2405213321], length 711
00:55:30.399729 IP sea15s07-in-f74.1e100.net.https > 192.168.1.10.46744: Flags [P.], seq 148:696, ack 2309, win 192, options [nop,nop,TS val 2405213383 ecr 133724], length 548
00:55:30.400013 IP sea15s07-in-f74.1e100.net.https > 192.168.1.10.46744: Flags [P.], seq 696:730, ack 2309, win 192, options [nop,nop,TS val 2405213383 ecr 133724], length 34
00:55:30.405360 IP 192.168.1.10.46744 > sea15s07-in-f74.1e100.net.https: Flags [.], ack 730, win 351, options [nop,nop,TS val 133730 ecr 2405213383], length 0
00:55:30.441110 IP 192.168.1.10.40650 > sea15s07-in-f74.1e100.net.https: Flags [P.], seq 356325382:356325413, ack 1748149637, win 351, options [nop,nop,TS val 133732 ecr 3307662247], length 31
00:55:30.441138 IP 192.168.1.10.40650 > sea15s07-in-f74.1e100.net.https: Flags [F.], seq 31, ack 1, win 351, options [nop,nop,TS val 133732 ecr 3307662247], length 0
00:55:30.472077 IP sea15s07-in-f74.1e100.net.https > 192.168.1.10.40650: Flags [F.], seq 1, ack 32, win 213, options [nop,nop,TS val 3307771337 ecr 133732], length 0
00:55:30.474341 IP 192.168.1.10.40650 > sea15s07-in-f74.1e100.net.https: Flags [.], ack 2, win 351, options [nop,nop,TS val 133737 ecr 3307771337], length 0
00:55:30.531262 IP 192.168.1.10.46744 > sea15s07-in-f74.1e100.net.https: Flags [.], seq 2309:3657, ack 730, win 351, options [nop,nop,TS val 133740 ecr 2405213383], length 1348
00:55:30.531286 IP 192.168.1.10.46744 > sea15s07-in-f74.1e100.net.https: Flags [P.], seq 3657:3664, ack 730, win 351, options [nop,nop,TS val 133740 ecr 2405213383], length 7
00:55:30.544557 IP sea15s07-in-f3.1e100.net.www > 192.168.1.10.41692: Flags [F.], seq 2040251779, ack 884396533, win 219, options [nop,nop,TS val 3160335663 ecr 121752], length 0
00:55:30.561040 IP sea15s07-in-f74.1e100.net.https > 192.168.1.10.46744: Flags [.], ack 3664, win 202, options [nop,nop,TS val 2405213544 ecr 133740], length 0
00:55:30.576708 IP sea15s07-in-f74.1e100.net.https > 192.168.1.10.46744: Flags [P.], seq 730:1304, ack 3664, win 202, options [nop,nop,TS val 2405213560 ecr 133740], length 574
00:55:30.576923 IP sea15s07-in-f74.1e100.net.https > 192.168.1.10.46744: Flags [P.], seq 1304:1338, ack 3664, win 202, options [nop,nop,TS val 2405213560 ecr 133740], length 34
00:55:30.579304 IP 192.168.1.10.46744 > sea15s07-in-f74.1e100.net.https: Flags [.], ack 1338, win 356, options [nop,nop,TS val 133747 ecr 2405213560], length 0
00:55:30.584357 IP 192.168.1.10.41692 > sea15s07-in-f3.1e100.net.www: Flags [.], ack 1, win 347, options [nop,nop,TS val 133748 ecr 3160335663], length 0
00:55:31.109988 IP 192.168.1.10.43819 > sea15s02-in-f10.1e100.net.https: Flags [S], seq 1379692641, win 65535, options [mss 1460,sackOK,TS val 133800 ecr 0,nop,wscale 8], length 0
00:55:31.140506 IP sea15s02-in-f10.1e100.net.https > 192.168.1.10.43819: Flags [S.], seq 4080464278, ack 1379692642, win 42408, options [mss 1360,sackOK,TS val 3272219760 ecr 133800,nop,wscale 8], length 0
00:55:31.161329 IP 192.168.1.10.43819 > sea15s02-in-f10.1e100.net.https: Flags [.], ack 1, win 343, options [nop,nop,TS val 133805 ecr 3272219760], length 0
00:55:31.165171 IP 192.168.1.10.43819 > sea15s02-in-f10.1e100.net.https: Flags [P.], seq 1:198, ack 1, win 343, options [nop,nop,TS val 133806 ecr 3272219760], length 197
00:55:31.195634 IP sea15s02-in-f10.1e100.net.https > 192.168.1.10.43819: Flags [.], ack 198, win 170, options [nop,nop,TS val 3272219816 ecr 133806], length 0
00:55:31.204624 IP sea15s02-in-f10.1e100.net.https > 192.168.1.10.43819: Flags [.], seq 1:1349, ack 198, win 170, options [nop,nop,TS val 3272219824 ecr 133806], length 1348
00:55:31.204695 IP sea15s02-in-f10.1e100.net.https > 192.168.1.10.43819: Flags [.], seq 1349:2697, ack 198, win 170, options [nop,nop,TS val 3272219824 ecr 133806], length 1348
00:55:31.204727 IP sea15s02-in-f10.1e100.net.https > 192.168.1.10.43819: Flags [P.], seq 2697:3265, ack 198, win 170, options [nop,nop,TS val 3272219824 ecr 133806], length 568
00:55:31.207491 IP 192.168.1.10.43819 > sea15s02-in-f10.1e100.net.https: Flags [.], ack 1349, win 353, options [nop,nop,TS val 133810 ecr 3272219824], length 0
00:55:31.207506 IP 192.168.1.10.43819 > sea15s02-in-f10.1e100.net.https: Flags [.], ack 2697, win 364, options [nop,nop,TS val 133810 ecr 3272219824], length 0
00:55:31.207524 IP 192.168.1.10.43819 > sea15s02-in-f10.1e100.net.https: Flags [.], ack 3265, win 374, options [nop,nop,TS val 133810 ecr 3272219824], length 0
00:55:31.250931 IP 192.168.1.10.43819 > sea15s02-in-f10.1e100.net.https: Flags [P.], seq 198:291, ack 3265, win 374, options [nop,nop,TS val 133812 ecr 3272219824], length 93
00:55:31.281782 IP sea15s02-in-f10.1e100.net.https > 192.168.1.10.43819: Flags [P.], seq 3265:3316, ack 291, win 170, options [nop,nop,TS val 3272219902 ecr 133812], length 51
00:55:31.288549 IP 192.168.1.10.43819 > sea15s02-in-f10.1e100.net.https: Flags [.], seq 291:1639, ack 3316, win 374, options [nop,nop,TS val 133818 ecr 3272219902], length 1348
00:55:31.288568 IP 192.168.1.10.43819 > sea15s02-in-f10.1e100.net.https: Flags [.], seq 1639:2987, ack 3316, win 374, options [nop,nop,TS val 133818 ecr 3272219902], length 1348
00:55:31.288580 IP 192.168.1.10.43819 > sea15s02-in-f10.1e100.net.https: Flags [.], seq 2987:4335, ack 3316, win 374, options [nop,nop,TS val 133818 ecr 3272219902], length 1348
00:55:31.288603 IP 192.168.1.10.43819 > sea15s02-in-f10.1e100.net.https: Flags [P.], seq 4335:5081, ack 3316, win 374, options [nop,nop,TS val 133818 ecr 3272219902], length 746
00:55:31.319506 IP sea15s02-in-f10.1e100.net.https > 192.168.1.10.43819: Flags [.], ack 2987, win 192, options [nop,nop,TS val 3272219939 ecr 133818], length 0
00:55:31.319752 IP sea15s02-in-f10.1e100.net.https > 192.168.1.10.43819: Flags [.], ack 5081, win 208, options [nop,nop,TS val 3272219939 ecr 133818], length 0
00:55:31.338042 IP sea15s02-in-f10.1e100.net.https > 192.168.1.10.43819: Flags [P.], seq 3316:4664, ack 5081, win 208, options [nop,nop,TS val 3272219958 ecr 133818], length 1348
00:55:31.338230 IP sea15s02-in-f10.1e100.net.https > 192.168.1.10.43819: Flags [P.], seq 4664:6012, ack 5081, win 208, options [nop,nop,TS val 3272219958 ecr 133818], length 1348
00:55:31.338413 IP sea15s02-in-f10.1e100.net.https > 192.168.1.10.43819: Flags [.], seq 6012:7360, ack 5081, win 208, options [nop,nop,TS val 3272219958 ecr 133818], length 1348
00:55:31.338491 IP sea15s02-in-f10.1e100.net.https > 192.168.1.10.43819: Flags [P.], seq 7360:8577, ack 5081, win 208, options [nop,nop,TS val 3272219958 ecr 133818], length 1217
00:55:31.338576 IP sea15s02-in-f10.1e100.net.https > 192.168.1.10.43819: Flags [P.], seq 8577:8611, ack 5081, win 208, options [nop,nop,TS val 3272219958 ecr 133818], length 34
00:55:31.341746 IP 192.168.1.10.43819 > sea15s02-in-f10.1e100.net