tcpdump: verbose output suppressed, use -v or -vv for full protocol decode
listening on wlan0, link-type EN10MB (Ethernet), capture size 262144 bytes
00:52:58.932157 IP 192.168.1.10.53475 > sea15s07-in-f3.1e100.net.www: Flags [S], seq 3722829460, win 65535, options [mss 1460,sackOK,TS val 549833 ecr 0,nop,wscale 6], length 0
00:52:58.941001 IP sea15s07-in-f3.1e100.net.www > 192.168.1.10.53475: Flags [S.], seq 2165858187, ack 3722829461, win 26960, options [mss 1360,sackOK,TS val 3157360556 ecr 549833,nop,wscale 7], length 0
00:52:58.983529 IP 192.168.1.10.53475 > sea15s07-in-f3.1e100.net.www: Flags [.], ack 1, win 1369, options [nop,nop,TS val 549837 ecr 3157360556], length 0
00:52:58.983544 IP 192.168.1.10.37679 > pg-in-f188.1e100.net.5228: Flags [S], seq 1977206021, win 65535, options [mss 1460,sackOK,TS val 549838 ecr 0,nop,wscale 6], length 0
00:52:58.987954 IP 192.168.1.10.57021 > sea15s07-in-f14.1e100.net.www: Flags [S], seq 2164183121, win 65535, options [mss 1460,sackOK,TS val 549838 ecr 0,nop,wscale 6], length 0
00:52:58.992304 IP 192.168.1.10.53475 > sea15s07-in-f3.1e100.net.www: Flags [P.], seq 1:187, ack 1, win 1369, options [nop,nop,TS val 549838 ecr 3157360556], length 186: HTTP: GET /generate_204 HTTP/1.1
00:52:58.996936 IP sea15s07-in-f14.1e100.net.www > 192.168.1.10.57021: Flags [S.], seq 3876677120, ack 2164183122, win 26960, options [mss 1360,sackOK,TS val 3157360570 ecr 549838,nop,wscale 7], length 0
00:52:59.001123 IP sea15s07-in-f3.1e100.net.www > 192.168.1.10.53475: Flags [.], ack 187, win 219, options [nop,nop,TS val 3157360571 ecr 549838], length 0
00:52:59.006635 IP pg-in-f188.1e100.net.5228 > 192.168.1.10.37679: Flags [S.], seq 4198752909, ack 1977206022, win 42408, options [mss 1360,sackOK,TS val 917457909 ecr 549838,nop,wscale 8], length 0
00:52:59.007668 IP 192.168.1.10.57021 > sea15s07-in-f14.1e100.net.www: Flags [.], ack 1, win 1369, options [nop,nop,TS val 549842 ecr 3157360570], length 0
00:52:59.007685 IP 192.168.1.10.57021 > sea15s07-in-f14.1e100.net.www: Flags [P.], seq 1:177, ack 1, win 1369, options [nop,nop,TS val 549842 ecr 3157360570], length 176: HTTP: GET /generate_204 HTTP/1.1
00:52:59.012056 IP 192.168.1.10.37679 > pg-in-f188.1e100.net.5228: Flags [.], ack 1, win 1369, options [nop,nop,TS val 549843 ecr 917457909], length 0
00:52:59.016577 IP sea15s07-in-f14.1e100.net.www > 192.168.1.10.57021: Flags [.], ack 177, win 219, options [nop,nop,TS val 3157360575 ecr 549842], length 0
00:52:59.016437 IP 192.168.1.10.37679 > pg-in-f188.1e100.net.5228: Flags [P.], seq 1:168, ack 1, win 1369, options [nop,nop,TS val 549843 ecr 917457909], length 167
00:52:59.039690 IP pg-in-f188.1e100.net.5228 > 192.168.1.10.37679: Flags [.], ack 168, win 170, options [nop,nop,TS val 917457942 ecr 549843], length 0
00:52:59.040107 IP pg-in-f188.1e100.net.5228 > 192.168.1.10.37679: Flags [.], seq 1:1349, ack 168, win 170, options [nop,nop,TS val 917457942 ecr 549843], length 1348
00:52:59.040162 IP pg-in-f188.1e100.net.5228 > 192.168.1.10.37679: Flags [.], seq 1349:2697, ack 168, win 170, options [nop,nop,TS val 917457942 ecr 549843], length 1348
00:52:59.040194 IP pg-in-f188.1e100.net.5228 > 192.168.1.10.37679: Flags [.], seq 2697:4045, ack 168, win 170, options [nop,nop,TS val 917457942 ecr 549843], length 1348
00:52:59.040223 IP pg-in-f188.1e100.net.5228 > 192.168.1.10.37679: Flags [P.], seq 4045:4111, ack 168, win 170, options [nop,nop,TS val 917457942 ecr 549843], length 66
00:52:59.046919 IP 192.168.1.10.37679 > pg-in-f188.1e100.net.5228: Flags [.], ack 1349, win 1411, options [nop,nop,TS val 549846 ecr 917457942], length 0
00:52:59.049452 IP sea15s07-in-f3.1e100.net.www > 192.168.1.10.53475: Flags [P.], seq 1:227, ack 187, win 219, options [nop,nop,TS val 3157360583 ecr 549838], length 226: HTTP: HTTP/1.1 204 No Content
00:52:59.051272 IP 192.168.1.10.37679 > pg-in-f188.1e100.net.5228: Flags [.], ack 2697, win 1453, options [nop,nop,TS val 549846 ecr 917457942], length 0
00:52:59.055516 IP 192.168.1.10.37679 > pg-in-f188.1e100.net.5228: Flags [.], ack 4045, win 1496, options [nop,nop,TS val 549846 ecr 917457942], length 0
00:52:59.055529 IP 192.168.1.10.37679 > pg-in-f188.1e100.net.5228: Flags [.], ack 4111, win 1496, options [nop,nop,TS val 549846 ecr 917457942], length 0
00:52:59.059975 IP 192.168.1.10.53475 > sea15s07-in-f3.1e100.net.www: Flags [.], ack 227, win 1369, options [nop,nop,TS val 549847 ecr 3157360583], length 0
00:52:59.064208 IP sea15s07-in-f14.1e100.net.www > 192.168.1.10.57021: Flags [P.], seq 1:227, ack 177, win 219, options [nop,nop,TS val 3157360587 ecr 549842], length 226: HTTP: HTTP/1.1 204 No Content
00:52:59.070552 IP 192.168.1.10.57021 > sea15s07-in-f14.1e100.net.www: Flags [.], ack 227, win 1369, options [nop,nop,TS val 549848 ecr 3157360587], length 0
00:52:59.175352 IP 192.168.1.10.43309 > sea15s07-in-f74.1e100.net.https: Flags [S], seq 2892094336, win 65535, options [mss 1460,sackOK,TS val 549859 ecr 0,nop,wscale 6], length 0
00:52:59.207182 IP sea15s07-in-f74.1e100.net.https > 192.168.1.10.43309: Flags [S.], seq 1998559637, ack 2892094337, win 42408, options [mss 1360,sackOK,TS val 3656051994 ecr 549859,nop,wscale 8], length 0
00:52:59.219476 IP 192.168.1.10.43309 > sea15s07-in-f74.1e100.net.https: Flags [.], ack 1, win 1369, options [nop,nop,TS val 549863 ecr 3656051994], length 0
00:52:59.219499 IP 192.168.1.10.43309 > sea15s07-in-f74.1e100.net.https: Flags [P.], seq 1:185, ack 1, win 1369, options [nop,nop,TS val 549863 ecr 3656051994], length 184
00:52:59.223844 IP 192.168.1.10.37679 > pg-in-f188.1e100.net.5228: Flags [P.], seq 168:253, ack 4111, win 1496, options [nop,nop,TS val 549864 ecr 917457942], length 85
00:52:59.247341 IP pg-in-f188.1e100.net.5228 > 192.168.1.10.37679: Flags [P.], seq 4111:4387, ack 253, win 170, options [nop,nop,TS val 917458150 ecr 549864], length 276
00:52:59.251239 IP sea15s07-in-f74.1e100.net.https > 192.168.1.10.43309: Flags [.], ack 185, win 170, options [nop,nop,TS val 3656052038 ecr 549863], length 0
00:52:59.260658 IP sea15s07-in-f74.1e100.net.https > 192.168.1.10.43309: Flags [.], seq 1:1349, ack 185, win 170, options [nop,nop,TS val 3656052048 ecr 549863], length 1348
00:52:59.260835 IP sea15s07-in-f74.1e100.net.https > 192.168.1.10.43309: Flags [.], seq 1349:2697, ack 185, win 170, options [nop,nop,TS val 3656052048 ecr 549863], length 1348
00:52:59.260922 IP sea15s07-in-f74.1e100.net.https > 192.168.1.10.43309: Flags [P.], seq 2697:3252, ack 185, win 170, options [nop,nop,TS val 3656052048 ecr 549863], length 555
00:52:59.261799 IP 192.168.1.10.37679 > pg-in-f188.1e100.net.5228: Flags [.], ack 4387, win 1538, options [nop,nop,TS val 549867 ecr 917458150], length 0
00:52:59.266159 IP 192.168.1.10.43309 > sea15s07-in-f74.1e100.net.https: Flags [.], ack 1349, win 1411, options [nop,nop,TS val 549868 ecr 3656052048], length 0
00:52:59.266171 IP 192.168.1.10.43309 > sea15s07-in-f74.1e100.net.https: Flags [.], ack 2697, win 1453, options [nop,nop,TS val 549868 ecr 3656052048], length 0
00:52:59.266181 IP 192.168.1.10.43309 > sea15s07-in-f74.1e100.net.https: Flags [.], ack 3252, win 1496, options [nop,nop,TS val 549868 ecr 3656052048], length 0
00:52:59.300438 IP 192.168.1.10.37679 > pg-in-f188.1e100.net.5228: Flags [P.], seq 253:590, ack 4387, win 1538, options [nop,nop,TS val 549871 ecr 917458150], length 337
00:52:59.324763 IP pg-in-f188.1e100.net.5228 > 192.168.1.10.37679: Flags [P.], seq 4387:4409, ack 590, win 175, options [nop,nop,TS val 917458227 ecr 549871], length 22
00:52:59.327619 IP pg-in-f188.1e100.net.5228 > 192.168.1.10.37679: Flags [P.], seq 4409:4515, ack 590, win 175, options [nop,nop,TS val 917458230 ecr 549871], length 106
00:52:59.328614 IP pg-in-f188.1e100.net.5228 > 192.168.1.10.37679: Flags [P.], seq 4515:4632, ack 590, win 175, options [nop,nop,TS val 917458231 ecr 549871], length 117
00:52:59.330540 IP 192.168.1.10.37679 > pg-in-f188.1e100.net.5228: Flags [.], ack 4409, win 1538, options [nop,nop,TS val 549874 ecr 917458227], length 0
00:52:59.330553 IP 192.168.1.10.37679 > pg-in-f188.1e100.net.5228: Flags [.], ack 4515, win 1538, options [nop,nop,TS val 549875 ecr 917458230], length 0
00:52:59.330564 IP 192.168.1.10.37679 > pg-in-f188.1e100.net.5228: Flags [.], ack 4632, win 1538, options [nop,nop,TS val 549875 ecr 917458231], length 0
00:52:59.339645 IP 192.168.1.10.43309 > sea15s07-in-f74.1e100.net.https: Flags [P.], seq 185:270, ack 3252, win 1496, options [nop,nop,TS val 549875 ecr 3656052048], length 85
00:52:59.372068 IP sea15s07-in-f74.1e100.net.https > 192.168.1.10.43309: Flags [P.], seq 3252:3528, ack 270, win 170, options [nop,nop,TS val 3656052159 ecr 549875], length 276
00:52:59.382949 IP 192.168.1.10.43309 > sea15s07-in-f74.1e100.net.https: Flags [P.], seq 270:1208, ack 3528, win 1538, options [nop,nop,TS val 549879 ecr 3656052159], length 938
00:52:59.453684 IP sea15s07-in-f74.1e100.net.https > 192.168.1.10.43309: Flags [P.], seq 3528:4876, ack 1208, win 178, options [nop,nop,TS val 3656052241 ecr 549879], length 1348
00:52:59.453849 IP sea15s07-in-f74.1e100.net.https > 192.168.1.10.43309: Flags [P.], seq 4876:6224, ack 1208, win 178, options [nop,nop,TS val 3656052241 ecr 549879], length 1348
00:52:59.454013 IP sea15s07-in-f74.1e100.net.https > 192.168.1.10.43309: Flags [.], seq 6224:7572, ack 1208, win 178, options [nop,nop,TS val 3656052241 ecr 549879], length 1348
00:52:59.454061 IP sea15s07-in-f74.1e100.net.https > 192.168.1.10.43309: Flags [P.], seq 7572:7786, ack 1208, win 178, options [nop,nop,TS val 3656052241 ecr 549879], length 214
00:52:59.454145 IP sea15s07-in-f74.1e100.net.https > 192.168.1.10.43309: Flags [P.], seq 7786:9134, ack 1208, win 178, options [nop,nop,TS val 3656052241 ecr 549879], length 1348
00:52:59.454259 IP sea15s07-in-f74.1e100.net.https > 192.168.1.10.43309: Flags [.], seq 9134:10482, ack 1208, win 178, options [nop,nop,TS val 3656052241 ecr 549879], length 1348
00:52:59.454278 IP sea15s07-in-f74.1e100.net.https > 192.168.1.10.43309: Flags [P.], seq 10482:11830, ack 1208, win 178, options [nop,nop,TS val 3656052241 ecr 549879], length 1348
00:52:59.454335 IP sea15s07-in-f74.1e100.net.https > 192.168.1.10.43309: Flags [P.], seq 11830:12029, ack 1208, win 178, options [nop,nop,TS val 3656052241 ecr 549879], length 199
00:52:59.454788 IP sea15s07-in-f74.1e100.net.https > 192.168.1.10.43309: Flags [P.], seq 12029:13377, ack 1208, win 178, options [nop,nop,TS val 3656052242 ecr 549879], length 1348
00:52:59.454919 IP sea15s07-in-f74.1e100.net.https > 192.168.1.10.43309: Flags [.], seq 13377:14725, ack 1208, win 178, options [nop,nop,TS val 3656052242 ecr 549879], length 1348
00:52:59.454958 IP sea15s07-in-f74.1e100.net.https > 192.168.1.10.43309: Flags [P.], seq 14725:16073, ack 1208, win 178, options [nop,nop,TS val 3656052242 ecr 549879], length 1348
00:52:59.458357 IP sea15s07-in-f74.1e100.net.https > 192.168.1.10.43309: Flags [.], seq 16073:17421, ack 1208, win 178, options [nop,nop,TS val 3656052242 ecr 549879], length 1348
00:52:59.458401 IP sea15s07-in-f74.1e100.net.https > 192.168.1.10.43309: Flags [.], seq 17421:18769, ack 1208, win 178, options [nop,nop,TS val 3656052242 ecr 549879], length 1348
00:52:59.461867 IP sea15s07-in-f74.1e100.net.https > 192.168.1.10.43309: Flags [.], seq 18769:20117, ack 1208, win 178, options [nop,nop,TS val 3656052242 ecr 549879], length 1348
00:52:59.476794 IP 192.168.1.10.42817 > sea15s07-in-f74.1e100.net.https: Flags [S], seq 196959408, win 65535, options [mss 1460,sackOK,TS val 549887 ecr 0,nop,wscale 6], length 0
00:52:59.476809 IP 192.168.1.10.43309 > sea15s07-in-f74.1e100.net.https: Flags [.], ack 6224, win 1622, options [nop,nop,TS val 549888 ecr 3656052241], length 0
00:52:59.481215 IP 192.168.1.10.43309 > sea15s07-in-f74.1e100.net.https: Flags [.], ack 7786, win 1664, options [nop,nop,TS val 549889 ecr 3656052241], length 0
00:52:59.481230 IP 192.168.1.10.43309 > sea15s07-in-f74.1e100.net.https: Flags [.], ack 10482, win 1748, options [nop,nop,TS val 549889 ecr 3656052241], length 0
00:52:59.491575 IP 192.168.1.10.43309 > sea15s07-in-f74.1e100.net.https: Flags [.], ack 12029, win 1790, options [nop,nop,TS val 549889 ecr 3656052241], length 0
00:52:59.495908 IP 192.168.1.10.43309 > sea15s07-in-f74.1e100.net.https: Flags [.], ack 14725, win 1875, options [nop,nop,TS val 549889 ecr 3656052242], length 0
00:52:59.495922 IP 192.168.1.10.43309 > sea15s07-in-f74.1e100.net.https: Flags [.], ack 17421, win 1959, options [nop,nop,TS val 549890 ecr 3656052242], length 0
00:52:59.495932 IP 192.168.1.10.43309 > sea15s07-in-f74.1e100.net.https: Flags [.], ack 20117, win 2043, options [nop,nop,TS val 549890 ecr 3656052242], length 0
00:52:59.507406 IP sea15s07-in-f74.1e100.net.https > 192.168.1.10.42817: Flags [S.], seq 1507579587, ack 196959409, win 42408, options [mss 1360,sackOK,TS val 2092620442 ecr 549887,nop,wscale 8], length 0
00:52:59.508486 IP sea15s07-in-f74.1e100.net.https > 192.168.1.10.43309: Flags [.], seq 20117:21465, ack 1208, win 178, options [nop,nop,TS val 3656052296 ecr 549888], length 1348
00:52:59.508665 IP sea15s07-in-f74.1e100.net.https > 192.168.1.10.43309: Flags [.], seq 21465:22813, ack 1208, win 178, options [nop,nop,TS val 3656052296 ecr 549888], length 1348
00:52:59.508712 IP sea15s07-in-f74.1e100.net.https > 192.168.1.10.43309: Flags [.], seq 22813:24161, ack 1208, win 178, options [nop,nop,TS val 3656052296 ecr 549888], length 1348
00:52:59.508759 IP sea15s07-in-f74.1e100.net.https > 192.168.1.10.43309: Flags [.], seq 24161:25509, ack 1208, win 178, options [nop,nop,TS val 3656052296 ecr 549888], length 1348
00:52:59.512932 IP sea15s07-in-f74.1e100.net.https > 192.168.1.10.43309: Flags [.], seq 25509:26857, ack 1208, win 178, options [nop,nop,TS val 3656052300 ecr 549889], length 1348
00:52:59.512980 IP sea15s07-in-f74.1e100.net.https > 192.168.1.10.43309: Flags [.], seq 26857:28205, ack 1208, win 178, options [nop,nop,TS val 3656052300 ecr 549889], length 1348
00:52:59.514707 IP sea15s07-in-f74.1e100.net.https > 192.168.1.10.43309: Flags [.], seq 28205:29553, ack 1208, win 178, options [nop,nop,TS val 3656052300 ecr 549889], length 1348
00:52:59.514763 IP sea15s07-in-f74.1e100.net.https > 192.168.1.10.43309: Flags [.], seq 29553:30901, ack 1208, win 178, options [nop,nop,TS val 3656052300 ecr 549889], length 1348
00:52:59.515039 IP 192.168.1.10.42817 > sea15s07-in-f74.1e100.net.https: Flags [.], ack 1, win 1369, options [nop,nop,TS val 549893 ecr 2092620442], length 0
00:52:59.518304 IP sea15s07-in-f74.1e100.net.https > 192.168.1.10.43309: Flags [.], seq 30901:32249, ack 1208, win 178, options [nop,nop,TS val 3656052300 ecr 549889], length 1348
00:52:59.518393 IP sea15s07-in-f74.1e100.net.https > 192.168.1.10.43309: Flags [.], seq 32249:33597, ack 1208, win 178, options [nop,nop,TS val 3656052300 ecr 549889], length 1348
00:52:59.521750 IP sea15s07-in-f74.1e100.net.https > 192.168.1.10.43309: Flags [.], seq 33597:34945, ack 1208, win 178, options [nop,nop,TS val 3656052302 ecr 549889], length 1348
00:52:59.521797 IP sea15s07-in-f74.1e100.net.https > 192.168.1.10.43309: Flags [.], seq 34945:36293, ack 1208, win 178, options [nop,nop,TS val 3656052302 ecr 549889], length 1348
00:52:59.525283 IP sea15s07-in-f74.1e100.net.https > 192.168.1.10.43309: Flags [.], seq 36293:37641, ack 1208, win 178, options [nop,nop,TS val 3656052310 ecr 549889], length 1348
00:52:59.525324 IP sea15s07-in-f74.1e100.net.https > 192.168.1.10.43309: Flags [.], seq 37641:38989, ack 1208, win 178, options [nop,nop,TS val 3656052310 ecr 549889], length 1348
00:52:59.528859 IP sea15s07-in-f74.1e100.net.https > 192.168.1.10.43309: Flags [.], seq 38989:40337, ack 1208, win 178, options [nop,nop,TS val 3656052315 ecr 549889], length 1348
00:52:59.528914 IP sea15s07-in-f74.1e100.net.https > 192.168.1.10.43309: Flags [.], seq 40337:41685, ack 1208, win 178, options [nop,nop,TS val 3656052315 ecr 549889], length 1348
00:52:59.528942 IP sea15s07-in-f74.1e100.net.https > 192.168.1.10.43309: Flags [.], seq 41685:43033, ack 1208, win 178, options [nop,nop,TS val 3656052315 ecr 549889], length 1348
00:52:59.529045 IP sea15s07-in-f74.1e100.net.https > 192.168.1.10.43309: Flags [.], seq 43033:44381, ack 1208, win 178, options [nop,nop,TS val 3656052315 ecr 549889], length 1348
00:52:59.532368 IP sea15s07-in-f74.1e100.net.https > 192.168.1.10.43309: Flags [.], seq 44381:45729, ack 1208, win 178, options [nop,nop,TS val 3656052316 ecr 549890], length 1348
00:52:59.532407 IP sea15s07-in-f74.1e100.net.https > 192.168.1.10.43309: Flags [.], seq 45729:47077, ack 1208, win 178, options [nop,nop,TS val 3656052316 ecr 549890], length 1348
00:52:59.535959 IP sea15s07-in-f74.1e100.net.https > 192.168.1.10.43309: Flags [.], seq 47077:48425, ack 1208, win 178, options [nop,nop,TS val 3656052316 ecr 549890], length 1348
00:52:59.536001 IP sea15s07-in-f74.1e100.net.https > 192.168.1.10.43309: Flags [.], seq 48425:49773, ack 1208, win 178, options [nop,nop,TS val 3656052316 ecr 549890], length 1348
00:52:59.539457 IP sea15s07-in-f74.1e100.net.https > 192.168.1.10.43309: Flags [.], seq 49773:51121, ack 1208, win 178, options [nop,nop,TS val 3656052320 ecr 549890], length 1348
00:52:59.539497 IP sea15s07-in-f74.1e100.net.https > 192.168.1.10.43309: Flags [.], seq 51121:52469, ack 1208, win 178, options [nop,nop,TS val 3656052320 ecr 549890], length 1348
00:52:59.543007 IP sea15s07-in-f74.1e100.net.https > 192.168.1.10.43309: Flags [.], seq 52469:53817, ack 1208, win 178, options [nop,nop,TS val 3656052323 ecr 549890], length 1348
00:52:59.543046 IP sea15s07-in-f74.1e100.net.https > 192.168.1.10.43309: Flags [.], seq 53817:55165, ack 1208, win 178, options [nop,nop,TS val 3656052323 ecr 549890], length 1348
00:52:59.544297 IP 192.168.1.10.42817 > sea15s07-in-f74.1e100.net.https: Flags [P.], seq 1:185, ack 1, win 1369, options [nop,nop,TS val 549893 ecr 2092620442], length 184
00:52:59.571514 IP 192.168.1.10.43309 > sea15s07-in-f74.1e100.net.https: Flags [.], ack 22813, win 2127, options [nop,nop,TS val 549893 ecr 3656052296], length 0
00:52:59.571527 IP 192.168.1.10.43309 > sea15s07-in-f74.1e100.net.https: Flags [.], ack 25509, win 2212, options [nop,nop,TS val 549893 ecr 3656052296], length 0
00:52:59.571538 IP 192.168.1.10.43309 > sea15s07-in-f74.1e100.net.https: Flags [.], ack 28205, win 2296, options [nop,nop,TS val 549894 ecr 3656052300], length 0
00:52:59.574743 IP sea15s07-in-f74.1e100.net.https > 192.168.1.10.42817: Flags [.], ack 185, win 170, options [nop,nop,TS val 2092620509 ecr 549893], length 0
00:52:59.581920 IP 192.168.1.10.43309 > sea15s07-in-f74.1e100.net.https: Flags [.], ack 30901, win 2380, options [nop,nop,TS val 549895 ecr 3656052300], length 0
00:52:59.581934 IP 192.168.1.10.43309 > sea15s07-in-f74.1e100.net.https: Flags [.], ack 33597, win 2464, options [nop,nop,TS val 549895 ecr 3656052300], length 0
00:52:59.581944 IP 192.168.1.10.43309 > sea15s07-in-f74.1e100.net.https: Flags [.], ack 36293, win 2549, options [nop,nop,TS val 549896 ecr 3656052302], length 0
00:52:59.581955 IP 192.168.1.10.43309 > sea15s07-in-f74.1e100.net.https: Flags [.], ack 38989, win 2633, options [nop,nop,TS val 549896 ecr 3656052310], length 0
00:52:59.581965 IP 192.168.1.10.43309 > sea15s07-in-f74.1e100.net.https: Flags [.], ack 41685, win 2717, options [nop,nop,TS val 549897 ecr 3656052315], length 0
00:52:59.581996 IP 192.168.1.10.43309 > sea15s07-in-f74.1e100.net.https: Flags [.], ack 44381, win 2801, options [nop,nop,TS val 549897 ecr 3656052315], length 0
00:52:59.582007 IP 192.168.1.10.43309 > sea15s07-in-f74.1e100.net.https: Flags [.], ack 47077, win 2886, options [nop,nop,TS val 549897 ecr 3656052316], length 0
00:52:59.582017 IP 192.168.1.10.43309 > sea15s07-in-f74.1e100.net.https: Flags [.], ack 49773, win 2970, options [nop,nop,TS val 549897 ecr 3656052316], length 0
00:52:59.582027 IP 192.168.1.10.43309 > sea15s07-in-f74.1e100.net.https: Flags [.], ack 52469, win 3054, options [nop,nop,TS val 549897 ecr 3656052320], length 0
00:52:59.582037 IP 192.168.1.10.43309 > sea15s07-in-f74.1e100.net.https: Flags [.], ack 55165, win 3138, options [nop,nop,TS val 549897 ecr 3656052323], length 0
00:52:59.591472 IP sea15s07-in-f74.1e100.net.https > 192.168.1.10.42817: Flags [.], seq 1:1349, ack 185, win 170, options [nop,nop,TS val 2092620526 ecr 549893], length 1348
00:52:59.591534 IP sea15s07-in-f74.1e100.net.https > 192.168.1.10.42817: Flags [.], seq 1349:2697, ack 185, win 170, options [nop,nop,TS val 2092620526 ecr 549893], length 1348
00:52:59.591562 IP sea15s07-in-f74.1e100.net.https > 192.168.1.10.42817: Flags [P.], seq 2697:3252, ack 185, win 170, options [nop,nop,TS val 2092620526 ecr 549893], length 555
00:52:59.603222 IP sea15s07-in-f74.1e100.net.https > 192.168.1.10.43309: Flags [.], seq 55165:56513, ack 1208, win 178, options [nop,nop,TS val 3656052390 ecr 549893], length 1348
00:52:59.603269 IP sea15s07-in-f74.1e100.net.https > 192.168.1.10.43309: Flags [.], seq 56513:57861, ack 1208, win 178, options [nop,nop,TS val 3656052390 ecr 549893], length 1348
00:52:59.603297 IP sea15s07-in-f74.1e100.net.https > 192.168.1.10.43309: Flags [.], seq 57861:59209, ack 1208, win 178, options [nop,nop,TS val 3656052390 ecr 549893], length 1348
00:52:59.603438 IP sea15s07-in-f74.1e100.net.https > 192.168.1.10.43309: Flags [.], seq 59209:60557, ack 1208, win 178, options [nop,nop,TS val 3656052390 ecr 549893], length 1348
00:52:59.604908 IP sea15s07-in-f74.1e100.net.https > 192.168.1.10.43309: Flags [.], seq 60557:61905, ack 1208, win 178, options [nop,nop,TS val 3656052390 ecr 549894], length 1348
00:52:59.604959 IP sea15s07-in-f74.1e100.net.https > 192.168.1.10.43309: Flags [.], seq 61905:63253, ack 1208, win 178, options [nop,nop,TS val 3656052390 ecr 549894], length 1348
00:52:59.605173 IP 192.168.1.10.42817 > sea15s07-in-f74.1e100.net.https: Flags [.], ack 1349, win 1411, options [nop,nop,TS val 549901 ecr 2092620526], length 0
00:52:59.605188 IP 192.168.1.10.42817 > sea15s07-in-f74.1e100.net.https: Flags [.], ack 2697, win 1453, options [nop,nop,TS val 549901 ecr 2092620526], length 0
00:52:59.608444 IP sea15s07-in-f74.1e100.net.https > 192.168.1.10.43309: Flags [.], seq 63253:64601, ack 1208, win 178, options [nop,nop,TS val 3656052390 ecr 549894], length 1348
00:52:59.608495 IP sea15s07-in-f74.1e100.net.https > 192.168.1.10.43309: Flags [.], seq 64601:65949, ack 1208, win 178, options [nop,nop,TS val 3656052390 ecr 549894], length 1348
00:52:59.609525 IP 192.168.1.10.42817 > sea15s07-in-f74.1e100.net.https: Flags [.], ack 3252, win 1496, options [nop,nop,TS val 549901 ecr 2092620526], length 0
00:52:59.609539 IP 192.168.1.10.43309 > sea15s07-in-f74.1e100.net.https: Flags [.], ack 57861, win 3223, options [nop,nop,TS val 549902 ecr 3656052390], length 0
00:52:59.613668 IP sea15s07-in-f74.1e100.net.https > 192.168.1.10.43309: Flags [.], seq 65949:67297, ack 1208, win 178, options [nop,nop,TS val 3656052401 ecr 549895], length 1348
00:52:59.613717 IP sea15s07-in-f74.1e100.net.https > 192.168.1.10.43309: Flags [.], seq 67297:68645, ack 1208, win 178, options [nop,nop,TS val 3656052401 ecr 549895], length 1348
00:52:59.614026 IP 192.168.1.10.43309 > sea15s07-in-f74.1e100.net.https: Flags [.], ack 60557, win 3307, options [nop,nop,TS val 549902 ecr 3656052390], length 0
00:52:59.614040 IP 192.168.1.10.43309 > sea15s07-in-f74.1e100.net.https: Flags [.], ack 63253, win 3391, options [nop,nop,TS val 549902 ecr 3656052390], length 0
00:52:59.614051 IP 192.168.1.10.43309 > sea15s07-in-f74.1e100.net.https: Flags [.], ack 65949, win 3475, options [nop,nop,TS val 549903 ecr 3656052390], length 0
00:52:59.615500 IP sea15s07-in-f74.1e100.net.https > 192.168.1.10.43309: Flags [.], seq 68645:69993, ack 1208, win 178, options [nop,nop,TS val 3656052401 ecr 549895], length 1348
00:52:59.615546 IP sea15s07-in-f74.1e100.net.https > 192.168.1.10.43309: Flags [.], seq 69993:71341, ack 1208, win 178, options [nop,nop,TS val 3656052401 ecr 549895], length 1348
00:52:59.618251 IP sea15s07-in-f74.1e100.net.https > 192.168.1.10.43309: Flags [.], seq 71341:72689, ack 1208, win 178, options [nop,nop,TS val 3656052401 ecr 549896], length 1348
00:52:59.618334 IP sea15s07-in-f74.1e100.net.https > 192.168.1.10.43309: Flags [.], seq 72689:74037, ack 1208, win 178, options [nop,nop,TS val 3656052401 ecr 549896], length 1348
00:52:59.620885 IP sea15s07-in-f74.1e100.net.https > 192.168.1.10.43309: Flags [.], seq 74037:75385, ack 1208, win 178, options [nop,nop,TS val 3656052403 ecr 549897], length 1348
00:52:59.620935 IP sea15s07-in-f74.1e100.net.https > 192.168.1.10.43309: Flags [.], seq 75385:76733, ack 1208, win 178, options [nop,nop,TS val 3656052403 ecr 549897], length 1348
00:52:59.621046 IP sea15s07-in-f74.1e100.net.https > 192.168.1.10.43309: Flags [.], seq 76733:78081, ack 1208, win 178, options [nop,nop,TS val 3656052405 ecr 549897], length 1348
00:52:59.621082 IP sea15s07-in-f74.1e100.net.https > 192.168.1.10.43309: Flags [.], seq 78081:79429, ack 1208, win 178, options [nop,nop,TS val 3656052405 ecr 549897], length 1348
00:52:59.623458 IP sea15s07-in-f74.1e100.net.https > 192.168.1.10.43309: Flags [.], seq 79429:80777, ack 1208, win 178, options [nop,nop,TS val 3656052408 ecr 549897], length 1348
00:52:59.623550 IP sea15s07-in-f74.1e100.net.https > 192.168.1.10.43309: Flags [.], seq 80777:82125, ack 1208, win 178, options [nop,nop,TS val 3656052408 ecr 549897], length 1348
00:52:59.626175 IP sea15s07-in-f74.1e100.net.https > 192.168.1.10.43309: Flags [.], seq 82125:83473, ack 1208, win 178, options [nop,nop,TS val 3656052408 ecr 549897], length 1348
00:52:59.626215 IP sea15s07-in-f74.1e100.net.https > 192.168.1.10.43309: Flags [.], seq 83473:84821, ack 1208, win 178, options [nop,nop,TS val 3656052408 ecr 549897], length 1348
00:52:59.628945 IP sea15s07-in-f74.1e100.net.https > 192.168.1.10.43309: Flags [.], seq 84821:86169, ack 1208, win 178, options [nop,nop,TS val 3656052411 ecr 549897], length 1348
00:52:59.629030 IP sea15s07-in-f74.1e100.net.https > 192.168.1.10.43309: Flags [.], seq 86169:87517, ack 1208, win 178, options [nop,nop,TS val 3656052411 ecr 549897], length 1348
00:52:59.629254 IP 192.168.1.10.42817 > sea15s07-in-f74.1e100.net.https: Flags [P.], seq 185:270, ack 3252, win 1496, options [nop,nop,TS val 549903 ecr 2092620526], length 85
00:52:59.629271 IP 192.168.1.10.43309 > sea15s07-in-f74.1e100.net.https: Flags [.], ack 68645, win 3560, options [nop,nop,TS val 549903 ecr 3656052401], length 0
00:52:59.629293 IP 192.168.1.10.43309 > sea15s07-in-f74.1e100.net.https: Flags [.], ack 71341, win 3644, options [nop,nop,TS val 549904 ecr 3656052401], length 0
00:52:59.631632 IP sea15s07-in-f74.1e100.net.https > 192.168.1.10.43309: Flags [.], seq 87517:88865, ack 1208, win 178, options [nop,nop,TS val 3656052413 ecr 549897], length 1348
00:52:59.631728 IP sea15s07-in-f74.1e100.net.https > 192.168.1.10.43309: Flags [.], seq 88865:90213, ack 1208, win 178, options [nop,nop,TS val 3656052413 ecr 549897], length 1348
00:52:59.634217 IP sea15s07-in-f74.1e100.net.https > 192.168.1.10.43309: Flags [.], seq 90213:91561, ack 1208, win 178, options [nop,nop,TS val 3656052416 ecr 549897], length 1348
00:52:59.634280 IP sea15s07-in-f74.1e100.net.https > 192.168.1.10.43309: Flags [.], seq 91561:92909, ack 1208, win 178, options [nop,nop,TS val 3656052416 ecr 549897], length 1348
00:52:59.636853 IP sea15s07-in-f74.1e100.net.https > 192.168.1.10.43309: Flags [.], seq 92909:94257, ack 1208, win 178, options [nop,nop,TS val 3656052419 ecr 549897], length 1348
00:52:59.636899 IP sea15s07-in-f74.1e100.net.https > 192.168.1.10.43309: Flags [.], seq 94257:95605, ack 1208, win 178, options [nop,nop,TS val 3656052419 ecr 549897], length 1348
00:52:59.638803 IP 192.168.1.10.43309 > sea15s07-in-f74.1e100.net.https: Flags [.], ack 74037, win 3728, options [nop,nop,TS val 549904 ecr 3656052401], length 0
00:52:59.638830 IP 192.168.1.10.43309 > sea15s07-in-f74.1e100.net.https: Flags [.], ack 76733, win 3812, options [nop,nop,TS val 549904 ecr 3656052403], length 0
00:52:59.639572 IP sea15s07-in-f74.1e100.net.https > 192.168.1.10.43309: Flags [.], seq 95605:96953, ack 1208, win 178, options [nop,nop,TS val 3656052421 ecr 549897], length 1348
00:52:59.639634 IP sea15s07-in-f74.1e100.net.https > 192.168.1.10.43309: Flags [.], seq 96953:98301, ack 1208, win 178, options [nop,nop,TS val 3656052421 ecr 549897], length 1348
00:52:59.639815 IP sea15s07-in-f74.1e100.net.https > 192.168.1.10.43309: Flags [.], seq 98301:99649, ack 1208, win 178, options [nop,nop,TS val 3656052424 ecr 549897], length 1348
00:52:59.639901 IP sea15s07-in-f74.1e100.net.https > 192.168.1.10.43309: Flags [.], seq 99649:100997, ack 1208, win 178, options [nop,nop,TS val 3656052424 ecr 549897], length 1348
00:52:59.642284 IP sea15s07-in-f74.1e100.net.https > 192.168.1.10.43309: Flags [.], seq 100997:102345, ack 1208, win 178, options [nop,nop,TS val 3656052427 ecr 549897], length 1348
00:52:59.642337 IP sea15s07-in-f74.1e100.net.https > 192.168.1.10.43309: Flags [.], seq 102345:103693, ack 1208, win 178, options [nop,nop,TS val 3656052427 ecr 549897], length 1348
00:52:59.643165 IP 192.168.1.10.43309 > sea15s07-in-f74.1e100.net.https: Flags [.], ack 79429, win 3897, options [nop,nop,TS val 549904 ecr 3656052405], length 0
00:52:59.644894 IP sea15s07-in-f74.1e100.net.https > 192.168.1.10.43309: Flags [.], seq 103693:105041, ack 1208, win 178, options [nop,nop,TS val 3656052427 ecr 549897], length 1348
00:52:59.644945 IP sea15s07-in-f74.1e100.net.https > 192.168.1.10.43309: Flags [.], seq 105041:106389, ack 1208, win 178, options [nop,nop,TS val 3656052427 ecr 549897], length 1348
00:52:59.647530 IP sea15s07-in-f74.1e100.net.https > 192.168.1.10.43309: Flags [.], seq 106389:107737, ack 1208, win 178, options [nop,nop,TS val 3656052429 ecr 549902], length 1348
00:52:59.647570 IP sea15s07-in-f74.1e100.net.https > 192.168.1.10.43309: Flags [.], seq 107737:109085, ack 1208, win 178, options [nop,nop,TS val 3656052429 ecr 549902], length 1348
00:52:59.647654 IP 192.168.1.10.43309 > sea15s07-in-f74.1e100.net.https: Flags [.], ack 82125, win 3981, options [nop,nop,TS val 549904 ecr 3656052408], length 0
00:52:59.650111 IP sea15s07-in-f74.1e100.net.https > 192.168.1.10.43309: Flags [.], seq 109085:110433, ack 1208, win 178, options [nop,nop,TS val 3656052432 ecr 549902], length 1348
00:52:59.650153 IP sea15s07-in-f74.1e100.net.https > 192.168.1.10.43309: Flags [.], seq 110433:111781, ack 1208, win 178, options [nop,nop,TS val 3656052432 ecr 549902], length 1348
00:52:59.651898 IP 192.168.1.10.43309 > sea15s07-in-f74.1e100.net.https: Flags [.], ack 84821, win 4065, options [nop,nop,TS val 549905 ecr 3656052408], length 0
00:52:59.652695 IP sea15s07-in-f74.1e100.net.https > 192.168.1.10.43309: Flags [.], seq 111781:113129, ack 1208, win 178, options [nop,nop,TS val 3656052435 ecr 549903], length 1348
00:52:59.652742 IP sea15s07-in-f74.1e100.net.https > 192.168.1.10.43309: Flags [.], seq 113129:114477, ack 1208, win 178, options [nop,nop,TS val 3656052435 ecr 549903], length 1348
00:52:59.655300 IP sea15s07-in-f74.1e100.net.https > 192.168.1.10.43309: Flags [.], seq 114477:115825, ack 1208, win 178, options [nop,nop,TS val 3656052437 ecr 549903], length 1348
00:52:59.655339 IP sea15s07-in-f74.1e100.net.https > 192.168.1.10.43309: Flags [.], seq 115825:117173, ack 1208, win 178, options [nop,nop,TS val 3656052437 ecr 549903], length 1348
00:52:59.657890 IP sea15s07-in-f74.1e100.net.https > 192.168.1.10.43309: Flags [.], seq 117173:118521, ack 1208, win 178, options [nop,nop,TS val 3656052440 ecr 549903], length 1348
00:52:59.657926 IP sea15s07-in-f74.1e100.net.https > 192.168.1.10.43309: Flags [.], seq 118521:119869, ack 1208, win 178, options [nop,nop,TS val 3656052440 ecr 549903], length 1348
00:52:59.660231 IP sea15s07-in-f74.1e100.net.https > 192.168.1.10.42817: Flags [P.], seq 3252:3528, ack 270, win 170, options [nop,nop,TS val 2092620595 ecr 549903], length 276
00:52:59.661028 IP sea15s07-in-f74.1e100.net.https > 192.168.1.10.43309: Flags [.], seq 119869:121217, ack 1208, win 178, options [nop,nop,TS val 3656052448 ecr 549903], length 1348
00:52:59.661067 IP sea15s07-in-f74.1e100.net.https > 192.168.1.10.43309: Flags [.], seq 121217:122565, ack 1208, win 178, options [nop,nop,TS val 3656052448 ecr 549903], length 1348
00:52:59.662330 IP sea15s07-in-f74.1e100.net.https > 192.168.1.10.43309: Flags [.], seq 122565:123913, ack 1208, win 178, options [nop,nop,TS val 3656052448 ecr 549904], length 1348
00:52:59.662372 IP sea15s07-in-f74.1e100.net.https > 192.168.1.10.43309: Flags [.], seq 123913:125261, ack 1208, win 178, options [nop,nop,TS val 3656052448 ecr 549904], length 1348
00:52:59.670490 IP sea15s07-in-f74.1e100.net.https > 192.168.1.10.43309: Flags [.], seq 125261:126609, ack 1208, win 178, options [nop,nop,TS val 3656052458 ecr 549904], length 1348
00:52:59.670534 IP sea15s07-in-f74.1e100.net.https > 192.168.1.10.43309: Flags [.], seq 126609:127957, ack 1208, win 178, options [nop,nop,TS val 3656052458 ecr 549904], length 1348
00:52:59.671739 IP sea15s07-in-f74.1e100.net.https > 192.168.1.10.43309: Flags [.], seq 127957:129305, ack 1208, win 178, options [nop,nop,TS val 3656052458 ecr 549904], length 1348
00:52:59.671782 IP sea15s07-in-f74.1e100.net.https > 192.168.1.10.43309: Flags [.], seq 129305:130653, ack 1208, win 178, options [nop,nop,TS val 3656052458 ecr 549904], length 1348
00:52:59.674722 IP sea15s07-in-f74.1e100.net.https > 192.168.1.10.43309: Flags [.], seq 130653:132001, ack 1208, win 178, options [nop,nop,TS val 3656052462 ecr 549904], length 1348
00:52:59.674761 IP sea15s07-in-f74.1e100.net.https > 192.168.1.10.43309: Flags [.], seq 132001:133349, ack 1208, win 178, options [nop,nop,TS val 3656052462 ecr 549904], length 1348
00:52:59.679123 IP sea15s07-in-f74.1e100.net.https > 192.168.1.10.43309: Flags [P.], seq 133349:133914, ack 1208, win 178, options [nop,nop,TS val 3656052466 ecr 549904], length 565
00:52:59.684547 IP 192.168.1.10.43309 > sea15s07-in-f74.1e100.net.https: Flags [.], ack 87517, win 4149, options [nop,nop,TS val 549905 ecr 3656052411], length 0
00:52:59.684562 IP 192.168.1.10.43309 > sea15s07-in-f74.1e100.net.https: Flags [.], ack 90213, win 4234, options [nop,nop,TS val 549905 ecr 3656052413], length 0
00:52:59.684573 IP 192.168.1.10.43309 > sea15s07-in-f74.1e100.net.https: Flags [.], ack 92909, win 4318, options [nop,nop,TS val 549905 ecr 3656052416], length 0
00:52:59.684584 IP 192.168.1.10.43309 > sea15s07-in-f74.1e100.net.https: Flags [.], ack 95605, win 4402, options [nop,nop,TS val 549907 ecr 3656052419], length 0
00:52:59.696032 IP 192.168.1.10.43309 > sea15s07-in-f74.1e100.net.https: Flags [.], ack 98301, win 4486, options [nop,nop,TS val 549908 ecr 3656052421], length 0
00:52:59.696047 IP 192.168.1.10.43309 > sea15s07-in-f74.1e100.net.https: Flags [.], ack 100997, win 4571, options [nop,nop,TS val 549908 ecr 3656052424], length 0
00:52:59.700457 IP 192.168.1.10.43309 > sea15s07-in-f74.1e100.net.https: Flags [.], ack 103693, win 4655, options [nop,nop,TS val 549908 ecr 3656052427], length 0
00:52:59.700476 IP 192.168.1.10.43309 > sea15s07-in-f74.1e100.net.https: Flags [.], ack 106389, win 4739, options [nop,nop,TS val 549908 ecr 3656052427], length 0
00:52:59.723820 IP 192.168.1.10.43309 > sea15s07-in-f74.1e100.net.https: Flags [.], ack 109085, win 4823, options [nop,nop,TS val 549908 ecr 3656052429], length 0
00:52:59.723838 IP 192.168.1.10.43309 > sea15s07-in-f74.1e100.net.https: Flags [.], ack 111781, win 4908, options [nop,nop,TS val 549908 ecr 3656052432], length 0
00:52:59.723848 IP 192.168.1.10.43309 > sea15s07-in-f74.1e100.net.https: Flags [.], ack 114477, win 4992, options [nop,nop,TS val 549909 ecr 3656052435], length 0
00:52:59.728169 IP 192.168.1.10.43309 > sea15s07-in-f74.1e100.net.https: Flags [.], ack 117173, win 5076, options [nop,nop,TS val 549909 ecr 3656052437], length 0
00:52:59.732527 IP 192.168.1.10.43309 > sea15s07-in-f74.1e100.net.https: Flags [.], ack 119869, win 5160, options [nop,nop,TS val 549909 ecr 3656052440], length 0
00:52:59.732542 IP 192.168.1.10.42817 > sea15s07-in-f74.1e100.net.https: Flags [P.], seq 270:1235, ack 3528, win 1538, options [nop,nop,TS val 549909 ecr 2092620595], length 965
00:52:59.732552 IP 192.168.1.10.43309 > sea15s07-in-f74.1e100.net.https: Flags [.], ack 122565, win 5245, options [nop,nop,TS val 549909 ecr 3656052448], length 0
00:52:59.732562 IP 192.168.1.10.43309 > sea15s07-in-f74.1e100.net.https: Flags [.], ack 125261, win 5329, options [nop,nop,TS val 549909 ecr 3656052448], length 0
00:52:59.732575 IP 192.168.1.10.43309 > sea15s07-in-f74.1e100.net.https: Flags [.], ack 127957, win 5413, options [nop,nop,TS val 549909 ecr 3656052458], length 0
00:52:59.732585 IP 192.168.1.10.43309 > sea15s07-in-f74.1e100.net.https: Flags [.], ack 130653, win 5497, options [nop,nop,TS val 549909 ecr 3656052458], length 0
00:52:59.741821 IP 192.168.1.10.43309 > sea15s07-in-f74.1e100.net.https: Flags [.], ack 133349, win 5582, options [nop,nop,TS val 549909 ecr 3656052462], length 0
00:52:59.741835 IP 192.168.1.10.43309 > sea15s07-in-f74.1e100.net.https: Flags [.], ack 133914, win 5582, options [nop,nop,TS val 549914 ecr 3656052466], length 0
00:52:59.802167 IP sea15s07-in-f74.1e100.net.https > 192.168.1.10.42817: Flags [P.], seq 3528:4876, ack 1235, win 178, options [nop,nop,TS val 2092620736 ecr 549909], length 1348
00:52:59.802344 IP sea15s07-in-f74.1e100.net.https > 192.168.1.10.42817: Flags [P.], seq 4876:6224, ack 1235, win 178, options [nop,nop,TS val 2092620736 ecr 549909], length 1348
00:52:59.802512 IP sea15s07-in-f74.1e100.net.https > 192.168.1.10.42817: Flags [.], seq 6224:7572, ack 1235, win 178, options [nop,nop,TS val 2092620736 ecr 549909], length 1348
00:52:59.802558 IP sea15s07-in-f74.1e100.net.https > 192.168.1.10.42817: Flags [P.], seq 7572:7856, ack 1235, win 178, options [nop,nop,TS val 2092620736 ecr 549909], length 284
00:52:59.802650 IP sea15s07-in-f74.1e100.net.https > 192.168.1.10.42817: Flags [P.], seq 7856:9204, ack 1235, win 178, options [nop,nop,TS val 2092620736 ecr 549909], length 1348
00:52:59.802762 IP sea15s07-in-f74.1e100.net.https > 192.168.1.10.42817: Flags [.], seq 9204:10552, ack 1235, win 178, options [nop,nop,TS val 2092620736 ecr 549909], length 1348
00:52:59.802780 IP sea15s07-in-f74.1e100.net.https > 192.168.1.10.42817: Flags [P.], seq 10552:11900, ack 1235, win 178, options [nop,nop,TS val 2092620736 ecr 549909], length 1348
00:52:59.802836 IP sea15s07-in-f74.1e100.net.https > 192.168.1.10.42817: Flags [P.], seq 11900:12191, ack 1235, win 178, options [nop,nop,TS val 2092620737 ecr 549909], length 291
00:52:59.802884 IP sea15s07-in-f74.1e100.net.https > 192.168.1.10.42817: Flags [P.], seq 12191:13539, ack 1235, win 178, options [nop,nop,TS val 2092620737 ecr 549909], length 1348
00:52:59.802966 IP sea15s07-in-f74.1e100.net.https > 192.168.1.10.42817: Flags [.], seq 13539:14887, ack 1235, win 178, options [nop,nop,TS val 2092620737 ecr 549909], length 1348
00:52:59.802983 IP sea15s07-in-f74.1e100.net.https > 192.168.1.10.42817: Flags [P.], seq 14887:16235, ack 1235, win 178, options [nop,nop,TS val 2092620737 ecr 549909], length 1348
00:52:59.805550 IP sea15s07-in-f74.1e100.net.https > 192.168.1.10.42817: Flags [.], seq 16235:17583, ack 1235, win 178, options [nop,nop,TS val 2092620737 ecr 549909], length 1348
00:52:59.805596 IP sea15s07-in-f74.1e100.net.https > 192.168.1.10.42817: Flags [.], seq 17583:18931, ack 1235, win 178, options [nop,nop,TS val 2092620737 ecr 549909], length 1348
00:52:59.808557 IP sea15s07-in-f74.1e100.net.https > 192.168.1.10.42817: Flags [P.], seq 18931:20279, ack 1235, win 178, options [nop,nop,TS val 2092620737 ecr 549909], length 1348
00:52:59.810804 IP 192.168.1.10.42817 > sea15s07-in-f74.1e100.net.https: Flags [.], ack 6224, win 1622, options [nop,nop,TS val 549922 ecr 2092620736], length 0
