tcpdump: verbose output suppressed, use -v or -vv for full protocol decode
listening on wlan0, link-type EN10MB (Ethernet), capture size 262144 bytes
00:53:47.678384 IP 192.168.1.10.50360 > sea15s07-in-f78.1e100.net.www: Flags [S], seq 2805528704, win 65535, options [mss 1460,sackOK,TS val 684393 ecr 0,nop,wscale 6], length 0
00:53:47.684826 IP sea15s07-in-f78.1e100.net.www > 192.168.1.10.50360: Flags [S.], seq 3923940684, ack 2805528705, win 26960, options [mss 1360,sackOK,TS val 3157370312 ecr 684393,nop,wscale 7], length 0
00:53:47.687398 IP 192.168.1.10.50360 > sea15s07-in-f78.1e100.net.www: Flags [.], ack 1, win 1369, options [nop,nop,TS val 684396 ecr 3157370312], length 0
00:53:47.689496 IP 192.168.1.10.50360 > sea15s07-in-f78.1e100.net.www: Flags [P.], seq 1:432, ack 1, win 1369, options [nop,nop,TS val 684396 ecr 3157370312], length 431: HTTP: GET /generate_204 HTTP/1.1
00:53:47.695822 IP sea15s07-in-f78.1e100.net.www > 192.168.1.10.50360: Flags [.], ack 432, win 219, options [nop,nop,TS val 3157370315 ecr 684396], length 0
00:53:47.794082 IP sea15s07-in-f78.1e100.net.www > 192.168.1.10.50360: Flags [P.], seq 1:219, ack 432, win 219, options [nop,nop,TS val 3157370340 ecr 684396], length 218: HTTP: HTTP/1.1 204 No Content
00:53:47.794228 IP sea15s07-in-f78.1e100.net.www > 192.168.1.10.50360: Flags [F.], seq 219, ack 432, win 219, options [nop,nop,TS val 3157370340 ecr 684396], length 0
00:53:47.812105 IP 192.168.1.10.52944 > sea15s01-in-f142.1e100.net.https: Flags [S], seq 3329555138, win 65535, options [mss 1460,sackOK,TS val 684421 ecr 0,nop,wscale 6], length 0
00:53:47.814389 IP 192.168.1.10.50360 > sea15s07-in-f78.1e100.net.www: Flags [.], ack 219, win 1386, options [nop,nop,TS val 684421 ecr 3157370340], length 0
00:53:47.840666 IP sea15s01-in-f142.1e100.net.https > 192.168.1.10.52944: Flags [S.], seq 2679186034, ack 3329555139, win 42408, options [mss 1360,sackOK,TS val 1791336972 ecr 684421,nop,wscale 8], length 0
00:53:47.842411 IP 192.168.1.10.52944 > sea15s01-in-f142.1e100.net.https: Flags [.], ack 1, win 1369, options [nop,nop,TS val 684427 ecr 1791336972], length 0
00:53:47.847315 IP 192.168.1.10.50360 > sea15s07-in-f78.1e100.net.www: Flags [F.], seq 432, ack 220, win 1386, options [nop,nop,TS val 684428 ecr 3157370340], length 0
00:53:47.853759 IP sea15s07-in-f78.1e100.net.www > 192.168.1.10.50360: Flags [.], ack 433, win 219, options [nop,nop,TS val 3157370354 ecr 684428], length 0
00:53:48.031888 IP 192.168.1.10.58448 > sea15s02-in-f10.1e100.net.https: Flags [S], seq 2466078299, win 65535, options [mss 1460,sackOK,TS val 684465 ecr 0,nop,wscale 6], length 0
00:53:48.061063 IP sea15s02-in-f10.1e100.net.https > 192.168.1.10.58448: Flags [S.], seq 691160762, ack 2466078300, win 42408, options [mss 1360,sackOK,TS val 849970690 ecr 684465,nop,wscale 8], length 0
00:53:48.063142 IP 192.168.1.10.58448 > sea15s02-in-f10.1e100.net.https: Flags [.], ack 1, win 1369, options [nop,nop,TS val 684471 ecr 849970690], length 0
00:53:48.114676 IP 192.168.1.10.58448 > sea15s02-in-f10.1e100.net.https: Flags [P.], seq 1:171, ack 1, win 1369, options [nop,nop,TS val 684481 ecr 849970690], length 170
00:53:48.143900 IP sea15s02-in-f10.1e100.net.https > 192.168.1.10.58448: Flags [.], ack 171, win 170, options [nop,nop,TS val 849970773 ecr 684481], length 0
00:53:48.152762 IP sea15s02-in-f10.1e100.net.https > 192.168.1.10.58448: Flags [.], seq 1:1349, ack 171, win 170, options [nop,nop,TS val 849970781 ecr 684481], length 1348
00:53:48.152866 IP sea15s02-in-f10.1e100.net.https > 192.168.1.10.58448: Flags [.], seq 1349:2697, ack 171, win 170, options [nop,nop,TS val 849970781 ecr 684481], length 1348
00:53:48.152898 IP sea15s02-in-f10.1e100.net.https > 192.168.1.10.58448: Flags [P.], seq 2697:3263, ack 171, win 170, options [nop,nop,TS val 849970781 ecr 684481], length 566
00:53:48.156691 IP 192.168.1.10.58448 > sea15s02-in-f10.1e100.net.https: Flags [.], ack 1349, win 1411, options [nop,nop,TS val 684490 ecr 849970781], length 0
00:53:48.157005 IP 192.168.1.10.58448 > sea15s02-in-f10.1e100.net.https: Flags [.], ack 3263, win 1496, options [nop,nop,TS val 684490 ecr 849970781], length 0
00:53:48.610196 IP 192.168.1.10.52944 > sea15s01-in-f142.1e100.net.https: Flags [P.], seq 1:174, ack 1, win 1369, options [nop,nop,TS val 684580 ecr 1791336972], length 173
00:53:48.638807 IP sea15s01-in-f142.1e100.net.https > 192.168.1.10.52944: Flags [.], ack 174, win 170, options [nop,nop,TS val 1791337770 ecr 684580], length 0
00:53:48.646304 IP sea15s01-in-f142.1e100.net.https > 192.168.1.10.52944: Flags [.], seq 1:1349, ack 174, win 170, options [nop,nop,TS val 1791337777 ecr 684580], length 1348
00:53:48.646388 IP sea15s01-in-f142.1e100.net.https > 192.168.1.10.52944: Flags [.], seq 1349:2697, ack 174, win 170, options [nop,nop,TS val 1791337777 ecr 684580], length 1348
00:53:48.646418 IP sea15s01-in-f142.1e100.net.https > 192.168.1.10.52944: Flags [.], seq 2697:4045, ack 174, win 170, options [nop,nop,TS val 1791337777 ecr 684580], length 1348
00:53:48.646447 IP sea15s01-in-f142.1e100.net.https > 192.168.1.10.52944: Flags [P.], seq 4045:4139, ack 174, win 170, options [nop,nop,TS val 1791337777 ecr 684580], length 94
00:53:48.648916 IP 192.168.1.10.52944 > sea15s01-in-f142.1e100.net.https: Flags [.], ack 1349, win 1411, options [nop,nop,TS val 684588 ecr 1791337777], length 0
00:53:48.649408 IP 192.168.1.10.52944 > sea15s01-in-f142.1e100.net.https: Flags [.], ack 2697, win 1453, options [nop,nop,TS val 684588 ecr 1791337777], length 0
00:53:48.650171 IP 192.168.1.10.52944 > sea15s01-in-f142.1e100.net.https: Flags [.], ack 4045, win 1496, options [nop,nop,TS val 684589 ecr 1791337777], length 0
00:53:48.650644 IP 192.168.1.10.52944 > sea15s01-in-f142.1e100.net.https: Flags [.], ack 4139, win 1496, options [nop,nop,TS val 684589 ecr 1791337777], length 0
00:53:49.489241 IP 192.168.1.10.58448 > sea15s02-in-f10.1e100.net.https: Flags [P.], seq 171:256, ack 3263, win 1496, options [nop,nop,TS val 684754 ecr 849970781], length 85
00:53:49.518678 IP sea15s02-in-f10.1e100.net.https > 192.168.1.10.58448: Flags [P.], seq 3263:3306, ack 256, win 170, options [nop,nop,TS val 849972147 ecr 684754], length 43
00:53:49.521412 IP 192.168.1.10.58448 > sea15s02-in-f10.1e100.net.https: Flags [.], ack 3306, win 1496, options [nop,nop,TS val 684763 ecr 849972147], length 0
00:53:49.748474 IP 192.168.1.10.52944 > sea15s01-in-f142.1e100.net.https: Flags [P.], seq 174:259, ack 4139, win 1496, options [nop,nop,TS val 684808 ecr 1791337777], length 85
00:53:49.777067 IP sea15s01-in-f142.1e100.net.https > 192.168.1.10.52944: Flags [P.], seq 4139:4182, ack 259, win 170, options [nop,nop,TS val 1791338908 ecr 684808], length 43
00:53:49.779034 IP 192.168.1.10.52944 > sea15s01-in-f142.1e100.net.https: Flags [.], ack 4182, win 1496, options [nop,nop,TS val 684814 ecr 1791338908], length 0
00:53:49.815437 IP 192.168.1.10.58448 > sea15s02-in-f10.1e100.net.https: Flags [P.], seq 256:645, ack 3306, win 1496, options [nop,nop,TS val 684822 ecr 849972147], length 389
00:53:49.862569 IP sea15s02-in-f10.1e100.net.https > 192.168.1.10.58448: Flags [P.], seq 3306:4062, ack 645, win 175, options [nop,nop,TS val 849972491 ecr 684822], length 756
00:53:49.862735 IP sea15s02-in-f10.1e100.net.https > 192.168.1.10.58448: Flags [P.], seq 4062:4088, ack 645, win 175, options [nop,nop,TS val 849972491 ecr 684822], length 26
00:53:49.865036 IP 192.168.1.10.58448 > sea15s02-in-f10.1e100.net.https: Flags [.], ack 4062, win 1538, options [nop,nop,TS val 684832 ecr 849972491], length 0
00:53:49.865506 IP 192.168.1.10.58448 > sea15s02-in-f10.1e100.net.https: Flags [.], ack 4088, win 1538, options [nop,nop,TS val 684832 ecr 849972491], length 0
00:53:49.983576 IP 192.168.1.10.52944 > sea15s01-in-f142.1e100.net.https: Flags [.], seq 259:1607, ack 4182, win 1496, options [nop,nop,TS val 684855 ecr 1791338908], length 1348
00:53:49.984141 IP 192.168.1.10.52944 > sea15s01-in-f142.1e100.net.https: Flags [P.], seq 1607:1863, ack 4182, win 1496, options [nop,nop,TS val 684855 ecr 1791338908], length 256
00:53:50.012392 IP sea15s01-in-f142.1e100.net.https > 192.168.1.10.52944: Flags [.], ack 1863, win 192, options [nop,nop,TS val 1791339144 ecr 684855], length 0
00:53:50.037928 IP 192.168.1.10.40747 > sea15s07-in-f10.1e100.net.https: Flags [S], seq 2059525027, win 65535, options [mss 1460,sackOK,TS val 684866 ecr 0,nop,wscale 6], length 0
00:53:50.038651 IP 192.168.1.10.46005 > sea15s07-in-f10.1e100.net.https: Flags [S], seq 354581959, win 65535, options [mss 1460,sackOK,TS val 684866 ecr 0,nop,wscale 6], length 0
00:53:50.065946 IP sea15s07-in-f10.1e100.net.https > 192.168.1.10.46005: Flags [S.], seq 1995092794, ack 354581960, win 42408, options [mss 1360,sackOK,TS val 1977681968 ecr 684866,nop,wscale 8], length 0
00:53:50.066300 IP sea15s07-in-f10.1e100.net.https > 192.168.1.10.40747: Flags [S.], seq 1912848091, ack 2059525028, win 42408, options [mss 1360,sackOK,TS val 1977681968 ecr 684866,nop,wscale 8], length 0
00:53:50.067906 IP 192.168.1.10.46005 > sea15s07-in-f10.1e100.net.https: Flags [.], ack 1, win 1369, options [nop,nop,TS val 684872 ecr 1977681968], length 0
00:53:50.069761 IP 192.168.1.10.40747 > sea15s07-in-f10.1e100.net.https: Flags [.], ack 1, win 1369, options [nop,nop,TS val 684873 ecr 1977681968], length 0
00:53:50.090321 IP 192.168.1.10.46005 > sea15s07-in-f10.1e100.net.https: Flags [P.], seq 1:170, ack 1, win 1369, options [nop,nop,TS val 684877 ecr 1977681968], length 169
00:53:50.090848 IP 192.168.1.10.40747 > sea15s07-in-f10.1e100.net.https: Flags [P.], seq 1:170, ack 1, win 1369, options [nop,nop,TS val 684877 ecr 1977681968], length 169
00:53:50.117658 IP sea15s07-in-f10.1e100.net.https > 192.168.1.10.46005: Flags [.], ack 170, win 170, options [nop,nop,TS val 1977682020 ecr 684877], length 0
00:53:50.119095 IP sea15s07-in-f10.1e100.net.https > 192.168.1.10.40747: Flags [.], ack 170, win 170, options [nop,nop,TS val 1977682021 ecr 684877], length 0
00:53:50.126392 IP sea15s07-in-f10.1e100.net.https > 192.168.1.10.40747: Flags [.], seq 1:1349, ack 170, win 170, options [nop,nop,TS val 1977682028 ecr 684877], length 1348
00:53:50.126473 IP sea15s07-in-f10.1e100.net.https > 192.168.1.10.40747: Flags [.], seq 1349:2697, ack 170, win 170, options [nop,nop,TS val 1977682028 ecr 684877], length 1348
00:53:50.126505 IP sea15s07-in-f10.1e100.net.https > 192.168.1.10.40747: Flags [P.], seq 2697:3236, ack 170, win 170, options [nop,nop,TS val 1977682028 ecr 684877], length 539
00:53:50.126762 IP sea15s07-in-f10.1e100.net.https > 192.168.1.10.46005: Flags [.], seq 1:1349, ack 170, win 170, options [nop,nop,TS val 1977682029 ecr 684877], length 1348
00:53:50.126889 IP sea15s07-in-f10.1e100.net.https > 192.168.1.10.46005: Flags [.], seq 1349:2697, ack 170, win 170, options [nop,nop,TS val 1977682029 ecr 684877], length 1348
00:53:50.126928 IP sea15s07-in-f10.1e100.net.https > 192.168.1.10.46005: Flags [P.], seq 2697:3235, ack 170, win 170, options [nop,nop,TS val 1977682029 ecr 684877], length 538
00:53:50.129411 IP 192.168.1.10.40747 > sea15s07-in-f10.1e100.net.https: Flags [.], ack 1349, win 1411, options [nop,nop,TS val 684884 ecr 1977682028], length 0
00:53:50.129758 IP 192.168.1.10.40747 > sea15s07-in-f10.1e100.net.https: Flags [.], ack 2697, win 1453, options [nop,nop,TS val 684885 ecr 1977682028], length 0
00:53:50.130259 IP 192.168.1.10.40747 > sea15s07-in-f10.1e100.net.https: Flags [.], ack 3236, win 1496, options [nop,nop,TS val 684885 ecr 1977682028], length 0
00:53:50.132371 IP 192.168.1.10.46005 > sea15s07-in-f10.1e100.net.https: Flags [.], ack 1349, win 1411, options [nop,nop,TS val 684885 ecr 1977682029], length 0
00:53:50.132870 IP 192.168.1.10.46005 > sea15s07-in-f10.1e100.net.https: Flags [.], ack 3235, win 1496, options [nop,nop,TS val 684885 ecr 1977682029], length 0
00:53:50.247869 IP sea15s01-in-f142.1e100.net.https > 192.168.1.10.52944: Flags [P.], seq 4182:4686, ack 1863, win 192, options [nop,nop,TS val 1791339379 ecr 684855], length 504
00:53:50.248040 IP sea15s01-in-f142.1e100.net.https > 192.168.1.10.52944: Flags [P.], seq 4686:4907, ack 1863, win 192, options [nop,nop,TS val 1791339379 ecr 684855], length 221
00:53:50.248137 IP sea15s01-in-f142.1e100.net.https > 192.168.1.10.52944: Flags [P.], seq 4907:4933, ack 1863, win 192, options [nop,nop,TS val 1791339379 ecr 684855], length 26
00:53:50.251569 IP 192.168.1.10.52944 > sea15s01-in-f142.1e100.net.https: Flags [.], ack 4686, win 1538, options [nop,nop,TS val 684909 ecr 1791339379], length 0
00:53:50.251890 IP 192.168.1.10.52944 > sea15s01-in-f142.1e100.net.https: Flags [.], ack 4933, win 1580, options [nop,nop,TS val 684909 ecr 1791339379], length 0
00:53:50.345063 IP 192.168.1.10.46005 > sea15s07-in-f10.1e100.net.https: Flags [P.], seq 170:255, ack 3235, win 1496, options [nop,nop,TS val 684928 ecr 1977682029], length 85
00:53:50.355805 IP 192.168.1.10.40747 > sea15s07-in-f10.1e100.net.https: Flags [P.], seq 170:255, ack 3236, win 1496, options [nop,nop,TS val 684930 ecr 1977682028], length 85
00:53:50.377580 IP sea15s07-in-f10.1e100.net.https > 192.168.1.10.46005: Flags [P.], seq 3235:3511, ack 255, win 170, options [nop,nop,TS val 1977682280 ecr 684928], length 276
00:53:50.379804 IP 192.168.1.10.46005 > sea15s07-in-f10.1e100.net.https: Flags [.], ack 3511, win 1538, options [nop,nop,TS val 684935 ecr 1977682280], length 0
00:53:50.384568 IP sea15s07-in-f10.1e100.net.https > 192.168.1.10.40747: Flags [P.], seq 3236:3512, ack 255, win 170, options [nop,nop,TS val 1977682286 ecr 684930], length 276
00:53:50.386435 IP 192.168.1.10.40747 > sea15s07-in-f10.1e100.net.https: Flags [.], ack 3512, win 1538, options [nop,nop,TS val 684936 ecr 1977682286], length 0
00:53:50.392178 IP 192.168.1.10.40747 > sea15s07-in-f10.1e100.net.https: Flags [P.], seq 255:1266, ack 3512, win 1538, options [nop,nop,TS val 684937 ecr 1977682286], length 1011
00:53:50.401185 IP 192.168.1.10.46005 > sea15s07-in-f10.1e100.net.https: Flags [P.], seq 255:1268, ack 3511, win 1538, options [nop,nop,TS val 684939 ecr 1977682280], length 1013
00:53:50.452069 IP sea15s07-in-f10.1e100.net.https > 192.168.1.10.40747: Flags [P.], seq 3512:4860, ack 1266, win 178, options [nop,nop,TS val 1977682354 ecr 684937], length 1348
00:53:50.452235 IP sea15s07-in-f10.1e100.net.https > 192.168.1.10.40747: Flags [P.], seq 4860:6208, ack 1266, win 178, options [nop,nop,TS val 1977682354 ecr 684937], length 1348
00:53:50.452393 IP sea15s07-in-f10.1e100.net.https > 192.168.1.10.40747: Flags [.], seq 6208:7556, ack 1266, win 178, options [nop,nop,TS val 1977682354 ecr 684937], length 1348
00:53:50.452438 IP sea15s07-in-f10.1e100.net.https > 192.168.1.10.40747: Flags [P.], seq 7556:7932, ack 1266, win 178, options [nop,nop,TS val 1977682354 ecr 684937], length 376
00:53:50.452533 IP sea15s07-in-f10.1e100.net.https > 192.168.1.10.40747: Flags [P.], seq 7932:9280, ack 1266, win 178, options [nop,nop,TS val 1977682354 ecr 684937], length 1348
00:53:50.452647 IP sea15s07-in-f10.1e100.net.https > 192.168.1.10.40747: Flags [.], seq 9280:10628, ack 1266, win 178, options [nop,nop,TS val 1977682354 ecr 684937], length 1348
00:53:50.452665 IP sea15s07-in-f10.1e100.net.https > 192.168.1.10.40747: Flags [P.], seq 10628:11976, ack 1266, win 178, options [nop,nop,TS val 1977682354 ecr 684937], length 1348
00:53:50.452718 IP sea15s07-in-f10.1e100.net.https > 192.168.1.10.40747: Flags [P.], seq 11976:12141, ack 1266, win 178, options [nop,nop,TS val 1977682354 ecr 684937], length 165
00:53:50.452767 IP sea15s07-in-f10.1e100.net.https > 192.168.1.10.40747: Flags [P.], seq 12141:13489, ack 1266, win 178, options [nop,nop,TS val 1977682354 ecr 684937], length 1348
00:53:50.452847 IP sea15s07-in-f10.1e100.net.https > 192.168.1.10.40747: Flags [.], seq 13489:14837, ack 1266, win 178, options [nop,nop,TS val 1977682354 ecr 684937], length 1348
00:53:50.452862 IP sea15s07-in-f10.1e100.net.https > 192.168.1.10.40747: Flags [P.], seq 14837:16185, ack 1266, win 178, options [nop,nop,TS val 1977682354 ecr 684937], length 1348
00:53:50.455123 IP sea15s07-in-f10.1e100.net.https > 192.168.1.10.40747: Flags [.], seq 16185:17533, ack 1266, win 178, options [nop,nop,TS val 1977682354 ecr 684937], length 1348
00:53:50.455202 IP sea15s07-in-f10.1e100.net.https > 192.168.1.10.40747: Flags [.], seq 17533:18881, ack 1266, win 178, options [nop,nop,TS val 1977682354 ecr 684937], length 1348
00:53:50.456544 IP 192.168.1.10.40747 > sea15s07-in-f10.1e100.net.https: Flags [.], ack 6208, win 1622, options [nop,nop,TS val 684950 ecr 1977682354], length 0
00:53:50.456886 IP 192.168.1.10.40747 > sea15s07-in-f10.1e100.net.https: Flags [.], ack 10628, win 1790, options [nop,nop,TS val 684950 ecr 1977682354], length 0
00:53:50.457593 IP sea15s07-in-f10.1e100.net.https > 192.168.1.10.40747: Flags [.], seq 18881:20229, ack 1266, win 178, options [nop,nop,TS val 1977682354 ecr 684937], length 1348
00:53:50.466876 IP 192.168.1.10.40747 > sea15s07-in-f10.1e100.net.https: Flags [.], ack 12141, win 1875, options [nop,nop,TS val 684952 ecr 1977682354], length 0
00:53:50.467501 IP 192.168.1.10.40747 > sea15s07-in-f10.1e100.net.https: Flags [.], ack 14837, win 1959, options [nop,nop,TS val 684952 ecr 1977682354], length 0
00:53:50.468775 IP sea15s07-in-f10.1e100.net.https > 192.168.1.10.46005: Flags [.], ack 1268, win 178, options [nop,nop,TS val 1977682331 ecr 684939], length 0
00:53:50.469873 IP 192.168.1.10.40747 > sea15s07-in-f10.1e100.net.https: Flags [.], ack 17533, win 2043, options [nop,nop,TS val 684952 ecr 1977682354], length 0
00:53:50.470378 IP 192.168.1.10.40747 > sea15s07-in-f10.1e100.net.https: Flags [.], ack 20229, win 2127, options [nop,nop,TS val 684952 ecr 1977682354], length 0
00:53:50.477846 IP sea15s07-in-f10.1e100.net.https > 192.168.1.10.46005: Flags [P.], seq 4859:6207, ack 1268, win 178, options [nop,nop,TS val 1977682380 ecr 684939], length 1348
00:53:50.477991 IP sea15s07-in-f10.1e100.net.https > 192.168.1.10.46005: Flags [P.], seq 3511:4859, ack 1268, win 178, options [nop,nop,TS val 1977682380 ecr 684939], length 1348
00:53:50.478140 IP sea15s07-in-f10.1e100.net.https > 192.168.1.10.46005: Flags [.], seq 6207:7555, ack 1268, win 178, options [nop,nop,TS val 1977682380 ecr 684939], length 1348
00:53:50.478185 IP sea15s07-in-f10.1e100.net.https > 192.168.1.10.46005: Flags [P.], seq 7555:7735, ack 1268, win 178, options [nop,nop,TS val 1977682380 ecr 684939], length 180
00:53:50.480568 IP 192.168.1.10.46005 > sea15s07-in-f10.1e100.net.https: Flags [.], ack 3511, win 1538, options [nop,nop,TS val 684955 ecr 1977682331,nop,nop,sack 1 {4859:6207}], length 0
00:53:50.481016 IP 192.168.1.10.46005 > sea15s07-in-f10.1e100.net.https: Flags [.], ack 6207, win 1580, options [nop,nop,TS val 684955 ecr 1977682380], length 0
00:53:50.481509 IP 192.168.1.10.46005 > sea15s07-in-f10.1e100.net.https: Flags [.], ack 7555, win 1622, options [nop,nop,TS val 684955 ecr 1977682380], length 0
00:53:50.483051 IP sea15s07-in-f10.1e100.net.https > 192.168.1.10.46005: Flags [P.], seq 7735:9083, ack 1268, win 178, options [nop,nop,TS val 1977682385 ecr 684939], length 1348
00:53:50.483235 IP sea15s07-in-f10.1e100.net.https > 192.168.1.10.46005: Flags [.], seq 9083:10431, ack 1268, win 178, options [nop,nop,TS val 1977682385 ecr 684939], length 1348
00:53:50.483283 IP sea15s07-in-f10.1e100.net.https > 192.168.1.10.46005: Flags [P.], seq 10431:11779, ack 1268, win 178, options [nop,nop,TS val 1977682385 ecr 684939], length 1348
00:53:50.483470 IP sea15s07-in-f10.1e100.net.https > 192.168.1.10.46005: Flags [.], seq 11779:13127, ack 1268, win 178, options [nop,nop,TS val 1977682386 ecr 684939], length 1348
00:53:50.483518 IP sea15s07-in-f10.1e100.net.https > 192.168.1.10.46005: Flags [.], seq 13127:14475, ack 1268, win 178, options [nop,nop,TS val 1977682386 ecr 684939], length 1348
00:53:50.483534 IP sea15s07-in-f10.1e100.net.https > 192.168.1.10.46005: Flags [.], seq 14475:15823, ack 1268, win 178, options [nop,nop,TS val 1977682386 ecr 684939], length 1348
00:53:50.483545 IP sea15s07-in-f10.1e100.net.https > 192.168.1.10.46005: Flags [.], seq 15823:17171, ack 1268, win 178, options [nop,nop,TS val 1977682386 ecr 684939], length 1348
00:53:50.485006 IP sea15s07-in-f10.1e100.net.https > 192.168.1.10.40747: Flags [.], seq 20229:21577, ack 1266, win 178, options [nop,nop,TS val 1977682386 ecr 684950], length 1348
00:53:50.485095 IP sea15s07-in-f10.1e100.net.https > 192.168.1.10.40747: Flags [.], seq 21577:22925, ack 1266, win 178, options [nop,nop,TS val 1977682386 ecr 684950], length 1348
00:53:50.485480 IP sea15s07-in-f10.1e100.net.https > 192.168.1.10.46005: Flags [.], seq 17171:18519, ack 1268, win 178, options [nop,nop,TS val 1977682386 ecr 684939], length 1348
00:53:50.485525 IP sea15s07-in-f10.1e100.net.https > 192.168.1.10.46005: Flags [.], seq 18519:19867, ack 1268, win 178, options [nop,nop,TS val 1977682386 ecr 684939], length 1348
00:53:50.486190 IP sea15s07-in-f10.1e100.net.https > 192.168.1.10.40747: Flags [.], seq 22925:24273, ack 1266, win 178, options [nop,nop,TS val 1977682386 ecr 684950], length 1348
00:53:50.486231 IP sea15s07-in-f10.1e100.net.https > 192.168.1.10.40747: Flags [.], seq 24273:25621, ack 1266, win 178, options [nop,nop,TS val 1977682386 ecr 684950], length 1348
00:53:50.487237 IP 192.168.1.10.46005 > sea15s07-in-f10.1e100.net.https: Flags [.], ack 7735, win 1664, options [nop,nop,TS val 684956 ecr 1977682380], length 0
00:53:50.487859 IP sea15s07-in-f10.1e100.net.https > 192.168.1.10.46005: Flags [.], seq 19867:21215, ack 1268, win 178, options [nop,nop,TS val 1977682386 ecr 684939], length 1348
00:53:50.488156 IP 192.168.1.10.46005 > sea15s07-in-f10.1e100.net.https: Flags [.], ack 11779, win 1790, options [nop,nop,TS val 684956 ecr 1977682385], length 0
00:53:50.488178 IP 192.168.1.10.46005 > sea15s07-in-f10.1e100.net.https: Flags [.], ack 13127, win 1833, options [nop,nop,TS val 684956 ecr 1977682386], length 0
00:53:50.488798 IP sea15s07-in-f10.1e100.net.https > 192.168.1.10.40747: Flags [.], seq 25621:26969, ack 1266, win 178, options [nop,nop,TS val 1977682387 ecr 684950], length 1348
00:53:50.488865 IP sea15s07-in-f10.1e100.net.https > 192.168.1.10.40747: Flags [.], seq 26969:28317, ack 1266, win 178, options [nop,nop,TS val 1977682387 ecr 684950], length 1348
00:53:50.488968 IP 192.168.1.10.46005 > sea15s07-in-f10.1e100.net.https: Flags [.], ack 15823, win 1917, options [nop,nop,TS val 684956 ecr 1977682386], length 0
00:53:50.490170 IP 192.168.1.10.46005 > sea15s07-in-f10.1e100.net.https: Flags [.], ack 17171, win 1959, options [nop,nop,TS val 684956 ecr 1977682386], length 0
00:53:50.490651 IP 192.168.1.10.40747 > sea15s07-in-f10.1e100.net.https: Flags [.], ack 22925, win 2212, options [nop,nop,TS val 684957 ecr 1977682386], length 0
00:53:50.490673 IP 192.168.1.10.46005 > sea15s07-in-f10.1e100.net.https: Flags [.], ack 18519, win 2001, options [nop,nop,TS val 684957 ecr 1977682386], length 0
00:53:50.491199 IP 192.168.1.10.46005 > sea15s07-in-f10.1e100.net.https: Flags [.], ack 19867, win 2043, options [nop,nop,TS val 684957 ecr 1977682386], length 0
00:53:50.491520 IP sea15s07-in-f10.1e100.net.https > 192.168.1.10.40747: Flags [.], seq 28317:29665, ack 1266, win 178, options [nop,nop,TS val 1977682388 ecr 684950], length 1348
00:53:50.491598 IP sea15s07-in-f10.1e100.net.https > 192.168.1.10.40747: Flags [.], seq 29665:31013, ack 1266, win 178, options [nop,nop,TS val 1977682388 ecr 684950], length 1348
00:53:50.491904 IP 192.168.1.10.40747 > sea15s07-in-f10.1e100.net.https: Flags [.], ack 25621, win 2296, options [nop,nop,TS val 684957 ecr 1977682386], length 0
00:53:50.492108 IP 192.168.1.10.46005 > sea15s07-in-f10.1e100.net.https: Flags [.], ack 21215, win 2085, options [nop,nop,TS val 684957 ecr 1977682386], length 0
00:53:50.493434 IP 192.168.1.10.40747 > sea15s07-in-f10.1e100.net.https: Flags [.], ack 28317, win 2380, options [nop,nop,TS val 684957 ecr 1977682387], length 0
00:53:50.493906 IP sea15s07-in-f10.1e100.net.https > 192.168.1.10.40747: Flags [.], seq 31013:32361, ack 1266, win 178, options [nop,nop,TS val 1977682390 ecr 684950], length 1348
00:53:50.493999 IP sea15s07-in-f10.1e100.net.https > 192.168.1.10.40747: Flags [.], seq 32361:33709, ack 1266, win 178, options [nop,nop,TS val 1977682390 ecr 684950], length 1348
00:53:50.494140 IP sea15s07-in-f10.1e100.net.https > 192.168.1.10.40747: Flags [.], seq 33709:35057, ack 1266, win 178, options [nop,nop,TS val 1977682393 ecr 684950], length 1348
00:53:50.494182 IP sea15s07-in-f10.1e100.net.https > 192.168.1.10.40747: Flags [.], seq 35057:36405, ack 1266, win 178, options [nop,nop,TS val 1977682393 ecr 684950], length 1348
00:53:50.494488 IP 192.168.1.10.40747 > sea15s07-in-f10.1e100.net.https: Flags [.], ack 31013, win 2464, options [nop,nop,TS val 684957 ecr 1977682388], length 0
00:53:50.496452 IP sea15s07-in-f10.1e100.net.https > 192.168.1.10.40747: Flags [.], seq 36405:37753, ack 1266, win 178, options [nop,nop,TS val 1977682397 ecr 684952], length 1348
00:53:50.496551 IP sea15s07-in-f10.1e100.net.https > 192.168.1.10.40747: Flags [.], seq 37753:39101, ack 1266, win 178, options [nop,nop,TS val 1977682397 ecr 684952], length 1348
00:53:50.496954 IP 192.168.1.10.40747 > sea15s07-in-f10.1e100.net.https: Flags [.], ack 33709, win 2549, options [nop,nop,TS val 684958 ecr 1977682390], length 0
00:53:50.497910 IP 192.168.1.10.40747 > sea15s07-in-f10.1e100.net.https: Flags [.], ack 36405, win 2633, options [nop,nop,TS val 684958 ecr 1977682393], length 0
00:53:50.499023 IP sea15s07-in-f10.1e100.net.https > 192.168.1.10.40747: Flags [.], seq 39101:40449, ack 1266, win 178, options [nop,nop,TS val 1977682397 ecr 684952], length 1348
00:53:50.499109 IP sea15s07-in-f10.1e100.net.https > 192.168.1.10.40747: Flags [.], seq 40449:41797, ack 1266, win 178, options [nop,nop,TS val 1977682397 ecr 684952], length 1348
00:53:50.499317 IP 192.168.1.10.40747 > sea15s07-in-f10.1e100.net.https: Flags [.], ack 39101, win 2717, options [nop,nop,TS val 684958 ecr 1977682397], length 0
00:53:50.501554 IP sea15s07-in-f10.1e100.net.https > 192.168.1.10.40747: Flags [.], seq 41797:43145, ack 1266, win 178, options [nop,nop,TS val 1977682398 ecr 684952], length 1348
00:53:50.501643 IP sea15s07-in-f10.1e100.net.https > 192.168.1.10.40747: Flags [.], seq 43145:44493, ack 1266, win 178, options [nop,nop,TS val 1977682398 ecr 684952], length 1348
00:53:50.501747 IP 192.168.1.10.40747 > sea15s07-in-f10.1e100.net.https: Flags [.], ack 41797, win 2801, options [nop,nop,TS val 684959 ecr 1977682397], length 0
00:53:50.504052 IP sea15s07-in-f10.1e100.net.https > 192.168.1.10.40747: Flags [.], seq 44493:45841, ack 1266, win 178, options [nop,nop,TS val 1977682400 ecr 684952], length 1348
00:53:50.504152 IP sea15s07-in-f10.1e100.net.https > 192.168.1.10.40747: Flags [.], seq 45841:47189, ack 1266, win 178, options [nop,nop,TS val 1977682400 ecr 684952], length 1348
00:53:50.504437 IP 192.168.1.10.40747 > sea15s07-in-f10.1e100.net.https: Flags [.], ack 44493, win 2886, options [nop,nop,TS val 684959 ecr 1977682398], length 0
00:53:50.506707 IP sea15s07-in-f10.1e100.net.https > 192.168.1.10.40747: Flags [.], seq 47189:48537, ack 1266, win 178, options [nop,nop,TS val 1977682403 ecr 684952], length 1348
00:53:50.506798 IP sea15s07-in-f10.1e100.net.https > 192.168.1.10.40747: Flags [.], seq 48537:49885, ack 1266, win 178, options [nop,nop,TS val 1977682403 ecr 684952], length 1348
00:53:50.507006 IP 192.168.1.10.40747 > sea15s07-in-f10.1e100.net.https: Flags [.], ack 47189, win 2970, options [nop,nop,TS val 684960 ecr 1977682400], length 0
00:53:50.508039 IP sea15s07-in-f10.1e100.net.https > 192.168.1.10.46005: Flags [.], seq 21215:22563, ack 1268, win 178, options [nop,nop,TS val 1977682410 ecr 684955], length 1348
00:53:50.508112 IP sea15s07-in-f10.1e100.net.https > 192.168.1.10.46005: Flags [.], seq 22563:23911, ack 1268, win 178, options [nop,nop,TS val 1977682410 ecr 684955], length 1348
00:53:50.509109 IP sea15s07-in-f10.1e100.net.https > 192.168.1.10.40747: Flags [.], seq 49885:51233, ack 1266, win 178, options [nop,nop,TS val 1977682406 ecr 684952], length 1348
00:53:50.509189 IP sea15s07-in-f10.1e100.net.https > 192.168.1.10.46005: Flags [.], seq 23911:25259, ack 1268, win 178, options [nop,nop,TS val 1977682411 ecr 684955], length 1348
00:53:50.509290 IP sea15s07-in-f10.1e100.net.https > 192.168.1.10.40747: Flags [.], seq 51233:52581, ack 1266, win 178, options [nop,nop,TS val 1977682406 ecr 684952], length 1348
00:53:50.509379 IP sea15s07-in-f10.1e100.net.https > 192.168.1.10.46005: Flags [.], seq 25259:26607, ack 1268, win 178, options [nop,nop,TS val 1977682411 ecr 684955], length 1348
00:53:50.509541 IP 192.168.1.10.40747 > sea15s07-in-f10.1e100.net.https: Flags [.], ack 49885, win 3054, options [nop,nop,TS val 684960 ecr 1977682403], length 0
00:53:50.511578 IP sea15s07-in-f10.1e100.net.https > 192.168.1.10.46005: Flags [.], seq 26607:27955, ack 1268, win 178, options [nop,nop,TS val 1977682411 ecr 684955], length 1348
00:53:50.511669 IP sea15s07-in-f10.1e100.net.https > 192.168.1.10.46005: Flags [.], seq 27955:29303, ack 1268, win 178, options [nop,nop,TS val 1977682411 ecr 684955], length 1348
00:53:50.511817 IP sea15s07-in-f10.1e100.net.https > 192.168.1.10.40747: Flags [.], seq 52581:53929, ack 1266, win 178, options [nop,nop,TS val 1977682408 ecr 684952], length 1348
00:53:50.511886 IP sea15s07-in-f10.1e100.net.https > 192.168.1.10.40747: Flags [.], seq 53929:55277, ack 1266, win 178, options [nop,nop,TS val 1977682408 ecr 684952], length 1348
00:53:50.512025 IP sea15s07-in-f10.1e100.net.https > 192.168.1.10.40747: Flags [.], seq 55277:56625, ack 1266, win 178, options [nop,nop,TS val 1977682411 ecr 684952], length 1348
00:53:50.512046 IP sea15s07-in-f10.1e100.net.https > 192.168.1.10.40747: Flags [.], seq 56625:57973, ack 1266, win 178, options [nop,nop,TS val 1977682411 ecr 684952], length 1348
00:53:50.512201 IP 192.168.1.10.46005 > sea15s07-in-f10.1e100.net.https: Flags [.], ack 22563, win 2127, options [nop,nop,TS val 684961 ecr 1977682410], length 0
00:53:50.512227 IP 192.168.1.10.46005 > sea15s07-in-f10.1e100.net.https: Flags [.], ack 23911, win 2170, options [nop,nop,TS val 684961 ecr 1977682410], length 0
00:53:50.514669 IP sea15s07-in-f10.1e100.net.https > 192.168.1.10.46005: Flags [.], seq 29303:30651, ack 1268, win 178, options [nop,nop,TS val 1977682417 ecr 684956], length 1348
00:53:50.514763 IP sea15s07-in-f10.1e100.net.https > 192.168.1.10.46005: Flags [.], seq 30651:31999, ack 1268, win 178, options [nop,nop,TS val 1977682417 ecr 684956], length 1348
00:53:50.515779 IP 192.168.1.10.46005 > sea15s07-in-f10.1e100.net.https: Flags [.], ack 25259, win 2212, options [nop,nop,TS val 684961 ecr 1977682411], length 0
00:53:50.516208 IP sea15s07-in-f10.1e100.net.https > 192.168.1.10.46005: Flags [.], seq 31999:33347, ack 1268, win 178, options [nop,nop,TS val 1977682418 ecr 684956], length 1348
00:53:50.516268 IP sea15s07-in-f10.1e100.net.https > 192.168.1.10.46005: Flags [.], seq 33347:34695, ack 1268, win 178, options [nop,nop,TS val 1977682418 ecr 684956], length 1348
00:53:50.516388 IP 192.168.1.10.40747 > sea15s07-in-f10.1e100.net.https: Flags [.], ack 52581, win 3138, options [nop,nop,TS val 684962 ecr 1977682406], length 0
00:53:50.516404 IP 192.168.1.10.46005 > sea15s07-in-f10.1e100.net.https: Flags [.], ack 27955, win 2296, options [nop,nop,TS val 684962 ecr 1977682411], length 0
00:53:50.516878 IP 192.168.1.10.46005 > sea15s07-in-f10.1e100.net.https: Flags [.], ack 29303, win 2338, options [nop,nop,TS val 684962 ecr 1977682411], length 0
00:53:50.517754 IP 192.168.1.10.40747 > sea15s07-in-f10.1e100.net.https: Flags [.], ack 55277, win 3223, options [nop,nop,TS val 684962 ecr 1977682408], length 0
00:53:50.518252 IP 192.168.1.10.40747 > sea15s07-in-f10.1e100.net.https: Flags [.], ack 57973, win 3307, options [nop,nop,TS val 684962 ecr 1977682411], length 0
00:53:50.518552 IP sea15s07-in-f10.1e100.net.https > 192.168.1.10.46005: Flags [.], seq 34695:36043, ack 1268, win 178, options [nop,nop,TS val 1977682418 ecr 684956], length 1348
00:53:50.518621 IP sea15s07-in-f10.1e100.net.https > 192.168.1.10.46005: Flags [.], seq 36043:37391, ack 1268, win 178, options [nop,nop,TS val 1977682418 ecr 684956], length 1348
00:53:50.518699 IP 192.168.1.10.46005 > sea15s07-in-f10.1e100.net.https: Flags [.], ack 30651, win 2380, options [nop,nop,TS val 684962 ecr 1977682417], length 0
00:53:50.519055 IP sea15s07-in-f10.1e100.net.https > 192.168.1.10.40747: Flags [.], seq 57973:59321, ack 1266, win 178, options [nop,nop,TS val 1977682421 ecr 684957], length 1348
00:53:50.519112 IP sea15s07-in-f10.1e100.net.https > 192.168.1.10.40747: Flags [.], seq 59321:60669, ack 1266, win 178, options [nop,nop,TS val 1977682421 ecr 684957], length 1348
00:53:50.519189 IP 192.168.1.10.46005 > sea15s07-in-f10.1e100.net.https: Flags [.], ack 31999, win 2422, options [nop,nop,TS val 684962 ecr 1977682417], length 0
00:53:50.520059 IP sea15s07-in-f10.1e100.net.https > 192.168.1.10.40747: Flags [.], seq 60669:62017, ack 1266, win 178, options [nop,nop,TS val 1977682421 ecr 684957], length 1348
00:53:50.520141 IP sea15s07-in-f10.1e100.net.https > 192.168.1.10.40747: Flags [.], seq 62017:63365, ack 1266, win 178, options [nop,nop,TS val 1977682421 ecr 684957], length 1348
00:53:50.520555 IP 192.168.1.10.46005 > sea15s07-in-f10.1e100.net.https: Flags [.], ack 33347, win 2464, options [nop,nop,TS val 684962 ecr 1977682418], length 0
00:53:50.520935 IP sea15s07-in-f10.1e100.net.https > 192.168.1.10.46005: Flags [.], seq 37391:38739, ack 1268, win 178, options [nop,nop,TS val 1977682419 ecr 684956], length 1348
00:53:50.521003 IP sea15s07-in-f10.1e100.net.https > 192.168.1.10.46005: Flags [.], seq 38739:40087, ack 1268, win 178, options [nop,nop,TS val 1977682419 ecr 684956], length 1348
00:53:50.522051 IP sea15s07-in-f10.1e100.net.https > 192.168.1.10.40747: Flags [.], seq 63365:64713, ack 1266, win 178, options [nop,nop,TS val 1977682422 ecr 684957], length 1348
00:53:50.522126 IP sea15s07-in-f10.1e100.net.https > 192.168.1.10.40747: Flags [.], seq 64713:66061, ack 1266, win 178, options [nop,nop,TS val 1977682422 ecr 684957], length 1348
00:53:50.522245 IP 192.168.1.10.46005 > sea15s07-in-f10.1e100.net.https: Flags [.], ack 36043, win 2549, options [nop,nop,TS val 684963 ecr 1977682418], length 0
00:53:50.522640 IP 192.168.1.10.46005 > sea15s07-in-f10.1e100.net.https: Flags [.], ack 37391, win 2591, options [nop,nop,TS val 684963 ecr 1977682418], length 0
00:53:50.522656 IP 192.168.1.10.40747 > sea15s07-in-f10.1e100.net.https: Flags [.], ack 60669, win 3391, options [nop,nop,TS val 684963 ecr 1977682421], length 0
00:53:50.523279 IP sea15s07-in-f10.1e100.net.https > 192.168.1.10.46005: Flags [.], seq 40087:41435, ack 1268, win 178, options [nop,nop,TS val 1977682421 ecr 684957], length 1348
00:53:50.523341 IP sea15s07-in-f10.1e100.net.https > 192.168.1.10.46005: Flags [.], seq 41435:42783, ack 1268, win 178, options [nop,nop,TS val 1977682421 ecr 684957], length 1348
00:53:50.523447 IP sea15s07-in-f10.1e100.net.https > 192.168.1.10.46005: Flags [.], seq 42783:44131, ack 1268, win 178, options [nop,nop,TS val 1977682423 ecr 684957], length 1348
00:53:50.523498 IP sea15s07-in-f10.1e100.net.https > 192.168.1.10.46005: Flags [.], seq 44131:45479, ack 1268, win 178, options [nop,nop,TS val 1977682423 ecr 684957], length 1348
00:53:50.523596 IP 192.168.1.10.40747 > sea15s07-in-f10.1e100.net.https: Flags [.], ack 63365, win 3475, options [nop,nop,TS val 684963 ecr 1977682421], length 0
00:53:50.523613 IP 192.168.1.10.46005 > sea15s07-in-f10.1e100.net.https: Flags [.], ack 38739, win 2633, options [nop,nop,TS val 684963 ecr 1977682419], length 0
00:53:50.523843 IP sea15s07-in-f10.1e100.net.https > 192.168.1.10.40747: Flags [.], seq 66061:67409, ack 1266, win 178, options [nop,nop,TS val 1977682422 ecr 684957], length 1348
00:53:50.523899 IP sea15s07-in-f10.1e100.net.https > 192.168.1.10.40747: Flags [.], seq 67409:68757, ack 1266, win 178, options [nop,nop,TS val 1977682422 ecr 684957], length 1348
00:53:50.524040 IP 192.168.1.10.46005 > sea15s07-in-f10.1e100.net.https: Flags [.], ack 40087, win 2675, options [nop,nop,TS val 684963 ecr 1977682419], length 0
00:53:50.525612 IP sea15s07-in-f10.1e100.net.https > 192.168.1.10.40747: Flags [.], seq 68757:70105, ack 1266, win 178, options [nop,nop,TS val 1977682424 ecr 684957], length 1348
00:53:50.525705 IP sea15s07-in-f10.1e100.net.https > 192.168.1.10.40747: Flags [.], seq 70105:71453, ack 1266, win 178, options [nop,nop,TS val 1977682424 ecr 684957], length 1348
00:53:50.525897 IP sea15s07-in-f10.1e100.net.https > 192.168.1.10.46005: Flags [.], seq 45479:46827, ack 1268, win 178, options [nop,nop,TS val 1977682426 ecr 684957], length 1348
00:53:50.525946 IP sea15s07-in-f10.1e100.net.https > 192.168.1.10.46005: Flags [.], seq 46827:48175, ack 1268, win 178, options [nop,nop,TS val 1977682426 ecr 684957], length 1348
00:53:50.526073 IP 192.168.1.10.40747 > sea15s07-in-f10.1e100.net.https: Flags [.], ack 66061, win 3560, options [nop,nop,TS val 684964 ecr 1977682422], length 0
00:53:50.526391 IP 192.168.1.10.46005 > sea15s07-in-f10.1e100.net.https: Flags [.], ack 44131, win 2801, options [nop,nop,TS val 684964 ecr 1977682423], length 0
00:53:50.527347 IP sea15s07-in-f10.1e100.net.https > 192.168.1.10.40747: Flags [.], seq 71453:72801, ack 1266, win 178, options [nop,nop,TS val 1977682425 ecr 684957], length 1348
00:53:50.527399 IP sea15s07-in-f10.1e100.net.https > 192.168.1.10.40747: Flags [.], seq 72801:74149, ack 1266, win 178, options [nop,nop,TS val 1977682425 ecr 684957], length 1348
00:53:50.527944 IP sea15s07-in-f10.1e100.net.https > 192.168.1.10.46005: Flags [.], seq 48175:49523, ack 1268, win 178, options [nop,nop,TS val 1977682426 ecr 684957], length 1348
00:53:50.527985 IP sea15s07-in-f10.1e100.net.https > 192.168.1.10.46005: Flags [.], seq 49523:50871, ack 1268, win 178, options [nop,nop,TS val 1977682426 ecr 684957], length 1348
00:53:50.528949 IP sea15s07-in-f10.1e100.net.https > 192.168.1.10.40747: Flags [.], seq 74149:75497, ack 1266, win 178, options [nop,nop,TS val 1977682427 ecr 684958], length 1348
00:53:50.528992 IP sea15s07-in-f10.1e100.net.https > 192.168.1.10.40747: Flags [.], seq 75497:76845, ack 1266, win 178, options [nop,nop,TS val 1977682427 ecr 684958], length 1348
00:53:50.529122 IP sea15s07-in-f10.1e100.net.https > 192.168.1.10.40747: Flags [.], seq 76845:78193, ack 1266, win 178, options [nop,nop,TS val 1977682429 ecr 684958], length 1348
00:53:50.529159 IP sea15s07-in-f10.1e100.net.https > 192.168.1.10.40747: Flags [.], seq 78193:79541, ack 1266, win 178, options [nop,nop,TS val 1977682429 ecr 684958], length 1348
00:53:50.530300 IP sea15s07-in-f10.1e100.net.https > 192.168.1.10.46005: Flags [.], seq 50871:52219, ack 1268, win 178, options [nop,nop,TS val 1977682428 ecr 684957], length 1348
00:53:50.530343 IP sea15s07-in-f10.1e100.net.https > 192.168.1.10.46005: Flags [.], seq 52219:53567, ack 1268, win 178, options [nop,nop,TS val 1977682428 ecr 684957], length 1348
00:53:50.530614 IP sea15s07-in-f10.1e100.net.https > 192.168.1.10.40747: Flags [.], seq 79541:80889, ack 1266, win 178, options [nop,nop,TS val 1977682431 ecr 684958], length 1348
00:53:50.530652 IP sea15s07-in-f10.1e100.net.https > 192.168.1.10.40747: Flags [.], seq 80889:82237, ack 1266, win 178, options [nop,nop,TS val 1977682431 ecr 684958], length 1348
00:53:50.530748 IP 192.168.1.10.46005 > sea15s07-in-f10.1e100.net.https: Flags [.], ack 45479, win 2844, options [nop,nop,TS val 684964 ecr 1977682423], length 0
00:53:50.531254 IP 192.168.1.10.40747 > sea15s07-in-f10.1e100.net.https: Flags [.], ack 71453, win 3728, options [nop,nop,TS val 684964 ecr 1977682424], length 0
