tcpdump: verbose output suppressed, use -v or -vv for full protocol decode
listening on wlan0, link-type EN10MB (Ethernet), capture size 262144 bytes
20:47:27.111060 IP 192.168.1.10.40438 > 74.125.197.109.587: Flags [S], seq 1316677611, win 14600, options [mss 1460,sackOK,TS val 170565 ecr 0,nop,wscale 7], length 0
20:47:27.142530 IP 74.125.197.109.587 > 192.168.1.10.40438: Flags [S.], seq 530190363, ack 1316677612, win 42408, options [mss 1360,sackOK,TS val 2539105781 ecr 170565,nop,wscale 8], length 0
20:47:27.149416 IP 192.168.1.10.40438 > 74.125.197.109.587: Flags [.], ack 1, win 115, options [nop,nop,TS val 170569 ecr 2539105781], length 0
20:47:27.193703 IP 74.125.197.109.587 > 192.168.1.10.40438: Flags [P.], seq 1:52, ack 1, win 166, options [nop,nop,TS val 2539105832 ecr 170569], length 51
20:47:27.209305 IP 192.168.1.10.40438 > 74.125.197.109.587: Flags [.], ack 52, win 115, options [nop,nop,TS val 170575 ecr 2539105832], length 0
20:47:27.209320 IP 192.168.1.10.40438 > 74.125.197.109.587: Flags [F.], seq 1, ack 52, win 115, options [nop,nop,TS val 170575 ecr 2539105832], length 0
20:47:27.240764 IP 74.125.197.109.587 > 192.168.1.10.40438: Flags [.], ack 2, win 166, options [nop,nop,TS val 2539105879 ecr 170575], length 0
20:47:27.243216 IP 74.125.197.109.587 > 192.168.1.10.40438: Flags [F.], seq 52, ack 2, win 166, options [nop,nop,TS val 2539105882 ecr 170575], length 0
20:47:27.250547 IP 192.168.1.10.40438 > 74.125.197.109.587: Flags [.], ack 53, win 115, options [nop,nop,TS val 170579 ecr 2539105882], length 0
20:47:27.333420 IP 192.168.1.10.59215 > ec2-54-205-161-210.compute-1.amazonaws.com.https: Flags [S], seq 1177622200, win 14600, options [mss 1460,sackOK,TS val 170588 ecr 0,nop,wscale 7], length 0
20:47:28.198176 IP 192.168.1.10.57454 > sea15s01-in-f14.1e100.net.www: Flags [S], seq 1376584301, win 14600, options [mss 1460,sackOK,TS val 170674 ecr 0,nop,wscale 7], length 0
20:47:28.205732 IP sea15s01-in-f14.1e100.net.www > 192.168.1.10.57454: Flags [S.], seq 534596080, ack 1376584302, win 26960, options [mss 1360,sackOK,TS val 3175277159 ecr 170674,nop,wscale 7], length 0
20:47:28.211660 IP 192.168.1.10.57454 > sea15s01-in-f14.1e100.net.www: Flags [.], ack 1, win 115, options [nop,nop,TS val 170675 ecr 3175277159], length 0
20:47:28.237508 IP 192.168.1.10.57454 > sea15s01-in-f14.1e100.net.www: Flags [P.], seq 1:187, ack 1, win 115, options [nop,nop,TS val 170678 ecr 3175277159], length 186: HTTP: GET /generate_204 HTTP/1.1
20:47:28.244761 IP sea15s01-in-f14.1e100.net.www > 192.168.1.10.57454: Flags [.], ack 187, win 219, options [nop,nop,TS val 3175277169 ecr 170678], length 0
20:47:28.332605 IP 192.168.1.10.59215 > ec2-54-205-161-210.compute-1.amazonaws.com.https: Flags [S], seq 1177622200, win 14600, options [mss 1460,sackOK,TS val 170688 ecr 0,nop,wscale 7], length 0
20:47:28.342511 IP sea15s01-in-f14.1e100.net.www > 192.168.1.10.57454: Flags [P.], seq 1:227, ack 187, win 219, options [nop,nop,TS val 3175277193 ecr 170678], length 226: HTTP: HTTP/1.1 204 No Content
20:47:28.349887 IP 192.168.1.10.57454 > sea15s01-in-f14.1e100.net.www: Flags [.], ack 227, win 123, options [nop,nop,TS val 170689 ecr 3175277193], length 0
20:47:30.338002 IP 192.168.1.10.59215 > ec2-54-205-161-210.compute-1.amazonaws.com.https: Flags [S], seq 1177622200, win 14600, options [mss 1460,sackOK,TS val 170888 ecr 0,nop,wscale 7], length 0
20:47:34.347654 IP 192.168.1.10.59215 > ec2-54-205-161-210.compute-1.amazonaws.com.https: Flags [S], seq 1177622200, win 14600, options [mss 1460,sackOK,TS val 171289 ecr 0,nop,wscale 7], length 0
20:47:37.011414 IP 192.168.1.10.57457 > sea15s01-in-f14.1e100.net.www: Flags [S], seq 1992046455, win 14600, options [mss 1460,sackOK,TS val 171555 ecr 0,nop,wscale 7], length 0
20:47:37.019024 IP sea15s01-in-f14.1e100.net.www > 192.168.1.10.57457: Flags [S.], seq 4024619560, ack 1992046456, win 26960, options [mss 1360,sackOK,TS val 3175279362 ecr 171555,nop,wscale 7], length 0
20:47:37.035757 IP 192.168.1.10.57457 > sea15s01-in-f14.1e100.net.www: Flags [.], ack 1, win 115, options [nop,nop,TS val 171558 ecr 3175279362], length 0
20:47:37.060629 IP 192.168.1.10.57457 > sea15s01-in-f14.1e100.net.www: Flags [P.], seq 1:182, ack 1, win 115, options [nop,nop,TS val 171560 ecr 3175279362], length 181: HTTP: GET /generate_204 HTTP/1.1
20:47:37.067987 IP sea15s01-in-f14.1e100.net.www > 192.168.1.10.57457: Flags [.], ack 182, win 219, options [nop,nop,TS val 3175279374 ecr 171560], length 0
20:47:37.115477 IP sea15s01-in-f14.1e100.net.www > 192.168.1.10.57457: Flags [P.], seq 1:227, ack 182, win 219, options [nop,nop,TS val 3175279386 ecr 171560], length 226: HTTP: HTTP/1.1 204 No Content
20:47:37.138746 IP 192.168.1.10.57457 > sea15s01-in-f14.1e100.net.www: Flags [.], ack 227, win 123, options [nop,nop,TS val 171568 ecr 3175279386], length 0
20:47:37.551644 IP 192.168.1.10.55770 > sea15s11-in-f162.1e100.net.https: Flags [S], seq 2021627583, win 14600, options [mss 1460,sackOK,TS val 171609 ecr 0,nop,wscale 7], length 0
20:47:37.579995 IP sea15s11-in-f162.1e100.net.https > 192.168.1.10.55770: Flags [S.], seq 3753469586, ack 2021627584, win 42408, options [mss 1360,sackOK,TS val 134119029 ecr 171609,nop,wscale 8], length 0
20:47:37.586161 IP 192.168.1.10.55770 > sea15s11-in-f162.1e100.net.https: Flags [.], ack 1, win 115, options [nop,nop,TS val 171613 ecr 134119029], length 0
20:47:37.647899 IP 192.168.1.10.55770 > sea15s11-in-f162.1e100.net.https: Flags [P.], seq 1:181, ack 1, win 115, options [nop,nop,TS val 171619 ecr 134119029], length 180
20:47:37.676230 IP sea15s11-in-f162.1e100.net.https > 192.168.1.10.55770: Flags [.], ack 181, win 170, options [nop,nop,TS val 134119125 ecr 171619], length 0
20:47:37.683464 IP sea15s11-in-f162.1e100.net.https > 192.168.1.10.55770: Flags [.], seq 1:1349, ack 181, win 170, options [nop,nop,TS val 134119132 ecr 171619], length 1348
20:47:37.683573 IP sea15s11-in-f162.1e100.net.https > 192.168.1.10.55770: Flags [P.], seq 1349:2517, ack 181, win 170, options [nop,nop,TS val 134119132 ecr 171619], length 1168
20:47:37.689801 IP 192.168.1.10.55770 > sea15s11-in-f162.1e100.net.https: Flags [.], ack 1349, win 136, options [nop,nop,TS val 171623 ecr 134119132], length 0
20:47:37.689833 IP 192.168.1.10.55770 > sea15s11-in-f162.1e100.net.https: Flags [.], ack 2517, win 157, options [nop,nop,TS val 171623 ecr 134119132], length 0
20:47:38.232291 IP 192.168.1.10.55770 > sea15s11-in-f162.1e100.net.https: Flags [P.], seq 181:266, ack 2517, win 157, options [nop,nop,TS val 171677 ecr 134119132], length 85
20:47:38.261021 IP sea15s11-in-f162.1e100.net.https > 192.168.1.10.55770: Flags [P.], seq 2517:2793, ack 266, win 170, options [nop,nop,TS val 134119710 ecr 171677], length 276
20:47:38.271001 IP 192.168.1.10.55770 > sea15s11-in-f162.1e100.net.https: Flags [.], ack 2793, win 178, options [nop,nop,TS val 171681 ecr 134119710], length 0
20:47:38.271018 IP 192.168.1.10.49879 > sea15s12-in-f10.1e100.net.https: Flags [S], seq 2042577403, win 14600, options [mss 1460,sackOK,TS val 171682 ecr 0,nop,wscale 7], length 0
20:47:38.300370 IP sea15s12-in-f10.1e100.net.https > 192.168.1.10.49879: Flags [S.], seq 432164509, ack 2042577404, win 42408, options [mss 1360,sackOK,TS val 2746689196 ecr 171682,nop,wscale 8], length 0
20:47:38.306126 IP 192.168.1.10.49879 > sea15s12-in-f10.1e100.net.https: Flags [.], ack 1, win 115, options [nop,nop,TS val 171685 ecr 2746689196], length 0
20:47:38.315385 IP 192.168.1.10.49879 > sea15s12-in-f10.1e100.net.https: Flags [P.], seq 1:170, ack 1, win 115, options [nop,nop,TS val 171686 ecr 2746689196], length 169
20:47:38.344729 IP sea15s12-in-f10.1e100.net.https > 192.168.1.10.49879: Flags [.], ack 170, win 170, options [nop,nop,TS val 2746689240 ecr 171686], length 0
20:47:38.352098 IP sea15s12-in-f10.1e100.net.https > 192.168.1.10.49879: Flags [.], seq 1:1349, ack 170, win 170, options [nop,nop,TS val 2746689247 ecr 171686], length 1348
20:47:38.352167 IP sea15s12-in-f10.1e100.net.https > 192.168.1.10.49879: Flags [.], seq 1349:2697, ack 170, win 170, options [nop,nop,TS val 2746689247 ecr 171686], length 1348
20:47:38.352200 IP sea15s12-in-f10.1e100.net.https > 192.168.1.10.49879: Flags [P.], seq 2697:3236, ack 170, win 170, options [nop,nop,TS val 2746689247 ecr 171686], length 539
20:47:38.366523 IP 192.168.1.10.49879 > sea15s12-in-f10.1e100.net.https: Flags [.], ack 1349, win 136, options [nop,nop,TS val 171691 ecr 2746689247], length 0
20:47:38.370871 IP 192.168.1.10.49879 > sea15s12-in-f10.1e100.net.https: Flags [.], ack 2697, win 157, options [nop,nop,TS val 171691 ecr 2746689247], length 0
20:47:38.370888 IP 192.168.1.10.49879 > sea15s12-in-f10.1e100.net.https: Flags [.], ack 3236, win 178, options [nop,nop,TS val 171691 ecr 2746689247], length 0
20:47:38.863428 IP 192.168.1.10.55772 > sea15s11-in-f162.1e100.net.https: Flags [S], seq 2302614634, win 14600, options [mss 1460,sackOK,TS val 171740 ecr 0,nop,wscale 7], length 0
20:47:38.894603 IP sea15s11-in-f162.1e100.net.https > 192.168.1.10.55772: Flags [S.], seq 3437249818, ack 2302614635, win 42408, options [mss 1360,sackOK,TS val 460208664 ecr 171740,nop,wscale 8], length 0
20:47:38.900397 IP 192.168.1.10.55772 > sea15s11-in-f162.1e100.net.https: Flags [.], ack 1, win 115, options [nop,nop,TS val 171744 ecr 460208664], length 0
20:47:38.961145 IP 192.168.1.10.55772 > sea15s11-in-f162.1e100.net.https: Flags [P.], seq 1:518, ack 1, win 115, options [nop,nop,TS val 171750 ecr 460208664], length 517
20:47:38.961163 IP 192.168.1.10.55770 > sea15s11-in-f162.1e100.net.https: Flags [P.], seq 266:708, ack 2793, win 178, options [nop,nop,TS val 171750 ecr 134119710], length 442
20:47:38.992255 IP sea15s11-in-f162.1e100.net.https > 192.168.1.10.55772: Flags [.], ack 518, win 170, options [nop,nop,TS val 460208761 ecr 171750], length 0
20:47:38.992648 IP sea15s11-in-f162.1e100.net.https > 192.168.1.10.55772: Flags [P.], seq 1:140, ack 518, win 170, options [nop,nop,TS val 460208762 ecr 171750], length 139
20:47:38.997909 IP sea15s11-in-f162.1e100.net.https > 192.168.1.10.55770: Flags [P.], seq 2793:3603, ack 708, win 175, options [nop,nop,TS val 134120447 ecr 171750], length 810
20:47:38.998364 IP 192.168.1.10.55772 > sea15s11-in-f162.1e100.net.https: Flags [.], ack 140, win 123, options [nop,nop,TS val 171754 ecr 460208762], length 0
20:47:38.998380 IP 192.168.1.10.55772 > sea15s11-in-f162.1e100.net.https: Flags [P.], seq 518:561, ack 140, win 123, options [nop,nop,TS val 171754 ecr 460208762], length 43
20:47:39.008258 IP 192.168.1.10.55770 > sea15s11-in-f162.1e100.net.https: Flags [.], ack 3603, win 199, options [nop,nop,TS val 171755 ecr 134120447], length 0
20:47:39.069400 IP sea15s11-in-f162.1e100.net.https > 192.168.1.10.55772: Flags [.], ack 561, win 170, options [nop,nop,TS val 460208798 ecr 171754], length 0
20:47:39.072242 IP 192.168.1.10.49879 > sea15s12-in-f10.1e100.net.https: Flags [P.], seq 170:255, ack 3236, win 178, options [nop,nop,TS val 171761 ecr 2746689247], length 85
20:47:39.101933 IP sea15s12-in-f10.1e100.net.https > 192.168.1.10.49879: Flags [P.], seq 3236:3512, ack 255, win 170, options [nop,nop,TS val 2746689997 ecr 171761], length 276
20:47:39.108575 IP 192.168.1.10.49879 > sea15s12-in-f10.1e100.net.https: Flags [.], ack 3512, win 199, options [nop,nop,TS val 171765 ecr 2746689997], length 0
20:47:39.282039 IP 192.168.1.10.49879 > sea15s12-in-f10.1e100.net.https: Flags [P.], seq 255:1223, ack 3512, win 199, options [nop,nop,TS val 171782 ecr 2746689997], length 968
20:47:39.342899 IP sea15s12-in-f10.1e100.net.https > 192.168.1.10.49879: Flags [P.], seq 3512:4860, ack 1223, win 178, options [nop,nop,TS val 2746690238 ecr 171782], length 1348
20:47:39.343087 IP sea15s12-in-f10.1e100.net.https > 192.168.1.10.49879: Flags [P.], seq 4860:6208, ack 1223, win 178, options [nop,nop,TS val 2746690238 ecr 171782], length 1348
20:47:39.343694 IP sea15s12-in-f10.1e100.net.https > 192.168.1.10.49879: Flags [.], seq 6208:7556, ack 1223, win 178, options [nop,nop,TS val 2746690238 ecr 171782], length 1348
20:47:39.343764 IP sea15s12-in-f10.1e100.net.https > 192.168.1.10.49879: Flags [P.], seq 7556:7754, ack 1223, win 178, options [nop,nop,TS val 2746690238 ecr 171782], length 198
20:47:39.344690 IP sea15s12-in-f10.1e100.net.https > 192.168.1.10.49879: Flags [P.], seq 7754:9102, ack 1223, win 178, options [nop,nop,TS val 2746690238 ecr 171782], length 1348
20:47:39.345589 IP sea15s12-in-f10.1e100.net.https > 192.168.1.10.49879: Flags [.], seq 9102:10450, ack 1223, win 178, options [nop,nop,TS val 2746690238 ecr 171782], length 1348
20:47:39.345675 IP sea15s12-in-f10.1e100.net.https > 192.168.1.10.49879: Flags [P.], seq 10450:11798, ack 1223, win 178, options [nop,nop,TS val 2746690238 ecr 171782], length 1348
20:47:39.347328 IP sea15s12-in-f10.1e100.net.https > 192.168.1.10.49879: Flags [.], seq 11798:13146, ack 1223, win 178, options [nop,nop,TS val 2746690238 ecr 171782], length 1348
20:47:39.347415 IP sea15s12-in-f10.1e100.net.https > 192.168.1.10.49879: Flags [.], seq 13146:14494, ack 1223, win 178, options [nop,nop,TS val 2746690238 ecr 171782], length 1348
20:47:39.347444 IP sea15s12-in-f10.1e100.net.https > 192.168.1.10.49879: Flags [.], seq 14494:15842, ack 1223, win 178, options [nop,nop,TS val 2746690238 ecr 171782], length 1348
20:47:39.347473 IP sea15s12-in-f10.1e100.net.https > 192.168.1.10.49879: Flags [P.], seq 15842:16364, ack 1223, win 178, options [nop,nop,TS val 2746690238 ecr 171782], length 522
20:47:39.349370 IP 192.168.1.10.49879 > sea15s12-in-f10.1e100.net.https: Flags [.], ack 4860, win 220, options [nop,nop,TS val 171789 ecr 2746690238], length 0
20:47:39.349387 IP 192.168.1.10.49879 > sea15s12-in-f10.1e100.net.https: Flags [.], ack 6208, win 241, options [nop,nop,TS val 171789 ecr 2746690238], length 0
20:47:39.349397 IP 192.168.1.10.49879 > sea15s12-in-f10.1e100.net.https: Flags [.], ack 7556, win 262, options [nop,nop,TS val 171789 ecr 2746690238], length 0
20:47:39.349407 IP 192.168.1.10.49879 > sea15s12-in-f10.1e100.net.https: Flags [.], ack 7754, win 283, options [nop,nop,TS val 171789 ecr 2746690238], length 0
20:47:39.349417 IP 192.168.1.10.49879 > sea15s12-in-f10.1e100.net.https: Flags [.], ack 9102, win 304, options [nop,nop,TS val 171789 ecr 2746690238], length 0
20:47:39.349429 IP 192.168.1.10.49879 > sea15s12-in-f10.1e100.net.https: Flags [.], ack 10450, win 325, options [nop,nop,TS val 171789 ecr 2746690238], length 0
20:47:39.349440 IP 192.168.1.10.49879 > sea15s12-in-f10.1e100.net.https: Flags [.], ack 11798, win 346, options [nop,nop,TS val 171790 ecr 2746690238], length 0
20:47:39.350274 IP sea15s12-in-f10.1e100.net.https > 192.168.1.10.49879: Flags [P.], seq 16364:17712, ack 1223, win 178, options [nop,nop,TS val 2746690238 ecr 171782], length 1348
20:47:39.351121 IP sea15s12-in-f10.1e100.net.https > 192.168.1.10.49879: Flags [.], seq 17712:19060, ack 1223, win 178, options [nop,nop,TS val 2746690238 ecr 171782], length 1348
20:47:39.351206 IP sea15s12-in-f10.1e100.net.https > 192.168.1.10.49879: Flags [.], seq 19060:20408, ack 1223, win 178, options [nop,nop,TS val 2746690238 ecr 171782], length 1348
20:47:39.358252 IP 192.168.1.10.49879 > sea15s12-in-f10.1e100.net.https: Flags [.], ack 13146, win 367, options [nop,nop,TS val 171790 ecr 2746690238], length 0
20:47:39.358283 IP 192.168.1.10.49879 > sea15s12-in-f10.1e100.net.https: Flags [.], ack 14494, win 388, options [nop,nop,TS val 171790 ecr 2746690238], length 0
20:47:39.358294 IP 192.168.1.10.49879 > sea15s12-in-f10.1e100.net.https: Flags [.], ack 15842, win 409, options [nop,nop,TS val 171790 ecr 2746690238], length 0
20:47:39.358305 IP 192.168.1.10.49879 > sea15s12-in-f10.1e100.net.https: Flags [.], ack 16364, win 430, options [nop,nop,TS val 171790 ecr 2746690238], length 0
20:47:39.362645 IP 192.168.1.10.49879 > sea15s12-in-f10.1e100.net.https: Flags [.], ack 17712, win 452, options [nop,nop,TS val 171790 ecr 2746690238], length 0
20:47:39.362661 IP 192.168.1.10.49879 > sea15s12-in-f10.1e100.net.https: Flags [.], ack 19060, win 473, options [nop,nop,TS val 171791 ecr 2746690238], length 0
20:47:39.362672 IP 192.168.1.10.49879 > sea15s12-in-f10.1e100.net.https: Flags [.], ack 20408, win 494, options [nop,nop,TS val 171791 ecr 2746690238], length 0
20:47:39.378828 IP sea15s12-in-f10.1e100.net.https > 192.168.1.10.49879: Flags [.], seq 20408:21756, ack 1223, win 178, options [nop,nop,TS val 2746690274 ecr 171789], length 1348
20:47:39.378939 IP sea15s12-in-f10.1e100.net.https > 192.168.1.10.49879: Flags [.], seq 21756:23104, ack 1223, win 178, options [nop,nop,TS val 2746690274 ecr 171789], length 1348
20:47:39.380242 IP sea15s12-in-f10.1e100.net.https > 192.168.1.10.49879: Flags [.], seq 23104:24452, ack 1223, win 178, options [nop,nop,TS val 2746690274 ecr 171789], length 1348
20:47:39.380382 IP sea15s12-in-f10.1e100.net.https > 192.168.1.10.49879: Flags [.], seq 24452:25800, ack 1223, win 178, options [nop,nop,TS val 2746690274 ecr 171789], length 1348
20:47:39.383075 IP sea15s12-in-f10.1e100.net.https > 192.168.1.10.49879: Flags [.], seq 25800:27148, ack 1223, win 178, options [nop,nop,TS val 2746690274 ecr 171789], length 1348
20:47:39.383173 IP sea15s12-in-f10.1e100.net.https > 192.168.1.10.49879: Flags [.], seq 27148:28496, ack 1223, win 178, options [nop,nop,TS val 2746690274 ecr 171789], length 1348
20:47:39.385879 IP sea15s12-in-f10.1e100.net.https > 192.168.1.10.49879: Flags [.], seq 28496:29844, ack 1223, win 178, options [nop,nop,TS val 2746690275 ecr 171790], length 1348
20:47:39.385974 IP sea15s12-in-f10.1e100.net.https > 192.168.1.10.49879: Flags [.], seq 29844:31192, ack 1223, win 178, options [nop,nop,TS val 2746690275 ecr 171790], length 1348
20:47:39.388794 IP sea15s12-in-f10.1e100.net.https > 192.168.1.10.49879: Flags [.], seq 31192:32540, ack 1223, win 178, options [nop,nop,TS val 2746690278 ecr 171790], length 1348
20:47:39.388870 IP sea15s12-in-f10.1e100.net.https > 192.168.1.10.49879: Flags [.], seq 32540:33888, ack 1223, win 178, options [nop,nop,TS val 2746690278 ecr 171790], length 1348
20:47:39.388900 IP sea15s12-in-f10.1e100.net.https > 192.168.1.10.49879: Flags [.], seq 33888:35236, ack 1223, win 178, options [nop,nop,TS val 2746690278 ecr 171790], length 1348
20:47:39.388995 IP 192.168.1.10.49879 > sea15s12-in-f10.1e100.net.https: Flags [.], ack 21756, win 515, options [nop,nop,TS val 171793 ecr 2746690274], length 0
20:47:39.391544 IP sea15s12-in-f10.1e100.net.https > 192.168.1.10.49879: Flags [.], seq 35236:36584, ack 1223, win 178, options [nop,nop,TS val 2746690281 ecr 171790], length 1348
20:47:39.391645 IP sea15s12-in-f10.1e100.net.https > 192.168.1.10.49879: Flags [.], seq 36584:37932, ack 1223, win 178, options [nop,nop,TS val 2746690281 ecr 171790], length 1348
20:47:39.394359 IP sea15s12-in-f10.1e100.net.https > 192.168.1.10.49879: Flags [.], seq 37932:39280, ack 1223, win 178, options [nop,nop,TS val 2746690284 ecr 171790], length 1348
20:47:39.394452 IP sea15s12-in-f10.1e100.net.https > 192.168.1.10.49879: Flags [.], seq 39280:40628, ack 1223, win 178, options [nop,nop,TS val 2746690284 ecr 171790], length 1348
20:47:39.397130 IP sea15s12-in-f10.1e100.net.https > 192.168.1.10.49879: Flags [.], seq 40628:41976, ack 1223, win 178, options [nop,nop,TS val 2746690287 ecr 171790], length 1348
20:47:39.397198 IP sea15s12-in-f10.1e100.net.https > 192.168.1.10.49879: Flags [.], seq 41976:43324, ack 1223, win 178, options [nop,nop,TS val 2746690287 ecr 171790], length 1348
20:47:39.400012 IP sea15s12-in-f10.1e100.net.https > 192.168.1.10.49879: Flags [.], seq 43324:44672, ack 1223, win 178, options [nop,nop,TS val 2746690289 ecr 171791], length 1348
20:47:39.400096 IP sea15s12-in-f10.1e100.net.https > 192.168.1.10.49879: Flags [.], seq 44672:46020, ack 1223, win 178, options [nop,nop,TS val 2746690289 ecr 171791], length 1348
20:47:39.400129 IP sea15s12-in-f10.1e100.net.https > 192.168.1.10.49879: Flags [.], seq 46020:47368, ack 1223, win 178, options [nop,nop,TS val 2746690289 ecr 171791], length 1348
20:47:39.402713 IP sea15s12-in-f10.1e100.net.https > 192.168.1.10.49879: Flags [.], seq 47368:48716, ack 1223, win 178, options [nop,nop,TS val 2746690292 ecr 171791], length 1348
20:47:39.402797 IP sea15s12-in-f10.1e100.net.https > 192.168.1.10.49879: Flags [.], seq 48716:50064, ack 1223, win 178, options [nop,nop,TS val 2746690292 ecr 171791], length 1348
20:47:39.405630 IP sea15s12-in-f10.1e100.net.https > 192.168.1.10.49879: Flags [.], seq 50064:51412, ack 1223, win 178, options [nop,nop,TS val 2746690295 ecr 171791], length 1348
20:47:39.405732 IP sea15s12-in-f10.1e100.net.https > 192.168.1.10.49879: Flags [.], seq 51412:52760, ack 1223, win 178, options [nop,nop,TS val 2746690295 ecr 171791], length 1348
20:47:39.408371 IP sea15s12-in-f10.1e100.net.https > 192.168.1.10.49879: Flags [.], seq 52760:54108, ack 1223, win 178, options [nop,nop,TS val 2746690298 ecr 171791], length 1348
20:47:39.408400 IP sea15s12-in-f10.1e100.net.https > 192.168.1.10.49879: Flags [.], seq 54108:55456, ack 1223, win 178, options [nop,nop,TS val 2746690298 ecr 171791], length 1348
20:47:39.408589 IP 192.168.1.10.49879 > sea15s12-in-f10.1e100.net.https: Flags [.], ack 23104, win 536, options [nop,nop,TS val 171795 ecr 2746690274], length 0
20:47:39.409108 IP sea15s12-in-f10.1e100.net.https > 192.168.1.10.49879: Flags [.], seq 55456:56804, ack 1223, win 178, options [nop,nop,TS val 2746690301 ecr 171791], length 1348
20:47:39.418655 IP sea15s12-in-f10.1e100.net.https > 192.168.1.10.49879: Flags [.], seq 56804:58152, ack 1223, win 178, options [nop,nop,TS val 2746690314 ecr 171793], length 1348
20:47:39.418707 IP sea15s12-in-f10.1e100.net.https > 192.168.1.10.49879: Flags [.], seq 58152:59500, ack 1223, win 178, options [nop,nop,TS val 2746690314 ecr 171793], length 1348
20:47:39.423900 IP 192.168.1.10.49879 > sea15s12-in-f10.1e100.net.https: Flags [.], ack 24452, win 557, options [nop,nop,TS val 171795 ecr 2746690274], length 0
20:47:39.423913 IP 192.168.1.10.49879 > sea15s12-in-f10.1e100.net.https: Flags [.], ack 25800, win 578, options [nop,nop,TS val 171797 ecr 2746690274], length 0
20:47:39.437957 IP sea15s12-in-f10.1e100.net.https > 192.168.1.10.49879: Flags [.], seq 59500:60848, ack 1223, win 178, options [nop,nop,TS val 2746690333 ecr 171795], length 1348
20:47:39.438006 IP sea15s12-in-f10.1e100.net.https > 192.168.1.10.49879: Flags [.], seq 60848:62196, ack 1223, win 178, options [nop,nop,TS val 2746690333 ecr 171795], length 1348
20:47:39.453266 IP sea15s12-in-f10.1e100.net.https > 192.168.1.10.49879: Flags [.], seq 62196:63544, ack 1223, win 178, options [nop,nop,TS val 2746690348 ecr 171795], length 1348
20:47:39.453364 IP sea15s12-in-f10.1e100.net.https > 192.168.1.10.49879: Flags [.], seq 63544:64892, ack 1223, win 178, options [nop,nop,TS val 2746690348 ecr 171795], length 1348
20:47:39.454346 IP sea15s12-in-f10.1e100.net.https > 192.168.1.10.49879: Flags [.], seq 64892:66240, ack 1223, win 178, options [nop,nop,TS val 2746690348 ecr 171797], length 1348
20:47:39.454402 IP sea15s12-in-f10.1e100.net.https > 192.168.1.10.49879: Flags [.], seq 66240:67588, ack 1223, win 178, options [nop,nop,TS val 2746690348 ecr 171797], length 1348
20:47:39.454416 IP sea15s12-in-f10.1e100.net.https > 192.168.1.10.49879: Flags [.], seq 67588:68936, ack 1223, win 178, options [nop,nop,TS val 2746690348 ecr 171797], length 1348
20:47:39.458267 IP 192.168.1.10.49879 > sea15s12-in-f10.1e100.net.https: Flags [.], ack 27148, win 599, options [nop,nop,TS val 171799 ecr 2746690274], length 0
20:47:39.458285 IP 192.168.1.10.49879 > sea15s12-in-f10.1e100.net.https: Flags [.], ack 28496, win 620, options [nop,nop,TS val 171799 ecr 2746690274], length 0
20:47:39.458297 IP 192.168.1.10.49879 > sea15s12-in-f10.1e100.net.https: Flags [.], ack 29844, win 641, options [nop,nop,TS val 171800 ecr 2746690275], length 0
20:47:39.458308 IP 192.168.1.10.49879 > sea15s12-in-f10.1e100.net.https: Flags [.], ack 31192, win 662, options [nop,nop,TS val 171800 ecr 2746690275], length 0
20:47:39.458319 IP 192.168.1.10.49879 > sea15s12-in-f10.1e100.net.https: Flags [.], ack 32540, win 683, options [nop,nop,TS val 171800 ecr 2746690278], length 0
20:47:39.458330 IP 192.168.1.10.49879 > sea15s12-in-f10.1e100.net.https: Flags [.], ack 33888, win 704, options [nop,nop,TS val 171800 ecr 2746690278], length 0
20:47:39.462633 IP 192.168.1.10.49879 > sea15s12-in-f10.1e100.net.https: Flags [.], ack 35236, win 725, options [nop,nop,TS val 171801 ecr 2746690278], length 0
20:47:39.467001 IP 192.168.1.10.49879 > sea15s12-in-f10.1e100.net.https: Flags [.], ack 36584, win 746, options [nop,nop,TS val 171801 ecr 2746690281], length 0
20:47:39.477403 IP 192.168.1.10.49879 > sea15s12-in-f10.1e100.net.https: Flags [.], ack 37932, win 767, options [nop,nop,TS val 171801 ecr 2746690281], length 0
20:47:39.477417 IP 192.168.1.10.49879 > sea15s12-in-f10.1e100.net.https: Flags [.], ack 39280, win 789, options [nop,nop,TS val 171801 ecr 2746690284], length 0
20:47:39.477429 IP 192.168.1.10.49879 > sea15s12-in-f10.1e100.net.https: Flags [.], ack 40628, win 810, options [nop,nop,TS val 171801 ecr 2746690284], length 0
20:47:39.477440 IP 192.168.1.10.49879 > sea15s12-in-f10.1e100.net.https: Flags [.], ack 41976, win 831, options [nop,nop,TS val 171801 ecr 2746690287], length 0
20:47:39.477450 IP 192.168.1.10.49879 > sea15s12-in-f10.1e100.net.https: Flags [.], ack 43324, win 852, options [nop,nop,TS val 171801 ecr 2746690287], length 0
20:47:39.477462 IP 192.168.1.10.49879 > sea15s12-in-f10.1e100.net.https: Flags [.], ack 44672, win 873, options [nop,nop,TS val 171801 ecr 2746690289], length 0
20:47:39.481853 IP 192.168.1.10.49879 > sea15s12-in-f10.1e100.net.https: Flags [.], ack 46020, win 894, options [nop,nop,TS val 171801 ecr 2746690289], length 0
20:47:39.481867 IP 192.168.1.10.49879 > sea15s12-in-f10.1e100.net.https: Flags [.], ack 47368, win 915, options [nop,nop,TS val 171801 ecr 2746690289], length 0
20:47:39.481879 IP 192.168.1.10.49879 > sea15s12-in-f10.1e100.net.https: Flags [.], ack 48716, win 936, options [nop,nop,TS val 171801 ecr 2746690292], length 0
20:47:39.481890 IP 192.168.1.10.49879 > sea15s12-in-f10.1e100.net.https: Flags [.], ack 50064, win 957, options [nop,nop,TS val 171801 ecr 2746690292], length 0
20:47:39.481900 IP 192.168.1.10.49879 > sea15s12-in-f10.1e100.net.https: Flags [.], ack 51412, win 978, options [nop,nop,TS val 171802 ecr 2746690295], length 0
20:47:39.481910 IP 192.168.1.10.49879 > sea15s12-in-f10.1e100.net.https: Flags [.], ack 52760, win 999, options [nop,nop,TS val 171802 ecr 2746690295], length 0
20:47:39.481921 IP 192.168.1.10.49879 > sea15s12-in-f10.1e100.net.https: Flags [.], ack 54108, win 1020, options [nop,nop,TS val 171802 ecr 2746690298], length 0
20:47:39.481931 IP 192.168.1.10.49879 > sea15s12-in-f10.1e100.net.https: Flags [.], ack 55456, win 1041, options [nop,nop,TS val 171802 ecr 2746690298], length 0
20:47:39.481941 IP 192.168.1.10.49879 > sea15s12-in-f10.1e100.net.https: Flags [.], ack 56804, win 1062, options [nop,nop,TS val 171802 ecr 2746690301], length 0
20:47:39.486266 IP 192.168.1.10.49879 > sea15s12-in-f10.1e100.net.https: Flags [.], ack 58152, win 1083, options [nop,nop,TS val 171802 ecr 2746690314], length 0
20:47:39.486284 IP 192.168.1.10.49879 > sea15s12-in-f10.1e100.net.https: Flags [.], ack 59500, win 1104, options [nop,nop,TS val 171802 ecr 2746690314], length 0
20:47:39.486296 IP 192.168.1.10.49879 > sea15s12-in-f10.1e100.net.https: Flags [.], ack 60848, win 1126, options [nop,nop,TS val 171802 ecr 2746690333], length 0
20:47:39.486313 IP 192.168.1.10.49879 > sea15s12-in-f10.1e100.net.https: Flags [.], ack 62196, win 1147, options [nop,nop,TS val 171802 ecr 2746690333], length 0
20:47:39.486355 IP 192.168.1.10.49879 > sea15s12-in-f10.1e100.net.https: Flags [.], ack 63544, win 1168, options [nop,nop,TS val 171802 ecr 2746690348], length 0
20:47:39.486369 IP 192.168.1.10.49879 > sea15s12-in-f10.1e100.net.https: Flags [.], ack 64892, win 1189, options [nop,nop,TS val 171802 ecr 2746690348], length 0
20:47:39.486380 IP 192.168.1.10.49879 > sea15s12-in-f10.1e100.net.https: Flags [.], ack 66240, win 1210, options [nop,nop,TS val 171802 ecr 2746690348], length 0
20:47:39.486391 IP 192.168.1.10.49879 > sea15s12-in-f10.1e100.net.https: Flags [.], ack 67588, win 1231, options [nop,nop,TS val 171802 ecr 2746690348], length 0
20:47:39.486401 IP 192.168.1.10.49879 > sea15s12-in-f10.1e100.net.https: Flags [.], ack 68936, win 1252, options [nop,nop,TS val 171802 ecr 2746690348], length 0
20:47:39.486411 IP 192.168.1.10.53621 > sea15s01-in-f131.1e100.net.https: Flags [S], seq 3795568563, win 14600, options [mss 1460,sackOK,TS val 171803 ecr 0,nop,wscale 7], length 0
20:47:39.487716 IP sea15s12-in-f10.1e100.net.https > 192.168.1.10.49879: Flags [.], seq 68936:70284, ack 1223, win 178, options [nop,nop,TS val 2746690383 ecr 171799], length 1348
20:47:39.487819 IP sea15s12-in-f10.1e100.net.https > 192.168.1.10.49879: Flags [.], seq 70284:71632, ack 1223, win 178, options [nop,nop,TS val 2746690383 ecr 171799], length 1348
20:47:39.488886 IP sea15s12-in-f10.1e100.net.https > 192.168.1.10.49879: Flags [.], seq 71632:72980, ack 1223, win 178, options [nop,nop,TS val 2746690383 ecr 171799], length 1348
20:47:39.488955 IP sea15s12-in-f10.1e100.net.https > 192.168.1.10.49879: Flags [.], seq 72980:74328, ack 1223, win 178, options [nop,nop,TS val 2746690383 ecr 171799], length 1348
20:47:39.491091 IP sea15s12-in-f10.1e100.net.https > 192.168.1.10.49879: Flags [.], seq 74328:75676, ack 1223, win 178, options [nop,nop,TS val 2746690383 ecr 171800], length 1348
20:47:39.491141 IP sea15s12-in-f10.1e100.net.https > 192.168.1.10.49879: Flags [.], seq 75676:77024, ack 1223, win 178, options [nop,nop,TS val 2746690383 ecr 171800], length 1348
20:47:39.491926 IP sea15s12-in-f10.1e100.net.https > 192.168.1.10.49879: Flags [.], seq 77024:78372, ack 1223, win 178, options [nop,nop,TS val 2746690384 ecr 171800], length 1348
20:47:39.492000 IP sea15s12-in-f10.1e100.net.https > 192.168.1.10.49879: Flags [.], seq 78372:79720, ack 1223, win 178, options [nop,nop,TS val 2746690384 ecr 171800], length 1348
20:47:39.493633 IP sea15s12-in-f10.1e100.net.https > 192.168.1.10.49879: Flags [.], seq 79720:81068, ack 1223, win 178, options [nop,nop,TS val 2746690386 ecr 171800], length 1348
20:47:39.495277 IP 192.168.1.10.49879 > sea15s12-in-f10.1e100.net.https: Flags [.], ack 70284, win 1273, options [nop,nop,TS val 171804 ecr 2746690383], length 0
20:47:39.495296 IP 192.168.1.10.49879 > sea15s12-in-f10.1e100.net.https: Flags [.], ack 71632, win 1294, options [nop,nop,TS val 171804 ecr 2746690383], length 0
20:47:39.495307 IP 192.168.1.10.49879 > sea15s12-in-f10.1e100.net.https: Flags [.], ack 72980, win 1315, options [nop,nop,TS val 171804 ecr 2746690383], length 0
20:47:39.495318 IP 192.168.1.10.49879 > sea15s12-in-f10.1e100.net.https: Flags [.], ack 74328, win 1336, options [nop,nop,TS val 171804 ecr 2746690383], length 0
20:47:39.495843 IP sea15s12-in-f10.1e100.net.https > 192.168.1.10.49879: Flags [.], seq 81068:82416, ack 1223, win 178, options [nop,nop,TS val 2746690386 ecr 171800], length 1348
20:47:39.495930 IP sea15s12-in-f10.1e100.net.https > 192.168.1.10.49879: Flags [.], seq 82416:83764, ack 1223, win 178, options [nop,nop,TS val 2746690386 ecr 171800], length 1348
20:47:39.498032 IP sea15s12-in-f10.1e100.net.https > 192.168.1.10.49879: Flags [.], seq 83764:85112, ack 1223, win 178, options [nop,nop,TS val 2746690387 ecr 171801], length 1348
20:47:39.498132 IP sea15s12-in-f10.1e100.net.https > 192.168.1.10.49879: Flags [.], seq 85112:86460, ack 1223, win 178, options [nop,nop,TS val 2746690387 ecr 171801], length 1348
20:47:39.499662 IP 192.168.1.10.49879 > sea15s12-in-f10.1e100.net.https: Flags [.], ack 75676, win 1357, options [nop,nop,TS val 171804 ecr 2746690383], length 0
20:47:39.499680 IP 192.168.1.10.49879 > sea15s12-in-f10.1e100.net.https: Flags [.], ack 77024, win 1378, options [nop,nop,TS val 171804 ecr 2746690383], length 0
20:47:39.499692 IP 192.168.1.10.49879 > sea15s12-in-f10.1e100.net.https: Flags [.], ack 78372, win 1399, options [nop,nop,TS val 171804 ecr 2746690384], length 0
20:47:39.499702 IP 192.168.1.10.49879 > sea15s12-in-f10.1e100.net.https: Flags [.], ack 79720, win 1420, options [nop,nop,TS val 171804 ecr 2746690384], length 0
20:47:39.500264 IP sea15s12-in-f10.1e100.net.https > 192.168.1.10.49879: Flags [.], seq 86460:87808, ack 1223, win 178, options [nop,nop,TS val 2746690391 ecr 171801], length 1348
20:47:39.500398 IP sea15s12-in-f10.1e100.net.https > 192.168.1.10.49879: Flags [.], seq 87808:89156, ack 1223, win 178, options [nop,nop,TS val 2746690391 ecr 171801], length 1348
20:47:39.504013 IP 192.168.1.10.49879 > sea15s12-in-f10.1e100.net.https: Flags [.], ack 81068, win 1441, options [nop,nop,TS val 171804 ecr 2746690386], length 0
20:47:39.504029 IP 192.168.1.10.49879 > sea15s12-in-f10.1e100.net.https: Flags [.], ack 82416, win 1463, options [nop,nop,TS val 171805 ecr 2746690386], length 0
20:47:39.504075 IP 192.168.1.10.49879 > sea15s12-in-f10.1e100.net.https: Flags [.], ack 83764, win 1484, options [nop,nop,TS val 171805 ecr 2746690386], length 0
20:47:39.504088 IP 192.168.1.10.49879 > sea15s12-in-f10.1e100.net.https: Flags [.], ack 85112, win 1505, options [nop,nop,TS val 171805 ecr 2746690387], length 0
20:47:39.504100 IP 192.168.1.10.49879 > sea15s12-in-f10.1e100.net.https: Flags [.], ack 86460, win 1526, options [nop,nop,TS val 171805 ecr 2746690387], length 0
20:47:39.504111 IP 192.168.1.10.49879 > sea15s12-in-f10.1e100.net.https: Flags [.], ack 87808, win 1547, options [nop,nop,TS val 171805 ecr 2746690391], length 0
20:47:39.506842 IP sea15s12-in-f10.1e100.net.https > 192.168.1.10.49879: Flags [.], seq 89156:90504, ack 1223, win 178, options [nop,nop,TS val 2746690402 ecr 171801], length 1348
20:47:39.506942 IP sea15s12-in-f10.1e100.net.https > 192.168.1.10.49879: Flags [.], seq 90504:91852, ack 1223, win 178, options [nop,nop,TS val 2746690402 ecr 171801], length 1348
20:47:39.508026 IP sea15s12-in-f10.1e100.net.https > 192.168.1.10.49879: Flags [.], seq 91852:93200, ack 1223, win 178, options [nop,nop,TS val 2746690402 ecr 171801], length 1348
20:47:39.508421 IP 192.168.1.10.49879 > sea15s12-in-f10.1e100.net.https: Flags [.], ack 89156, win 1568, options [nop,nop,TS val 171805 ecr 2746690391], length 0
20:47:39.510409 IP sea15s12-in-f10.1e100.net.https > 192.168.1.10.49879: Flags [.], seq 93200:94548, ack 1223, win 178, options [nop,nop,TS val 2746690402 ecr 171801], length 1348
20:47:39.510534 IP sea15s12-in-f10.1e100.net.https > 192.168.1.10.49879: Flags [.], seq 94548:95896, ack 1223, win 178, options [nop,nop,TS val 2746690402 ecr 171801], length 1348
20:47:39.512652 IP sea15s12-in-f10.1e100.net.https > 192.168.1.10.49879: Flags [.], seq 95896:97244, ack 1223, win 178, options [nop,nop,TS val 2746690402 ecr 171801], length 1348
20:47:39.512802 IP sea15s12-in-f10.1e100.net.https > 192.168.1.10.49879: Flags [.], seq 97244:98592, ack 1223, win 178, options [nop,nop,TS val 2746690402 ecr 171801], length 1348
20:47:39.513146 IP 192.168.1.10.49879 > sea15s12-in-f10.1e100.net.https: Flags [.], ack 90504, win 1589, options [nop,nop,TS val 171806 ecr 2746690402], length 0
20:47:39.513165 IP 192.168.1.10.49879 > sea15s12-in-f10.1e100.net.https: Flags [.], ack 91852, win 1610, options [nop,nop,TS val 171806 ecr 2746690402], length 0
20:47:39.513178 IP 192.168.1.10.49879 > sea15s12-in-f10.1e100.net.https: Flags [.], ack 93200, win 1631, options [nop,nop,TS val 171806 ecr 2746690402], length 0
20:47:39.513188 IP 192.168.1.10.49879 > sea15s12-in-f10.1e100.net.https: Flags [.], ack 94548, win 1652, options [nop,nop,TS val 171806 ecr 2746690402], length 0
20:47:39.513663 IP sea15s12-in-f10.1e100.net.https > 192.168.1.10.49879: Flags [.], seq 98592:99940, ack 1223, win 178, options [nop,nop,TS val 2746690405 ecr 171801], length 1348
20:47:39.513765 IP sea15s12-in-f10.1e100.net.https > 192.168.1.10.49879: Flags [.], seq 99940:101288, ack 1223, win 178, options [nop,nop,TS val 2746690405 ecr 171801], length 1348
20:47:39.515084 IP sea15s12-in-f10.1e100.net.https > 192.168.1.10.49879: Flags [.], seq 101288:102636, ack 1223, win 178, options [nop,nop,TS val 2746690408 ecr 171802], length 1348
20:47:39.517179 IP sea15s12-in-f10.1e100.net.https > 192.168.1.10.49879: Flags [.], seq 102636:103984, ack 1223, win 178, options [nop,nop,TS val 2746690408 ecr 171802], length 1348
20:47:39.517297 IP sea15s12-in-f10.1e100.net.https > 192.168.1.10.49879: Flags [.], seq 103984:105332, ack 1223, win 178, options [nop,nop,TS val 2746690408 ecr 171802], length 1348
20:47:39.517513 IP 192.168.1.10.49879 > sea15s12-in-f10.1e100.net.https: Flags [.], ack 95896, win 1673, options [nop,nop,TS val 171806 ecr 2746690402], length 0
20:47:39.517532 IP 192.168.1.10.49879 > sea15s12-in-f10.1e100.net.https: Flags [.], ack 97244, win 1694, options [nop,nop,TS val 171806 ecr 2746690402], length 0
20:47:39.517956 IP sea15s01-in-f131.1e100.net.https > 192.168.1.10.53621: Flags [S.], seq 4088012569, ack 3795568564, win 42408, options [mss 1360,sackOK,TS val 1851022829 ecr 171803,nop,wscale 8], length 0
20:47:39.519009 IP sea15s12-in-f10.1e100.net.https > 192.168.1.10.49879: Flags [.], seq 105332:106680, ack 1223, win 178, options [nop,nop,TS val 2746690408 ecr 171802], length 1348
20:47:39.519093 IP sea15s12-in-f10.1e100.net.https > 192.168.1.10.49879: Flags [.], seq 106680:108028, ack 1223, win 178, options [nop,nop,TS val 2746690408 ecr 171802], length 1348
20:47:39.519771 IP sea15s12-in-f10.1e100.net.https > 192.168.1.10.49879: Flags [.], seq 108028:109376, ack 1223, win 178, options [nop,nop,TS val 2746690412 ecr 171802], length 1348
20:47:39.519848 IP sea15s12-in-f10.1e100.net.https > 192.168.1.10.49879: Flags [.], seq 109376:110724, ack 1223, win 178, options [nop,nop,TS val 2746690412 ecr 171802], length 1348
20:47:39.521557 IP sea15s12-in-f10.1e100.net.https > 192.168.1.10.49879: Flags [.], seq 110724:112072, ack 1223, win 178, options [nop,nop,TS val 2746690414 ecr 171802], length 1348
20:47:39.521664 IP sea15s12-in-f10.1e100.net.https > 192.168.1.10.49879: Flags [.], seq 112072:113420, ack 1223, win 178, options [nop,nop,TS val 2746690414 ecr 171802], length 1348
20:47:39.521771 IP 192.168.1.10.49879 > sea15s12-in-f10.1e100.net.https: Flags [.], ack 98592, win 1715, options [nop,nop,TS val 171806 ecr 2746690402], length 0
20:47:39.521816 IP 192.168.1.10.49879 > sea15s12-in-f10.1e100.net.https: Flags [.], ack 99940, win 1736, options [nop,nop,TS val 171806 ecr 2746690405], length 0
20:47:39.521831 IP 192.168.1.10.49879 > sea15s12-in-f10.1e100.net.https: Flags [.], ack 101288, win 1757, options [nop,nop,TS val 171806 ecr 2746690405], length 0
20:47:39.523245 IP sea15s12-in-f10.1e100.net.https > 192.168.1.10.49879: Flags [.], seq 113420:114768, ack 1223, win 178, options [nop,nop,TS val 2746690414 ecr 171802], length 1348
20:47:39.523395 IP sea15s12-in-f10.1e100.net.https > 192.168.1.10.49879: Flags [.], seq 114768:116116, ack 1223, win 178, options [nop,nop,TS val 2746690414 ecr 171802], length 1348
20:47:39.524962 IP sea15s12-in-f10.1e100.net.https > 192.168.1.10.49879: Flags [.], seq 116116:117464, ack 1223, win 178, options [nop,nop,TS val 2746690416 ecr 171802], length 1348
20:47:39.525079 IP sea15s12-in-f10.1e100.net.https > 192.168.1.10.49879: Flags [.], seq 117464:118812, ack 1223, win 178, options [nop,nop,TS val 2746690416 ecr 171802], length 1348
20:47:39.525883 IP 192.168.1.10.49879 > sea15s12-in-f10.1e100.net.https: Flags [.], ack 102636, win 1778, options [nop,nop,TS val 171806 ecr 2746690408], length 0
20:47:39.526646 IP sea15s12-in-f10.1e100.net.https > 192.168.1.10.49879: Flags [.], seq 118812:120160, ack 1223, win 178, options [nop,nop,TS val 2746690418 ecr 171802], length 1348
