tcpdump: verbose output suppressed, use -v or -vv for full protocol decode
listening on wlan0, link-type EN10MB (Ethernet), capture size 262144 bytes
00:53:30.578638 IP 192.168.1.10.43992 > server-13-33-151-61.sea4.r.cloudfront.net.www: Flags [S], seq 2159942322, win 65535, options [mss 1460,sackOK,TS val 121747 ecr 0,nop,wscale 8], length 0
00:53:30.581547 IP 192.168.1.10.41692 > sea15s07-in-f67.1e100.net.www: Flags [S], seq 884396345, win 65535, options [mss 1460,sackOK,TS val 121747 ecr 0,nop,wscale 8], length 0
00:53:30.586431 IP server-13-33-151-61.sea4.r.cloudfront.net.www > 192.168.1.10.43992: Flags [S.], seq 386673692, ack 2159942323, win 26960, options [mss 1360,sackOK,TS val 3160305673 ecr 121747,nop,wscale 7], length 0
00:53:30.589379 IP sea15s07-in-f67.1e100.net.www > 192.168.1.10.41692: Flags [S.], seq 2040251552, ack 884396346, win 26960, options [mss 1360,sackOK,TS val 3160305674 ecr 121747,nop,wscale 7], length 0
00:53:30.597015 IP 192.168.1.10.43992 > server-13-33-151-61.sea4.r.cloudfront.net.www: Flags [.], ack 1, win 343, options [nop,nop,TS val 121749 ecr 3160305673], length 0
00:53:30.597029 IP 192.168.1.10.41692 > sea15s07-in-f67.1e100.net.www: Flags [.], ack 1, win 343, options [nop,nop,TS val 121749 ecr 3160305674], length 0
00:53:30.597048 IP 192.168.1.10.41692 > sea15s07-in-f67.1e100.net.www: Flags [P.], seq 1:188, ack 1, win 343, options [nop,nop,TS val 121749 ecr 3160305674], length 187: HTTP: GET /generate_204 HTTP/1.1
00:53:30.598409 IP 192.168.1.10.43992 > server-13-33-151-61.sea4.r.cloudfront.net.www: Flags [P.], seq 1:342, ack 1, win 343, options [nop,nop,TS val 121749 ecr 3160305673], length 341: HTTP: GET /xtra2.bin HTTP/1.1
00:53:30.604850 IP sea15s07-in-f67.1e100.net.www > 192.168.1.10.41692: Flags [.], ack 188, win 219, options [nop,nop,TS val 3160305678 ecr 121749], length 0
00:53:30.606098 IP server-13-33-151-61.sea4.r.cloudfront.net.www > 192.168.1.10.43992: Flags [.], ack 342, win 219, options [nop,nop,TS val 3160305678 ecr 121749], length 0
00:53:30.628298 IP sea15s07-in-f67.1e100.net.www > 192.168.1.10.41692: Flags [P.], seq 1:227, ack 188, win 219, options [nop,nop,TS val 3160305684 ecr 121749], length 226: HTTP: HTTP/1.1 204 No Content
00:53:30.631098 IP 192.168.1.10.41692 > sea15s07-in-f67.1e100.net.www: Flags [.], ack 227, win 347, options [nop,nop,TS val 121752 ecr 3160305684], length 0
00:53:31.016508 IP server-13-33-151-61.sea4.r.cloudfront.net.www > 192.168.1.10.43992: Flags [P.], seq 1:625, ack 342, win 219, options [nop,nop,TS val 3160305781 ecr 121749], length 624: HTTP: HTTP/1.1 200 OK
00:53:31.016799 IP server-13-33-151-61.sea4.r.cloudfront.net.www > 192.168.1.10.43992: Flags [.], seq 625:1973, ack 342, win 219, options [nop,nop,TS val 3160305781 ecr 121749], length 1348: HTTP
00:53:31.016855 IP server-13-33-151-61.sea4.r.cloudfront.net.www > 192.168.1.10.43992: Flags [.], seq 1973:3321, ack 342, win 219, options [nop,nop,TS val 3160305781 ecr 121749], length 1348: HTTP
00:53:31.016886 IP server-13-33-151-61.sea4.r.cloudfront.net.www > 192.168.1.10.43992: Flags [.], seq 3321:4669, ack 342, win 219, options [nop,nop,TS val 3160305781 ecr 121749], length 1348: HTTP
00:53:31.016916 IP server-13-33-151-61.sea4.r.cloudfront.net.www > 192.168.1.10.43992: Flags [P.], seq 4669:4721, ack 342, win 219, options [nop,nop,TS val 3160305781 ecr 121749], length 52: HTTP
00:53:31.017145 IP server-13-33-151-61.sea4.r.cloudfront.net.www > 192.168.1.10.43992: Flags [.], seq 4721:6069, ack 342, win 219, options [nop,nop,TS val 3160305781 ecr 121749], length 1348: HTTP
00:53:31.017167 IP server-13-33-151-61.sea4.r.cloudfront.net.www > 192.168.1.10.43992: Flags [.], seq 6069:7417, ack 342, win 219, options [nop,nop,TS val 3160305781 ecr 121749], length 1348: HTTP
00:53:31.017179 IP server-13-33-151-61.sea4.r.cloudfront.net.www > 192.168.1.10.43992: Flags [.], seq 7417:8765, ack 342, win 219, options [nop,nop,TS val 3160305781 ecr 121749], length 1348: HTTP
00:53:31.017190 IP server-13-33-151-61.sea4.r.cloudfront.net.www > 192.168.1.10.43992: Flags [.], seq 8765:10113, ack 342, win 219, options [nop,nop,TS val 3160305781 ecr 121749], length 1348: HTTP
00:53:31.017214 IP server-13-33-151-61.sea4.r.cloudfront.net.www > 192.168.1.10.43992: Flags [.], seq 10113:11461, ack 342, win 219, options [nop,nop,TS val 3160305781 ecr 121749], length 1348: HTTP
00:53:31.021024 IP 192.168.1.10.43992 > server-13-33-151-61.sea4.r.cloudfront.net.www: Flags [.], ack 625, win 348, options [nop,nop,TS val 121791 ecr 3160305781], length 0
00:53:31.021039 IP 192.168.1.10.43992 > server-13-33-151-61.sea4.r.cloudfront.net.www: Flags [.], ack 1973, win 358, options [nop,nop,TS val 121791 ecr 3160305781], length 0
00:53:31.021049 IP 192.168.1.10.43992 > server-13-33-151-61.sea4.r.cloudfront.net.www: Flags [.], ack 3321, win 369, options [nop,nop,TS val 121791 ecr 3160305781], length 0
00:53:31.021070 IP 192.168.1.10.43992 > server-13-33-151-61.sea4.r.cloudfront.net.www: Flags [.], ack 4669, win 379, options [nop,nop,TS val 121791 ecr 3160305781], length 0
00:53:31.021355 IP 192.168.1.10.43992 > server-13-33-151-61.sea4.r.cloudfront.net.www: Flags [.], ack 4721, win 379, options [nop,nop,TS val 121791 ecr 3160305781], length 0
00:53:31.021367 IP 192.168.1.10.43992 > server-13-33-151-61.sea4.r.cloudfront.net.www: Flags [.], ack 6069, win 390, options [nop,nop,TS val 121791 ecr 3160305781], length 0
00:53:31.021376 IP 192.168.1.10.43992 > server-13-33-151-61.sea4.r.cloudfront.net.www: Flags [.], ack 7417, win 400, options [nop,nop,TS val 121791 ecr 3160305781], length 0
00:53:31.021385 IP 192.168.1.10.43992 > server-13-33-151-61.sea4.r.cloudfront.net.www: Flags [.], ack 8765, win 411, options [nop,nop,TS val 121791 ecr 3160305781], length 0
00:53:31.021393 IP 192.168.1.10.43992 > server-13-33-151-61.sea4.r.cloudfront.net.www: Flags [.], ack 10113, win 421, options [nop,nop,TS val 121791 ecr 3160305781], length 0
00:53:31.021406 IP 192.168.1.10.43992 > server-13-33-151-61.sea4.r.cloudfront.net.www: Flags [.], ack 11461, win 432, options [nop,nop,TS val 121791 ecr 3160305781], length 0
00:53:31.029055 IP server-13-33-151-61.sea4.r.cloudfront.net.www > 192.168.1.10.43992: Flags [.], seq 11461:12809, ack 342, win 219, options [nop,nop,TS val 3160305784 ecr 121791], length 1348: HTTP
00:53:31.029123 IP server-13-33-151-61.sea4.r.cloudfront.net.www > 192.168.1.10.43992: Flags [.], seq 12809:14157, ack 342, win 219, options [nop,nop,TS val 3160305784 ecr 121791], length 1348: HTTP
00:53:31.029156 IP server-13-33-151-61.sea4.r.cloudfront.net.www > 192.168.1.10.43992: Flags [.], seq 14157:15505, ack 342, win 219, options [nop,nop,TS val 3160305784 ecr 121791], length 1348: HTTP
00:53:31.029185 IP server-13-33-151-61.sea4.r.cloudfront.net.www > 192.168.1.10.43992: Flags [.], seq 15505:16853, ack 342, win 219, options [nop,nop,TS val 3160305784 ecr 121791], length 1348: HTTP
00:53:31.029213 IP server-13-33-151-61.sea4.r.cloudfront.net.www > 192.168.1.10.43992: Flags [.], seq 16853:18201, ack 342, win 219, options [nop,nop,TS val 3160305784 ecr 121791], length 1348: HTTP
00:53:31.029227 IP server-13-33-151-61.sea4.r.cloudfront.net.www > 192.168.1.10.43992: Flags [.], seq 18201:19549, ack 342, win 219, options [nop,nop,TS val 3160305784 ecr 121791], length 1348: HTTP
00:53:31.029238 IP server-13-33-151-61.sea4.r.cloudfront.net.www > 192.168.1.10.43992: Flags [.], seq 19549:20897, ack 342, win 219, options [nop,nop,TS val 3160305784 ecr 121791], length 1348: HTTP
00:53:31.029393 IP server-13-33-151-61.sea4.r.cloudfront.net.www > 192.168.1.10.43992: Flags [.], seq 20897:22245, ack 342, win 219, options [nop,nop,TS val 3160305784 ecr 121791], length 1348: HTTP
00:53:31.029416 IP server-13-33-151-61.sea4.r.cloudfront.net.www > 192.168.1.10.43992: Flags [.], seq 22245:23593, ack 342, win 219, options [nop,nop,TS val 3160305784 ecr 121791], length 1348: HTTP
00:53:31.029428 IP server-13-33-151-61.sea4.r.cloudfront.net.www > 192.168.1.10.43992: Flags [P.], seq 23593:24379, ack 342, win 219, options [nop,nop,TS val 3160305784 ecr 121791], length 786: HTTP
00:53:31.029537 IP server-13-33-151-61.sea4.r.cloudfront.net.www > 192.168.1.10.43992: Flags [.], seq 24379:25727, ack 342, win 219, options [nop,nop,TS val 3160305784 ecr 121791], length 1348: HTTP
00:53:31.029556 IP server-13-33-151-61.sea4.r.cloudfront.net.www > 192.168.1.10.43992: Flags [.], seq 25727:27075, ack 342, win 219, options [nop,nop,TS val 3160305784 ecr 121791], length 1348: HTTP
00:53:31.029568 IP server-13-33-151-61.sea4.r.cloudfront.net.www > 192.168.1.10.43992: Flags [P.], seq 27075:27123, ack 342, win 219, options [nop,nop,TS val 3160305784 ecr 121791], length 48: HTTP
00:53:31.029684 IP server-13-33-151-61.sea4.r.cloudfront.net.www > 192.168.1.10.43992: Flags [.], seq 27123:28471, ack 342, win 219, options [nop,nop,TS val 3160305784 ecr 121791], length 1348: HTTP
00:53:31.029703 IP server-13-33-151-61.sea4.r.cloudfront.net.www > 192.168.1.10.43992: Flags [.], seq 28471:29819, ack 342, win 219, options [nop,nop,TS val 3160305784 ecr 121791], length 1348: HTTP
00:53:31.029714 IP server-13-33-151-61.sea4.r.cloudfront.net.www > 192.168.1.10.43992: Flags [.], seq 29819:31167, ack 342, win 219, options [nop,nop,TS val 3160305784 ecr 121791], length 1348: HTTP
00:53:31.029725 IP server-13-33-151-61.sea4.r.cloudfront.net.www > 192.168.1.10.43992: Flags [P.], seq 31167:31219, ack 342, win 219, options [nop,nop,TS val 3160305784 ecr 121791], length 52: HTTP
00:53:31.034680 IP 192.168.1.10.43992 > server-13-33-151-61.sea4.r.cloudfront.net.www: Flags [.], ack 12809, win 442, options [nop,nop,TS val 121793 ecr 3160305784], length 0
00:53:31.034697 IP 192.168.1.10.43992 > server-13-33-151-61.sea4.r.cloudfront.net.www: Flags [.], ack 14157, win 453, options [nop,nop,TS val 121793 ecr 3160305784], length 0
00:53:31.034707 IP 192.168.1.10.43992 > server-13-33-151-61.sea4.r.cloudfront.net.www: Flags [.], ack 15505, win 463, options [nop,nop,TS val 121793 ecr 3160305784], length 0
00:53:31.034717 IP 192.168.1.10.43992 > server-13-33-151-61.sea4.r.cloudfront.net.www: Flags [.], ack 16853, win 474, options [nop,nop,TS val 121793 ecr 3160305784], length 0
00:53:31.034726 IP 192.168.1.10.43992 > server-13-33-151-61.sea4.r.cloudfront.net.www: Flags [.], ack 18201, win 484, options [nop,nop,TS val 121793 ecr 3160305784], length 0
00:53:31.034736 IP 192.168.1.10.43992 > server-13-33-151-61.sea4.r.cloudfront.net.www: Flags [.], ack 19549, win 495, options [nop,nop,TS val 121793 ecr 3160305784], length 0
00:53:31.034745 IP 192.168.1.10.43992 > server-13-33-151-61.sea4.r.cloudfront.net.www: Flags [.], ack 20897, win 506, options [nop,nop,TS val 121793 ecr 3160305784], length 0
00:53:31.034762 IP 192.168.1.10.43992 > server-13-33-151-61.sea4.r.cloudfront.net.www: Flags [.], ack 22245, win 516, options [nop,nop,TS val 121793 ecr 3160305784], length 0
00:53:31.036148 IP 192.168.1.10.43992 > server-13-33-151-61.sea4.r.cloudfront.net.www: Flags [.], ack 23593, win 527, options [nop,nop,TS val 121793 ecr 3160305784], length 0
00:53:31.036159 IP 192.168.1.10.43992 > server-13-33-151-61.sea4.r.cloudfront.net.www: Flags [.], ack 24379, win 537, options [nop,nop,TS val 121793 ecr 3160305784], length 0
00:53:31.036169 IP 192.168.1.10.43992 > server-13-33-151-61.sea4.r.cloudfront.net.www: Flags [.], ack 25727, win 548, options [nop,nop,TS val 121793 ecr 3160305784], length 0
00:53:31.036178 IP 192.168.1.10.43992 > server-13-33-151-61.sea4.r.cloudfront.net.www: Flags [.], ack 27075, win 558, options [nop,nop,TS val 121793 ecr 3160305784], length 0
00:53:31.036187 IP 192.168.1.10.43992 > server-13-33-151-61.sea4.r.cloudfront.net.www: Flags [.], ack 27123, win 558, options [nop,nop,TS val 121793 ecr 3160305784], length 0
00:53:31.036196 IP 192.168.1.10.43992 > server-13-33-151-61.sea4.r.cloudfront.net.www: Flags [.], ack 28471, win 569, options [nop,nop,TS val 121793 ecr 3160305784], length 0
00:53:31.036206 IP 192.168.1.10.43992 > server-13-33-151-61.sea4.r.cloudfront.net.www: Flags [.], ack 29819, win 579, options [nop,nop,TS val 121793 ecr 3160305784], length 0
00:53:31.036215 IP 192.168.1.10.43992 > server-13-33-151-61.sea4.r.cloudfront.net.www: Flags [.], ack 31167, win 590, options [nop,nop,TS val 121793 ecr 3160305784], length 0
00:53:31.036227 IP 192.168.1.10.43992 > server-13-33-151-61.sea4.r.cloudfront.net.www: Flags [.], ack 31219, win 590, options [nop,nop,TS val 121793 ecr 3160305784], length 0
00:53:31.042713 IP server-13-33-151-61.sea4.r.cloudfront.net.www > 192.168.1.10.43992: Flags [.], seq 31219:32567, ack 342, win 219, options [nop,nop,TS val 3160305787 ecr 121793], length 1348: HTTP
00:53:31.042803 IP server-13-33-151-61.sea4.r.cloudfront.net.www > 192.168.1.10.43992: Flags [.], seq 32567:33915, ack 342, win 219, options [nop,nop,TS val 3160305787 ecr 121793], length 1348: HTTP
00:53:31.042835 IP server-13-33-151-61.sea4.r.cloudfront.net.www > 192.168.1.10.43992: Flags [.], seq 33915:35263, ack 342, win 219, options [nop,nop,TS val 3160305787 ecr 121793], length 1348: HTTP
00:53:31.042864 IP server-13-33-151-61.sea4.r.cloudfront.net.www > 192.168.1.10.43992: Flags [P.], seq 35263:35315, ack 342, win 219, options [nop,nop,TS val 3160305787 ecr 121793], length 52: HTTP
00:53:31.043267 IP server-13-33-151-61.sea4.r.cloudfront.net.www > 192.168.1.10.43992: Flags [.], seq 35315:36663, ack 342, win 219, options [nop,nop,TS val 3160305787 ecr 121793], length 1348: HTTP
00:53:31.043299 IP server-13-33-151-61.sea4.r.cloudfront.net.www > 192.168.1.10.43992: Flags [.], seq 36663:38011, ack 342, win 219, options [nop,nop,TS val 3160305787 ecr 121793], length 1348: HTTP
00:53:31.043312 IP server-13-33-151-61.sea4.r.cloudfront.net.www > 192.168.1.10.43992: Flags [.], seq 38011:39359, ack 342, win 219, options [nop,nop,TS val 3160305787 ecr 121793], length 1348: HTTP
00:53:31.043324 IP server-13-33-151-61.sea4.r.cloudfront.net.www > 192.168.1.10.43992: Flags [.], seq 39359:40707, ack 342, win 219, options [nop,nop,TS val 3160305787 ecr 121793], length 1348: HTTP
00:53:31.043336 IP server-13-33-151-61.sea4.r.cloudfront.net.www > 192.168.1.10.43992: Flags [.], seq 40707:42055, ack 342, win 219, options [nop,nop,TS val 3160305787 ecr 121793], length 1348: HTTP
00:53:31.043346 IP server-13-33-151-61.sea4.r.cloudfront.net.www > 192.168.1.10.43992: Flags [.], seq 42055:43403, ack 342, win 219, options [nop,nop,TS val 3160305787 ecr 121793], length 1348: HTTP
00:53:31.043357 IP server-13-33-151-61.sea4.r.cloudfront.net.www > 192.168.1.10.43992: Flags [.], seq 43403:44751, ack 342, win 219, options [nop,nop,TS val 3160305787 ecr 121793], length 1348: HTTP
00:53:31.043367 IP server-13-33-151-61.sea4.r.cloudfront.net.www > 192.168.1.10.43992: Flags [.], seq 44751:46099, ack 342, win 219, options [nop,nop,TS val 3160305787 ecr 121793], length 1348: HTTP
00:53:31.043379 IP server-13-33-151-61.sea4.r.cloudfront.net.www > 192.168.1.10.43992: Flags [.], seq 46099:47447, ack 342, win 219, options [nop,nop,TS val 3160305787 ecr 121793], length 1348: HTTP
00:53:31.043390 IP server-13-33-151-61.sea4.r.cloudfront.net.www > 192.168.1.10.43992: Flags [.], seq 47447:48795, ack 342, win 219, options [nop,nop,TS val 3160305787 ecr 121793], length 1348: HTTP
00:53:31.043403 IP server-13-33-151-61.sea4.r.cloudfront.net.www > 192.168.1.10.43992: Flags [.], seq 48795:50143, ack 342, win 219, options [nop,nop,TS val 3160305787 ecr 121793], length 1348: HTTP
00:53:31.043413 IP server-13-33-151-61.sea4.r.cloudfront.net.www > 192.168.1.10.43992: Flags [.], seq 50143:51491, ack 342, win 219, options [nop,nop,TS val 3160305787 ecr 121793], length 1348: HTTP
00:53:31.043423 IP server-13-33-151-61.sea4.r.cloudfront.net.www > 192.168.1.10.43992: Flags [.], seq 51491:52839, ack 342, win 219, options [nop,nop,TS val 3160305787 ecr 121793], length 1348: HTTP
00:53:31.043433 IP server-13-33-151-61.sea4.r.cloudfront.net.www > 192.168.1.10.43992: Flags [.], seq 52839:54187, ack 342, win 219, options [nop,nop,TS val 3160305787 ecr 121793], length 1348: HTTP
00:53:31.043445 IP server-13-33-151-61.sea4.r.cloudfront.net.www > 192.168.1.10.43992: Flags [.], seq 54187:55535, ack 342, win 219, options [nop,nop,TS val 3160305787 ecr 121793], length 1348: HTTP
00:53:31.044132 IP server-13-33-151-61.sea4.r.cloudfront.net.www > 192.168.1.10.43992: Flags [.], seq 55535:56883, ack 342, win 219, options [nop,nop,TS val 3160305788 ecr 121793], length 1348: HTTP
00:53:31.044193 IP server-13-33-151-61.sea4.r.cloudfront.net.www > 192.168.1.10.43992: Flags [.], seq 56883:58231, ack 342, win 219, options [nop,nop,TS val 3160305788 ecr 121793], length 1348: HTTP
00:53:31.044248 IP server-13-33-151-61.sea4.r.cloudfront.net.www > 192.168.1.10.43992: Flags [.], seq 58231:59579, ack 342, win 219, options [nop,nop,TS val 3160305788 ecr 121793], length 1348: HTTP
00:53:31.044262 IP server-13-33-151-61.sea4.r.cloudfront.net.www > 192.168.1.10.43992: Flags [.], seq 59579:60927, ack 342, win 219, options [nop,nop,TS val 3160305788 ecr 121793], length 1348: HTTP
00:53:31.044274 IP server-13-33-151-61.sea4.r.cloudfront.net.www > 192.168.1.10.43992: Flags [P.], seq 60927:61456, ack 342, win 219, options [nop,nop,TS val 3160305788 ecr 121793], length 529: HTTP
00:53:31.047014 IP 192.168.1.10.43992 > server-13-33-151-61.sea4.r.cloudfront.net.www: Flags [.], ack 32567, win 600, options [nop,nop,TS val 121794 ecr 3160305787], length 0
00:53:31.047029 IP 192.168.1.10.43992 > server-13-33-151-61.sea4.r.cloudfront.net.www: Flags [.], ack 33915, win 611, options [nop,nop,TS val 121794 ecr 3160305787], length 0
00:53:31.047038 IP 192.168.1.10.43992 > server-13-33-151-61.sea4.r.cloudfront.net.www: Flags [.], ack 35263, win 621, options [nop,nop,TS val 121794 ecr 3160305787], length 0
00:53:31.047047 IP 192.168.1.10.43992 > server-13-33-151-61.sea4.r.cloudfront.net.www: Flags [.], ack 35315, win 621, options [nop,nop,TS val 121794 ecr 3160305787], length 0
00:53:31.047064 IP 192.168.1.10.43992 > server-13-33-151-61.sea4.r.cloudfront.net.www: Flags [.], ack 36663, win 632, options [nop,nop,TS val 121794 ecr 3160305787], length 0
00:53:31.052865 IP 192.168.1.10.43992 > server-13-33-151-61.sea4.r.cloudfront.net.www: Flags [.], ack 38011, win 642, options [nop,nop,TS val 121794 ecr 3160305787], length 0
00:53:31.052878 IP 192.168.1.10.43992 > server-13-33-151-61.sea4.r.cloudfront.net.www: Flags [.], ack 39359, win 653, options [nop,nop,TS val 121794 ecr 3160305787], length 0
00:53:31.052887 IP 192.168.1.10.43992 > server-13-33-151-61.sea4.r.cloudfront.net.www: Flags [.], ack 40707, win 663, options [nop,nop,TS val 121794 ecr 3160305787], length 0
00:53:31.052896 IP 192.168.1.10.43992 > server-13-33-151-61.sea4.r.cloudfront.net.www: Flags [.], ack 42055, win 674, options [nop,nop,TS val 121794 ecr 3160305787], length 0
00:53:31.052906 IP 192.168.1.10.43992 > server-13-33-151-61.sea4.r.cloudfront.net.www: Flags [.], ack 43403, win 685, options [nop,nop,TS val 121794 ecr 3160305787], length 0
00:53:31.052915 IP 192.168.1.10.43992 > server-13-33-151-61.sea4.r.cloudfront.net.www: Flags [.], ack 44751, win 695, options [nop,nop,TS val 121794 ecr 3160305787], length 0
00:53:31.052924 IP 192.168.1.10.43992 > server-13-33-151-61.sea4.r.cloudfront.net.www: Flags [.], ack 46099, win 706, options [nop,nop,TS val 121794 ecr 3160305787], length 0
00:53:31.052933 IP 192.168.1.10.43992 > server-13-33-151-61.sea4.r.cloudfront.net.www: Flags [.], ack 47447, win 716, options [nop,nop,TS val 121794 ecr 3160305787], length 0
00:53:31.052941 IP 192.168.1.10.43992 > server-13-33-151-61.sea4.r.cloudfront.net.www: Flags [.], ack 48795, win 727, options [nop,nop,TS val 121794 ecr 3160305787], length 0
00:53:31.052951 IP 192.168.1.10.43992 > server-13-33-151-61.sea4.r.cloudfront.net.www: Flags [.], ack 50143, win 737, options [nop,nop,TS val 121794 ecr 3160305787], length 0
00:53:31.052961 IP 192.168.1.10.43992 > server-13-33-151-61.sea4.r.cloudfront.net.www: Flags [.], ack 51491, win 748, options [nop,nop,TS val 121794 ecr 3160305787], length 0
00:53:31.052969 IP 192.168.1.10.43992 > server-13-33-151-61.sea4.r.cloudfront.net.www: Flags [.], ack 52839, win 758, options [nop,nop,TS val 121794 ecr 3160305787], length 0
00:53:31.052978 IP 192.168.1.10.43992 > server-13-33-151-61.sea4.r.cloudfront.net.www: Flags [.], ack 54187, win 769, options [nop,nop,TS val 121794 ecr 3160305787], length 0
00:53:31.052987 IP 192.168.1.10.43992 > server-13-33-151-61.sea4.r.cloudfront.net.www: Flags [.], ack 55535, win 779, options [nop,nop,TS val 121794 ecr 3160305787], length 0
00:53:31.053003 IP 192.168.1.10.43992 > server-13-33-151-61.sea4.r.cloudfront.net.www: Flags [.], ack 56883, win 790, options [nop,nop,TS val 121794 ecr 3160305788], length 0
00:53:31.102936 IP server-13-33-151-61.sea4.r.cloudfront.net.www > 192.168.1.10.43992: Flags [P.], seq 60927:61456, ack 342, win 219, options [nop,nop,TS val 3160305803 ecr 121794], length 529: HTTP
00:53:31.170030 IP 192.168.1.10.43992 > server-13-33-151-61.sea4.r.cloudfront.net.www: Flags [.], ack 58231, win 800, options [nop,nop,TS val 121794 ecr 3160305788], length 0
00:53:31.170044 IP 192.168.1.10.43992 > server-13-33-151-61.sea4.r.cloudfront.net.www: Flags [.], ack 59579, win 811, options [nop,nop,TS val 121794 ecr 3160305788], length 0
00:53:31.170052 IP 192.168.1.10.43992 > server-13-33-151-61.sea4.r.cloudfront.net.www: Flags [.], ack 60927, win 821, options [nop,nop,TS val 121794 ecr 3160305788], length 0
00:53:31.170068 IP 192.168.1.10.43992 > server-13-33-151-61.sea4.r.cloudfront.net.www: Flags [.], ack 61456, win 832, options [nop,nop,TS val 121794 ecr 3160305788], length 0
00:53:31.172063 IP 192.168.1.10.43992 > server-13-33-151-61.sea4.r.cloudfront.net.www: Flags [.], ack 61456, win 832, options [nop,nop,TS val 121806 ecr 3160305803,nop,nop,sack 1 {60927:61456}], length 0
00:53:31.187120 IP 192.168.1.10.40821 > sea15s12-in-f206.1e100.net.https: Flags [S], seq 3439061952, win 65535, options [mss 1460,sackOK,TS val 121808 ecr 0,nop,wscale 8], length 0
00:53:31.217566 IP sea15s12-in-f206.1e100.net.https > 192.168.1.10.40821: Flags [S.], seq 5021471, ack 3439061953, win 42408, options [mss 1360,sackOK,TS val 610999161 ecr 121808,nop,wscale 8], length 0
00:53:31.219895 IP 192.168.1.10.40821 > sea15s12-in-f206.1e100.net.https: Flags [.], ack 1, win 343, options [nop,nop,TS val 121811 ecr 610999161], length 0
00:53:31.312127 IP 192.168.1.10.40821 > sea15s12-in-f206.1e100.net.https: Flags [P.], seq 1:174, ack 1, win 343, options [nop,nop,TS val 121820 ecr 610999161], length 173
00:53:31.342591 IP sea15s12-in-f206.1e100.net.https > 192.168.1.10.40821: Flags [.], ack 174, win 170, options [nop,nop,TS val 610999286 ecr 121820], length 0
00:53:31.349874 IP sea15s12-in-f206.1e100.net.https > 192.168.1.10.40821: Flags [.], seq 1:1349, ack 174, win 170, options [nop,nop,TS val 610999293 ecr 121820], length 1348
00:53:31.349978 IP sea15s12-in-f206.1e100.net.https > 192.168.1.10.40821: Flags [.], seq 1349:2697, ack 174, win 170, options [nop,nop,TS val 610999293 ecr 121820], length 1348
00:53:31.350015 IP sea15s12-in-f206.1e100.net.https > 192.168.1.10.40821: Flags [.], seq 2697:4045, ack 174, win 170, options [nop,nop,TS val 610999293 ecr 121820], length 1348
00:53:31.350046 IP sea15s12-in-f206.1e100.net.https > 192.168.1.10.40821: Flags [P.], seq 4045:4140, ack 174, win 170, options [nop,nop,TS val 610999293 ecr 121820], length 95
00:53:31.352634 IP 192.168.1.10.40821 > sea15s12-in-f206.1e100.net.https: Flags [.], ack 1349, win 353, options [nop,nop,TS val 121824 ecr 610999293], length 0
00:53:31.352650 IP 192.168.1.10.40821 > sea15s12-in-f206.1e100.net.https: Flags [.], ack 2697, win 364, options [nop,nop,TS val 121825 ecr 610999293], length 0
00:53:31.352660 IP 192.168.1.10.40821 > sea15s12-in-f206.1e100.net.https: Flags [.], ack 4045, win 374, options [nop,nop,TS val 121825 ecr 610999293], length 0
00:53:31.352679 IP 192.168.1.10.40821 > sea15s12-in-f206.1e100.net.https: Flags [.], ack 4140, win 374, options [nop,nop,TS val 121825 ecr 610999293], length 0
00:53:31.499530 IP 192.168.1.10.40817 > sea15s07-in-f68.1e100.net.https: Flags [S], seq 652942090, win 65535, options [mss 1460,sackOK,TS val 121839 ecr 0,nop,wscale 8], length 0
00:53:31.530992 IP 192.168.1.10.42981 > sea15s07-in-f10.1e100.net.https: Flags [S], seq 2782916310, win 65535, options [mss 1460,sackOK,TS val 121842 ecr 0,nop,wscale 8], length 0
00:53:31.531196 IP sea15s07-in-f68.1e100.net.https > 192.168.1.10.40817: Flags [S.], seq 1672446621, ack 652942091, win 42408, options [mss 1360,sackOK,TS val 3478505777 ecr 121839,nop,wscale 8], length 0
00:53:31.533258 IP 192.168.1.10.40817 > sea15s07-in-f68.1e100.net.https: Flags [.], ack 1, win 343, options [nop,nop,TS val 121843 ecr 3478505777], length 0
00:53:31.534604 IP 192.168.1.10.40817 > sea15s07-in-f68.1e100.net.https: Flags [P.], seq 1:208, ack 1, win 343, options [nop,nop,TS val 121843 ecr 3478505777], length 207
00:53:31.544771 IP 192.168.1.10.40821 > sea15s12-in-f206.1e100.net.https: Flags [P.], seq 174:267, ack 4140, win 374, options [nop,nop,TS val 121844 ecr 610999293], length 93
00:53:31.560299 IP sea15s07-in-f10.1e100.net.https > 192.168.1.10.42981: Flags [S.], seq 626930379, ack 2782916311, win 42408, options [mss 1360,sackOK,TS val 1839865883 ecr 121842,nop,wscale 8], length 0
00:53:31.562486 IP 192.168.1.10.42981 > sea15s07-in-f10.1e100.net.https: Flags [.], ack 1, win 343, options [nop,nop,TS val 121845 ecr 1839865883], length 0
00:53:31.565483 IP 192.168.1.10.42981 > sea15s07-in-f10.1e100.net.https: Flags [P.], seq 1:185, ack 1, win 343, options [nop,nop,TS val 121846 ecr 1839865883], length 184
00:53:31.566058 IP sea15s07-in-f68.1e100.net.https > 192.168.1.10.40817: Flags [.], ack 208, win 170, options [nop,nop,TS val 3478505812 ecr 121843], length 0
00:53:31.573276 IP sea15s07-in-f68.1e100.net.https > 192.168.1.10.40817: Flags [.], seq 1:1349, ack 208, win 170, options [nop,nop,TS val 3478505819 ecr 121843], length 1348
00:53:31.573326 IP sea15s07-in-f68.1e100.net.https > 192.168.1.10.40817: Flags [.], seq 1349:2697, ack 208, win 170, options [nop,nop,TS val 3478505819 ecr 121843], length 1348
00:53:31.573358 IP sea15s07-in-f68.1e100.net.https > 192.168.1.10.40817: Flags [P.], seq 2697:3432, ack 208, win 170, options [nop,nop,TS val 3478505819 ecr 121843], length 735
00:53:31.575848 IP 192.168.1.10.40817 > sea15s07-in-f68.1e100.net.https: Flags [.], ack 1349, win 353, options [nop,nop,TS val 121847 ecr 3478505819], length 0
00:53:31.575863 IP 192.168.1.10.40817 > sea15s07-in-f68.1e100.net.https: Flags [.], ack 2697, win 364, options [nop,nop,TS val 121847 ecr 3478505819], length 0
00:53:31.575877 IP 192.168.1.10.40817 > sea15s07-in-f68.1e100.net.https: Flags [.], ack 3432, win 374, options [nop,nop,TS val 121847 ecr 3478505819], length 0
00:53:31.576794 IP sea15s12-in-f206.1e100.net.https > 192.168.1.10.40821: Flags [P.], seq 4140:4191, ack 267, win 170, options [nop,nop,TS val 610999520 ecr 121844], length 51
00:53:31.578852 IP 192.168.1.10.40821 > sea15s12-in-f206.1e100.net.https: Flags [.], ack 4191, win 374, options [nop,nop,TS val 121847 ecr 610999520], length 0
00:53:31.592549 IP 192.168.1.10.40817 > sea15s07-in-f68.1e100.net.https: Flags [P.], seq 208:334, ack 3432, win 374, options [nop,nop,TS val 121848 ecr 3478505819], length 126
00:53:31.594764 IP sea15s07-in-f10.1e100.net.https > 192.168.1.10.42981: Flags [.], ack 185, win 170, options [nop,nop,TS val 1839865918 ecr 121846], length 0
00:53:31.603463 IP sea15s07-in-f10.1e100.net.https > 192.168.1.10.42981: Flags [.], seq 1:1349, ack 185, win 170, options [nop,nop,TS val 1839865926 ecr 121846], length 1348
00:53:31.603541 IP sea15s07-in-f10.1e100.net.https > 192.168.1.10.42981: Flags [.], seq 1349:2697, ack 185, win 170, options [nop,nop,TS val 1839865926 ecr 121846], length 1348
00:53:31.603575 IP sea15s07-in-f10.1e100.net.https > 192.168.1.10.42981: Flags [P.], seq 2697:3251, ack 185, win 170, options [nop,nop,TS val 1839865926 ecr 121846], length 554
00:53:31.605993 IP 192.168.1.10.42981 > sea15s07-in-f10.1e100.net.https: Flags [.], ack 1349, win 353, options [nop,nop,TS val 121850 ecr 1839865926], length 0
00:53:31.606008 IP 192.168.1.10.42981 > sea15s07-in-f10.1e100.net.https: Flags [.], ack 2697, win 364, options [nop,nop,TS val 121850 ecr 1839865926], length 0
00:53:31.606024 IP 192.168.1.10.42981 > sea15s07-in-f10.1e100.net.https: Flags [.], ack 3251, win 374, options [nop,nop,TS val 121850 ecr 1839865926], length 0
00:53:31.624524 IP sea15s07-in-f68.1e100.net.https > 192.168.1.10.40817: Flags [P.], seq 3432:3716, ack 334, win 170, options [nop,nop,TS val 3478505870 ecr 121848], length 284
00:53:31.625477 IP 192.168.1.10.40821 > sea15s12-in-f206.1e100.net.https: Flags [.], seq 267:1615, ack 4191, win 374, options [nop,nop,TS val 121852 ecr 610999520], length 1348
00:53:31.625494 IP 192.168.1.10.40821 > sea15s12-in-f206.1e100.net.https: Flags [P.], seq 1615:1880, ack 4191, win 374, options [nop,nop,TS val 121852 ecr 610999520], length 265
00:53:31.654489 IP 192.168.1.10.40817 > sea15s07-in-f68.1e100.net.https: Flags [P.], seq 334:387, ack 3716, win 385, options [nop,nop,TS val 121855 ecr 3478505870], length 53
00:53:31.654502 IP 192.168.1.10.40817 > sea15s07-in-f68.1e100.net.https: Flags [P.], seq 387:437, ack 3716, win 385, options [nop,nop,TS val 121855 ecr 3478505870], length 50
00:53:31.654511 IP 192.168.1.10.40817 > sea15s07-in-f68.1e100.net.https: Flags [P.], seq 437:479, ack 3716, win 385, options [nop,nop,TS val 121855 ecr 3478505870], length 42
00:53:31.654540 IP 192.168.1.10.40817 > sea15s07-in-f68.1e100.net.https: Flags [P.], seq 479:976, ack 3716, win 385, options [nop,nop,TS val 121855 ecr 3478505870], length 497
00:53:31.655666 IP sea15s12-in-f206.1e100.net.https > 192.168.1.10.40821: Flags [.], ack 1880, win 183, options [nop,nop,TS val 610999599 ecr 121852], length 0
00:53:31.666282 IP 192.168.1.10.42981 > sea15s07-in-f10.1e100.net.https: Flags [P.], seq 185:278, ack 3251, win 374, options [nop,nop,TS val 121856 ecr 1839865926], length 93
00:53:31.686162 IP sea15s07-in-f68.1e100.net.https > 192.168.1.10.40817: Flags [P.], seq 3716:3785, ack 387, win 170, options [nop,nop,TS val 3478505932 ecr 121855], length 69
00:53:31.686289 IP sea15s07-in-f68.1e100.net.https > 192.168.1.10.40817: Flags [.], ack 479, win 170, options [nop,nop,TS val 3478505932 ecr 121855], length 0
00:53:31.686684 IP sea15s07-in-f68.1e100.net.https > 192.168.1.10.40817: Flags [P.], seq 3785:3823, ack 976, win 175, options [nop,nop,TS val 3478505932 ecr 121855], length 38
00:53:31.696035 IP sea15s07-in-f10.1e100.net.https > 192.168.1.10.42981: Flags [P.], seq 3251:3535, ack 278, win 170, options [nop,nop,TS val 1839866019 ecr 121856], length 284
00:53:31.714242 IP sea15s07-in-f68.1e100.net.https > 192.168.1.10.40817: Flags [P.], seq 3823:4154, ack 976, win 175, options [nop,nop,TS val 3478505960 ecr 121855], length 331
00:53:31.714311 IP sea15s07-in-f68.1e100.net.https > 192.168.1.10.40817: Flags [P.], seq 4154:4582, ack 976, win 175, options [nop,nop,TS val 3478505960 ecr 121855], length 428
00:53:31.714483 IP sea15s07-in-f68.1e100.net.https > 192.168.1.10.40817: Flags [P.], seq 4582:4628, ack 976, win 175, options [nop,nop,TS val 3478505960 ecr 121855], length 46
00:53:31.714596 IP sea15s07-in-f68.1e100.net.https > 192.168.1.10.40817: Flags [P.], seq 4628:4674, ack 976, win 175, options [nop,nop,TS val 3478505960 ecr 121855], length 46
00:53:31.791062 IP sea15s07-in-f68.1e100.net.https > 192.168.1.10.40817: Flags [P.], seq 4628:4674, ack 976, win 175, options [nop,nop,TS val 3478506037 ecr 121855], length 46
00:53:31.802373 IP 192.168.1.10.40817 > sea15s07-in-f68.1e100.net.https: Flags [P.], seq 479:976, ack 3716, win 385, options [nop,nop,TS val 121863 ecr 3478505870], length 497
00:53:31.807982 IP 192.168.1.10.40817 > sea15s07-in-f68.1e100.net.https: Flags [P.], seq 976:1014, ack 3785, win 385, options [nop,nop,TS val 121870 ecr 3478505932], length 38
00:53:31.807997 IP 192.168.1.10.42981 > sea15s07-in-f10.1e100.net.https: Flags [P.], seq 278:1283, ack 3535, win 385, options [nop,nop,TS val 121870 ecr 1839866019], length 1005
00:53:31.808007 IP 192.168.1.10.40817 > sea15s07-in-f68.1e100.net.https: Flags [.], ack 4154, win 395, options [nop,nop,TS val 121870 ecr 3478505932], length 0
00:53:31.808016 IP 192.168.1.10.40817 > sea15s07-in-f68.1e100.net.https: Flags [.], ack 4628, win 406, options [nop,nop,TS val 121870 ecr 3478505960], length 0
00:53:31.808033 IP 192.168.1.10.40817 > sea15s07-in-f68.1e100.net.https: Flags [.], ack 4674, win 406, options [nop,nop,TS val 121870 ecr 3478506037,nop,nop,sack 1 {4628:4674}], length 0
00:53:31.815744 IP 192.168.1.10.40817 > sea15s07-in-f68.1e100.net.https: Flags [P.], seq 1014:1060, ack 4674, win 406, options [nop,nop,TS val 121871 ecr 3478506037], length 46
00:53:31.834580 IP sea15s07-in-f68.1e100.net.https > 192.168.1.10.40817: Flags [.], ack 976, win 175, options [nop,nop,TS val 3478506080 ecr 121863,nop,nop,sack 1 {479:976}], length 0
00:53:31.839580 IP sea15s07-in-f68.1e100.net.https > 192.168.1.10.40817: Flags [.], ack 1014, win 175, options [nop,nop,TS val 3478506085 ecr 121870], length 0
00:53:31.847179 IP sea15s07-in-f68.1e100.net.https > 192.168.1.10.40817: Flags [.], ack 1060, win 175, options [nop,nop,TS val 3478506093 ecr 121871], length 0
00:53:31.872943 IP sea15s07-in-f10.1e100.net.https > 192.168.1.10.42981: Flags [P.], seq 3535:4883, ack 1283, win 178, options [nop,nop,TS val 1839866196 ecr 121870], length 1348
00:53:31.873049 IP sea15s07-in-f10.1e100.net.https > 192.168.1.10.42981: Flags [P.], seq 4883:6231, ack 1283, win 178, options [nop,nop,TS val 1839866196 ecr 121870], length 1348
00:53:31.873210 IP sea15s07-in-f10.1e100.net.https > 192.168.1.10.42981: Flags [.], seq 6231:7579, ack 1283, win 178, options [nop,nop,TS val 1839866196 ecr 121870], length 1348
00:53:31.873257 IP sea15s07-in-f10.1e100.net.https > 192.168.1.10.42981: Flags [P.], seq 7579:7784, ack 1283, win 178, options [nop,nop,TS val 1839866196 ecr 121870], length 205
00:53:31.873344 IP sea15s07-in-f10.1e100.net.https > 192.168.1.10.42981: Flags [P.], seq 7784:9132, ack 1283, win 178, options [nop,nop,TS val 1839866196 ecr 121870], length 1348
00:53:31.873450 IP sea15s07-in-f10.1e100.net.https > 192.168.1.10.42981: Flags [.], seq 9132:10480, ack 1283, win 178, options [nop,nop,TS val 1839866196 ecr 121870], length 1348
00:53:31.873468 IP sea15s07-in-f10.1e100.net.https > 192.168.1.10.42981: Flags [P.], seq 10480:11828, ack 1283, win 178, options [nop,nop,TS val 1839866196 ecr 121870], length 1348
00:53:31.873523 IP sea15s07-in-f10.1e100.net.https > 192.168.1.10.42981: Flags [P.], seq 11828:12114, ack 1283, win 178, options [nop,nop,TS val 1839866196 ecr 121870], length 286
00:53:31.873572 IP sea15s07-in-f10.1e100.net.https > 192.168.1.10.42981: Flags [P.], seq 12114:13462, ack 1283, win 178, options [nop,nop,TS val 1839866196 ecr 121870], length 1348
00:53:31.873620 IP sea15s07-in-f10.1e100.net.https > 192.168.1.10.42981: Flags [P.], seq 13462:14810, ack 1283, win 178, options [nop,nop,TS val 1839866196 ecr 121870], length 1348
00:53:31.873700 IP sea15s07-in-f10.1e100.net.https > 192.168.1.10.42981: Flags [.], seq 14810:16158, ack 1283, win 178, options [nop,nop,TS val 1839866196 ecr 121870], length 1348
00:53:31.873717 IP sea15s07-in-f10.1e100.net.https > 192.168.1.10.42981: Flags [P.], seq 16158:16447, ack 1283, win 178, options [nop,nop,TS val 1839866196 ecr 121870], length 289
00:53:31.875903 IP sea15s07-in-f10.1e100.net.https > 192.168.1.10.42981: Flags [P.], seq 16447:17795, ack 1283, win 178, options [nop,nop,TS val 1839866196 ecr 121870], length 1348
00:53:31.876002 IP sea15s07-in-f10.1e100.net.https > 192.168.1.10.42981: Flags [.], seq 17795:19143, ack 1283, win 178, options [nop,nop,TS val 1839866196 ecr 121870], length 1348
00:53:31.877609 IP 192.168.1.10.42981 > sea15s07-in-f10.1e100.net.https: Flags [.], ack 6231, win 406, options [nop,nop,TS val 121877 ecr 1839866196], length 0
00:53:31.877624 IP 192.168.1.10.42981 > sea15s07-in-f10.1e100.net.https: Flags [.], ack 7784, win 427, options [nop,nop,TS val 121877 ecr 1839866196], length 0
00:53:31.877651 IP 192.168.1.10.42981 > sea15s07-in-f10.1e100.net.https: Flags [.], ack 10480, win 448, options [nop,nop,TS val 121877 ecr 1839866196], length 0
00:53:31.878978 IP 192.168.1.10.42981 > sea15s07-in-f10.1e100.net.https: Flags [.], ack 12114, win 469, options [nop,nop,TS val 121877 ecr 1839866196], length 0
00:53:31.878990 IP 192.168.1.10.42981 > sea15s07-in-f10.1e100.net.https: Flags [.], ack 14810, win 490, options [nop,nop,TS val 121877 ecr 1839866196], length 0
00:53:31.879000 IP 192.168.1.10.42981 > sea15s07-in-f10.1e100.net.https: Flags [.], ack 16447, win 511, options [nop,nop,TS val 121877 ecr 1839866196], length 0
00:53:31.879013 IP 192.168.1.10.42981 > sea15s07-in-f10.1e100.net.https: Flags [.], ack 19143, win 532, options [nop,nop,TS val 121877 ecr 1839866196], length 0
00:53:31.883098 IP sea15s12-in-f206.1e100.net.https > 192.168.1.10.40821: Flags [P.], seq 4191:4703, ack 1880, win 183, options [nop,nop,TS val 610999826 ecr 121852], length 512
00:53:31.883187 IP sea15s12-in-f206.1e100.net.https > 192.168.1.10.40821: Flags [P.], seq 4703:5008, ack 1880, win 183, options [nop,nop,TS val 610999827 ecr 121852], length 305
00:53:31.883252 IP sea15s12-in-f206.1e100.net.https > 192.168.1.10.40821: Flags [P.], seq 5008:5042, ack 1880, win 183, options [nop,nop,TS val 610999827 ecr 121852], length 34
00:53:31.885463 IP 192.168.1.10.40821 > sea15s12-in-f206.1e100.net.https: Flags [.], ack 4703, win 385, options [nop,nop,TS val 121878 ecr 610999826], length 0
00:53:31.885475 IP 192.168.1.10.40821 > sea15s12-in-f206.1e100.net.https: Flags [.], ack 5008, win 395, options [nop,nop,TS val 121878 ecr 610999827], length 0
00:53:31.885488 IP 192.168.1.10.40821 > sea15s12-in-f206.1e100.net.https: Flags [.], ack 5042, win 395, options [nop,nop,TS val 121878 ecr 610999827], length 0
00:53:31.907100 IP sea15s07-in-f10.1e100.net.https > 192.168.1.10.42981: Flags [.], seq 19143:20491, ack 1283, win 178, options [nop,nop,TS val 1839866230 ecr 121877], length 1348
00:53:31.907159 IP sea15s07-in-f10.1e100.net.https > 192.168.1.10.42981: Flags [.], seq 20491:21839, ack 1283, win 178, options [nop,nop,TS val 1839866230 ecr 121877], length 1348
00:53:31.908326 IP sea15s07-in-f10.1e100.net.https > 192.168.1.10.42981: Flags [.], seq 21839:23187, ack 1283, win 178, options [nop,nop,TS val 1839866230 ecr 121877], length 1348
00:53:31.908378 IP sea15s07-in-f10.1e100.net.https > 192.168.1.10.42981: Flags [.], seq 23187:24535, ack 1283, win 178, options [nop,nop,TS val 1839866230 ecr 121877], length 1348
00:53:31.909727 IP 192.168.1.10.42981 > sea15s07-in-f10.1e100.net.https: Flags [.], ack 21839, win 553, options [nop,nop,TS val 121880 ecr 1839866230], length 0
00:53:31.910862 IP sea15s07-in-f10.1e100.net.https > 192.168.1.10.42981: Flags [.], seq 24535:25883, ack 1283, win 178, options [nop,nop,TS val 1839866231 ecr 121877], length 1348
00:53:31.910934 IP sea15s07-in-f10.1e100.net.https > 192.168.1.10.42981: Flags [.], seq 25883:27231, ack 1283, win 178, options [nop,nop,TS val 1839866231 ecr 121877], length 1348
00:53:31.910967 IP sea15s07-in-f10.1e100.net.https > 192.168.1.10.42981: Flags [.], seq 27231:28579, ack 1283, win 178, options [nop,nop,TS val 1839866231 ecr 121877], length 1348
00:53:31.910994 IP sea15s07-in-f10.1e100.net.https > 192.168.1.10.42981: Flags [.], seq 28579:29927, ack 1283, win 178, options [nop,nop,TS val 1839866231 ecr 121877], length 1348
00:53:31.911094 IP 192.168.1.10.42981 > sea15s07-in-f10.1e100.net.https: Flags [.], ack 24535, win 574, options [nop,nop,TS val 121880 ecr 1839866230], length 0
00:53:31.913100 IP sea15s07-in-f10.1e100.net.https > 192.168.1.10.42981: Flags [.], seq 29927:31275, ack 1283, win 178, options [nop,nop,TS val 1839866234 ecr 121877], length 1348
