tcpdump: verbose output suppressed, use -v or -vv for full protocol decode
listening on wlan0, link-type EN10MB (Ethernet), capture size 262144 bytes
22:36:17.670893 IP sea15s07-in-f68.1e100.net.www > 192.168.1.10.59348: Flags [P.], seq 1716039344:1716040146, ack 151056147, win 211, options [nop,nop,TS val 3155308609 ecr 695423], length 802: HTTP: HTTP/1.1 200 OK
22:36:17.671187 IP sea15s07-in-f68.1e100.net.www > 192.168.1.10.59348: Flags [.], seq 802:2150, ack 1, win 211, options [nop,nop,TS val 3155308609 ecr 695423], length 1348: HTTP
22:36:17.671239 IP sea15s07-in-f68.1e100.net.www > 192.168.1.10.59348: Flags [.], seq 2150:3498, ack 1, win 211, options [nop,nop,TS val 3155308609 ecr 695423], length 1348: HTTP
22:36:17.671269 IP sea15s07-in-f68.1e100.net.www > 192.168.1.10.59348: Flags [.], seq 3498:4846, ack 1, win 211, options [nop,nop,TS val 3155308609 ecr 695423], length 1348: HTTP
22:36:17.671299 IP sea15s07-in-f68.1e100.net.www > 192.168.1.10.59348: Flags [P.], seq 4846:4898, ack 1, win 211, options [nop,nop,TS val 3155308609 ecr 695423], length 52: HTTP
22:36:17.673130 IP sea15s07-in-f68.1e100.net.www > 192.168.1.10.59348: Flags [P.], seq 4898:5831, ack 1, win 211, options [nop,nop,TS val 3155308609 ecr 695423], length 933: HTTP
22:36:17.673712 IP sea15s07-in-f68.1e100.net.www > 192.168.1.10.59348: Flags [F.], seq 5831, ack 1, win 211, options [nop,nop,TS val 3155308609 ecr 695423], length 0
22:36:17.678059 IP 192.168.1.10.59348 > sea15s07-in-f68.1e100.net.www: Flags [.], ack 802, win 697, options [nop,nop,TS val 695441 ecr 3155308609], length 0
22:36:17.678074 IP 192.168.1.10.59348 > sea15s07-in-f68.1e100.net.www: Flags [.], ack 2150, win 718, options [nop,nop,TS val 695441 ecr 3155308609], length 0
22:36:17.678094 IP 192.168.1.10.59348 > sea15s07-in-f68.1e100.net.www: Flags [.], ack 3498, win 740, options [nop,nop,TS val 695441 ecr 3155308609], length 0
22:36:17.678526 IP 192.168.1.10.59348 > sea15s07-in-f68.1e100.net.www: Flags [.], ack 4846, win 761, options [nop,nop,TS val 695441 ecr 3155308609], length 0
22:36:17.678541 IP 192.168.1.10.59348 > sea15s07-in-f68.1e100.net.www: Flags [.], ack 4898, win 761, options [nop,nop,TS val 695441 ecr 3155308609], length 0
22:36:17.679072 IP 192.168.1.10.59348 > sea15s07-in-f68.1e100.net.www: Flags [.], ack 5831, win 782, options [nop,nop,TS val 695441 ecr 3155308609], length 0
22:36:17.709473 IP 192.168.1.10.59348 > sea15s07-in-f68.1e100.net.www: Flags [.], ack 5832, win 782, options [nop,nop,TS val 695445 ecr 3155308609], length 0
22:36:17.792364 IP 192.168.1.10.34390 > sea15s02-in-f14.1e100.net.https: Flags [.], seq 2517982507:2517983855, ack 3445128120, win 832, options [nop,nop,TS val 695453 ecr 3425481345], length 1348
22:36:17.792632 IP 192.168.1.10.34390 > sea15s02-in-f14.1e100.net.https: Flags [P.], seq 1348:1616, ack 1, win 832, options [nop,nop,TS val 695453 ecr 3425481345], length 268
22:36:17.822441 IP 192.168.1.10.44683 > sea15s07-in-f74.1e100.net.https: Flags [S], seq 3511554114, win 65535, options [mss 1460,sackOK,TS val 695456 ecr 0,nop,wscale 7], length 0
22:36:17.864080 IP sea15s02-in-f14.1e100.net.https > 192.168.1.10.34390: Flags [.], ack 1616, win 226, options [nop,nop,TS val 3425482648 ecr 695453], length 0
22:36:17.883579 IP 192.168.1.10.44685 > sea15s07-in-f74.1e100.net.https: Flags [S], seq 3119172683, win 65535, options [mss 1460,sackOK,TS val 695462 ecr 0,nop,wscale 7], length 0
22:36:17.885567 IP sea15s07-in-f74.1e100.net.https > 192.168.1.10.44683: Flags [S.], seq 2423000546, ack 3511554115, win 42408, options [mss 1360,sackOK,TS val 548697488 ecr 695456,nop,wscale 8], length 0
22:36:17.887585 IP 192.168.1.10.44683 > sea15s07-in-f74.1e100.net.https: Flags [.], ack 1, win 685, options [nop,nop,TS val 695462 ecr 548697488], length 0
22:36:17.895822 IP 192.168.1.10.44683 > sea15s07-in-f74.1e100.net.https: Flags [P.], seq 1:208, ack 1, win 685, options [nop,nop,TS val 695462 ecr 548697488], length 207
22:36:17.899955 IP 192.168.1.10.39613 > sea15s01-in-f142.1e100.net.https: Flags [S], seq 1436045079, win 65535, options [mss 1460,sackOK,TS val 695464 ecr 0,nop,wscale 7], length 0
22:36:17.954319 IP sea15s07-in-f74.1e100.net.https > 192.168.1.10.44685: Flags [S.], seq 96239941, ack 3119172684, win 42408, options [mss 1360,sackOK,TS val 1009699738 ecr 695462,nop,wscale 8], length 0
22:36:17.959444 IP sea15s07-in-f74.1e100.net.https > 192.168.1.10.44683: Flags [.], ack 208, win 170, options [nop,nop,TS val 548697561 ecr 695462], length 0
22:36:17.961114 IP 192.168.1.10.44685 > sea15s07-in-f74.1e100.net.https: Flags [.], ack 1, win 685, options [nop,nop,TS val 695470 ecr 1009699738], length 0
22:36:17.961414 IP 192.168.1.10.44685 > sea15s07-in-f74.1e100.net.https: Flags [P.], seq 1:208, ack 1, win 685, options [nop,nop,TS val 695470 ecr 1009699738], length 207
22:36:17.965909 IP sea15s01-in-f142.1e100.net.https > 192.168.1.10.39613: Flags [S.], seq 4156637804, ack 1436045080, win 42408, options [mss 1360,sackOK,TS val 3327126748 ecr 695464,nop,wscale 8], length 0
22:36:17.967513 IP sea15s07-in-f74.1e100.net.https > 192.168.1.10.44683: Flags [.], seq 1:1349, ack 208, win 170, options [nop,nop,TS val 548697569 ecr 695462], length 1348
22:36:17.967598 IP sea15s07-in-f74.1e100.net.https > 192.168.1.10.44683: Flags [.], seq 1349:2697, ack 208, win 170, options [nop,nop,TS val 548697569 ecr 695462], length 1348
22:36:17.967630 IP sea15s07-in-f74.1e100.net.https > 192.168.1.10.44683: Flags [P.], seq 2697:3490, ack 208, win 170, options [nop,nop,TS val 548697569 ecr 695462], length 793
22:36:17.967981 IP 192.168.1.10.39613 > sea15s01-in-f142.1e100.net.https: Flags [.], ack 1, win 685, options [nop,nop,TS val 695470 ecr 3327126748], length 0
22:36:17.970184 IP 192.168.1.10.44683 > sea15s07-in-f74.1e100.net.https: Flags [.], ack 1349, win 706, options [nop,nop,TS val 695471 ecr 548697569], length 0
22:36:17.970407 IP 192.168.1.10.44683 > sea15s07-in-f74.1e100.net.https: Flags [.], ack 2697, win 727, options [nop,nop,TS val 695471 ecr 548697569], length 0
22:36:17.970602 IP 192.168.1.10.44683 > sea15s07-in-f74.1e100.net.https: Flags [.], ack 3490, win 748, options [nop,nop,TS val 695471 ecr 548697569], length 0
22:36:17.975371 IP 192.168.1.10.39613 > sea15s01-in-f142.1e100.net.https: Flags [P.], seq 1:200, ack 1, win 685, options [nop,nop,TS val 695471 ecr 3327126748], length 199
22:36:17.981085 IP 192.168.1.10.44683 > sea15s07-in-f74.1e100.net.https: Flags [P.], seq 208:301, ack 3490, win 748, options [nop,nop,TS val 695472 ecr 548697569], length 93
22:36:18.030390 IP sea15s07-in-f74.1e100.net.https > 192.168.1.10.44685: Flags [.], ack 208, win 170, options [nop,nop,TS val 1009699814 ecr 695470], length 0
22:36:18.037884 IP sea15s07-in-f74.1e100.net.https > 192.168.1.10.44685: Flags [.], seq 1:1349, ack 208, win 170, options [nop,nop,TS val 1009699822 ecr 695470], length 1348
22:36:18.037992 IP sea15s07-in-f74.1e100.net.https > 192.168.1.10.44685: Flags [.], seq 1349:2697, ack 208, win 170, options [nop,nop,TS val 1009699822 ecr 695470], length 1348
22:36:18.038024 IP sea15s07-in-f74.1e100.net.https > 192.168.1.10.44685: Flags [P.], seq 2697:3490, ack 208, win 170, options [nop,nop,TS val 1009699822 ecr 695470], length 793
22:36:18.040249 IP 192.168.1.10.44685 > sea15s07-in-f74.1e100.net.https: Flags [.], ack 1349, win 706, options [nop,nop,TS val 695478 ecr 1009699822], length 0
22:36:18.040957 IP 192.168.1.10.44685 > sea15s07-in-f74.1e100.net.https: Flags [.], ack 2697, win 727, options [nop,nop,TS val 695478 ecr 1009699822], length 0
22:36:18.041099 IP 192.168.1.10.44685 > sea15s07-in-f74.1e100.net.https: Flags [.], ack 3490, win 748, options [nop,nop,TS val 695478 ecr 1009699822], length 0
22:36:18.042564 IP sea15s01-in-f142.1e100.net.https > 192.168.1.10.39613: Flags [.], ack 200, win 170, options [nop,nop,TS val 3327126824 ecr 695471], length 0
22:36:18.046498 IP 192.168.1.10.44685 > sea15s07-in-f74.1e100.net.https: Flags [P.], seq 208:301, ack 3490, win 748, options [nop,nop,TS val 695478 ecr 1009699822], length 93
22:36:18.046904 IP sea15s07-in-f74.1e100.net.https > 192.168.1.10.44683: Flags [P.], seq 3490:3774, ack 301, win 170, options [nop,nop,TS val 548697649 ecr 695472], length 284
22:36:18.047051 IP sea15s07-in-f74.1e100.net.https > 192.168.1.10.44683: Flags [P.], seq 3774:3843, ack 301, win 170, options [nop,nop,TS val 548697649 ecr 695472], length 69
22:36:18.054798 IP sea15s01-in-f142.1e100.net.https > 192.168.1.10.39613: Flags [.], seq 1:1349, ack 200, win 170, options [nop,nop,TS val 3327126836 ecr 695471], length 1348
22:36:18.054918 IP sea15s01-in-f142.1e100.net.https > 192.168.1.10.39613: Flags [.], seq 1349:2697, ack 200, win 170, options [nop,nop,TS val 3327126836 ecr 695471], length 1348
22:36:18.054954 IP sea15s01-in-f142.1e100.net.https > 192.168.1.10.39613: Flags [.], seq 2697:4045, ack 200, win 170, options [nop,nop,TS val 3327126836 ecr 695471], length 1348
22:36:18.054986 IP sea15s01-in-f142.1e100.net.https > 192.168.1.10.39613: Flags [P.], seq 4045:4365, ack 200, win 170, options [nop,nop,TS val 3327126836 ecr 695471], length 320
22:36:18.058533 IP 192.168.1.10.39613 > sea15s01-in-f142.1e100.net.https: Flags [.], ack 1349, win 706, options [nop,nop,TS val 695479 ecr 3327126836], length 0
22:36:18.058788 IP 192.168.1.10.39613 > sea15s01-in-f142.1e100.net.https: Flags [.], ack 2697, win 727, options [nop,nop,TS val 695479 ecr 3327126836], length 0
22:36:18.059090 IP 192.168.1.10.39613 > sea15s01-in-f142.1e100.net.https: Flags [.], ack 4045, win 748, options [nop,nop,TS val 695479 ecr 3327126836], length 0
22:36:18.059104 IP 192.168.1.10.39613 > sea15s01-in-f142.1e100.net.https: Flags [.], ack 4365, win 769, options [nop,nop,TS val 695479 ecr 3327126836], length 0
22:36:18.064528 IP 192.168.1.10.39613 > sea15s01-in-f142.1e100.net.https: Flags [P.], seq 200:293, ack 4365, win 769, options [nop,nop,TS val 695480 ecr 3327126836], length 93
22:36:18.079634 IP 192.168.1.10.44683 > sea15s07-in-f74.1e100.net.https: Flags [.], ack 3843, win 769, options [nop,nop,TS val 695482 ecr 548697649], length 0
22:36:18.085203 IP sea15s02-in-f14.1e100.net.https > 192.168.1.10.34390: Flags [P.], seq 1:513, ack 1616, win 226, options [nop,nop,TS val 3425482869 ecr 695453], length 512
22:36:18.086632 IP sea15s02-in-f14.1e100.net.https > 192.168.1.10.34390: Flags [P.], seq 513:976, ack 1616, win 226, options [nop,nop,TS val 3425482871 ecr 695453], length 463
22:36:18.086858 IP sea15s02-in-f14.1e100.net.https > 192.168.1.10.34390: Flags [P.], seq 976:1010, ack 1616, win 226, options [nop,nop,TS val 3425482871 ecr 695453], length 34
22:36:18.091927 IP 192.168.1.10.34390 > sea15s02-in-f14.1e100.net.https: Flags [.], ack 1010, win 874, options [nop,nop,TS val 695483 ecr 3425482869], length 0
22:36:18.108940 IP sea15s07-in-f74.1e100.net.https > 192.168.1.10.44685: Flags [P.], seq 3490:3774, ack 301, win 170, options [nop,nop,TS val 1009699893 ecr 695478], length 284
22:36:18.109102 IP sea15s07-in-f74.1e100.net.https > 192.168.1.10.44685: Flags [P.], seq 3774:3843, ack 301, win 170, options [nop,nop,TS val 1009699893 ecr 695478], length 69
22:36:18.133853 IP sea15s01-in-f142.1e100.net.https > 192.168.1.10.39613: Flags [P.], seq 4365:4649, ack 293, win 170, options [nop,nop,TS val 3327126916 ecr 695480], length 284
22:36:18.134025 IP sea15s01-in-f142.1e100.net.https > 192.168.1.10.39613: Flags [P.], seq 4649:4718, ack 293, win 170, options [nop,nop,TS val 3327126916 ecr 695480], length 69
22:36:18.149516 IP 192.168.1.10.44685 > sea15s07-in-f74.1e100.net.https: Flags [.], ack 3843, win 769, options [nop,nop,TS val 695489 ecr 1009699893], length 0
22:36:18.169508 IP 192.168.1.10.39613 > sea15s01-in-f142.1e100.net.https: Flags [.], ack 4718, win 790, options [nop,nop,TS val 695491 ecr 3327126916], length 0
22:36:18.730019 IP 192.168.1.10.50727 > sea15s12-in-f194.1e100.net.https: Flags [P.], seq 1561838324:1561838730, ack 608822208, win 769, options [nop,nop,TS val 695546 ecr 3591275777], length 406
22:36:18.784297 IP sea15s12-in-f194.1e100.net.https > 192.168.1.10.50727: Flags [P.], seq 1:819, ack 406, win 179, options [nop,nop,TS val 3591276981 ecr 695546], length 818
22:36:18.786819 IP 192.168.1.10.50727 > sea15s12-in-f194.1e100.net.https: Flags [.], ack 819, win 782, options [nop,nop,TS val 695552 ecr 3591276981], length 0
22:36:19.160752 IP 192.168.1.10.45908 > 216.157.12.18.www: Flags [F.], seq 775466178, ack 3323619612, win 693, options [nop,nop,TS val 695589 ecr 3155308131], length 0
22:36:19.161372 IP 192.168.1.10.44326 > 192.229.163.250.www: Flags [F.], seq 1315563307, ack 2427526728, win 1464, options [nop,nop,TS val 695590 ecr 3155308359], length 0
22:36:19.168309 IP 216.157.12.18.www > 192.168.1.10.45908: Flags [F.], seq 1, ack 1, win 219, options [nop,nop,TS val 3155308983 ecr 695589], length 0
22:36:19.168713 IP 192.229.163.250.www > 192.168.1.10.44326: Flags [F.], seq 1, ack 1, win 219, options [nop,nop,TS val 3155308983 ecr 695590], length 0
22:36:19.171225 IP 192.168.1.10.45908 > 216.157.12.18.www: Flags [.], ack 2, win 693, options [nop,nop,TS val 695591 ecr 3155308983], length 0
22:36:19.171393 IP 192.168.1.10.44326 > 192.229.163.250.www: Flags [.], ack 2, win 1464, options [nop,nop,TS val 695591 ecr 3155308983], length 0
22:36:19.548916 IP 192.168.1.10.41762 > sea15s11-in-f10.1e100.net.https: Flags [S], seq 1249470781, win 65535, options [mss 1460,sackOK,TS val 695628 ecr 0,nop,wscale 7], length 0
22:36:19.625134 IP sea15s11-in-f10.1e100.net.https > 192.168.1.10.41762: Flags [S.], seq 3741658211, ack 1249470782, win 42408, options [mss 1360,sackOK,TS val 2633003623 ecr 695628,nop,wscale 8], length 0
22:36:19.627456 IP 192.168.1.10.41762 > sea15s11-in-f10.1e100.net.https: Flags [.], ack 1, win 685, options [nop,nop,TS val 695636 ecr 2633003623], length 0
22:36:19.628962 IP 192.168.1.10.41762 > sea15s11-in-f10.1e100.net.https: Flags [P.], seq 1:174, ack 1, win 685, options [nop,nop,TS val 695636 ecr 2633003623], length 173
22:36:19.708811 IP sea15s11-in-f10.1e100.net.https > 192.168.1.10.41762: Flags [.], ack 174, win 170, options [nop,nop,TS val 2633003707 ecr 695636], length 0
22:36:19.717513 IP sea15s11-in-f10.1e100.net.https > 192.168.1.10.41762: Flags [.], seq 1:1349, ack 174, win 170, options [nop,nop,TS val 2633003715 ecr 695636], length 1348
22:36:19.717614 IP sea15s11-in-f10.1e100.net.https > 192.168.1.10.41762: Flags [.], seq 1349:2697, ack 174, win 170, options [nop,nop,TS val 2633003715 ecr 695636], length 1348
22:36:19.717633 IP sea15s11-in-f10.1e100.net.https > 192.168.1.10.41762: Flags [P.], seq 2697:3264, ack 174, win 170, options [nop,nop,TS val 2633003715 ecr 695636], length 567
22:36:19.741435 IP 192.168.1.10.41762 > sea15s11-in-f10.1e100.net.https: Flags [.], ack 1349, win 706, options [nop,nop,TS val 695648 ecr 2633003715], length 0
22:36:19.751548 IP 192.168.1.10.41762 > sea15s11-in-f10.1e100.net.https: Flags [.], ack 2697, win 727, options [nop,nop,TS val 695649 ecr 2633003715], length 0
22:36:19.751829 IP 192.168.1.10.41762 > sea15s11-in-f10.1e100.net.https: Flags [.], ack 3264, win 748, options [nop,nop,TS val 695649 ecr 2633003715], length 0
22:36:19.770056 IP 192.168.1.10.41762 > sea15s11-in-f10.1e100.net.https: Flags [P.], seq 174:267, ack 3264, win 748, options [nop,nop,TS val 695651 ecr 2633003715], length 93
22:36:19.823561 IP sea15s11-in-f10.1e100.net.https > 192.168.1.10.41762: Flags [P.], seq 3264:3315, ack 267, win 170, options [nop,nop,TS val 2633003821 ecr 695651], length 51
22:36:19.832323 IP 192.168.1.10.41762 > sea15s11-in-f10.1e100.net.https: Flags [P.], seq 267:738, ack 3315, win 748, options [nop,nop,TS val 695657 ecr 2633003821], length 471
22:36:19.915577 IP sea15s11-in-f10.1e100.net.https > 192.168.1.10.41762: Flags [P.], seq 3315:3873, ack 738, win 175, options [nop,nop,TS val 2633003913 ecr 695657], length 558
22:36:19.915965 IP sea15s11-in-f10.1e100.net.https > 192.168.1.10.41762: Flags [P.], seq 3873:5221, ack 738, win 175, options [nop,nop,TS val 2633003914 ecr 695657], length 1348
22:36:19.916088 IP sea15s11-in-f10.1e100.net.https > 192.168.1.10.41762: Flags [P.], seq 5221:5506, ack 738, win 175, options [nop,nop,TS val 2633003914 ecr 695657], length 285
22:36:19.917951 IP 192.168.1.10.41762 > sea15s11-in-f10.1e100.net.https: Flags [.], ack 5221, win 790, options [nop,nop,TS val 695665 ecr 2633003913], length 0
22:36:19.918401 IP sea15s11-in-f10.1e100.net.https > 192.168.1.10.41762: Flags [P.], seq 5506:5557, ack 738, win 175, options [nop,nop,TS val 2633003916 ecr 695657], length 51
22:36:19.918823 IP sea15s11-in-f10.1e100.net.https > 192.168.1.10.41762: Flags [P.], seq 5557:5591, ack 738, win 175, options [nop,nop,TS val 2633003917 ecr 695657], length 34
22:36:19.924866 IP 192.168.1.10.41762 > sea15s11-in-f10.1e100.net.https: Flags [.], ack 5591, win 811, options [nop,nop,TS val 695666 ecr 2633003914], length 0
22:36:20.045962 IP 192.168.1.10.48550 > sea15s12-in-f10.1e100.net.https: Flags [S], seq 3357305497, win 65535, options [mss 1460,sackOK,TS val 695678 ecr 0,nop,wscale 7], length 0
22:36:20.101056 IP sea15s12-in-f10.1e100.net.https > 192.168.1.10.48550: Flags [S.], seq 4066707800, ack 3357305498, win 42408, options [mss 1360,sackOK,TS val 1665621192 ecr 695678,nop,wscale 8], length 0
22:36:20.102760 IP 192.168.1.10.48550 > sea15s12-in-f10.1e100.net.https: Flags [.], ack 1, win 685, options [nop,nop,TS val 695684 ecr 1665621192], length 0
22:36:20.104076 IP 192.168.1.10.48550 > sea15s12-in-f10.1e100.net.https: Flags [P.], seq 1:170, ack 1, win 685, options [nop,nop,TS val 695684 ecr 1665621192], length 169
22:36:20.157940 IP sea15s12-in-f10.1e100.net.https > 192.168.1.10.48550: Flags [.], ack 170, win 170, options [nop,nop,TS val 1665621248 ecr 695684], length 0
22:36:20.165195 IP sea15s12-in-f10.1e100.net.https > 192.168.1.10.48550: Flags [.], seq 1:1349, ack 170, win 170, options [nop,nop,TS val 1665621256 ecr 695684], length 1348
22:36:20.165309 IP sea15s12-in-f10.1e100.net.https > 192.168.1.10.48550: Flags [.], seq 1349:2697, ack 170, win 170, options [nop,nop,TS val 1665621256 ecr 695684], length 1348
22:36:20.165343 IP sea15s12-in-f10.1e100.net.https > 192.168.1.10.48550: Flags [P.], seq 2697:3236, ack 170, win 170, options [nop,nop,TS val 1665621256 ecr 695684], length 539
22:36:20.167617 IP 192.168.1.10.48550 > sea15s12-in-f10.1e100.net.https: Flags [.], ack 1349, win 706, options [nop,nop,TS val 695690 ecr 1665621256], length 0
22:36:20.167923 IP 192.168.1.10.48550 > sea15s12-in-f10.1e100.net.https: Flags [.], ack 2697, win 727, options [nop,nop,TS val 695690 ecr 1665621256], length 0
22:36:20.168313 IP 192.168.1.10.48550 > sea15s12-in-f10.1e100.net.https: Flags [.], ack 3236, win 748, options [nop,nop,TS val 695690 ecr 1665621256], length 0
22:36:20.209480 IP 192.168.1.10.48550 > sea15s12-in-f10.1e100.net.https: Flags [P.], seq 170:263, ack 3236, win 748, options [nop,nop,TS val 695695 ecr 1665621256], length 93
22:36:20.230221 IP 192.168.1.10.47368 > sea15s07-in-f68.1e100.net.www: Flags [S], seq 2283054064, win 65535, options [mss 1460,sackOK,TS val 695697 ecr 0,nop,wscale 7], length 0
22:36:20.237699 IP sea15s07-in-f68.1e100.net.www > 192.168.1.10.47368: Flags [S.], seq 3061502808, ack 2283054065, win 26960, options [mss 1360,sackOK,TS val 3155309251 ecr 695697,nop,wscale 7], length 0
22:36:20.239825 IP 192.168.1.10.47368 > sea15s07-in-f68.1e100.net.www: Flags [.], ack 1, win 685, options [nop,nop,TS val 695697 ecr 3155309251], length 0
22:36:20.240000 IP 192.168.1.10.47368 > sea15s07-in-f68.1e100.net.www: Flags [P.], seq 1:101, ack 1, win 685, options [nop,nop,TS val 695698 ecr 3155309251], length 100: HTTP: GET / HTTP/1.1
22:36:20.247174 IP sea15s07-in-f68.1e100.net.www > 192.168.1.10.47368: Flags [.], ack 101, win 211, options [nop,nop,TS val 3155309253 ecr 695698], length 0
22:36:20.262035 IP sea15s12-in-f10.1e100.net.https > 192.168.1.10.48550: Flags [P.], seq 3236:3520, ack 263, win 170, options [nop,nop,TS val 1665621353 ecr 695695], length 284
22:36:20.263841 IP 192.168.1.10.48550 > sea15s12-in-f10.1e100.net.https: Flags [.], ack 3520, win 769, options [nop,nop,TS val 695700 ecr 1665621353], length 0
22:36:20.265444 IP 192.168.1.10.48550 > sea15s12-in-f10.1e100.net.https: Flags [P.], seq 263:1283, ack 3520, win 769, options [nop,nop,TS val 695700 ecr 1665621353], length 1020
22:36:20.339671 IP sea15s07-in-f68.1e100.net.www > 192.168.1.10.47368: Flags [P.], seq 1:803, ack 101, win 211, options [nop,nop,TS val 3155309276 ecr 695698], length 802: HTTP: HTTP/1.1 200 OK
22:36:20.339958 IP sea15s07-in-f68.1e100.net.www > 192.168.1.10.47368: Flags [.], seq 803:2151, ack 101, win 211, options [nop,nop,TS val 3155309276 ecr 695698], length 1348: HTTP
22:36:20.340010 IP sea15s07-in-f68.1e100.net.www > 192.168.1.10.47368: Flags [.], seq 2151:3499, ack 101, win 211, options [nop,nop,TS val 3155309276 ecr 695698], length 1348: HTTP
22:36:20.340040 IP sea15s07-in-f68.1e100.net.www > 192.168.1.10.47368: Flags [.], seq 3499:4847, ack 101, win 211, options [nop,nop,TS val 3155309276 ecr 695698], length 1348: HTTP
22:36:20.340067 IP sea15s07-in-f68.1e100.net.www > 192.168.1.10.47368: Flags [P.], seq 4847:4899, ack 101, win 211, options [nop,nop,TS val 3155309276 ecr 695698], length 52: HTTP
22:36:20.341914 IP sea15s07-in-f68.1e100.net.www > 192.168.1.10.47368: Flags [P.], seq 4899:5836, ack 101, win 211, options [nop,nop,TS val 3155309276 ecr 695698], length 937: HTTP
22:36:20.342096 IP 192.168.1.10.47368 > sea15s07-in-f68.1e100.net.www: Flags [.], ack 803, win 697, options [nop,nop,TS val 695708 ecr 3155309276], length 0
22:36:20.342348 IP 192.168.1.10.47368 > sea15s07-in-f68.1e100.net.www: Flags [.], ack 2151, win 718, options [nop,nop,TS val 695708 ecr 3155309276], length 0
22:36:20.342364 IP 192.168.1.10.47368 > sea15s07-in-f68.1e100.net.www: Flags [.], ack 3499, win 740, options [nop,nop,TS val 695708 ecr 3155309276], length 0
22:36:20.342503 IP sea15s07-in-f68.1e100.net.www > 192.168.1.10.47368: Flags [F.], seq 5836, ack 101, win 211, options [nop,nop,TS val 3155309276 ecr 695698], length 0
22:36:20.343226 IP 192.168.1.10.47368 > sea15s07-in-f68.1e100.net.www: Flags [.], ack 4847, win 761, options [nop,nop,TS val 695708 ecr 3155309276], length 0
22:36:20.343245 IP 192.168.1.10.47368 > sea15s07-in-f68.1e100.net.www: Flags [.], ack 4899, win 761, options [nop,nop,TS val 695708 ecr 3155309276], length 0
22:36:20.343860 IP 192.168.1.10.47368 > sea15s07-in-f68.1e100.net.www: Flags [.], ack 5836, win 782, options [nop,nop,TS val 695708 ecr 3155309276], length 0
22:36:20.354137 IP sea15s12-in-f10.1e100.net.https > 192.168.1.10.48550: Flags [.], ack 1283, win 178, options [nop,nop,TS val 1665621405 ecr 695700], length 0
22:36:20.356699 IP sea15s12-in-f10.1e100.net.https > 192.168.1.10.48550: Flags [P.], seq 4868:6216, ack 1283, win 178, options [nop,nop,TS val 1665621447 ecr 695700], length 1348
22:36:20.356817 IP sea15s12-in-f10.1e100.net.https > 192.168.1.10.48550: Flags [P.], seq 3520:4868, ack 1283, win 178, options [nop,nop,TS val 1665621447 ecr 695700], length 1348
22:36:20.357485 IP sea15s12-in-f10.1e100.net.https > 192.168.1.10.48550: Flags [.], seq 6216:7564, ack 1283, win 178, options [nop,nop,TS val 1665621447 ecr 695700], length 1348
22:36:20.357530 IP sea15s12-in-f10.1e100.net.https > 192.168.1.10.48550: Flags [P.], seq 7564:7872, ack 1283, win 178, options [nop,nop,TS val 1665621447 ecr 695700], length 308
22:36:20.358550 IP sea15s12-in-f10.1e100.net.https > 192.168.1.10.48550: Flags [P.], seq 7872:9220, ack 1283, win 178, options [nop,nop,TS val 1665621449 ecr 695700], length 1348
22:36:20.359452 IP sea15s12-in-f10.1e100.net.https > 192.168.1.10.48550: Flags [.], seq 9220:10568, ack 1283, win 178, options [nop,nop,TS val 1665621449 ecr 695700], length 1348
22:36:20.359520 IP sea15s12-in-f10.1e100.net.https > 192.168.1.10.48550: Flags [P.], seq 10568:11916, ack 1283, win 178, options [nop,nop,TS val 1665621449 ecr 695700], length 1348
22:36:20.361139 IP sea15s12-in-f10.1e100.net.https > 192.168.1.10.48550: Flags [P.], seq 11916:12106, ack 1283, win 178, options [nop,nop,TS val 1665621449 ecr 695700], length 190
22:36:20.361298 IP sea15s12-in-f10.1e100.net.https > 192.168.1.10.48550: Flags [P.], seq 12106:13454, ack 1283, win 178, options [nop,nop,TS val 1665621450 ecr 695700], length 1348
22:36:20.362182 IP sea15s12-in-f10.1e100.net.https > 192.168.1.10.48550: Flags [.], seq 13454:14802, ack 1283, win 178, options [nop,nop,TS val 1665621450 ecr 695700], length 1348
22:36:20.362239 IP sea15s12-in-f10.1e100.net.https > 192.168.1.10.48550: Flags [P.], seq 14802:16150, ack 1283, win 178, options [nop,nop,TS val 1665621450 ecr 695700], length 1348
22:36:20.363904 IP sea15s12-in-f10.1e100.net.https > 192.168.1.10.48550: Flags [.], seq 16150:17498, ack 1283, win 178, options [nop,nop,TS val 1665621450 ecr 695700], length 1348
22:36:20.363957 IP sea15s12-in-f10.1e100.net.https > 192.168.1.10.48550: Flags [.], seq 17498:18846, ack 1283, win 178, options [nop,nop,TS val 1665621450 ecr 695700], length 1348
22:36:20.368162 IP sea15s12-in-f10.1e100.net.https > 192.168.1.10.48550: Flags [.], seq 18846:20194, ack 1283, win 178, options [nop,nop,TS val 1665621450 ecr 695700], length 1348
22:36:20.371252 IP 192.168.1.10.48550 > sea15s12-in-f10.1e100.net.https: Flags [.], ack 3520, win 769, options [nop,nop,TS val 695710 ecr 1665621405,nop,nop,sack 1 {4868:6216}], length 0
22:36:20.371278 IP 192.168.1.10.48550 > sea15s12-in-f10.1e100.net.https: Flags [.], ack 6216, win 790, options [nop,nop,TS val 695711 ecr 1665621447], length 0
22:36:20.373255 IP 192.168.1.10.48550 > sea15s12-in-f10.1e100.net.https: Flags [.], ack 7564, win 811, options [nop,nop,TS val 695711 ecr 1665621447], length 0
22:36:20.373279 IP 192.168.1.10.48550 > sea15s12-in-f10.1e100.net.https: Flags [.], ack 7872, win 832, options [nop,nop,TS val 695711 ecr 1665621447], length 0
22:36:20.375728 IP 192.168.1.10.48550 > sea15s12-in-f10.1e100.net.https: Flags [.], ack 9220, win 853, options [nop,nop,TS val 695711 ecr 1665621449], length 0
22:36:20.375742 IP 192.168.1.10.48550 > sea15s12-in-f10.1e100.net.https: Flags [.], ack 10568, win 874, options [nop,nop,TS val 695711 ecr 1665621449], length 0
22:36:20.375753 IP 192.168.1.10.48550 > sea15s12-in-f10.1e100.net.https: Flags [.], ack 11916, win 895, options [nop,nop,TS val 695711 ecr 1665621449], length 0
22:36:20.375762 IP 192.168.1.10.48550 > sea15s12-in-f10.1e100.net.https: Flags [.], ack 12106, win 917, options [nop,nop,TS val 695711 ecr 1665621449], length 0
22:36:20.375772 IP 192.168.1.10.48550 > sea15s12-in-f10.1e100.net.https: Flags [.], ack 13454, win 938, options [nop,nop,TS val 695711 ecr 1665621450], length 0
22:36:20.375801 IP 192.168.1.10.48550 > sea15s12-in-f10.1e100.net.https: Flags [.], ack 14802, win 959, options [nop,nop,TS val 695711 ecr 1665621450], length 0
22:36:20.376300 IP 192.168.1.10.48550 > sea15s12-in-f10.1e100.net.https: Flags [.], ack 16150, win 980, options [nop,nop,TS val 695711 ecr 1665621450], length 0
22:36:20.376313 IP 192.168.1.10.48550 > sea15s12-in-f10.1e100.net.https: Flags [.], ack 17498, win 1001, options [nop,nop,TS val 695711 ecr 1665621450], length 0
22:36:20.376323 IP 192.168.1.10.48550 > sea15s12-in-f10.1e100.net.https: Flags [.], ack 18846, win 1022, options [nop,nop,TS val 695711 ecr 1665621450], length 0
22:36:20.376354 IP 192.168.1.10.48550 > sea15s12-in-f10.1e100.net.https: Flags [.], ack 20194, win 1043, options [nop,nop,TS val 695711 ecr 1665621450], length 0
22:36:20.379470 IP 192.168.1.10.47368 > sea15s07-in-f68.1e100.net.www: Flags [.], ack 5837, win 782, options [nop,nop,TS val 695712 ecr 3155309276], length 0
22:36:20.416181 IP sea15s12-in-f10.1e100.net.https > 192.168.1.10.48550: Flags [.], seq 20194:21542, ack 1283, win 178, options [nop,nop,TS val 1665621507 ecr 695710], length 1348
22:36:20.416297 IP sea15s12-in-f10.1e100.net.https > 192.168.1.10.48550: Flags [.], seq 21542:22890, ack 1283, win 178, options [nop,nop,TS val 1665621507 ecr 695710], length 1348
22:36:20.416935 IP sea15s12-in-f10.1e100.net.https > 192.168.1.10.48550: Flags [.], seq 22890:24238, ack 1283, win 178, options [nop,nop,TS val 1665621507 ecr 695711], length 1348
22:36:20.417017 IP sea15s12-in-f10.1e100.net.https > 192.168.1.10.48550: Flags [.], seq 24238:25586, ack 1283, win 178, options [nop,nop,TS val 1665621507 ecr 695711], length 1348
22:36:20.418644 IP sea15s12-in-f10.1e100.net.https > 192.168.1.10.48550: Flags [.], seq 25586:26934, ack 1283, win 178, options [nop,nop,TS val 1665621509 ecr 695711], length 1348
22:36:20.418713 IP sea15s12-in-f10.1e100.net.https > 192.168.1.10.48550: Flags [.], seq 26934:28282, ack 1283, win 178, options [nop,nop,TS val 1665621509 ecr 695711], length 1348
22:36:20.418824 IP 192.168.1.10.48550 > sea15s12-in-f10.1e100.net.https: Flags [.], ack 21542, win 1064, options [nop,nop,TS val 695715 ecr 1665621507], length 0
22:36:20.419038 IP 192.168.1.10.48550 > sea15s12-in-f10.1e100.net.https: Flags [.], ack 22890, win 1085, options [nop,nop,TS val 695715 ecr 1665621507], length 0
22:36:20.419335 IP 192.168.1.10.48550 > sea15s12-in-f10.1e100.net.https: Flags [.], ack 24238, win 1106, options [nop,nop,TS val 695715 ecr 1665621507], length 0
22:36:20.420324 IP 192.168.1.10.48550 > sea15s12-in-f10.1e100.net.https: Flags [.], ack 25586, win 1127, options [nop,nop,TS val 695716 ecr 1665621507], length 0
22:36:20.420953 IP 192.168.1.10.48550 > sea15s12-in-f10.1e100.net.https: Flags [.], ack 26934, win 1148, options [nop,nop,TS val 695716 ecr 1665621509], length 0
22:36:20.421134 IP 192.168.1.10.48550 > sea15s12-in-f10.1e100.net.https: Flags [.], ack 28282, win 1169, options [nop,nop,TS val 695716 ecr 1665621509], length 0
22:36:20.423117 IP sea15s12-in-f10.1e100.net.https > 192.168.1.10.48550: Flags [.], seq 28282:29630, ack 1283, win 178, options [nop,nop,TS val 1665621509 ecr 695711], length 1348
22:36:20.423228 IP sea15s12-in-f10.1e100.net.https > 192.168.1.10.48550: Flags [.], seq 29630:30978, ack 1283, win 178, options [nop,nop,TS val 1665621509 ecr 695711], length 1348
22:36:20.425501 IP 192.168.1.10.48550 > sea15s12-in-f10.1e100.net.https: Flags [.], ack 29630, win 1190, options [nop,nop,TS val 695716 ecr 1665621509], length 0
22:36:20.425813 IP 192.168.1.10.48550 > sea15s12-in-f10.1e100.net.https: Flags [.], ack 30978, win 1211, options [nop,nop,TS val 695716 ecr 1665621509], length 0
22:36:20.426495 IP sea15s12-in-f10.1e100.net.https > 192.168.1.10.48550: Flags [.], seq 30978:32326, ack 1283, win 178, options [nop,nop,TS val 1665621511 ecr 695711], length 1348
22:36:20.426587 IP sea15s12-in-f10.1e100.net.https > 192.168.1.10.48550: Flags [.], seq 32326:33674, ack 1283, win 178, options [nop,nop,TS val 1665621511 ecr 695711], length 1348
22:36:20.428626 IP 192.168.1.10.48550 > sea15s12-in-f10.1e100.net.https: Flags [.], ack 32326, win 1232, options [nop,nop,TS val 695716 ecr 1665621511], length 0
22:36:20.429039 IP 192.168.1.10.48550 > sea15s12-in-f10.1e100.net.https: Flags [.], ack 33674, win 1254, options [nop,nop,TS val 695716 ecr 1665621511], length 0
22:36:20.430186 IP sea15s12-in-f10.1e100.net.https > 192.168.1.10.48550: Flags [.], seq 33674:35022, ack 1283, win 178, options [nop,nop,TS val 1665621513 ecr 695711], length 1348
22:36:20.430279 IP sea15s12-in-f10.1e100.net.https > 192.168.1.10.48550: Flags [.], seq 35022:36370, ack 1283, win 178, options [nop,nop,TS val 1665621513 ecr 695711], length 1348
22:36:20.433894 IP sea15s12-in-f10.1e100.net.https > 192.168.1.10.48550: Flags [.], seq 36370:37718, ack 1283, win 178, options [nop,nop,TS val 1665621517 ecr 695711], length 1348
22:36:20.433994 IP sea15s12-in-f10.1e100.net.https > 192.168.1.10.48550: Flags [.], seq 37718:39066, ack 1283, win 178, options [nop,nop,TS val 1665621517 ecr 695711], length 1348
22:36:20.434496 IP 192.168.1.10.48550 > sea15s12-in-f10.1e100.net.https: Flags [.], ack 35022, win 1275, options [nop,nop,TS val 695717 ecr 1665621513], length 0
22:36:20.435602 IP 192.168.1.10.48550 > sea15s12-in-f10.1e100.net.https: Flags [.], ack 36370, win 1296, options [nop,nop,TS val 695717 ecr 1665621513], length 0
22:36:20.436034 IP 192.168.1.10.48550 > sea15s12-in-f10.1e100.net.https: Flags [.], ack 37718, win 1317, options [nop,nop,TS val 695717 ecr 1665621517], length 0
22:36:20.436334 IP 192.168.1.10.48550 > sea15s12-in-f10.1e100.net.https: Flags [.], ack 39066, win 1338, options [nop,nop,TS val 695717 ecr 1665621517], length 0
22:36:20.437542 IP sea15s12-in-f10.1e100.net.https > 192.168.1.10.48550: Flags [.], seq 39066:40414, ack 1283, win 178, options [nop,nop,TS val 1665621521 ecr 695711], length 1348
22:36:20.437613 IP sea15s12-in-f10.1e100.net.https > 192.168.1.10.48550: Flags [.], seq 40414:41762, ack 1283, win 178, options [nop,nop,TS val 1665621521 ecr 695711], length 1348
22:36:20.438294 IP sea15s12-in-f10.1e100.net.https > 192.168.1.10.48550: Flags [.], seq 41762:43110, ack 1283, win 178, options [nop,nop,TS val 1665621524 ecr 695711], length 1348
22:36:20.438339 IP sea15s12-in-f10.1e100.net.https > 192.168.1.10.48550: Flags [.], seq 43110:44458, ack 1283, win 178, options [nop,nop,TS val 1665621524 ecr 695711], length 1348
22:36:20.439969 IP 192.168.1.10.48550 > sea15s12-in-f10.1e100.net.https: Flags [.], ack 40414, win 1359, options [nop,nop,TS val 695718 ecr 1665621521], length 0
22:36:20.440120 IP 192.168.1.10.48550 > sea15s12-in-f10.1e100.net.https: Flags [.], ack 41762, win 1380, options [nop,nop,TS val 695718 ecr 1665621521], length 0
22:36:20.441246 IP sea15s12-in-f10.1e100.net.https > 192.168.1.10.48550: Flags [.], seq 44458:45806, ack 1283, win 178, options [nop,nop,TS val 1665621528 ecr 695711], length 1348
22:36:20.441333 IP sea15s12-in-f10.1e100.net.https > 192.168.1.10.48550: Flags [.], seq 45806:47154, ack 1283, win 178, options [nop,nop,TS val 1665621528 ecr 695711], length 1348
22:36:20.443383 IP 192.168.1.10.48550 > sea15s12-in-f10.1e100.net.https: Flags [.], ack 43110, win 1401, options [nop,nop,TS val 695718 ecr 1665621524], length 0
22:36:20.443405 IP 192.168.1.10.48550 > sea15s12-in-f10.1e100.net.https: Flags [.], ack 44458, win 1422, options [nop,nop,TS val 695718 ecr 1665621524], length 0
22:36:20.443852 IP 192.168.1.10.48550 > sea15s12-in-f10.1e100.net.https: Flags [.], ack 45806, win 1443, options [nop,nop,TS val 695718 ecr 1665621528], length 0
22:36:20.444087 IP 192.168.1.10.48550 > sea15s12-in-f10.1e100.net.https: Flags [.], ack 47154, win 1464, options [nop,nop,TS val 695718 ecr 1665621528], length 0
22:36:20.444944 IP sea15s12-in-f10.1e100.net.https > 192.168.1.10.48550: Flags [.], seq 47154:48502, ack 1283, win 178, options [nop,nop,TS val 1665621528 ecr 695711], length 1348
22:36:20.445030 IP sea15s12-in-f10.1e100.net.https > 192.168.1.10.48550: Flags [.], seq 48502:49850, ack 1283, win 178, options [nop,nop,TS val 1665621528 ecr 695711], length 1348
22:36:20.446970 IP 192.168.1.10.48550 > sea15s12-in-f10.1e100.net.https: Flags [.], ack 48502, win 1485, options [nop,nop,TS val 695718 ecr 1665621528], length 0
22:36:20.447208 IP 192.168.1.10.48550 > sea15s12-in-f10.1e100.net.https: Flags [.], ack 49850, win 1506, options [nop,nop,TS val 695718 ecr 1665621528], length 0
22:36:20.448692 IP sea15s12-in-f10.1e100.net.https > 192.168.1.10.48550: Flags [.], seq 49850:51198, ack 1283, win 178, options [nop,nop,TS val 1665621532 ecr 695711], length 1348
22:36:20.448820 IP sea15s12-in-f10.1e100.net.https > 192.168.1.10.48550: Flags [.], seq 51198:52546, ack 1283, win 178, options [nop,nop,TS val 1665621532 ecr 695711], length 1348
22:36:20.450903 IP 192.168.1.10.48550 > sea15s12-in-f10.1e100.net.https: Flags [.], ack 51198, win 1527, options [nop,nop,TS val 695719 ecr 1665621532], length 0
22:36:20.451474 IP 192.168.1.10.48550 > sea15s12-in-f10.1e100.net.https: Flags [.], ack 52546, win 1548, options [nop,nop,TS val 695719 ecr 1665621532], length 0
22:36:20.452260 IP sea15s12-in-f10.1e100.net.https > 192.168.1.10.48550: Flags [.], seq 52546:53894, ack 1283, win 178, options [nop,nop,TS val 1665621535 ecr 695711], length 1348
22:36:20.452370 IP sea15s12-in-f10.1e100.net.https > 192.168.1.10.48550: Flags [.], seq 53894:55242, ack 1283, win 178, options [nop,nop,TS val 1665621535 ecr 695711], length 1348
22:36:20.454626 IP 192.168.1.10.48550 > sea15s12-in-f10.1e100.net.https: Flags [.], ack 53894, win 1569, options [nop,nop,TS val 695719 ecr 1665621535], length 0
22:36:20.455235 IP 192.168.1.10.48550 > sea15s12-in-f10.1e100.net.https: Flags [.], ack 55242, win 1591, options [nop,nop,TS val 695719 ecr 1665621535], length 0
22:36:20.456012 IP sea15s12-in-f10.1e100.net.https > 192.168.1.10.48550: Flags [.], seq 55242:56590, ack 1283, win 178, options [nop,nop,TS val 1665621539 ecr 695711], length 1348
22:36:20.456092 IP sea15s12-in-f10.1e100.net.https > 192.168.1.10.48550: Flags [.], seq 56590:57938, ack 1283, win 178, options [nop,nop,TS val 1665621539 ecr 695711], length 1348
22:36:20.463118 IP sea15s12-in-f10.1e100.net.https > 192.168.1.10.48550: Flags [.], seq 57938:59286, ack 1283, win 178, options [nop,nop,TS val 1665621554 ecr 695715], length 1348
22:36:20.463221 IP sea15s12-in-f10.1e100.net.https > 192.168.1.10.48550: Flags [.], seq 59286:60634, ack 1283, win 178, options [nop,nop,TS val 1665621554 ecr 695715], length 1348
22:36:20.464838 IP sea15s12-in-f10.1e100.net.https > 192.168.1.10.48550: Flags [.], seq 60634:61982, ack 1283, win 178, options [nop,nop,TS val 1665621554 ecr 695715], length 1348
22:36:20.464924 IP sea15s12-in-f10.1e100.net.https > 192.168.1.10.48550: Flags [.], seq 61982:63330, ack 1283, win 178, options [nop,nop,TS val 1665621554 ecr 695715], length 1348
22:36:20.464960 IP sea15s12-in-f10.1e100.net.https > 192.168.1.10.48550: Flags [.], seq 63330:64678, ack 1283, win 178, options [nop,nop,TS val 1665621554 ecr 695715], length 1348
22:36:20.464988 IP sea15s12-in-f10.1e100.net.https > 192.168.1.10.48550: Flags [.], seq 64678:66026, ack 1283, win 178, options [nop,nop,TS val 1665621554 ecr 695715], length 1348
22:36:20.467809 IP sea15s12-in-f10.1e100.net.https > 192.168.1.10.48550: Flags [.], seq 66026:67374, ack 1283, win 178, options [nop,nop,TS val 1665621555 ecr 695716], length 1348
22:36:20.467908 IP sea15s12-in-f10.1e100.net.https > 192.168.1.10.48550: Flags [.], seq 67374:68722, ack 1283, win 178, options [nop,nop,TS val 1665621555 ecr 695716], length 1348
22:36:20.469981 IP 192.168.1.10.48550 > sea15s12-in-f10.1e100.net.https: Flags [.], ack 56590, win 1612, options [nop,nop,TS val 695720 ecr 1665621539], length 0
22:36:20.470007 IP 192.168.1.10.48550 > sea15s12-in-f10.1e100.net.https: Flags [.], ack 57938, win 1633, options [nop,nop,TS val 695720 ecr 1665621539], length 0
22:36:20.470746 IP sea15s12-in-f10.1e100.net.https > 192.168.1.10.48550: Flags [.], seq 68722:70070, ack 1283, win 178, options [nop,nop,TS val 1665621556 ecr 695716], length 1348
22:36:20.470840 IP sea15s12-in-f10.1e100.net.https > 192.168.1.10.48550: Flags [.], seq 70070:71418, ack 1283, win 178, options [nop,nop,TS val 1665621556 ecr 695716], length 1348
22:36:20.470501 IP 192.168.1.10.48550 > sea15s12-in-f10.1e100.net.https: Flags [.], ack 59286, win 1654, options [nop,nop,TS val 695720 ecr 1665621554], length 0
22:36:20.470516 IP 192.168.1.10.48550 > sea15s12-in-f10.1e100.net.https: Flags [.], ack 60634, win 1675, options [nop,nop,TS val 695720 ecr 1665621554], length 0
22:36:20.470525 IP 192.168.1.10.48550 > sea15s12-in-f10.1e100.net.https: Flags [.], ack 61982, win 1696, options [nop,nop,TS val 695720 ecr 1665621554], length 0
22:36:20.470537 IP 192.168.1.10.48550 > sea15s12-in-f10.1e100.net.https: Flags [.], ack 63330, win 1717, options [nop,nop,TS val 695720 ecr 1665621554], length 0
22:36:20.470553 IP 192.168.1.10.48550 > sea15s12-in-f10.1e100.net.https: Flags [.], ack 64678, win 1738, options [nop,nop,TS val 695721 ecr 1665621554], length 0
22:36:20.471222 IP 192.168.1.10.48550 > sea15s12-in-f10.1e100.net.https: Flags [.], ack 66026, win 1759, options [nop,nop,TS val 695721 ecr 1665621554], length 0
