tcpdump: verbose output suppressed, use -v or -vv for full protocol decode
listening on wlan0, link-type EN10MB (Ethernet), capture size 262144 bytes
00:55:54.334755 IP 192.168.1.10.43309 > sea15s07-in-f10.1e100.net.https: Flags [F.], seq 2892103823, ack 1998776117, win 8025, options [nop,nop,TS val 567375 ecr 3656072521], length 0
00:55:54.334779 IP 192.168.1.10.42817 > sea15s07-in-f10.1e100.net.https: Flags [F.], seq 196961630, ack 1507759413, win 7056, options [nop,nop,TS val 567375 ecr 2092628209], length 0
00:55:54.365691 IP sea15s07-in-f10.1e100.net.https > 192.168.1.10.42817: Flags [F.], seq 1, ack 1, win 186, options [nop,nop,TS val 2092795300 ecr 567375], length 0
00:55:54.366802 IP sea15s07-in-f10.1e100.net.https > 192.168.1.10.43309: Flags [F.], seq 1, ack 1, win 259, options [nop,nop,TS val 3656227154 ecr 567375], length 0
00:55:54.367305 IP 192.168.1.10.42817 > sea15s07-in-f10.1e100.net.https: Flags [.], ack 2, win 7056, options [nop,nop,TS val 567378 ecr 2092795300], length 0
00:55:54.367781 IP 192.168.1.10.43309 > sea15s07-in-f10.1e100.net.https: Flags [.], ack 2, win 8025, options [nop,nop,TS val 567378 ecr 3656227154], length 0
00:55:55.260612 IP 192.168.1.10.36189 > sea15s12-in-f14.1e100.net.https: Flags [P.], seq 560840951:560841364, ack 3296857795, win 2085, options [nop,nop,TS val 567467 ecr 3461382475], length 413
00:55:55.260640 IP 192.168.1.10.36189 > sea15s12-in-f14.1e100.net.https: Flags [.], seq 413:1761, ack 1, win 2085, options [nop,nop,TS val 567467 ecr 3461382475], length 1348
00:55:55.292033 IP sea15s12-in-f14.1e100.net.https > 192.168.1.10.36189: Flags [.], ack 413, win 810, options [nop,nop,TS val 3461476843 ecr 567467], length 0
00:55:55.292217 IP sea15s12-in-f14.1e100.net.https > 192.168.1.10.36189: Flags [.], ack 1761, win 806, options [nop,nop,TS val 3461476843 ecr 567467], length 0
00:55:55.307591 IP 192.168.1.10.36189 > sea15s12-in-f14.1e100.net.https: Flags [P.], seq 1761:2479, ack 1, win 2085, options [nop,nop,TS val 567471 ecr 3461476843], length 718
00:55:55.338976 IP sea15s12-in-f14.1e100.net.https > 192.168.1.10.36189: Flags [.], ack 2479, win 810, options [nop,nop,TS val 3461476890 ecr 567471], length 0
00:55:56.916160 IP sea15s12-in-f14.1e100.net.https > 192.168.1.10.36189: Flags [P.], seq 1:505, ack 2479, win 811, options [nop,nop,TS val 3461478467 ecr 567471], length 504
00:55:56.916325 IP sea15s12-in-f14.1e100.net.https > 192.168.1.10.36189: Flags [P.], seq 505:747, ack 2479, win 811, options [nop,nop,TS val 3461478467 ecr 567471], length 242
00:55:56.916385 IP sea15s12-in-f14.1e100.net.https > 192.168.1.10.36189: Flags [P.], seq 747:773, ack 2479, win 811, options [nop,nop,TS val 3461478467 ecr 567471], length 26
00:55:57.009117 IP 192.168.1.10.36189 > sea15s12-in-f14.1e100.net.https: Flags [.], ack 505, win 2085, options [nop,nop,TS val 567642 ecr 3461478467], length 0
00:55:57.009131 IP 192.168.1.10.36189 > sea15s12-in-f14.1e100.net.https: Flags [.], ack 747, win 2085, options [nop,nop,TS val 567642 ecr 3461478467], length 0
00:55:57.009145 IP 192.168.1.10.36189 > sea15s12-in-f14.1e100.net.https: Flags [.], ack 773, win 2085, options [nop,nop,TS val 567642 ecr 3461478467], length 0
00:56:06.876913 IP 192.168.1.10.36189 > sea15s12-in-f14.1e100.net.https: Flags [P.], seq 2479:2919, ack 773, win 2085, options [nop,nop,TS val 568627 ecr 3461478467], length 440
00:56:06.908335 IP sea15s12-in-f14.1e100.net.https > 192.168.1.10.36189: Flags [.], ack 2919, win 810, options [nop,nop,TS val 3461488459 ecr 568627], length 0
00:56:07.108571 IP sea15s12-in-f14.1e100.net.https > 192.168.1.10.36189: Flags [P.], seq 773:1277, ack 2919, win 811, options [nop,nop,TS val 3461488659 ecr 568627], length 504
00:56:07.108791 IP sea15s12-in-f14.1e100.net.https > 192.168.1.10.36189: Flags [P.], seq 1277:1389, ack 2919, win 811, options [nop,nop,TS val 3461488659 ecr 568627], length 112
00:56:07.108905 IP sea15s12-in-f14.1e100.net.https > 192.168.1.10.36189: Flags [P.], seq 1389:1415, ack 2919, win 811, options [nop,nop,TS val 3461488660 ecr 568627], length 26
00:56:07.110812 IP 192.168.1.10.36189 > sea15s12-in-f14.1e100.net.https: Flags [.], ack 1277, win 2085, options [nop,nop,TS val 568653 ecr 3461488659], length 0
00:56:07.110827 IP 192