tcpdump: verbose output suppressed, use -v or -vv for full protocol decode
listening on wlan0, link-type EN10MB (Ethernet), capture size 262144 bytes
20:46:40.376402 IP 192.168.1.10.38281 > agentportal.flurry.vip.gq1.yahoo.com.www: Flags [S], seq 1439507293, win 14600, options [mss 1460,sackOK,TS val 58428 ecr 0,nop,wscale 7], length 0
20:46:40.376993 IP 192.168.1.10.38282 > agentportal.flurry.vip.gq1.yahoo.com.www: Flags [S], seq 2754234285, win 14600, options [mss 1460,sackOK,TS val 58428 ecr 0,nop,wscale 7], length 0
20:46:40.383722 IP agentportal.flurry.vip.gq1.yahoo.com.www > 192.168.1.10.38281: Flags [S.], seq 1557581156, ack 1439507294, win 26960, options [mss 1360,sackOK,TS val 3175263290 ecr 58428,nop,wscale 7], length 0
20:46:40.384244 IP agentportal.flurry.vip.gq1.yahoo.com.www > 192.168.1.10.38282: Flags [S.], seq 1803894136, ack 2754234286, win 26960, options [mss 1360,sackOK,TS val 3175263291 ecr 58428,nop,wscale 7], length 0
20:46:40.385206 IP 192.168.1.10.38281 > agentportal.flurry.vip.gq1.yahoo.com.www: Flags [.], ack 1, win 115, options [nop,nop,TS val 58429 ecr 3175263290], length 0
20:46:40.385361 IP 192.168.1.10.38282 > agentportal.flurry.vip.gq1.yahoo.com.www: Flags [.], ack 1, win 115, options [nop,nop,TS val 58429 ecr 3175263291], length 0
20:46:40.386687 IP 192.168.1.10.38281 > agentportal.flurry.vip.gq1.yahoo.com.www: Flags [P.], seq 1:134, ack 1, win 115, options [nop,nop,TS val 58429 ecr 3175263290], length 133: HTTP: POST /aap.do HTTP/1.1
20:46:40.387067 IP 192.168.1.10.38281 > agentportal.flurry.vip.gq1.yahoo.com.www: Flags [P.], seq 134:400, ack 1, win 115, options [nop,nop,TS val 58429 ecr 3175263290], length 266: HTTP
20:46:40.388726 IP 192.168.1.10.38282 > agentportal.flurry.vip.gq1.yahoo.com.www: Flags [P.], seq 1:134, ack 1, win 115, options [nop,nop,TS val 58429 ecr 3175263291], length 133: HTTP: POST /aap.do HTTP/1.1
20:46:40.389102 IP 192.168.1.10.38282 > agentportal.flurry.vip.gq1.yahoo.com.www: Flags [P.], seq 134:586, ack 1, win 115, options [nop,nop,TS val 58430 ecr 3175263291], length 452: HTTP
20:46:40.393891 IP agentportal.flurry.vip.gq1.yahoo.com.www > 192.168.1.10.38281: Flags [.], ack 134, win 219, options [nop,nop,TS val 3175263293 ecr 58429], length 0
20:46:40.394232 IP agentportal.flurry.vip.gq1.yahoo.com.www > 192.168.1.10.38281: Flags [.], ack 400, win 228, options [nop,nop,TS val 3175263293 ecr 58429], length 0
20:46:40.396003 IP agentportal.flurry.vip.gq1.yahoo.com.www > 192.168.1.10.38282: Flags [.], ack 134, win 219, options [nop,nop,TS val 3175263293 ecr 58429], length 0
20:46:40.396275 IP agentportal.flurry.vip.gq1.yahoo.com.www > 192.168.1.10.38282: Flags [.], ack 586, win 228, options [nop,nop,TS val 3175263294 ecr 58430], length 0
20:46:40.570959 IP agentportal.flurry.vip.gq1.yahoo.com.www > 192.168.1.10.38281: Flags [P.], seq 1:271, ack 400, win 228, options [nop,nop,TS val 3175263337 ecr 58429], length 270: HTTP: HTTP/1.1 200 OK
20:46:40.572873 IP 192.168.1.10.38281 > agentportal.flurry.vip.gq1.yahoo.com.www: Flags [.], ack 271, win 123, options [nop,nop,TS val 58448 ecr 3175263337], length 0
20:46:40.573052 IP agentportal.flurry.vip.gq1.yahoo.com.www > 192.168.1.10.38282: Flags [P.], seq 1:271, ack 586, win 228, options [nop,nop,TS val 3175263338 ecr 58430], length 270: HTTP: HTTP/1.1 200 OK
20:46:40.574496 IP 192.168.1.10.38282 > agentportal.flurry.vip.gq1.yahoo.com.www: Flags [.], ack 271, win 123, options [nop,nop,TS val 58448 ecr 3175263338], length 0
20:46:40.575922 IP 192.168.1.10.38282 > agentportal.flurry.vip.gq1.yahoo.com.www: Flags [F.], seq 586, ack 271, win 123, options [nop,nop,TS val 58448 ecr 3175263338], length 0
20:46:40.578920 IP 192.168.1.10.38281 > agentportal.flurry.vip.gq1.yahoo.com.www: Flags [F.], seq 400, ack 271, win 123, options [nop,nop,TS val 58449 ecr 3175263337], length 0
20:46:40.583349 IP agentportal.flurry.vip.gq1.yahoo.com.www > 192.168.1.10.38282: Flags [F.], seq 271, ack 587, win 228, options [nop,nop,TS val 3175263340 ecr 58448], length 0
20:46:40.584302 IP 192.168.1.10.51034 > 208.91.255.230.www: Flags [S], seq 766670480, win 14600, options [mss 1460,sackOK,TS val 58449 ecr 0,nop,wscale 7], length 0
20:46:40.584645 IP 192.168.1.10.38282 > agentportal.flurry.vip.gq1.yahoo.com.www: Flags [.], ack 272, win 123, options [nop,nop,TS val 58449 ecr 3175263340], length 0
20:46:40.586336 IP agentportal.flurry.vip.gq1.yahoo.com.www > 192.168.1.10.38281: Flags [F.], seq 271, ack 401, win 228, options [nop,nop,TS val 3175263341 ecr 58449], length 0
20:46:40.587590 IP 192.168.1.10.38281 > agentportal.flurry.vip.gq1.yahoo.com.www: Flags [.], ack 272, win 123, options [nop,nop,TS val 58449 ecr 3175263341], length 0
20:46:40.591771 IP 208.91.255.230.www > 192.168.1.10.51034: Flags [S.], seq 1651322279, ack 766670481, win 26960, options [mss 1360,sackOK,TS val 3175263342 ecr 58449,nop,wscale 7], length 0
20:46:40.593008 IP 192.168.1.10.51034 > 208.91.255.230.www: Flags [.], ack 1, win 115, options [nop,nop,TS val 58450 ecr 3175263342], length 0
20:46:40.635913 IP 192.168.1.10.51034 > 208.91.255.230.www: Flags [P.], seq 1:222, ack 1, win 115, options [nop,nop,TS val 58454 ecr 3175263342], length 221: HTTP: GET /guide/v3/lineup/tmobile/mobitvhd_3pg/4.0//tiles.text.plist HTTP/1.1
20:46:40.643387 IP 208.91.255.230.www > 192.168.1.10.51034: Flags [.], ack 222, win 219, options [nop,nop,TS val 3175263355 ecr 58454], length 0
20:46:40.725511 IP 208.91.255.230.www > 192.168.1.10.51034: Flags [.], seq 1:1349, ack 222, win 219, options [nop,nop,TS val 3175263376 ecr 58454], length 1348: HTTP: HTTP/1.1 200 OK
20:46:40.725620 IP 208.91.255.230.www > 192.168.1.10.51034: Flags [.], seq 1349:2697, ack 222, win 219, options [nop,nop,TS val 3175263376 ecr 58454], length 1348: HTTP
20:46:40.725651 IP 208.91.255.230.www > 192.168.1.10.51034: Flags [.], seq 2697:4045, ack 222, win 219, options [nop,nop,TS val 3175263376 ecr 58454], length 1348: HTTP
20:46:40.725682 IP 208.91.255.230.www > 192.168.1.10.51034: Flags [P.], seq 4045:4188, ack 222, win 219, options [nop,nop,TS val 3175263376 ecr 58454], length 143: HTTP
20:46:40.725951 IP 208.91.255.230.www > 192.168.1.10.51034: Flags [.], seq 4188:5536, ack 222, win 219, options [nop,nop,TS val 3175263376 ecr 58454], length 1348: HTTP
20:46:40.725978 IP 208.91.255.230.www > 192.168.1.10.51034: Flags [.], seq 5536:6884, ack 222, win 219, options [nop,nop,TS val 3175263376 ecr 58454], length 1348: HTTP
20:46:40.725990 IP 208.91.255.230.www > 192.168.1.10.51034: Flags [.], seq 6884:8232, ack 222, win 219, options [nop,nop,TS val 3175263376 ecr 58454], length 1348: HTTP
20:46:40.726000 IP 208.91.255.230.www > 192.168.1.10.51034: Flags [.], seq 8232:9580, ack 222, win 219, options [nop,nop,TS val 3175263376 ecr 58454], length 1348: HTTP
20:46:40.726011 IP 208.91.255.230.www > 192.168.1.10.51034: Flags [.], seq 9580:10928, ack 222, win 219, options [nop,nop,TS val 3175263376 ecr 58454], length 1348: HTTP
20:46:40.726021 IP 208.91.255.230.www > 192.168.1.10.51034: Flags [.], seq 10928:12276, ack 222, win 219, options [nop,nop,TS val 3175263376 ecr 58454], length 1348: HTTP
20:46:40.731895 IP 192.168.1.10.51034 > 208.91.255.230.www: Flags [.], ack 9580, win 283, options [nop,nop,TS val 58464 ecr 3175263376], length 0
20:46:40.731919 IP 192.168.1.10.51034 > 208.91.255.230.www: Flags [.], ack 12276, win 325, options [nop,nop,TS val 58464 ecr 3175263376], length 0
20:46:40.739197 IP 208.91.255.230.www > 192.168.1.10.51034: Flags [P.], seq 12276:13449, ack 222, win 219, options [nop,nop,TS val 3175263379 ecr 58464], length 1173: HTTP
20:46:40.740743 IP 192.168.1.10.51034 > 208.91.255.230.www: Flags [.], ack 13449, win 346, options [nop,nop,TS val 58465 ecr 3175263379], length 0
20:46:42.727405 IP 192.168.1.10.55619 > sea15s01-in-f142.1e100.net.www: Flags [S], seq 1743976908, win 14600, options [mss 1460,sackOK,TS val 58663 ecr 0,nop,wscale 7], length 0
20:46:42.734799 IP sea15s01-in-f142.1e100.net.www > 192.168.1.10.55619: Flags [S.], seq 3195860810, ack 1743976909, win 26960, options [mss 1360,sackOK,TS val 3175263878 ecr 58663,nop,wscale 7], length 0
20:46:43.382959 IP 192.168.1.10.42952 > sea15s11-in-f2.1e100.net.https: Flags [S], seq 3912305814, win 14600, options [mss 1460,sackOK,TS val 58724 ecr 0,nop,wscale 7], length 0
20:46:43.413941 IP sea15s11-in-f2.1e100.net.https > 192.168.1.10.42952: Flags [S.], seq 1939451399, ack 3912305815, win 42408, options [mss 1360,sackOK,TS val 3145448150 ecr 58724,nop,wscale 8], length 0
20:46:43.415303 IP 192.168.1.10.42952 > sea15s11-in-f2.1e100.net.https: Flags [.], ack 1, win 115, options [nop,nop,TS val 58732 ecr 3145448150], length 0
20:46:43.420911 IP 192.168.1.10.42952 > sea15s11-in-f2.1e100.net.https: Flags [P.], seq 1:181, ack 1, win 115, options [nop,nop,TS val 58733 ecr 3145448150], length 180
20:46:43.451712 IP sea15s11-in-f2.1e100.net.https > 192.168.1.10.42952: Flags [.], ack 181, win 170, options [nop,nop,TS val 3145448188 ecr 58733], length 0
20:46:43.458964 IP sea15s11-in-f2.1e100.net.https > 192.168.1.10.42952: Flags [.], seq 1:1349, ack 181, win 170, options [nop,nop,TS val 3145448195 ecr 58733], length 1348
20:46:43.459073 IP sea15s11-in-f2.1e100.net.https > 192.168.1.10.42952: Flags [P.], seq 1349:2518, ack 181, win 170, options [nop,nop,TS val 3145448195 ecr 58733], length 1169
20:46:43.460702 IP 192.168.1.10.42952 > sea15s11-in-f2.1e100.net.https: Flags [.], ack 1349, win 136, options [nop,nop,TS val 58737 ecr 3145448195], length 0
20:46:43.461042 IP 192.168.1.10.42952 > sea15s11-in-f2.1e100.net.https: Flags [.], ack 2518, win 157, options [nop,nop,TS val 58737 ecr 3145448195], length 0
20:46:43.726399 IP 192.168.1.10.55619 > sea15s01-in-f142.1e100.net.www: Flags [S], seq 1743976908, win 14600, options [mss 1460,sackOK,TS val 58763 ecr 0,nop,wscale 7], length 0
20:46:43.733946 IP sea15s01-in-f142.1e100.net.www > 192.168.1.10.55619: Flags [S.], seq 3195860810, ack 1743976909, win 26960, options [mss 1360,sackOK,TS val 3175264128 ecr 58663,nop,wscale 7], length 0
20:46:43.735255 IP 192.168.1.10.55619 > sea15s01-in-f142.1e100.net.www: Flags [.], ack 1, win 115, options [nop,nop,TS val 58764 ecr 3175264128], length 0
20:46:43.735749 IP 192.168.1.10.55619 > sea15s01-in-f142.1e100.net.www: Flags [P.], seq 1:150, ack 1, win 115, options [nop,nop,TS val 58764 ecr 3175264128], length 149: HTTP: GET /generate_204 HTTP/1.1
20:46:43.743008 IP sea15s01-in-f142.1e100.net.www > 192.168.1.10.55619: Flags [.], ack 150, win 219, options [nop,nop,TS val 3175264130 ecr 58764], length 0
20:46:43.772584 IP 192.168.1.10.49236 > sea15s02-in-f170.1e100.net.https: Flags [S], seq 2770248826, win 14600, options [mss 1460,sackOK,TS val 58768 ecr 0,nop,wscale 7], length 0
20:46:43.803723 IP sea15s02-in-f170.1e100.net.https > 192.168.1.10.49236: Flags [S.], seq 1309800624, ack 2770248827, win 42408, options [mss 1360,sackOK,TS val 1336164275 ecr 58768,nop,wscale 8], length 0
20:46:43.804956 IP 192.168.1.10.49236 > sea15s02-in-f170.1e100.net.https: Flags [.], ack 1, win 115, options [nop,nop,TS val 58771 ecr 1336164275], length 0
20:46:43.810221 IP 192.168.1.10.49236 > sea15s02-in-f170.1e100.net.https: Flags [P.], seq 1:170, ack 1, win 115, options [nop,nop,TS val 58772 ecr 1336164275], length 169
20:46:43.841333 IP sea15s02-in-f170.1e100.net.https > 192.168.1.10.49236: Flags [.], ack 170, win 170, options [nop,nop,TS val 1336164313 ecr 58772], length 0
20:46:43.842350 IP sea15s01-in-f142.1e100.net.www > 192.168.1.10.55619: Flags [P.], seq 1:219, ack 150, win 219, options [nop,nop,TS val 3175264155 ecr 58764], length 218: HTTP: HTTP/1.1 204 No Content
20:46:43.842488 IP sea15s01-in-f142.1e100.net.www > 192.168.1.10.55619: Flags [F.], seq 219, ack 150, win 219, options [nop,nop,TS val 3175264155 ecr 58764], length 0
20:46:43.843733 IP 192.168.1.10.55619 > sea15s01-in-f142.1e100.net.www: Flags [.], ack 219, win 123, options [nop,nop,TS val 58775 ecr 3175264155], length 0
20:46:43.844007 IP 192.168.1.10.55619 > sea15s01-in-f142.1e100.net.www: Flags [F.], seq 150, ack 220, win 123, options [nop,nop,TS val 58775 ecr 3175264155], length 0
20:46:43.848564 IP sea15s02-in-f170.1e100.net.https > 192.168.1.10.49236: Flags [.], seq 1:1349, ack 170, win 170, options [nop,nop,TS val 1336164320 ecr 58772], length 1348
20:46:43.848663 IP sea15s02-in-f170.1e100.net.https > 192.168.1.10.49236: Flags [.], seq 1349:2697, ack 170, win 170, options [nop,nop,TS val 1336164320 ecr 58772], length 1348
20:46:43.848695 IP sea15s02-in-f170.1e100.net.https > 192.168.1.10.49236: Flags [P.], seq 2697:3235, ack 170, win 170, options [nop,nop,TS val 1336164320 ecr 58772], length 538
20:46:43.850199 IP 192.168.1.10.49236 > sea15s02-in-f170.1e100.net.https: Flags [.], ack 1349, win 136, options [nop,nop,TS val 58776 ecr 1336164320], length 0
20:46:43.851186 IP sea15s01-in-f142.1e100.net.www > 192.168.1.10.55619: Flags [.], ack 151, win 219, options [nop,nop,TS val 3175264157 ecr 58775], length 0
20:46:43.852202 IP 192.168.1.10.49236 > sea15s02-in-f170.1e100.net.https: Flags [.], ack 3235, win 178, options [nop,nop,TS val 58776 ecr 1336164320], length 0
20:46:43.861563 IP 192.168.1.10.48970 > 213.71.30.150.www: Flags [S], seq 2342130461, win 14600, options [mss 1460,sackOK,TS val 58777 ecr 0,nop,wscale 7], length 0
20:46:43.868833 IP 213.71.30.150.www > 192.168.1.10.48970: Flags [S.], seq 3058113290, ack 2342130462, win 26960, options [mss 1360,sackOK,TS val 3175264162 ecr 58777,nop,wscale 7], length 0
20:46:43.870228 IP 192.168.1.10.48970 > 213.71.30.150.www: Flags [.], ack 1, win 115, options [nop,nop,TS val 58778 ecr 3175264162], length 0
20:46:43.874982 IP 192.168.1.10.48970 > 213.71.30.150.www: Flags [P.], seq 1:465, ack 1, win 115, options [nop,nop,TS val 58778 ecr 3175264162], length 464: HTTP: GET /security/sso/initialize/time HTTP/1.1
20:46:43.882259 IP 213.71.30.150.www > 192.168.1.10.48970: Flags [.], ack 465, win 219, options [nop,nop,TS val 3175264165 ecr 58778], length 0
20:46:43.916638 IP 192.168.1.10.49236 > sea15s02-in-f170.1e100.net.https: Flags [P.], seq 170:255, ack 3235, win 178, options [nop,nop,TS val 58782 ecr 1336164320], length 85
20:46:43.948317 IP sea15s02-in-f170.1e100.net.https > 192.168.1.10.49236: Flags [P.], seq 3235:3511, ack 255, win 170, options [nop,nop,TS val 1336164419 ecr 58782], length 276
20:46:43.949609 IP 192.168.1.10.49236 > sea15s02-in-f170.1e100.net.https: Flags [.], ack 3511, win 199, options [nop,nop,TS val 58786 ecr 1336164419], length 0
20:46:43.986884 IP 192.168.1.10.37347 > sea15s01-in-f3.1e100.net.https: Flags [S], seq 1071085537, win 14600, options [mss 1460,sackOK,TS val 58789 ecr 0,nop,wscale 7], length 0
20:46:44.010112 IP 192.168.1.10.49236 > sea15s02-in-f170.1e100.net.https: Flags [P.], seq 255:1203, ack 3511, win 199, options [nop,nop,TS val 58792 ecr 1336164419], length 948
20:46:44.017163 IP sea15s01-in-f3.1e100.net.https > 192.168.1.10.37347: Flags [S.], seq 867607777, ack 1071085538, win 42408, options [mss 1360,sackOK,TS val 1827825574 ecr 58789,nop,wscale 8], length 0
20:46:44.018339 IP 192.168.1.10.37347 > sea15s01-in-f3.1e100.net.https: Flags [.], ack 1, win 115, options [nop,nop,TS val 58792 ecr 1827825574], length 0
20:46:44.040601 IP 192.168.1.10.37347 > sea15s01-in-f3.1e100.net.https: Flags [P.], seq 1:165, ack 1, win 115, options [nop,nop,TS val 58795 ecr 1827825574], length 164
20:46:44.070804 IP sea15s01-in-f3.1e100.net.https > 192.168.1.10.37347: Flags [.], ack 165, win 170, options [nop,nop,TS val 1827825628 ecr 58795], length 0
20:46:44.076698 IP sea15s02-in-f170.1e100.net.https > 192.168.1.10.49236: Flags [P.], seq 3511:4859, ack 1203, win 178, options [nop,nop,TS val 1336164548 ecr 58792], length 1348
20:46:44.076789 IP sea15s02-in-f170.1e100.net.https > 192.168.1.10.49236: Flags [P.], seq 4859:6207, ack 1203, win 178, options [nop,nop,TS val 1336164548 ecr 58792], length 1348
20:46:44.076900 IP sea15s02-in-f170.1e100.net.https > 192.168.1.10.49236: Flags [.], seq 6207:7555, ack 1203, win 178, options [nop,nop,TS val 1336164548 ecr 58792], length 1348
20:46:44.076921 IP sea15s02-in-f170.1e100.net.https > 192.168.1.10.49236: Flags [P.], seq 7555:7901, ack 1203, win 178, options [nop,nop,TS val 1336164548 ecr 58792], length 346
20:46:44.076979 IP sea15s02-in-f170.1e100.net.https > 192.168.1.10.49236: Flags [P.], seq 7901:9249, ack 1203, win 178, options [nop,nop,TS val 1336164548 ecr 58792], length 1348
20:46:44.077101 IP sea15s02-in-f170.1e100.net.https > 192.168.1.10.49236: Flags [.], seq 9249:10597, ack 1203, win 178, options [nop,nop,TS val 1336164548 ecr 58792], length 1348
20:46:44.077120 IP sea15s02-in-f170.1e100.net.https > 192.168.1.10.49236: Flags [P.], seq 10597:11945, ack 1203, win 178, options [nop,nop,TS val 1336164548 ecr 58792], length 1348
20:46:44.077226 IP sea15s02-in-f170.1e100.net.https > 192.168.1.10.49236: Flags [.], seq 11945:13293, ack 1203, win 178, options [nop,nop,TS val 1336164548 ecr 58792], length 1348
20:46:44.077247 IP sea15s02-in-f170.1e100.net.https > 192.168.1.10.49236: Flags [.], seq 13293:14641, ack 1203, win 178, options [nop,nop,TS val 1336164548 ecr 58792], length 1348
20:46:44.077258 IP sea15s02-in-f170.1e100.net.https > 192.168.1.10.49236: Flags [.], seq 14641:15989, ack 1203, win 178, options [nop,nop,TS val 1336164548 ecr 58792], length 1348
20:46:44.077267 IP sea15s02-in-f170.1e100.net.https > 192.168.1.10.49236: Flags [P.], seq 15989:16422, ack 1203, win 178, options [nop,nop,TS val 1336164548 ecr 58792], length 433
20:46:44.078635 IP sea15s01-in-f3.1e100.net.https > 192.168.1.10.37347: Flags [.], seq 1:1349, ack 165, win 170, options [nop,nop,TS val 1827825636 ecr 58795], length 1348
20:46:44.078676 IP sea15s01-in-f3.1e100.net.https > 192.168.1.10.37347: Flags [.], seq 1349:2697, ack 165, win 170, options [nop,nop,TS val 1827825636 ecr 58795], length 1348
20:46:44.078687 IP sea15s01-in-f3.1e100.net.https > 192.168.1.10.37347: Flags [.], seq 2697:4045, ack 165, win 170, options [nop,nop,TS val 1827825636 ecr 58795], length 1348
20:46:44.078698 IP sea15s01-in-f3.1e100.net.https > 192.168.1.10.37347: Flags [P.], seq 4045:4140, ack 165, win 170, options [nop,nop,TS val 1827825636 ecr 58795], length 95
20:46:44.079533 IP sea15s02-in-f170.1e100.net.https > 192.168.1.10.49236: Flags [P.], seq 16422:17770, ack 1203, win 178, options [nop,nop,TS val 1336164548 ecr 58792], length 1348
20:46:44.079630 IP sea15s02-in-f170.1e100.net.https > 192.168.1.10.49236: Flags [.], seq 17770:19118, ack 1203, win 178, options [nop,nop,TS val 1336164548 ecr 58792], length 1348
20:46:44.079645 IP sea15s02-in-f170.1e100.net.https > 192.168.1.10.49236: Flags [P.], seq 19118:20466, ack 1203, win 178, options [nop,nop,TS val 1336164548 ecr 58792], length 1348
20:46:44.094847 IP 192.168.1.10.49236 > sea15s02-in-f170.1e100.net.https: Flags [.], ack 4859, win 220, options [nop,nop,TS val 58800 ecr 1336164548], length 0
20:46:44.094861 IP 192.168.1.10.49236 > sea15s02-in-f170.1e100.net.https: Flags [.], ack 6207, win 241, options [nop,nop,TS val 58800 ecr 1336164548], length 0
20:46:44.094870 IP 192.168.1.10.49236 > sea15s02-in-f170.1e100.net.https: Flags [.], ack 7555, win 262, options [nop,nop,TS val 58800 ecr 1336164548], length 0
20:46:44.094879 IP 192.168.1.10.49236 > sea15s02-in-f170.1e100.net.https: Flags [.], ack 7901, win 283, options [nop,nop,TS val 58800 ecr 1336164548], length 0
20:46:44.094888 IP 192.168.1.10.49236 > sea15s02-in-f170.1e100.net.https: Flags [.], ack 9249, win 304, options [nop,nop,TS val 58800 ecr 1336164548], length 0
20:46:44.094897 IP 192.168.1.10.49236 > sea15s02-in-f170.1e100.net.https: Flags [.], ack 10597, win 325, options [nop,nop,TS val 58800 ecr 1336164548], length 0
20:46:44.094908 IP 192.168.1.10.49236 > sea15s02-in-f170.1e100.net.https: Flags [.], ack 11945, win 346, options [nop,nop,TS val 58800 ecr 1336164548], length 0
20:46:44.094924 IP 192.168.1.10.49236 > sea15s02-in-f170.1e100.net.https: Flags [.], ack 13293, win 367, options [nop,nop,TS val 58800 ecr 1336164548], length 0
20:46:44.096832 IP 192.168.1.10.49236 > sea15s02-in-f170.1e100.net.https: Flags [.], ack 14641, win 388, options [nop,nop,TS val 58800 ecr 1336164548], length 0
20:46:44.096844 IP 192.168.1.10.49236 > sea15s02-in-f170.1e100.net.https: Flags [.], ack 15989, win 409, options [nop,nop,TS val 58800 ecr 1336164548], length 0
20:46:44.096854 IP 192.168.1.10.49236 > sea15s02-in-f170.1e100.net.https: Flags [.], ack 16422, win 430, options [nop,nop,TS val 58800 ecr 1336164548], length 0
20:46:44.096864 IP 192.168.1.10.37347 > sea15s01-in-f3.1e100.net.https: Flags [.], ack 1349, win 136, options [nop,nop,TS val 58800 ecr 1827825636], length 0
20:46:44.096872 IP 192.168.1.10.37347 > sea15s01-in-f3.1e100.net.https: Flags [.], ack 4140, win 178, options [nop,nop,TS val 58800 ecr 1827825636], length 0
20:46:44.096882 IP 192.168.1.10.49236 > sea15s02-in-f170.1e100.net.https: Flags [.], ack 17770, win 452, options [nop,nop,TS val 58800 ecr 1336164548], length 0
20:46:44.096896 IP 192.168.1.10.49236 > sea15s02-in-f170.1e100.net.https: Flags [.], ack 19118, win 473, options [nop,nop,TS val 58800 ecr 1336164548], length 0
20:46:44.097290 IP 192.168.1.10.49236 > sea15s02-in-f170.1e100.net.https: Flags [.], ack 20466, win 494, options [nop,nop,TS val 58800 ecr 1336164548], length 0
20:46:44.126251 IP sea15s02-in-f170.1e100.net.https > 192.168.1.10.49236: Flags [.], seq 20466:21814, ack 1203, win 178, options [nop,nop,TS val 1336164597 ecr 58800], length 1348
20:46:44.126351 IP sea15s02-in-f170.1e100.net.https > 192.168.1.10.49236: Flags [.], seq 21814:23162, ack 1203, win 178, options [nop,nop,TS val 1336164597 ecr 58800], length 1348
20:46:44.126385 IP sea15s02-in-f170.1e100.net.https > 192.168.1.10.49236: Flags [.], seq 23162:24510, ack 1203, win 178, options [nop,nop,TS val 1336164597 ecr 58800], length 1348
20:46:44.126413 IP sea15s02-in-f170.1e100.net.https > 192.168.1.10.49236: Flags [.], seq 24510:25858, ack 1203, win 178, options [nop,nop,TS val 1336164597 ecr 58800], length 1348
20:46:44.127486 IP sea15s02-in-f170.1e100.net.https > 192.168.1.10.49236: Flags [.], seq 25858:27206, ack 1203, win 178, options [nop,nop,TS val 1336164597 ecr 58800], length 1348
20:46:44.127591 IP sea15s02-in-f170.1e100.net.https > 192.168.1.10.49236: Flags [.], seq 27206:28554, ack 1203, win 178, options [nop,nop,TS val 1336164597 ecr 58800], length 1348
20:46:44.129171 IP 192.168.1.10.49236 > sea15s02-in-f170.1e100.net.https: Flags [.], ack 21814, win 515, options [nop,nop,TS val 58803 ecr 1336164597], length 0
20:46:44.129383 IP 192.168.1.10.49236 > sea15s02-in-f170.1e100.net.https: Flags [.], ack 23162, win 536, options [nop,nop,TS val 58804 ecr 1336164597], length 0
20:46:44.129394 IP 192.168.1.10.49236 > sea15s02-in-f170.1e100.net.https: Flags [.], ack 24510, win 557, options [nop,nop,TS val 58804 ecr 1336164597], length 0
20:46:44.129409 IP 192.168.1.10.49236 > sea15s02-in-f170.1e100.net.https: Flags [.], ack 25858, win 578, options [nop,nop,TS val 58804 ecr 1336164597], length 0
20:46:44.129489 IP 192.168.1.10.49236 > sea15s02-in-f170.1e100.net.https: Flags [.], ack 27206, win 599, options [nop,nop,TS val 58804 ecr 1336164597], length 0
20:46:44.130119 IP sea15s02-in-f170.1e100.net.https > 192.168.1.10.49236: Flags [.], seq 28554:29902, ack 1203, win 178, options [nop,nop,TS val 1336164597 ecr 58800], length 1348
20:46:44.130196 IP sea15s02-in-f170.1e100.net.https > 192.168.1.10.49236: Flags [.], seq 29902:31250, ack 1203, win 178, options [nop,nop,TS val 1336164597 ecr 58800], length 1348
20:46:44.131661 IP 192.168.1.10.49236 > sea15s02-in-f170.1e100.net.https: Flags [.], ack 28554, win 620, options [nop,nop,TS val 58804 ecr 1336164597], length 0
20:46:44.131995 IP 192.168.1.10.49236 > sea15s02-in-f170.1e100.net.https: Flags [.], ack 29902, win 641, options [nop,nop,TS val 58804 ecr 1336164597], length 0
20:46:44.132014 IP 192.168.1.10.49236 > sea15s02-in-f170.1e100.net.https: Flags [.], ack 31250, win 662, options [nop,nop,TS val 58804 ecr 1336164597], length 0
20:46:44.132818 IP sea15s02-in-f170.1e100.net.https > 192.168.1.10.49236: Flags [.], seq 31250:32598, ack 1203, win 178, options [nop,nop,TS val 1336164599 ecr 58800], length 1348
20:46:44.132942 IP sea15s02-in-f170.1e100.net.https > 192.168.1.10.49236: Flags [.], seq 32598:33946, ack 1203, win 178, options [nop,nop,TS val 1336164599 ecr 58800], length 1348
20:46:44.132976 IP sea15s02-in-f170.1e100.net.https > 192.168.1.10.49236: Flags [.], seq 33946:35294, ack 1203, win 178, options [nop,nop,TS val 1336164599 ecr 58800], length 1348
20:46:44.134822 IP 192.168.1.10.49236 > sea15s02-in-f170.1e100.net.https: Flags [.], ack 32598, win 683, options [nop,nop,TS val 58804 ecr 1336164599], length 0
20:46:44.135260 IP sea15s02-in-f170.1e100.net.https > 192.168.1.10.49236: Flags [.], seq 35294:36642, ack 1203, win 178, options [nop,nop,TS val 1336164601 ecr 58800], length 1348
20:46:44.135373 IP sea15s02-in-f170.1e100.net.https > 192.168.1.10.49236: Flags [.], seq 36642:37990, ack 1203, win 178, options [nop,nop,TS val 1336164601 ecr 58800], length 1348
20:46:44.135500 IP 192.168.1.10.49236 > sea15s02-in-f170.1e100.net.https: Flags [.], ack 33946, win 704, options [nop,nop,TS val 58804 ecr 1336164599], length 0
20:46:44.135527 IP 192.168.1.10.49236 > sea15s02-in-f170.1e100.net.https: Flags [.], ack 35294, win 725, options [nop,nop,TS val 58804 ecr 1336164599], length 0
20:46:44.136861 IP 192.168.1.10.49236 > sea15s02-in-f170.1e100.net.https: Flags [.], ack 36642, win 746, options [nop,nop,TS val 58804 ecr 1336164601], length 0
20:46:44.137898 IP sea15s02-in-f170.1e100.net.https > 192.168.1.10.49236: Flags [.], seq 37990:39338, ack 1203, win 178, options [nop,nop,TS val 1336164604 ecr 58800], length 1348
20:46:44.137992 IP sea15s02-in-f170.1e100.net.https > 192.168.1.10.49236: Flags [.], seq 39338:40686, ack 1203, win 178, options [nop,nop,TS val 1336164604 ecr 58800], length 1348
20:46:44.138725 IP 192.168.1.10.49236 > sea15s02-in-f170.1e100.net.https: Flags [.], ack 37990, win 767, options [nop,nop,TS val 58804 ecr 1336164601], length 0
20:46:44.139705 IP 192.168.1.10.49236 > sea15s02-in-f170.1e100.net.https: Flags [.], ack 39338, win 789, options [nop,nop,TS val 58805 ecr 1336164604], length 0
20:46:44.140055 IP 192.168.1.10.49236 > sea15s02-in-f170.1e100.net.https: Flags [.], ack 40686, win 810, options [nop,nop,TS val 58805 ecr 1336164604], length 0
20:46:44.140516 IP sea15s02-in-f170.1e100.net.https > 192.168.1.10.49236: Flags [.], seq 40686:42034, ack 1203, win 178, options [nop,nop,TS val 1336164606 ecr 58800], length 1348
20:46:44.140599 IP sea15s02-in-f170.1e100.net.https > 192.168.1.10.49236: Flags [.], seq 42034:43382, ack 1203, win 178, options [nop,nop,TS val 1336164606 ecr 58800], length 1348
20:46:44.142124 IP 192.168.1.10.49236 > sea15s02-in-f170.1e100.net.https: Flags [.], ack 42034, win 831, options [nop,nop,TS val 58805 ecr 1336164606], length 0
20:46:44.142992 IP sea15s02-in-f170.1e100.net.https > 192.168.1.10.49236: Flags [.], seq 43382:44730, ack 1203, win 178, options [nop,nop,TS val 1336164609 ecr 58800], length 1348
20:46:44.143201 IP sea15s02-in-f170.1e100.net.https > 192.168.1.10.49236: Flags [.], seq 44730:46078, ack 1203, win 178, options [nop,nop,TS val 1336164609 ecr 58800], length 1348
20:46:44.143249 IP sea15s02-in-f170.1e100.net.https > 192.168.1.10.49236: Flags [.], seq 46078:47426, ack 1203, win 178, options [nop,nop,TS val 1336164609 ecr 58800], length 1348
20:46:44.143877 IP 192.168.1.10.49236 > sea15s02-in-f170.1e100.net.https: Flags [.], ack 43382, win 852, options [nop,nop,TS val 58805 ecr 1336164606], length 0
20:46:44.145110 IP 192.168.1.10.49236 > sea15s02-in-f170.1e100.net.https: Flags [.], ack 46078, win 894, options [nop,nop,TS val 58805 ecr 1336164609], length 0
20:46:44.145304 IP 192.168.1.10.49236 > sea15s02-in-f170.1e100.net.https: Flags [.], ack 47426, win 915, options [nop,nop,TS val 58805 ecr 1336164609], length 0
20:46:44.145623 IP sea15s02-in-f170.1e100.net.https > 192.168.1.10.49236: Flags [.], seq 47426:48774, ack 1203, win 178, options [nop,nop,TS val 1336164612 ecr 58800], length 1348
20:46:44.145699 IP sea15s02-in-f170.1e100.net.https > 192.168.1.10.49236: Flags [.], seq 48774:50122, ack 1203, win 178, options [nop,nop,TS val 1336164612 ecr 58800], length 1348
20:46:44.147335 IP 192.168.1.10.49236 > sea15s02-in-f170.1e100.net.https: Flags [.], ack 50122, win 957, options [nop,nop,TS val 58805 ecr 1336164612], length 0
20:46:44.148265 IP sea15s02-in-f170.1e100.net.https > 192.168.1.10.49236: Flags [.], seq 50122:51470, ack 1203, win 178, options [nop,nop,TS val 1336164614 ecr 58800], length 1348
20:46:44.148346 IP sea15s02-in-f170.1e100.net.https > 192.168.1.10.49236: Flags [.], seq 51470:52818, ack 1203, win 178, options [nop,nop,TS val 1336164614 ecr 58800], length 1348
20:46:44.149988 IP 192.168.1.10.49236 > sea15s02-in-f170.1e100.net.https: Flags [.], ack 51470, win 978, options [nop,nop,TS val 58806 ecr 1336164614], length 0
20:46:44.150748 IP sea15s02-in-f170.1e100.net.https > 192.168.1.10.49236: Flags [.], seq 52818:54166, ack 1203, win 178, options [nop,nop,TS val 1336164617 ecr 58800], length 1348
20:46:44.150881 IP sea15s02-in-f170.1e100.net.https > 192.168.1.10.49236: Flags [.], seq 54166:55514, ack 1203, win 178, options [nop,nop,TS val 1336164617 ecr 58800], length 1348
20:46:44.152198 IP 192.168.1.10.49236 > sea15s02-in-f170.1e100.net.https: Flags [.], ack 52818, win 999, options [nop,nop,TS val 58806 ecr 1336164614], length 0
20:46:44.152325 IP 192.168.1.10.49236 > sea15s02-in-f170.1e100.net.https: Flags [.], ack 54166, win 1020, options [nop,nop,TS val 58806 ecr 1336164617], length 0
20:46:44.152339 IP 192.168.1.10.49236 > sea15s02-in-f170.1e100.net.https: Flags [.], ack 55514, win 1041, options [nop,nop,TS val 58806 ecr 1336164617], length 0
20:46:44.153313 IP sea15s02-in-f170.1e100.net.https > 192.168.1.10.49236: Flags [.], seq 55514:56862, ack 1203, win 178, options [nop,nop,TS val 1336164619 ecr 58800], length 1348
20:46:44.153868 IP 192.168.1.10.42957 > sea15s11-in-f2.1e100.net.https: Flags [S], seq 1642437345, win 14600, options [mss 1460,sackOK,TS val 58806 ecr 0,nop,wscale 7], length 0
20:46:44.154821 IP 192.168.1.10.49236 > sea15s02-in-f170.1e100.net.https: Flags [.], ack 56862, win 1062, options [nop,nop,TS val 58806 ecr 1336164619], length 0
20:46:44.160343 IP sea15s02-in-f170.1e100.net.https > 192.168.1.10.49236: Flags [.], seq 56862:58210, ack 1203, win 178, options [nop,nop,TS val 1336164631 ecr 58803], length 1348
20:46:44.160546 IP sea15s02-in-f170.1e100.net.https > 192.168.1.10.49236: Flags [.], seq 58210:59558, ack 1203, win 178, options [nop,nop,TS val 1336164631 ecr 58803], length 1348
20:46:44.161602 IP sea15s02-in-f170.1e100.net.https > 192.168.1.10.49236: Flags [.], seq 59558:60906, ack 1203, win 178, options [nop,nop,TS val 1336164632 ecr 58804], length 1348
20:46:44.161658 IP sea15s02-in-f170.1e100.net.https > 192.168.1.10.49236: Flags [.], seq 60906:62254, ack 1203, win 178, options [nop,nop,TS val 1336164632 ecr 58804], length 1348
20:46:44.161978 IP 192.168.1.10.49236 > sea15s02-in-f170.1e100.net.https: Flags [.], ack 58210, win 1083, options [nop,nop,TS val 58807 ecr 1336164631], length 0
20:46:44.164094 IP sea15s02-in-f170.1e100.net.https > 192.168.1.10.49236: Flags [.], seq 62254:63602, ack 1203, win 178, options [nop,nop,TS val 1336164632 ecr 58804], length 1348
20:46:44.164146 IP sea15s02-in-f170.1e100.net.https > 192.168.1.10.49236: Flags [.], seq 63602:64950, ack 1203, win 178, options [nop,nop,TS val 1336164632 ecr 58804], length 1348
20:46:44.165691 IP 192.168.1.10.49236 > sea15s02-in-f170.1e100.net.https: Flags [.], ack 59558, win 1104, options [nop,nop,TS val 58807 ecr 1336164631], length 0
20:46:44.165705 IP 192.168.1.10.49236 > sea15s02-in-f170.1e100.net.https: Flags [.], ack 60906, win 1126, options [nop,nop,TS val 58807 ecr 1336164632], length 0
20:46:44.165718 IP 192.168.1.10.49236 > sea15s02-in-f170.1e100.net.https: Flags [.], ack 62254, win 1147, options [nop,nop,TS val 58807 ecr 1336164632], length 0
20:46:44.165946 IP 192.168.1.10.49236 > sea15s02-in-f170.1e100.net.https: Flags [.], ack 63602, win 1168, options [nop,nop,TS val 58807 ecr 1336164632], length 0
20:46:44.165962 IP 192.168.1.10.49236 > sea15s02-in-f170.1e100.net.https: Flags [.], ack 64950, win 1189, options [nop,nop,TS val 58807 ecr 1336164632], length 0
20:46:44.166280 IP sea15s02-in-f170.1e100.net.https > 192.168.1.10.49236: Flags [.], seq 64950:66298, ack 1203, win 178, options [nop,nop,TS val 1336164633 ecr 58804], length 1348
20:46:44.166334 IP sea15s02-in-f170.1e100.net.https > 192.168.1.10.49236: Flags [.], seq 66298:67646, ack 1203, win 178, options [nop,nop,TS val 1336164633 ecr 58804], length 1348
20:46:44.167895 IP 192.168.1.10.49236 > sea15s02-in-f170.1e100.net.https: Flags [.], ack 66298, win 1210, options [nop,nop,TS val 58807 ecr 1336164633], length 0
20:46:44.168598 IP sea15s02-in-f170.1e100.net.https > 192.168.1.10.49236: Flags [.], seq 67646:68994, ack 1203, win 178, options [nop,nop,TS val 1336164635 ecr 58804], length 1348
20:46:44.168695 IP sea15s02-in-f170.1e100.net.https > 192.168.1.10.49236: Flags [.], seq 68994:70342, ack 1203, win 178, options [nop,nop,TS val 1336164635 ecr 58804], length 1348
20:46:44.168876 IP sea15s02-in-f170.1e100.net.https > 192.168.1.10.49236: Flags [.], seq 70342:71690, ack 1203, win 178, options [nop,nop,TS val 1336164635 ecr 58804], length 1348
20:46:44.169488 IP 192.168.1.10.49236 > sea15s02-in-f170.1e100.net.https: Flags [.], ack 67646, win 1231, options [nop,nop,TS val 58808 ecr 1336164633], length 0
20:46:44.170805 IP sea15s02-in-f170.1e100.net.https > 192.168.1.10.49236: Flags [.], seq 71690:73038, ack 1203, win 178, options [nop,nop,TS val 1336164638 ecr 58804], length 1348
20:46:44.170881 IP sea15s02-in-f170.1e100.net.https > 192.168.1.10.49236: Flags [.], seq 73038:74386, ack 1203, win 178, options [nop,nop,TS val 1336164638 ecr 58804], length 1348
20:46:44.170992 IP 192.168.1.10.49236 > sea15s02-in-f170.1e100.net.https: Flags [.], ack 70342, win 1273, options [nop,nop,TS val 58808 ecr 1336164635], length 0
20:46:44.171007 IP 192.168.1.10.49236 > sea15s02-in-f170.1e100.net.https: Flags [.], ack 71690, win 1294, options [nop,nop,TS val 58808 ecr 1336164635], length 0
20:46:44.172321 IP 192.168.1.10.49236 > sea15s02-in-f170.1e100.net.https: Flags [.], ack 73038, win 1315, options [nop,nop,TS val 58808 ecr 1336164638], length 0
20:46:44.172564 IP 192.168.1.10.49236 > sea15s02-in-f170.1e100.net.https: Flags [.], ack 74386, win 1336, options [nop,nop,TS val 58808 ecr 1336164638], length 0
20:46:44.172944 IP sea15s02-in-f170.1e100.net.https > 192.168.1.10.49236: Flags [.], seq 74386:75734, ack 1203, win 178, options [nop,nop,TS val 1336164640 ecr 58804], length 1348
20:46:44.172999 IP sea15s02-in-f170.1e100.net.https > 192.168.1.10.49236: Flags [.], seq 75734:77082, ack 1203, win 178, options [nop,nop,TS val 1336164640 ecr 58804], length 1348
20:46:44.174570 IP 192.168.1.10.49236 > sea15s02-in-f170.1e100.net.https: Flags [.], ack 77082, win 1378, options [nop,nop,TS val 58808 ecr 1336164640], length 0
20:46:44.175055 IP sea15s02-in-f170.1e100.net.https > 192.168.1.10.49236: Flags [.], seq 77082:78430, ack 1203, win 178, options [nop,nop,TS val 1336164642 ecr 58804], length 1348
20:46:44.175159 IP sea15s02-in-f170.1e100.net.https > 192.168.1.10.49236: Flags [.], seq 78430:79778, ack 1203, win 178, options [nop,nop,TS val 1336164642 ecr 58804], length 1348
20:46:44.176765 IP 192.168.1.10.49236 > sea15s02-in-f170.1e100.net.https: Flags [.], ack 79778, win 1420, options [nop,nop,TS val 58808 ecr 1336164642], length 0
20:46:44.177386 IP sea15s02-in-f170.1e100.net.https > 192.168.1.10.49236: Flags [.], seq 79778:81126, ack 1203, win 178, options [nop,nop,TS val 1336164644 ecr 58805], length 1348
20:46:44.177470 IP sea15s02-in-f170.1e100.net.https > 192.168.1.10.49236: Flags [.], seq 81126:82474, ack 1203, win 178, options [nop,nop,TS val 1336164644 ecr 58805], length 1348
20:46:44.177594 IP sea15s02-in-f170.1e100.net.https > 192.168.1.10.49236: Flags [.], seq 82474:83822, ack 1203, win 178, options [nop,nop,TS val 1336164644 ecr 58805], length 1348
20:46:44.179244 IP 192.168.1.10.49236 > sea15s02-in-f170.1e100.net.https: Flags [.], ack 82474, win 1463, options [nop,nop,TS val 58809 ecr 1336164644], length 0
20:46:44.179602 IP sea15s02-in-f170.1e100.net.https > 192.168.1.10.49236: Flags [.], seq 83822:85170, ack 1203, win 178, options [nop,nop,TS val 1336164646 ecr 58805], length 1348
20:46:44.179727 IP sea15s02-in-f170.1e100.net.https > 192.168.1.10.49236: Flags [.], seq 85170:86518, ack 1203, win 178, options [nop,nop,TS val 1336164646 ecr 58805], length 1348
20:46:44.179880 IP 192.168.1.10.49236 > sea15s02-in-f170.1e100.net.https: Flags [.], ack 83822, win 1484, options [nop,nop,TS val 58809 ecr 1336164644], length 0
20:46:44.181791 IP sea15s02-in-f170.1e100.net.https > 192.168.1.10.49236: Flags [.], seq 86518:87866, ack 1203, win 178, options [nop,nop,TS val 1336164649 ecr 58805], length 1348
20:46:44.181868 IP sea15s02-in-f170.1e100.net.https > 192.168.1.10.49236: Flags [.], seq 87866:89214, ack 1203, win 178, options [nop,nop,TS val 1336164649 ecr 58805], length 1348
20:46:44.183011 IP sea15s11-in-f2.1e100.net.https > 192.168.1.10.42957: Flags [S.], seq 2650983320, ack 1642437346, win 42408, options [mss 1360,sackOK,TS val 2352940743 ecr 58806,nop,wscale 8], length 0
20:46:44.183878 IP sea15s02-in-f170.1e100.net.https > 192.168.1.10.49236: Flags [.], seq 89214:90562, ack 1203, win 178, options [nop,nop,TS val 1336164651 ecr 58805], length 1348
20:46:44.183973 IP sea15s02-in-f170.1e100.net.https > 192.168.1.10.49236: Flags [.], seq 90562:91910, ack 1203, win 178, options [nop,nop,TS val 1336164651 ecr 58805], length 1348
20:46:44.186152 IP sea15s02-in-f170.1e100.net.https > 192.168.1.10.49236: Flags [.], seq 91910:93258, ack 1203, win 178, options [nop,nop,TS val 1336164653 ecr 58806], length 1348
20:46:44.186248 IP sea15s02-in-f170.1e100.net.https > 192.168.1.10.49236: Flags [.], seq 93258:94606, ack 1203, win 178, options [nop,nop,TS val 1336164653 ecr 58806], length 1348
20:46:44.186280 IP sea15s02-in-f170.1e100.net.https > 192.168.1.10.49236: Flags [.], seq 94606:95954, ack 1203, win 178, options [nop,nop,TS val 1336164653 ecr 58806], length 1348
20:46:44.188224 IP sea15s02-in-f170.1e100.net.https > 192.168.1.10.49236: Flags [.], seq 95954:97302, ack 1203, win 178, options [nop,nop,TS val 1336164655 ecr 58806], length 1348
20:46:44.188306 IP sea15s02-in-f170.1e100.net.https > 192.168.1.10.49236: Flags [.], seq 97302:98650, ack 1203, win 178, options [nop,nop,TS val 1336164655 ecr 58806], length 1348
20:46:44.190346 IP sea15s02-in-f170.1e100.net.https > 192.168.1.10.49236: Flags [.], seq 98650:99998, ack 1203, win 178, options [nop,nop,TS val 1336164657 ecr 58806], length 1348
20:46:44.190429 IP sea15s02-in-f170.1e100.net.https > 192.168.1.10.49236: Flags [.], seq 99998:101346, ack 1203, win 178, options [nop,nop,TS val 1336164657 ecr 58806], length 1348
20:46:44.192441 IP sea15s02-in-f170.1e100.net.https > 192.168.1.10.49236: Flags [.], seq 101346:102694, ack 1203, win 178, options [nop,nop,TS val 1336164659 ecr 58806], length 1348
20:46:44.192527 IP sea15s02-in-f170.1e100.net.https > 192.168.1.10.49236: Flags [.], seq 102694:104042, ack 1203, win 178, options [nop,nop,TS val 1336164659 ecr 58806], length 1348
20:46:44.192623 IP sea15s02-in-f170.1e100.net.https > 192.168.1.10.49236: Flags [.], seq 104042:105390, ack 1203, win 178, options [nop,nop,TS val 1336164662 ecr 58806], length 1348
20:46:44.194495 IP sea15s02-in-f170.1e100.net.https > 192.168.1.10.49236: Flags [.], seq 105390:106738, ack 1203, win 178, options [nop,nop,TS val 1336164662 ecr 58806], length 1348
20:46:44.194659 IP sea15s02-in-f170.1e100.net.https > 192.168.1.10.49236: Flags [.], seq 106738:108086, ack 1203, win 178, options [nop,nop,TS val 1336164662 ecr 58806], length 1348
