tcpdump: verbose output suppressed, use -v or -vv for full protocol decode
listening on wlan0, link-type EN10MB (Ethernet), capture size 262144 bytes
20:46:51.858297 IP 192.168.1.10.55378 > sea15s07-in-f78.1e100.net.www: Flags [S], seq 3319038124, win 14600, options [mss 1460,sackOK,TS val 757591 ecr 0,nop,wscale 7], length 0
20:46:51.866217 IP sea15s07-in-f78.1e100.net.www > 192.168.1.10.55378: Flags [S.], seq 1255955232, ack 3319038125, win 26960, options [mss 1360,sackOK,TS val 628918006 ecr 757591,nop,wscale 7], length 0
20:46:51.881927 IP 192.168.1.10.55378 > sea15s07-in-f78.1e100.net.www: Flags [.], ack 1, win 115, options [nop,nop,TS val 757593 ecr 628918006], length 0
20:46:51.903542 IP 192.168.1.10.55378 > sea15s07-in-f78.1e100.net.www: Flags [P.], seq 1:175, ack 1, win 115, options [nop,nop,TS val 757595 ecr 628918006], length 174: HTTP: GET /generate_204 HTTP/1.1
20:46:51.911447 IP sea15s07-in-f78.1e100.net.www > 192.168.1.10.55378: Flags [.], ack 175, win 219, options [nop,nop,TS val 628918017 ecr 757595], length 0
20:46:51.936015 IP sea15s07-in-f78.1e100.net.www > 192.168.1.10.55378: Flags [P.], seq 1:224, ack 175, win 219, options [nop,nop,TS val 628918023 ecr 757595], length 223: HTTP: HTTP/1.1 204 No Content
20:46:51.942872 IP 192.168.1.10.55378 > sea15s07-in-f78.1e100.net.www: Flags [.], ack 224, win 123, options [nop,nop,TS val 757599 ecr 628918023], length 0
20:46:57.123043 IP 192.168.1.10.46684 > sea15s11-in-f2.1e100.net.https: Flags [S], seq 1744602957, win 14600, options [mss 1460,sackOK,TS val 758117 ecr 0,nop,wscale 7], length 0
20:46:57.153934 IP sea15s11-in-f2.1e100.net.https > 192.168.1.10.46684: Flags [S.], seq 706032533, ack 1744602958, win 42408, options [mss 1360,sackOK,TS val 1538318798 ecr 758117,nop,wscale 8], length 0
20:46:57.159676 IP 192.168.1.10.46684 > sea15s11-in-f2.1e100.net.https: Flags [.], ack 1, win 115, options [nop,nop,TS val 758121 ecr 1538318798], length 0
20:46:57.272131 IP 192.168.1.10.46684 > sea15s11-in-f2.1e100.net.https: Flags [P.], seq 1:181, ack 1, win 115, options [nop,nop,TS val 758132 ecr 1538318798], length 180
20:46:57.302828 IP sea15s11-in-f2.1e100.net.https > 192.168.1.10.46684: Flags [.], ack 181, win 170, options [nop,nop,TS val 1538318947 ecr 758132], length 0
20:46:57.311702 IP sea15s11-in-f2.1e100.net.https > 192.168.1.10.46684: Flags [.], seq 1:1349, ack 181, win 170, options [nop,nop,TS val 1538318956 ecr 758132], length 1348
20:46:57.311817 IP sea15s11-in-f2.1e100.net.https > 192.168.1.10.46684: Flags [P.], seq 1349:2517, ack 181, win 170, options [nop,nop,TS val 1538318956 ecr 758132], length 1168
20:46:57.319150 IP 192.168.1.10.46684 > sea15s11-in-f2.1e100.net.https: Flags [.], ack 1349, win 136, options [nop,nop,TS val 758137 ecr 1538318956], length 0
20:46:57.319167 IP 192.168.1.10.46684 > sea15s11-in-f2.1e100.net.https: Flags [.], ack 2517, win 157, options [nop,nop,TS val 758137 ecr 1538318956], length 0
20:46:57.755072 IP 192.168.1.10.46685 > sea15s11-in-f2.1e100.net.https: Flags [S], seq 1729206197, win 14600, options [mss 1460,sackOK,TS val 758179 ecr 0,nop,wscale 7], length 0
20:46:57.785867 IP sea15s11-in-f2.1e100.net.https > 192.168.1.10.46685: Flags [S.], seq 2035311504, ack 1729206198, win 42408, options [mss 1360,sackOK,TS val 772086991 ecr 758179,nop,wscale 8], length 0
20:46:57.792034 IP 192.168.1.10.46685 > sea15s11-in-f2.1e100.net.https: Flags [.], ack 1, win 115, options [nop,nop,TS val 758184 ecr 772086991], length 0
20:46:57.909835 IP 192.168.1.10.46685 > sea15s11-in-f2.1e100.net.https: Flags [P.], seq 1:181, ack 1, win 115, options [nop,nop,TS val 758196 ecr 772086991], length 180
20:46:57.940497 IP sea15s11-in-f2.1e100.net.https > 192.168.1.10.46685: Flags [.], ack 181, win 170, options [nop,nop,TS val 772087145 ecr 758196], length 0
20:46:57.947755 IP sea15s11-in-f2.1e100.net.https > 192.168.1.10.46685: Flags [.], seq 1:1349, ack 181, win 170, options [nop,nop,TS val 772087152 ecr 758196], length 1348
20:46:57.947857 IP sea15s11-in-f2.1e100.net.https > 192.168.1.10.46685: Flags [P.], seq 1349:2517, ack 181, win 170, options [nop,nop,TS val 772087152 ecr 758196], length 1168
20:46:57.953828 IP 192.168.1.10.46685 > sea15s11-in-f2.1e100.net.https: Flags [.], ack 1349, win 136, options [nop,nop,TS val 758200 ecr 772087152], length 0
20:46:57.953843 IP 192.168.1.10.46685 > sea15s11-in-f2.1e100.net.https: Flags [.], ack 2517, win 157, options [nop,nop,TS val 758200 ecr 772087152], length 0
20:46:59.075539 IP 192.168.1.10.49031 > server-13-33-151-97.sea4.r.cloudfront.net.www: Flags [S], seq 2465488581, win 14600, options [mss 1460,sackOK,TS val 758312 ecr 0,nop,wscale 7], length 0
20:46:59.083894 IP server-13-33-151-97.sea4.r.cloudfront.net.www > 192.168.1.10.49031: Flags [S.], seq 3693836976, ack 2465488582, win 26960, options [mss 1360,sackOK,TS val 628919810 ecr 758312,nop,wscale 7], length 0
20:46:59.089530 IP 192.168.1.10.49031 > server-13-33-151-97.sea4.r.cloudfront.net.www: Flags [.], ack 1, win 115, options [nop,nop,TS val 758314 ecr 628919810], length 0
20:46:59.224303 IP 192.168.1.10.49031 > server-13-33-151-97.sea4.r.cloudfront.net.www: Flags [P.], seq 1:482, ack 1, win 115, options [nop,nop,TS val 758327 ecr 628919810], length 481: HTTP: GET /firmware/BNN/SM-T530NU/version.xml HTTP/1.1
20:46:59.232174 IP server-13-33-151-97.sea4.r.cloudfront.net.www > 192.168.1.10.49031: Flags [.], ack 482, win 219, options [nop,nop,TS val 628919847 ecr 758327], length 0
20:46:59.232564 IP server-13-33-151-97.sea4.r.cloudfront.net.www > 192.168.1.10.49031: Flags [.], seq 1:1349, ack 482, win 219, options [nop,nop,TS val 628919847 ecr 758327], length 1348: HTTP: HTTP/1.1 403 Forbidden
20:46:59.232619 IP server-13-33-151-97.sea4.r.cloudfront.net.www > 192.168.1.10.49031: Flags [.], seq 1349:2697, ack 482, win 219, options [nop,nop,TS val 628919847 ecr 758327], length 1348: HTTP
20:46:59.232654 IP server-13-33-151-97.sea4.r.cloudfront.net.www > 192.168.1.10.49031: Flags [.], seq 2697:4045, ack 482, win 219, options [nop,nop,TS val 628919847 ecr 758327], length 1348: HTTP
20:46:59.232687 IP server-13-33-151-97.sea4.r.cloudfront.net.www > 192.168.1.10.49031: Flags [P.], seq 4045:4076, ack 482, win 219, options [nop,nop,TS val 628919847 ecr 758327], length 31: HTTP
20:46:59.238795 IP 192.168.1.10.49031 > server-13-33-151-97.sea4.r.cloudfront.net.www: Flags [.], ack 1349, win 136, options [nop,nop,TS val 758329 ecr 628919847], length 0
20:46:59.238810 IP 192.168.1.10.49031 > server-13-33-151-97.sea4.r.cloudfront.net.www: Flags [.], ack 2697, win 157, options [nop,nop,TS val 758329 ecr 628919847], length 0
20:46:59.238821 IP 192.168.1.10.49031 > server-13-33-151-97.sea4.r.cloudfront.net.www: Flags [.], ack 4045, win 178, options [nop,nop,TS val 758329 ecr 628919847], length 0
20:46:59.238832 IP 192.168.1.10.49031 > server-13-33-151-97.sea4.r.cloudfront.net.www: Flags [.], ack 4076, win 178, options [nop,nop,TS val 758329 ecr 628919847], length 0
20:46:59.367979 IP 192.168.1.10.50165 > sea15s12-in-f202.1e100.net.https: Flags [S], seq 2895753008, win 14600, options [mss 1460,sackOK,TS val 758342 ecr 0,nop,wscale 7], length 0
20:46:59.399881 IP sea15s12-in-f202.1e100.net.https > 192.168.1.10.50165: Flags [S.], seq 1370739735, ack 2895753009, win 42408, options [mss 1360,sackOK,TS val 1300821540 ecr 758342,nop,wscale 8], length 0
20:46:59.405573 IP 192.168.1.10.50165 > sea15s12-in-f202.1e100.net.https: Flags [.], ack 1, win 115, options [nop,nop,TS val 758345 ecr 1300821540], length 0
20:46:59.417455 IP 192.168.1.10.50165 > sea15s12-in-f202.1e100.net.https: Flags [P.], seq 1:170, ack 1, win 115, options [nop,nop,TS val 758346 ecr 1300821540], length 169
20:46:59.449116 IP sea15s12-in-f202.1e100.net.https > 192.168.1.10.50165: Flags [.], ack 170, win 170, options [nop,nop,TS val 1300821590 ecr 758346], length 0
20:46:59.456897 IP sea15s12-in-f202.1e100.net.https > 192.168.1.10.50165: Flags [.], seq 1:1349, ack 170, win 170, options [nop,nop,TS val 1300821597 ecr 758346], length 1348
20:46:59.456999 IP sea15s12-in-f202.1e100.net.https > 192.168.1.10.50165: Flags [.], seq 1349:2697, ack 170, win 170, options [nop,nop,TS val 1300821597 ecr 758346], length 1348
20:46:59.457032 IP sea15s12-in-f202.1e100.net.https > 192.168.1.10.50165: Flags [P.], seq 2697:3235, ack 170, win 170, options [nop,nop,TS val 1300821597 ecr 758346], length 538
20:46:59.463004 IP 192.168.1.10.50165 > sea15s12-in-f202.1e100.net.https: Flags [.], ack 1349, win 136, options [nop,nop,TS val 758351 ecr 1300821597], length 0
20:46:59.463020 IP 192.168.1.10.50165 > sea15s12-in-f202.1e100.net.https: Flags [.], ack 2697, win 157, options [nop,nop,TS val 758351 ecr 1300821597], length 0
20:46:59.463030 IP 192.168.1.10.50165 > sea15s12-in-f202.1e100.net.https: Flags [.], ack 3235, win 178, options [nop,nop,TS val 758351 ecr 1300821597], length 0
20:46:59.801981 IP 192.168.1.10.50165 > sea15s12-in-f202.1e100.net.https: Flags [P.], seq 170:255, ack 3235, win 178, options [nop,nop,TS val 758385 ecr 1300821597], length 85
20:46:59.834417 IP sea15s12-in-f202.1e100.net.https > 192.168.1.10.50165: Flags [P.], seq 3235:3511, ack 255, win 170, options [nop,nop,TS val 1300821975 ecr 758385], length 276
20:46:59.840367 IP 192.168.1.10.50165 > sea15s12-in-f202.1e100.net.https: Flags [.], ack 3511, win 199, options [nop,nop,TS val 758389 ecr 1300821975], length 0
20:46:59.844728 IP 192.168.1.10.46684 > sea15s11-in-f2.1e100.net.https: Flags [P.], seq 181:266, ack 2517, win 157, options [nop,nop,TS val 758389 ecr 1538318956], length 85
20:46:59.876238 IP sea15s11-in-f2.1e100.net.https > 192.168.1.10.46684: Flags [P.], seq 2517:2793, ack 266, win 170, options [nop,nop,TS val 1538321520 ecr 758389], length 276
20:46:59.881992 IP 192.168.1.10.46684 > sea15s11-in-f2.1e100.net.https: Flags [.], ack 2793, win 178, options [nop,nop,TS val 758393 ecr 1538321520], length 0
20:46:59.903699 IP 192.168.1.10.50165 > sea15s12-in-f202.1e100.net.https: Flags [P.], seq 255:1260, ack 3511, win 199, options [nop,nop,TS val 758395 ecr 1300821975], length 1005
20:46:59.972183 IP sea15s12-in-f202.1e100.net.https > 192.168.1.10.50165: Flags [P.], seq 3511:4859, ack 1260, win 178, options [nop,nop,TS val 1300822113 ecr 758395], length 1348
20:46:59.972360 IP sea15s12-in-f202.1e100.net.https > 192.168.1.10.50165: Flags [P.], seq 4859:6207, ack 1260, win 178, options [nop,nop,TS val 1300822113 ecr 758395], length 1348
20:46:59.972975 IP sea15s12-in-f202.1e100.net.https > 192.168.1.10.50165: Flags [.], seq 6207:7555, ack 1260, win 178, options [nop,nop,TS val 1300822113 ecr 758395], length 1348
20:46:59.973038 IP sea15s12-in-f202.1e100.net.https > 192.168.1.10.50165: Flags [P.], seq 7555:7784, ack 1260, win 178, options [nop,nop,TS val 1300822113 ecr 758395], length 229
20:46:59.974016 IP sea15s12-in-f202.1e100.net.https > 192.168.1.10.50165: Flags [.], seq 9132:10480, ack 1260, win 178, options [nop,nop,TS val 1300822114 ecr 758395], length 1348
20:46:59.974074 IP sea15s12-in-f202.1e100.net.https > 192.168.1.10.50165: Flags [P.], seq 10480:11828, ack 1260, win 178, options [nop,nop,TS val 1300822114 ecr 758395], length 1348
20:46:59.975707 IP sea15s12-in-f202.1e100.net.https > 192.168.1.10.50165: Flags [P.], seq 7784:9132, ack 1260, win 178, options [nop,nop,TS val 1300822114 ecr 758395], length 1348
20:46:59.976582 IP sea15s12-in-f202.1e100.net.https > 192.168.1.10.50165: Flags [P.], seq 11828:12052, ack 1260, win 178, options [nop,nop,TS val 1300822114 ecr 758395], length 224
20:46:59.976741 IP sea15s12-in-f202.1e100.net.https > 192.168.1.10.50165: Flags [P.], seq 12052:13400, ack 1260, win 178, options [nop,nop,TS val 1300822114 ecr 758395], length 1348
20:46:59.977663 IP sea15s12-in-f202.1e100.net.https > 192.168.1.10.50165: Flags [.], seq 13400:14748, ack 1260, win 178, options [nop,nop,TS val 1300822115 ecr 758395], length 1348
20:46:59.977743 IP sea15s12-in-f202.1e100.net.https > 192.168.1.10.50165: Flags [P.], seq 14748:16096, ack 1260, win 178, options [nop,nop,TS val 1300822115 ecr 758395], length 1348
20:46:59.978481 IP 192.168.1.10.50165 > sea15s12-in-f202.1e100.net.https: Flags [.], ack 4859, win 220, options [nop,nop,TS val 758403 ecr 1300822113], length 0
20:46:59.978498 IP 192.168.1.10.50165 > sea15s12-in-f202.1e100.net.https: Flags [.], ack 6207, win 241, options [nop,nop,TS val 758403 ecr 1300822113], length 0
20:46:59.978511 IP 192.168.1.10.50165 > sea15s12-in-f202.1e100.net.https: Flags [.], ack 7555, win 262, options [nop,nop,TS val 758403 ecr 1300822113], length 0
20:46:59.978522 IP 192.168.1.10.50165 > sea15s12-in-f202.1e100.net.https: Flags [.], ack 7784, win 283, options [nop,nop,TS val 758403 ecr 1300822113], length 0
20:46:59.978534 IP 192.168.1.10.50165 > sea15s12-in-f202.1e100.net.https: Flags [.], ack 7784, win 283, options [nop,nop,TS val 758403 ecr 1300822113,nop,nop,sack 1 {9132:10480}], length 0
20:46:59.978545 IP 192.168.1.10.50165 > sea15s12-in-f202.1e100.net.https: Flags [.], ack 7784, win 283, options [nop,nop,TS val 758403 ecr 1300822113,nop,nop,sack 1 {9132:11828}], length 0
20:46:59.978556 IP 192.168.1.10.50165 > sea15s12-in-f202.1e100.net.https: Flags [.], ack 11828, win 304, options [nop,nop,TS val 758403 ecr 1300822114], length 0
20:46:59.978566 IP 192.168.1.10.50165 > sea15s12-in-f202.1e100.net.https: Flags [.], ack 12052, win 325, options [nop,nop,TS val 758403 ecr 1300822114], length 0
20:46:59.978578 IP 192.168.1.10.50165 > sea15s12-in-f202.1e100.net.https: Flags [.], ack 13400, win 346, options [nop,nop,TS val 758403 ecr 1300822114], length 0
20:46:59.979386 IP sea15s12-in-f202.1e100.net.https > 192.168.1.10.50165: Flags [P.], seq 16096:16462, ack 1260, win 178, options [nop,nop,TS val 1300822115 ecr 758395], length 366
20:46:59.979603 IP sea15s12-in-f202.1e100.net.https > 192.168.1.10.50165: Flags [P.], seq 16462:17810, ack 1260, win 178, options [nop,nop,TS val 1300822116 ecr 758395], length 1348
20:46:59.980470 IP sea15s12-in-f202.1e100.net.https > 192.168.1.10.50165: Flags [.], seq 17810:19158, ack 1260, win 178, options [nop,nop,TS val 1300822116 ecr 758395], length 1348
20:46:59.982994 IP 192.168.1.10.50165 > sea15s12-in-f202.1e100.net.https: Flags [.], ack 14748, win 367, options [nop,nop,TS val 758403 ecr 1300822115], length 0
20:46:59.983011 IP 192.168.1.10.50165 > sea15s12-in-f202.1e100.net.https: Flags [.], ack 16096, win 388, options [nop,nop,TS val 758403 ecr 1300822115], length 0
20:46:59.983023 IP 192.168.1.10.50165 > sea15s12-in-f202.1e100.net.https: Flags [.], ack 16462, win 409, options [nop,nop,TS val 758403 ecr 1300822115], length 0
20:46:59.983046 IP 192.168.1.10.50165 > sea15s12-in-f202.1e100.net.https: Flags [.], ack 17810, win 430, options [nop,nop,TS val 758403 ecr 1300822116], length 0
20:46:59.983059 IP 192.168.1.10.50165 > sea15s12-in-f202.1e100.net.https: Flags [.], ack 19158, win 452, options [nop,nop,TS val 758403 ecr 1300822116], length 0
20:47:00.010470 IP sea15s12-in-f202.1e100.net.https > 192.168.1.10.50165: Flags [.], seq 19158:20506, ack 1260, win 178, options [nop,nop,TS val 1300822151 ecr 758403], length 1348
20:47:00.010539 IP sea15s12-in-f202.1e100.net.https > 192.168.1.10.50165: Flags [.], seq 20506:21854, ack 1260, win 178, options [nop,nop,TS val 1300822151 ecr 758403], length 1348
20:47:00.011943 IP sea15s12-in-f202.1e100.net.https > 192.168.1.10.50165: Flags [.], seq 21854:23202, ack 1260, win 178, options [nop,nop,TS val 1300822151 ecr 758403], length 1348
20:47:00.011993 IP sea15s12-in-f202.1e100.net.https > 192.168.1.10.50165: Flags [.], seq 23202:24550, ack 1260, win 178, options [nop,nop,TS val 1300822151 ecr 758403], length 1348
20:47:00.015027 IP sea15s12-in-f202.1e100.net.https > 192.168.1.10.50165: Flags [.], seq 24550:25898, ack 1260, win 178, options [nop,nop,TS val 1300822151 ecr 758403], length 1348
20:47:00.015119 IP sea15s12-in-f202.1e100.net.https > 192.168.1.10.50165: Flags [.], seq 25898:27246, ack 1260, win 178, options [nop,nop,TS val 1300822151 ecr 758403], length 1348
20:47:00.015767 IP sea15s12-in-f202.1e100.net.https > 192.168.1.10.50165: Flags [.], seq 27246:28594, ack 1260, win 178, options [nop,nop,TS val 1300822153 ecr 758403], length 1348
20:47:00.015816 IP sea15s12-in-f202.1e100.net.https > 192.168.1.10.50165: Flags [.], seq 28594:29942, ack 1260, win 178, options [nop,nop,TS val 1300822153 ecr 758403], length 1348
20:47:00.016463 IP 192.168.1.10.50165 > sea15s12-in-f202.1e100.net.https: Flags [.], ack 20506, win 473, options [nop,nop,TS val 758406 ecr 1300822151], length 0
20:47:00.016479 IP 192.168.1.10.50165 > sea15s12-in-f202.1e100.net.https: Flags [.], ack 21854, win 494, options [nop,nop,TS val 758406 ecr 1300822151], length 0
20:47:00.016490 IP 192.168.1.10.50165 > sea15s12-in-f202.1e100.net.https: Flags [.], ack 23202, win 515, options [nop,nop,TS val 758407 ecr 1300822151], length 0
20:47:00.016500 IP 192.168.1.10.50165 > sea15s12-in-f202.1e100.net.https: Flags [.], ack 24550, win 536, options [nop,nop,TS val 758407 ecr 1300822151], length 0
20:47:00.016510 IP 192.168.1.10.43754 > sea15s01-in-f138.1e100.net.https: Flags [S], seq 3036653761, win 14600, options [mss 1460,sackOK,TS val 758407 ecr 0,nop,wscale 7], length 0
20:47:00.017485 IP sea15s12-in-f202.1e100.net.https > 192.168.1.10.50165: Flags [P.], seq 29942:31290, ack 1260, win 178, options [nop,nop,TS val 1300822156 ecr 758403], length 1348
20:47:00.019842 IP sea15s12-in-f202.1e100.net.https > 192.168.1.10.50165: Flags [.], seq 31290:32638, ack 1260, win 178, options [nop,nop,TS val 1300822156 ecr 758403], length 1348
20:47:00.019894 IP sea15s12-in-f202.1e100.net.https > 192.168.1.10.50165: Flags [.], seq 32638:33986, ack 1260, win 178, options [nop,nop,TS val 1300822156 ecr 758403], length 1348
20:47:00.020823 IP 192.168.1.10.50165 > sea15s12-in-f202.1e100.net.https: Flags [.], ack 25898, win 557, options [nop,nop,TS val 758407 ecr 1300822151], length 0
20:47:00.020838 IP 192.168.1.10.50165 > sea15s12-in-f202.1e100.net.https: Flags [.], ack 27246, win 578, options [nop,nop,TS val 758407 ecr 1300822151], length 0
20:47:00.020849 IP 192.168.1.10.50165 > sea15s12-in-f202.1e100.net.https: Flags [.], ack 28594, win 599, options [nop,nop,TS val 758407 ecr 1300822153], length 0
20:47:00.020860 IP 192.168.1.10.50165 > sea15s12-in-f202.1e100.net.https: Flags [.], ack 29942, win 620, options [nop,nop,TS val 758407 ecr 1300822153], length 0
20:47:00.020870 IP 192.168.1.10.50165 > sea15s12-in-f202.1e100.net.https: Flags [.], ack 31290, win 641, options [nop,nop,TS val 758407 ecr 1300822156], length 0
20:47:00.022316 IP sea15s12-in-f202.1e100.net.https > 192.168.1.10.50165: Flags [.], seq 33986:35334, ack 1260, win 178, options [nop,nop,TS val 1300822156 ecr 758403], length 1348
20:47:00.022365 IP sea15s12-in-f202.1e100.net.https > 192.168.1.10.50165: Flags [.], seq 35334:36682, ack 1260, win 178, options [nop,nop,TS val 1300822156 ecr 758403], length 1348
20:47:00.023072 IP sea15s12-in-f202.1e100.net.https > 192.168.1.10.50165: Flags [.], seq 36682:38030, ack 1260, win 178, options [nop,nop,TS val 1300822160 ecr 758403], length 1348
20:47:00.023119 IP sea15s12-in-f202.1e100.net.https > 192.168.1.10.50165: Flags [.], seq 38030:39378, ack 1260, win 178, options [nop,nop,TS val 1300822160 ecr 758403], length 1348
20:47:00.024869 IP sea15s12-in-f202.1e100.net.https > 192.168.1.10.50165: Flags [.], seq 39378:40726, ack 1260, win 178, options [nop,nop,TS val 1300822163 ecr 758403], length 1348
20:47:00.024966 IP sea15s12-in-f202.1e100.net.https > 192.168.1.10.50165: Flags [.], seq 40726:42074, ack 1260, win 178, options [nop,nop,TS val 1300822163 ecr 758403], length 1348
20:47:00.025342 IP 192.168.1.10.50165 > sea15s12-in-f202.1e100.net.https: Flags [.], ack 32638, win 662, options [nop,nop,TS val 758407 ecr 1300822156], length 0
20:47:00.025358 IP 192.168.1.10.50165 > sea15s12-in-f202.1e100.net.https: Flags [.], ack 33986, win 683, options [nop,nop,TS val 758407 ecr 1300822156], length 0
20:47:00.025372 IP 192.168.1.10.46684 > sea15s11-in-f2.1e100.net.https: Flags [P.], seq 266:754, ack 2793, win 178, options [nop,nop,TS val 758407 ecr 1538321520], length 488
20:47:00.025384 IP 192.168.1.10.50165 > sea15s12-in-f202.1e100.net.https: Flags [.], ack 35334, win 704, options [nop,nop,TS val 758408 ecr 1300822156], length 0
20:47:00.025394 IP 192.168.1.10.50165 > sea15s12-in-f202.1e100.net.https: Flags [.], ack 36682, win 725, options [nop,nop,TS val 758408 ecr 1300822156], length 0
20:47:00.025404 IP 192.168.1.10.50165 > sea15s12-in-f202.1e100.net.https: Flags [.], ack 38030, win 746, options [nop,nop,TS val 758408 ecr 1300822160], length 0
20:47:00.025415 IP 192.168.1.10.50165 > sea15s12-in-f202.1e100.net.https: Flags [.], ack 39378, win 767, options [nop,nop,TS val 758408 ecr 1300822160], length 0
20:47:00.027192 IP sea15s12-in-f202.1e100.net.https > 192.168.1.10.50165: Flags [.], seq 42074:43422, ack 1260, win 178, options [nop,nop,TS val 1300822163 ecr 758403], length 1348
20:47:00.029767 IP sea15s12-in-f202.1e100.net.https > 192.168.1.10.50165: Flags [.], seq 43422:44770, ack 1260, win 178, options [nop,nop,TS val 1300822163 ecr 758403], length 1348
20:47:00.029863 IP sea15s12-in-f202.1e100.net.https > 192.168.1.10.50165: Flags [.], seq 44770:46118, ack 1260, win 178, options [nop,nop,TS val 1300822163 ecr 758403], length 1348
20:47:00.030100 IP 192.168.1.10.50165 > sea15s12-in-f202.1e100.net.https: Flags [.], ack 40726, win 789, options [nop,nop,TS val 758408 ecr 1300822163], length 0
20:47:00.030117 IP 192.168.1.10.50165 > sea15s12-in-f202.1e100.net.https: Flags [.], ack 42074, win 810, options [nop,nop,TS val 758408 ecr 1300822163], length 0
20:47:00.030127 IP 192.168.1.10.50165 > sea15s12-in-f202.1e100.net.https: Flags [.], ack 43422, win 831, options [nop,nop,TS val 758408 ecr 1300822163], length 0
20:47:00.030518 IP sea15s12-in-f202.1e100.net.https > 192.168.1.10.50165: Flags [.], seq 46118:47466, ack 1260, win 178, options [nop,nop,TS val 1300822165 ecr 758403], length 1348
20:47:00.030570 IP sea15s12-in-f202.1e100.net.https > 192.168.1.10.50165: Flags [.], seq 47466:48814, ack 1260, win 178, options [nop,nop,TS val 1300822165 ecr 758403], length 1348
20:47:00.032217 IP sea15s12-in-f202.1e100.net.https > 192.168.1.10.50165: Flags [.], seq 48814:50162, ack 1260, win 178, options [nop,nop,TS val 1300822170 ecr 758403], length 1348
20:47:00.032264 IP sea15s12-in-f202.1e100.net.https > 192.168.1.10.50165: Flags [.], seq 50162:51510, ack 1260, win 178, options [nop,nop,TS val 1300822170 ecr 758403], length 1348
20:47:00.034073 IP 192.168.1.10.50165 > sea15s12-in-f202.1e100.net.https: Flags [.], ack 44770, win 852, options [nop,nop,TS val 758408 ecr 1300822163], length 0
20:47:00.034087 IP 192.168.1.10.50165 > sea15s12-in-f202.1e100.net.https: Flags [.], ack 46118, win 873, options [nop,nop,TS val 758408 ecr 1300822163], length 0
20:47:00.034097 IP 192.168.1.10.50165 > sea15s12-in-f202.1e100.net.https: Flags [.], ack 47466, win 894, options [nop,nop,TS val 758408 ecr 1300822165], length 0
20:47:00.034107 IP 192.168.1.10.50165 > sea15s12-in-f202.1e100.net.https: Flags [.], ack 48814, win 915, options [nop,nop,TS val 758408 ecr 1300822165], length 0
20:47:00.034564 IP sea15s12-in-f202.1e100.net.https > 192.168.1.10.50165: Flags [.], seq 51510:52858, ack 1260, win 178, options [nop,nop,TS val 1300822170 ecr 758403], length 1348
20:47:00.034620 IP sea15s12-in-f202.1e100.net.https > 192.168.1.10.50165: Flags [.], seq 52858:54206, ack 1260, win 178, options [nop,nop,TS val 1300822170 ecr 758403], length 1348
20:47:00.036941 IP sea15s12-in-f202.1e100.net.https > 192.168.1.10.50165: Flags [.], seq 54206:55554, ack 1260, win 178, options [nop,nop,TS val 1300822173 ecr 758403], length 1348
20:47:00.038658 IP 192.168.1.10.50165 > sea15s12-in-f202.1e100.net.https: Flags [.], ack 50162, win 936, options [nop,nop,TS val 758409 ecr 1300822170], length 0
20:47:00.038674 IP 192.168.1.10.50165 > sea15s12-in-f202.1e100.net.https: Flags [.], ack 51510, win 957, options [nop,nop,TS val 758409 ecr 1300822170], length 0
20:47:00.038685 IP 192.168.1.10.50165 > sea15s12-in-f202.1e100.net.https: Flags [.], ack 52858, win 978, options [nop,nop,TS val 758409 ecr 1300822170], length 0
20:47:00.038695 IP 192.168.1.10.50165 > sea15s12-in-f202.1e100.net.https: Flags [.], ack 54206, win 999, options [nop,nop,TS val 758409 ecr 1300822170], length 0
20:47:00.038705 IP 192.168.1.10.50165 > sea15s12-in-f202.1e100.net.https: Flags [.], ack 55554, win 1020, options [nop,nop,TS val 758409 ecr 1300822173], length 0
20:47:00.047080 IP sea15s01-in-f138.1e100.net.https > 192.168.1.10.43754: Flags [S.], seq 1727231688, ack 3036653762, win 42408, options [mss 1360,sackOK,TS val 1375463884 ecr 758407,nop,wscale 8], length 0
20:47:00.048225 IP sea15s12-in-f202.1e100.net.https > 192.168.1.10.50165: Flags [.], seq 55554:56902, ack 1260, win 178, options [nop,nop,TS val 1300822189 ecr 758406], length 1348
20:47:00.048288 IP sea15s12-in-f202.1e100.net.https > 192.168.1.10.50165: Flags [.], seq 56902:58250, ack 1260, win 178, options [nop,nop,TS val 1300822189 ecr 758406], length 1348
20:47:00.048322 IP sea15s12-in-f202.1e100.net.https > 192.168.1.10.50165: Flags [.], seq 58250:59598, ack 1260, win 178, options [nop,nop,TS val 1300822189 ecr 758406], length 1348
20:47:00.048351 IP sea15s12-in-f202.1e100.net.https > 192.168.1.10.50165: Flags [.], seq 59598:60946, ack 1260, win 178, options [nop,nop,TS val 1300822189 ecr 758406], length 1348
20:47:00.048488 IP 192.168.1.10.43754 > sea15s01-in-f138.1e100.net.https: Flags [.], ack 1, win 115, options [nop,nop,TS val 758410 ecr 1375463884], length 0
20:47:00.050453 IP 192.168.1.10.50165 > sea15s12-in-f202.1e100.net.https: Flags [.], ack 56902, win 1041, options [nop,nop,TS val 758410 ecr 1300822189], length 0
20:47:00.050464 IP 192.168.1.10.50165 > sea15s12-in-f202.1e100.net.https: Flags [.], ack 58250, win 1062, options [nop,nop,TS val 758410 ecr 1300822189], length 0
20:47:00.050479 IP 192.168.1.10.50165 > sea15s12-in-f202.1e100.net.https: Flags [.], ack 59598, win 1083, options [nop,nop,TS val 758410 ecr 1300822189], length 0
20:47:00.050745 IP sea15s12-in-f202.1e100.net.https > 192.168.1.10.50165: Flags [.], seq 60946:62294, ack 1260, win 178, options [nop,nop,TS val 1300822189 ecr 758407], length 1348
20:47:00.050794 IP sea15s12-in-f202.1e100.net.https > 192.168.1.10.50165: Flags [.], seq 62294:63642, ack 1260, win 178, options [nop,nop,TS val 1300822189 ecr 758407], length 1348
20:47:00.050845 IP 192.168.1.10.50165 > sea15s12-in-f202.1e100.net.https: Flags [.], ack 60946, win 1104, options [nop,nop,TS val 758410 ecr 1300822189], length 0
20:47:00.052071 IP 192.168.1.10.50165 > sea15s12-in-f202.1e100.net.https: Flags [.], ack 62294, win 1126, options [nop,nop,TS val 758410 ecr 1300822189], length 0
20:47:00.052310 IP 192.168.1.10.50165 > sea15s12-in-f202.1e100.net.https: Flags [.], ack 63642, win 1147, options [nop,nop,TS val 758410 ecr 1300822189], length 0
20:47:00.052424 IP sea15s12-in-f202.1e100.net.https > 192.168.1.10.50165: Flags [.], seq 63642:64990, ack 1260, win 178, options [nop,nop,TS val 1300822189 ecr 758407], length 1348
20:47:00.052470 IP sea15s12-in-f202.1e100.net.https > 192.168.1.10.50165: Flags [.], seq 64990:66338, ack 1260, win 178, options [nop,nop,TS val 1300822189 ecr 758407], length 1348
20:47:00.053823 IP 192.168.1.10.50165 > sea15s12-in-f202.1e100.net.https: Flags [.], ack 64990, win 1168, options [nop,nop,TS val 758411 ecr 1300822189], length 0
20:47:00.053956 IP 192.168.1.10.50165 > sea15s12-in-f202.1e100.net.https: Flags [.], ack 66338, win 1189, options [nop,nop,TS val 758411 ecr 1300822189], length 0
20:47:00.054114 IP sea15s12-in-f202.1e100.net.https > 192.168.1.10.50165: Flags [.], seq 66338:67686, ack 1260, win 178, options [nop,nop,TS val 1300822190 ecr 758407], length 1348
20:47:00.055032 IP sea15s12-in-f202.1e100.net.https > 192.168.1.10.50165: Flags [.], seq 67686:69034, ack 1260, win 178, options [nop,nop,TS val 1300822193 ecr 758407], length 1348
20:47:00.055076 IP sea15s12-in-f202.1e100.net.https > 192.168.1.10.50165: Flags [.], seq 69034:70382, ack 1260, win 178, options [nop,nop,TS val 1300822193 ecr 758407], length 1348
20:47:00.056721 IP sea15s12-in-f202.1e100.net.https > 192.168.1.10.50165: Flags [.], seq 70382:71730, ack 1260, win 178, options [nop,nop,TS val 1300822193 ecr 758407], length 1348
20:47:00.056756 IP sea15s12-in-f202.1e100.net.https > 192.168.1.10.50165: Flags [.], seq 71730:73078, ack 1260, win 178, options [nop,nop,TS val 1300822193 ecr 758407], length 1348
20:47:00.058442 IP sea15s12-in-f202.1e100.net.https > 192.168.1.10.50165: Flags [.], seq 73078:74426, ack 1260, win 178, options [nop,nop,TS val 1300822194 ecr 758407], length 1348
20:47:00.058481 IP sea15s12-in-f202.1e100.net.https > 192.168.1.10.50165: Flags [.], seq 74426:75774, ack 1260, win 178, options [nop,nop,TS val 1300822194 ecr 758407], length 1348
20:47:00.060187 IP sea15s12-in-f202.1e100.net.https > 192.168.1.10.50165: Flags [.], seq 75774:77122, ack 1260, win 178, options [nop,nop,TS val 1300822196 ecr 758407], length 1348
20:47:00.060238 IP sea15s12-in-f202.1e100.net.https > 192.168.1.10.50165: Flags [.], seq 77122:78470, ack 1260, win 178, options [nop,nop,TS val 1300822196 ecr 758407], length 1348
20:47:00.061883 IP sea15s12-in-f202.1e100.net.https > 192.168.1.10.50165: Flags [.], seq 78470:79818, ack 1260, win 178, options [nop,nop,TS val 1300822198 ecr 758407], length 1348
20:47:00.062777 IP sea15s12-in-f202.1e100.net.https > 192.168.1.10.50165: Flags [.], seq 79818:81166, ack 1260, win 178, options [nop,nop,TS val 1300822198 ecr 758407], length 1348
20:47:00.062868 IP sea15s12-in-f202.1e100.net.https > 192.168.1.10.50165: Flags [.], seq 81166:82514, ack 1260, win 178, options [nop,nop,TS val 1300822198 ecr 758407], length 1348
20:47:00.064537 IP sea15s12-in-f202.1e100.net.https > 192.168.1.10.50165: Flags [.], seq 82514:83862, ack 1260, win 178, options [nop,nop,TS val 1300822199 ecr 758408], length 1348
20:47:00.064632 IP sea15s12-in-f202.1e100.net.https > 192.168.1.10.50165: Flags [.], seq 83862:85210, ack 1260, win 178, options [nop,nop,TS val 1300822199 ecr 758408], length 1348
20:47:00.066253 IP sea15s12-in-f202.1e100.net.https > 192.168.1.10.50165: Flags [.], seq 85210:86558, ack 1260, win 178, options [nop,nop,TS val 1300822201 ecr 758408], length 1348
20:47:00.066319 IP sea15s12-in-f202.1e100.net.https > 192.168.1.10.50165: Flags [.], seq 86558:87906, ack 1260, win 178, options [nop,nop,TS val 1300822201 ecr 758408], length 1348
20:47:00.067925 IP sea15s11-in-f2.1e100.net.https > 192.168.1.10.46684: Flags [P.], seq 2793:3603, ack 754, win 175, options [nop,nop,TS val 1538321709 ecr 758407], length 810
20:47:00.068504 IP sea15s12-in-f202.1e100.net.https > 192.168.1.10.50165: Flags [.], seq 87906:89254, ack 1260, win 178, options [nop,nop,TS val 1300822203 ecr 758408], length 1348
20:47:00.068584 IP sea15s12-in-f202.1e100.net.https > 192.168.1.10.50165: Flags [.], seq 89254:90602, ack 1260, win 178, options [nop,nop,TS val 1300822203 ecr 758408], length 1348
20:47:00.070324 IP sea15s12-in-f202.1e100.net.https > 192.168.1.10.50165: Flags [.], seq 90602:91950, ack 1260, win 178, options [nop,nop,TS val 1300822205 ecr 758408], length 1348
20:47:00.070406 IP sea15s12-in-f202.1e100.net.https > 192.168.1.10.50165: Flags [.], seq 91950:93298, ack 1260, win 178, options [nop,nop,TS val 1300822205 ecr 758408], length 1348
20:47:00.070439 IP sea15s12-in-f202.1e100.net.https > 192.168.1.10.50165: Flags [.], seq 93298:94646, ack 1260, win 178, options [nop,nop,TS val 1300822205 ecr 758408], length 1348
20:47:00.072468 IP 192.168.1.10.50165 > sea15s12-in-f202.1e100.net.https: Flags [.], ack 67686, win 1210, options [nop,nop,TS val 758412 ecr 1300822190], length 0
20:47:00.072484 IP 192.168.1.10.50165 > sea15s12-in-f202.1e100.net.https: Flags [.], ack 69034, win 1231, options [nop,nop,TS val 758412 ecr 1300822193], length 0
20:47:00.072495 IP 192.168.1.10.50165 > sea15s12-in-f202.1e100.net.https: Flags [.], ack 70382, win 1252, options [nop,nop,TS val 758412 ecr 1300822193], length 0
20:47:00.072505 IP 192.168.1.10.50165 > sea15s12-in-f202.1e100.net.https: Flags [.], ack 71730, win 1273, options [nop,nop,TS val 758412 ecr 1300822193], length 0
20:47:00.072525 IP 192.168.1.10.50165 > sea15s12-in-f202.1e100.net.https: Flags [.], ack 73078, win 1294, options [nop,nop,TS val 758412 ecr 1300822193], length 0
20:47:00.072536 IP 192.168.1.10.50165 > sea15s12-in-f202.1e100.net.https: Flags [.], ack 74426, win 1315, options [nop,nop,TS val 758412 ecr 1300822194], length 0
20:47:00.072546 IP 192.168.1.10.50165 > sea15s12-in-f202.1e100.net.https: Flags [.], ack 75774, win 1336, options [nop,nop,TS val 758412 ecr 1300822194], length 0
20:47:00.072555 IP 192.168.1.10.50165 > sea15s12-in-f202.1e100.net.https: Flags [.], ack 77122, win 1357, options [nop,nop,TS val 758412 ecr 1300822196], length 0
20:47:00.072564 IP 192.168.1.10.50165 > sea15s12-in-f202.1e100.net.https: Flags [.], ack 78470, win 1378, options [nop,nop,TS val 758412 ecr 1300822196], length 0
20:47:00.072581 IP 192.168.1.10.50165 > sea15s12-in-f202.1e100.net.https: Flags [.], ack 79818, win 1399, options [nop,nop,TS val 758412 ecr 1300822198], length 0
20:47:00.073114 IP sea15s12-in-f202.1e100.net.https > 192.168.1.10.50165: Flags [.], seq 94646:95994, ack 1260, win 178, options [nop,nop,TS val 1300822207 ecr 758408], length 1348
20:47:00.073168 IP sea15s12-in-f202.1e100.net.https > 192.168.1.10.50165: Flags [.], seq 95994:97342, ack 1260, win 178, options [nop,nop,TS val 1300822207 ecr 758408], length 1348
20:47:00.073365 IP 192.168.1.10.50165 > sea15s12-in-f202.1e100.net.https: Flags [.], ack 81166, win 1420, options [nop,nop,TS val 758412 ecr 1300822198], length 0
20:47:00.074520 IP sea15s12-in-f202.1e100.net.https > 192.168.1.10.50165: Flags [.], seq 97342:98690, ack 1260, win 178, options [nop,nop,TS val 1300822209 ecr 758408], length 1348
20:47:00.074577 IP sea15s12-in-f202.1e100.net.https > 192.168.1.10.50165: Flags [.], seq 98690:100038, ack 1260, win 178, options [nop,nop,TS val 1300822209 ecr 758408], length 1348
20:47:00.076254 IP sea15s12-in-f202.1e100.net.https > 192.168.1.10.50165: Flags [.], seq 100038:101386, ack 1260, win 178, options [nop,nop,TS val 1300822211 ecr 758408], length 1348
20:47:00.076312 IP sea15s12-in-f202.1e100.net.https > 192.168.1.10.50165: Flags [.], seq 101386:102734, ack 1260, win 178, options [nop,nop,TS val 1300822211 ecr 758408], length 1348
20:47:00.076570 IP 192.168.1.10.50165 > sea15s12-in-f202.1e100.net.https: Flags [.], ack 82514, win 1441, options [nop,nop,TS val 758413 ecr 1300822198], length 0
20:47:00.076583 IP 192.168.1.10.50165 > sea15s12-in-f202.1e100.net.https: Flags [.], ack 83862, win 1463, options [nop,nop,TS val 758413 ecr 1300822199], length 0
20:47:00.076592 IP 192.168.1.10.50165 > sea15s12-in-f202.1e100.net.https: Flags [.], ack 85210, win 1484, options [nop,nop,TS val 758413 ecr 1300822199], length 0
20:47:00.076600 IP 192.168.1.10.50165 > sea15s12-in-f202.1e100.net.https: Flags [.], ack 86558, win 1505, options [nop,nop,TS val 758413 ecr 1300822201], length 0
20:47:00.076608 IP 192.168.1.10.50165 > sea15s12-in-f202.1e100.net.https: Flags [.], ack 87906, win 1526, options [nop,nop,TS val 758413 ecr 1300822201], length 0
20:47:00.076617 IP 192.168.1.10.46684 > sea15s11-in-f2.1e100.net.https: Flags [.], ack 3603, win 199, options [nop,nop,TS val 758413 ecr 1538321709], length 0
20:47:00.076627 IP 192.168.1.10.50165 > sea15s12-in-f202.1e100.net.https: Flags [.], ack 89254, win 1547, options [nop,nop,TS val 758413 ecr 1300822203], length 0
20:47:00.076637 IP 192.168.1.10.50165 > sea15s12-in-f202.1e100.net.https: Flags [.], ack 90602, win 1568, options [nop,nop,TS val 758413 ecr 1300822203], length 0
20:47:00.076653 IP 192.168.1.10.50165 > sea15s12-in-f202.1e100.net.https: Flags [.], ack 91950, win 1589, options [nop,nop,TS val 758413 ecr 1300822205], length 0
20:47:00.076668 IP 192.168.1.10.50165 > sea15s12-in-f202.1e100.net.https: Flags [.], ack 93298, win 1610, options [nop,nop,TS val 758413 ecr 1300822205], length 0
20:47:00.077270 IP 192.168.1.10.50165 > sea15s12-in-f202.1e100.net.https: Flags [.], ack 94646, win 1631, options [nop,nop,TS val 758413 ecr 1300822205], length 0
20:47:00.077284 IP 192.168.1.10.50165 > sea15s12-in-f202.1e100.net.https: Flags [.], ack 95994, win 1652, options [nop,nop,TS val 758413 ecr 1300822207], length 0
20:47:00.077980 IP sea15s12-in-f202.1e100.net.https > 192.168.1.10.50165: Flags [.], seq 102734:104082, ack 1260, win 178, options [nop,nop,TS val 1300822213 ecr 758409], length 1348
20:47:00.078028 IP sea15s12-in-f202.1e100.net.https > 192.168.1.10.50165: Flags [.], seq 104082:105430, ack 1260, win 178, options [nop,nop,TS val 1300822213 ecr 758409], length 1348
20:47:00.078057 IP sea15s12-in-f202.1e100.net.https > 192.168.1.10.50165: Flags [.], seq 105430:106778, ack 1260, win 178, options [nop,nop,TS val 1300822213 ecr 758409], length 1348
20:47:00.079830 IP 192.168.1.10.50165 > sea15s12-in-f202.1e100.net.https: Flags [.], ack 97342, win 1673, options [nop,nop,TS val 758413 ecr 1300822207], length 0
20:47:00.079842 IP 192.168.1.10.50165 > sea15s12-in-f202.1e100.net.https: Flags [.], ack 98690, win 1694, options [nop,nop,TS val 758413 ecr 1300822209], length 0
20:47:00.079851 IP 192.168.1.10.50165 > sea15s12-in-f202.1e100.net.https: Flags [.], ack 100038, win 1715, options [nop,nop,TS val 758413 ecr 1300822209], length 0
20:47:00.079860 IP 192.168.1.10.50165 > sea15s12-in-f202.1e100.net.https: Flags [.], ack 101386, win 1736, options [nop,nop,TS val 758413 ecr 1300822211], length 0
20:47:00.079868 IP 192.168.1.10.50165 > sea15s12-in-f202.1e100.net.https: Flags [.], ack 102734, win 1757, options [nop,nop,TS val 758413 ecr 1300822211], length 0
20:47:00.079877 IP 192.168.1.10.50165 > sea15s12-in-f202.1e100.net.https: Flags [.], ack 104082, win 1778, options [nop,nop,TS val 758413 ecr 1300822213], length 0
20:47:00.079897 IP 192.168.1.10.50165 > sea15s12-in-f202.1e100.net.https: Flags [.], ack 105430, win 1800, options [nop,nop,TS val 758413 ecr 1300822213], length 0
20:47:00.080221 IP 192.168.1.10.50165 > sea15s12-in-f202.1e100.net.https: Flags [.], ack 106778, win 1821, options [nop,nop,TS val 758413 ecr 1300822213], length 0
20:47:00.080566 IP sea15s12-in-f202.1e100.net.https > 192.168.1.10.50165: Flags [.], seq 106778:108126, ack 1260, win 178, options [nop,nop,TS val 1300822214 ecr 758409], length 1348
20:47:00.080617 IP sea15s12-in-f202.1e100.net.https > 192.168.1.10.50165: Flags [.], seq 108126:109474, ack 1260, win 178, options [nop,nop,TS val 1300822214 ecr 758409], length 1348
20:47:00.081942 IP 192.168.1.10.50165 > sea15s12-in-f202.1e100.net.https: Flags [.], ack 108126, win 1842, options [nop,nop,TS val 758413 ecr 1300822214], length 0
20:47:00.082288 IP sea15s12-in-f202.1e100.net.https > 192.168.1.10.50165: Flags [.], seq 109474:110822, ack 1260, win 178, options [nop,nop,TS val 1300822216 ecr 758409], length 1348
20:47:00.082334 IP sea15s12-in-f202.1e100.net.https > 192.168.1.10.50165: Flags [.], seq 110822:112170, ack 1260, win 178, options [nop,nop,TS val 1300822216 ecr 758409], length 1348
20:47:00.082411 IP 192.168.1.10.50165 > sea15s12-in-f202.1e100.net.https: Flags [.], ack 109474, win 1863, options [nop,nop,TS val 758413 ecr 1300822214], length 0
20:47:00.083801 IP 192.168.1.10.50165 > sea15s12-in-f202.1e100.net.https: Flags [.], ack 110822, win 1884, options [nop,nop,TS val 758414 ecr 1300822216], length 0
20:47:00.084037 IP sea15s12-in-f202.1e100.net.https > 192.168.1.10.50165: Flags [.], seq 112170:113518, ack 1260, win 178, options [nop,nop,TS val 1300822218 ecr 758409], length 1348
20:47:00.084092 IP sea15s12-in-f202.1e100.net.https > 192.168.1.10.50165: Flags [.], seq 113518:114866, ack 1260, win 178, options [nop,nop,TS val 1300822218 ecr 758409], length 1348
