tcpdump: verbose output suppressed, use -v or -vv for full protocol decode
listening on wlan0, link-type EN10MB (Ethernet), capture size 262144 bytes
18:33:29.857216 IP 192.168.1.10.46442 > sea15s07-in-f78.1e100.net.https: Flags [.], seq 3388859455:3388860803, ack 3892049572, win 532, options [nop,nop,TS val 415069 ecr 1841758209], length 1348
18:33:29.857974 IP 192.168.1.10.46442 > sea15s07-in-f78.1e100.net.https: Flags [P.], seq 1348:1567, ack 1, win 532, options [nop,nop,TS val 415071 ecr 1841758209], length 219
18:33:29.886146 IP sea15s07-in-f78.1e100.net.https > 192.168.1.10.46442: Flags [.], ack 1348, win 352, options [nop,nop,TS val 1841789384 ecr 415069], length 0
18:33:29.886365 IP sea15s07-in-f78.1e100.net.https > 192.168.1.10.46442: Flags [.], ack 1567, win 362, options [nop,nop,TS val 1841789385 ecr 415071], length 0
18:33:30.163342 IP sea15s07-in-f78.1e100.net.https > 192.168.1.10.46442: Flags [P.], seq 1:513, ack 1567, win 362, options [nop,nop,TS val 1841789661 ecr 415071], length 512
18:33:30.163631 IP sea15s07-in-f78.1e100.net.https > 192.168.1.10.46442: Flags [P.], seq 513:785, ack 1567, win 362, options [nop,nop,TS val 1841789662 ecr 415071], length 272
18:33:30.163734 IP sea15s07-in-f78.1e100.net.https > 192.168.1.10.46442: Flags [P.], seq 785:819, ack 1567, win 362, options [nop,nop,TS val 1841789662 ecr 415071], length 34
18:33:30.199650 IP 192.168.1.10.46442 > sea15s07-in-f78.1e100.net.https: Flags [.], ack 513, win 543, options [nop,nop,TS val 415173 ecr 1841789661], length 0
18:33:30.199664 IP 192.168.1.10.46442 > sea15s07-in-f78.1e100.net.https: Flags [.], ack 785, win 553, options [nop,nop,TS val 415173 ecr 1841789662], length 0
18:33:30.199682 IP 192.168.1.10.46442 > sea15s07-in-f78.1e100.net.https: Flags [.], ack 819, win 553, options [nop,nop,TS val 415174 ecr 1841789662], length 0
18:33:30.514795 IP 192.168.1.10.39406 > sea15s07-in-f74.1e100.net.https: Flags [S], seq 2543646086, win 65535, options [mss 1460,sackOK,TS val 415267 ecr 0,nop,wscale 8], length 0
18:33:30.545222 IP sea15s07-in-f74.1e100.net.https > 192.168.1.10.39406: Flags [S.], seq 467517209, ack 2543646087, win 42408, options [mss 1360,sackOK,TS val 976280473 ecr 415267,nop,wscale 8], length 0
18:33:30.547499 IP 192.168.1.10.39406 > sea15s07-in-f74.1e100.net.https: Flags [.], ack 1, win 343, options [nop,nop,TS val 415278 ecr 976280473], length 0
18:33:30.555516 IP 192.168.1.10.39406 > sea15s07-in-f74.1e100.net.https: Flags [P.], seq 1:186, ack 1, win 343, options [nop,nop,TS val 415280 ecr 976280473], length 185
18:33:30.585952 IP sea15s07-in-f74.1e100.net.https > 192.168.1.10.39406: Flags [.], ack 186, win 170, options [nop,nop,TS val 976280514 ecr 415280], length 0
18:33:30.593660 IP sea15s07-in-f74.1e100.net.https > 192.168.1.10.39406: Flags [.], seq 1:1349, ack 186, win 170, options [nop,nop,TS val 976280521 ecr 415280], length 1348
18:33:30.593772 IP sea15s07-in-f74.1e100.net.https > 192.168.1.10.39406: Flags [.], seq 1349:2697, ack 186, win 170, options [nop,nop,TS val 976280521 ecr 415280], length 1348
18:33:30.593857 IP sea15s07-in-f74.1e100.net.https > 192.168.1.10.39406: Flags [P.], seq 2697:3285, ack 186, win 170, options [nop,nop,TS val 976280521 ecr 415280], length 588
18:33:30.596950 IP 192.168.1.10.39406 > sea15s07-in-f74.1e100.net.https: Flags [.], ack 1349, win 353, options [nop,nop,TS val 415293 ecr 976280521], length 0
18:33:30.596968 IP 192.168.1.10.39406 > sea15s07-in-f74.1e100.net.https: Flags [.], ack 2697, win 364, options [nop,nop,TS val 415293 ecr 976280521], length 0
18:33:30.596988 IP 192.168.1.10.39406 > sea15s07-in-f74.1e100.net.https: Flags [.], ack 3285, win 374, options [nop,nop,TS val 415293 ecr 976280521], length 0
18:33:30.612992 IP 192.168.1.10.39251 > sea15s07-in-f16.1e100.net.https: Flags [S], seq 1549044030, win 65535, options [mss 1460,sackOK,TS val 415297 ecr 0,nop,wscale 8], length 0
18:33:30.640476 IP sea15s07-in-f16.1e100.net.https > 192.168.1.10.39251: Flags [S.], seq 56368788, ack 1549044031, win 42408, options [mss 1360,sackOK,TS val 1031104394 ecr 415297,nop,wscale 8], length 0
18:33:30.642757 IP 192.168.1.10.39251 > sea15s07-in-f16.1e100.net.https: Flags [.], ack 1, win 343, options [nop,nop,TS val 415306 ecr 1031104394], length 0
18:33:30.644489 IP 192.168.1.10.39251 > sea15s07-in-f16.1e100.net.https: Flags [P.], seq 1:190, ack 1, win 343, options [nop,nop,TS val 415307 ecr 1031104394], length 189
18:33:30.672001 IP sea15s07-in-f16.1e100.net.https > 192.168.1.10.39251: Flags [.], ack 190, win 170, options [nop,nop,TS val 1031104426 ecr 415307], length 0
18:33:30.674512 IP 192.168.1.10.39406 > sea15s07-in-f74.1e100.net.https: Flags [P.], seq 186:312, ack 3285, win 374, options [nop,nop,TS val 415316 ecr 976280521], length 126
18:33:30.680165 IP sea15s07-in-f16.1e100.net.https > 192.168.1.10.39251: Flags [.], seq 1:1349, ack 190, win 170, options [nop,nop,TS val 1031104434 ecr 415307], length 1348
18:33:30.680292 IP sea15s07-in-f16.1e100.net.https > 192.168.1.10.39251: Flags [.], seq 1349:2697, ack 190, win 170, options [nop,nop,TS val 1031104434 ecr 415307], length 1348
18:33:30.680329 IP sea15s07-in-f16.1e100.net.https > 192.168.1.10.39251: Flags [.], seq 2697:4045, ack 190, win 170, options [nop,nop,TS val 1031104434 ecr 415307], length 1348
18:33:30.680360 IP sea15s07-in-f16.1e100.net.https > 192.168.1.10.39251: Flags [P.], seq 4045:4051, ack 190, win 170, options [nop,nop,TS val 1031104434 ecr 415307], length 6
18:33:30.685394 IP 192.168.1.10.39251 > sea15s07-in-f16.1e100.net.https: Flags [.], ack 1349, win 353, options [nop,nop,TS val 415319 ecr 1031104434], length 0
18:33:30.685413 IP 192.168.1.10.39251 > sea15s07-in-f16.1e100.net.https: Flags [.], ack 2697, win 364, options [nop,nop,TS val 415319 ecr 1031104434], length 0
18:33:30.685423 IP 192.168.1.10.39251 > sea15s07-in-f16.1e100.net.https: Flags [.], ack 4045, win 374, options [nop,nop,TS val 415319 ecr 1031104434], length 0
18:33:30.685443 IP 192.168.1.10.39251 > sea15s07-in-f16.1e100.net.https: Flags [.], ack 4051, win 374, options [nop,nop,TS val 415319 ecr 1031104434], length 0
18:33:30.705256 IP sea15s07-in-f74.1e100.net.https > 192.168.1.10.39406: Flags [P.], seq 3285:3569, ack 312, win 170, options [nop,nop,TS val 976280633 ecr 415316], length 284
18:33:30.733412 IP 192.168.1.10.39406 > sea15s07-in-f74.1e100.net.https: Flags [P.], seq 312:641, ack 3569, win 385, options [nop,nop,TS val 415327 ecr 976280633], length 329
18:33:30.734643 IP 192.168.1.10.39251 > sea15s07-in-f16.1e100.net.https: Flags [P.], seq 190:316, ack 4051, win 374, options [nop,nop,TS val 415332 ecr 1031104434], length 126
18:33:30.763393 IP sea15s07-in-f16.1e100.net.https > 192.168.1.10.39251: Flags [P.], seq 4051:4335, ack 316, win 170, options [nop,nop,TS val 1031104517 ecr 415332], length 284
18:33:30.765768 IP 192.168.1.10.39251 > sea15s07-in-f16.1e100.net.https: Flags [P.], seq 316:572, ack 4335, win 385, options [nop,nop,TS val 415343 ecr 1031104517], length 256
18:33:30.782852 IP sea15s07-in-f74.1e100.net.https > 192.168.1.10.39406: Flags [P.], seq 3569:4228, ack 641, win 175, options [nop,nop,TS val 976280711 ecr 415327], length 659
18:33:30.783088 IP sea15s07-in-f74.1e100.net.https > 192.168.1.10.39406: Flags [P.], seq 4228:4390, ack 641, win 175, options [nop,nop,TS val 976280711 ecr 415327], length 162
18:33:30.783240 IP sea15s07-in-f74.1e100.net.https > 192.168.1.10.39406: Flags [P.], seq 4390:4424, ack 641, win 175, options [nop,nop,TS val 976280711 ecr 415327], length 34
18:33:30.790305 IP 192.168.1.10.39406 > sea15s07-in-f74.1e100.net.https: Flags [.], ack 4424, win 406, options [nop,nop,TS val 415351 ecr 976280711], length 0
18:33:30.793996 IP sea15s07-in-f16.1e100.net.https > 192.168.1.10.39251: Flags [P.], seq 4335:5532, ack 572, win 175, options [nop,nop,TS val 1031104548 ecr 415343], length 1197
18:33:30.836528 IP 192.168.1.10.39251 > sea15s07-in-f16.1e100.net.https: Flags [.], ack 5532, win 395, options [nop,nop,TS val 415365 ecr 1031104548], length 0
18:33:30.861273 IP 192.168.1.10.39251 > sea15s07-in-f16.1e100.net.https: Flags [P.], seq 572:817, ack 5532, win 395, options [nop,nop,TS val 415372 ecr 1031104548], length 245
18:33:30.889542 IP sea15s07-in-f16.1e100.net.https > 192.168.1.10.39251: Flags [P.], seq 5532:6683, ack 817, win 179, options [nop,nop,TS val 1031104643 ecr 415372], length 1151
18:33:30.892390 IP 192.168.1.10.39251 > sea15s07-in-f16.1e100.net.https: Flags [.], ack 6683, win 406, options [nop,nop,TS val 415381 ecr 1031104643], length 0
18:33:31.016016 IP 192.168.1.10.39251 > sea15s07-in-f16.1e100.net.https: Flags [P.], seq 817:1064, ack 6683, win 406, options [nop,nop,TS val 415418 ecr 1031104643], length 247
18:33:31.044289 IP sea15s07-in-f16.1e100.net.https > 192.168.1.10.39251: Flags [P.], seq 6683:7843, ack 1064, win 183, options [nop,nop,TS val 1031104798 ecr 415418], length 1160
18:33:31.048788 IP 192.168.1.10.39251 > sea15s07-in-f16.1e100.net.https: Flags [.], ack 7843, win 416, options [nop,nop,TS val 415428 ecr 1031104798], length 0
18:33:31.060141 IP 192.168.1.10.39251 > sea15s07-in-f16.1e100.net.https: Flags [P.], seq 1064:1317, ack 7843, win 416, options [nop,nop,TS val 415429 ecr 1031104798], length 253
18:33:31.088250 IP sea15s07-in-f16.1e100.net.https > 192.168.1.10.39251: Flags [P.], seq 7843:8924, ack 1317, win 187, options [nop,nop,TS val 1031104842 ecr 415429], length 1081
18:33:31.101747 IP 192.168.1.10.39251 > sea15s07-in-f16.1e100.net.https: Flags [P.], seq 1317:1569, ack 8924, win 427, options [nop,nop,TS val 415443 ecr 1031104842], length 252
18:33:31.130063 IP sea15s07-in-f16.1e100.net.https > 192.168.1.10.39251: Flags [P.], seq 8924:10113, ack 1569, win 191, options [nop,nop,TS val 1031104884 ecr 415443], length 1189
18:33:31.200849 IP 192.168.1.10.39251 > sea15s07-in-f16.1e100.net.https: Flags [.], ack 10113, win 437, options [nop,nop,TS val 415466 ecr 1031104884], length 0
18:33:32.939996 IP 192.168.1.10.39408 > sea15s07-in-f74.1e100.net.https: Flags [S], seq 98667970, win 65535, options [mss 1460,sackOK,TS val 415994 ecr 0,nop,wscale 8], length 0
18:33:32.969517 IP sea15s07-in-f74.1e100.net.https > 192.168.1.10.39408: Flags [S.], seq 1110157410, ack 98667971, win 42408, options [mss 1360,sackOK,TS val 976282898 ecr 415994,nop,wscale 8], length 0
18:33:32.972052 IP 192.168.1.10.39408 > sea15s07-in-f74.1e100.net.https: Flags [.], ack 1, win 343, options [nop,nop,TS val 416005 ecr 976282898], length 0
18:33:32.986372 IP 192.168.1.10.39408 > sea15s07-in-f74.1e100.net.https: Flags [P.], seq 1:170, ack 1, win 343, options [nop,nop,TS val 416009 ecr 976282898], length 169
18:33:33.015997 IP sea15s07-in-f74.1e100.net.https > 192.168.1.10.39408: Flags [.], ack 170, win 170, options [nop,nop,TS val 976282945 ecr 416009], length 0
18:33:33.023261 IP sea15s07-in-f74.1e100.net.https > 192.168.1.10.39408: Flags [.], seq 1:1349, ack 170, win 170, options [nop,nop,TS val 976282952 ecr 416009], length 1348
18:33:33.023373 IP sea15s07-in-f74.1e100.net.https > 192.168.1.10.39408: Flags [.], seq 1349:2697, ack 170, win 170, options [nop,nop,TS val 976282952 ecr 416009], length 1348
18:33:33.023407 IP sea15s07-in-f74.1e100.net.https > 192.168.1.10.39408: Flags [P.], seq 2697:3267, ack 170, win 170, options [nop,nop,TS val 976282952 ecr 416009], length 570
18:33:33.026399 IP 192.168.1.10.39408 > sea15s07-in-f74.1e100.net.https: Flags [.], ack 1349, win 353, options [nop,nop,TS val 416021 ecr 976282952], length 0
18:33:33.026417 IP 192.168.1.10.39408 > sea15s07-in-f74.1e100.net.https: Flags [.], ack 2697, win 364, options [nop,nop,TS val 416021 ecr 976282952], length 0
18:33:33.026438 IP 192.168.1.10.39408 > sea15s07-in-f74.1e100.net.https: Flags [.], ack 3267, win 374, options [nop,nop,TS val 416022 ecr 976282952], length 0
18:33:33.066684 IP 192.168.1.10.39408 > sea15s07-in-f74.1e100.net.https: Flags [P.], seq 170:428, ack 3267, win 374, options [nop,nop,TS val 416033 ecr 976282952], length 258
18:33:33.096781 IP sea15s07-in-f74.1e100.net.https > 192.168.1.10.39408: Flags [P.], seq 3267:3318, ack 428, win 175, options [nop,nop,TS val 976283026 ecr 416033], length 51
18:33:33.105458 IP 192.168.1.10.39408 > sea15s07-in-f74.1e100.net.https: Flags [P.], seq 428:1365, ack 3318, win 374, options [nop,nop,TS val 416045 ecr 976283026], length 937
18:33:33.174866 IP sea15s07-in-f74.1e100.net.https > 192.168.1.10.39408: Flags [.], ack 1365, win 182, options [nop,nop,TS val 976283064 ecr 416045], length 0
18:33:33.234662 IP sea15s07-in-f74.1e100.net.https > 192.168.1.10.39408: Flags [P.], seq 3318:3868, ack 1365, win 182, options [nop,nop,TS val 976283164 ecr 416045], length 550
18:33:33.234903 IP sea15s07-in-f74.1e100.net.https > 192.168.1.10.39408: Flags [P.], seq 3868:4017, ack 1365, win 182, options [nop,nop,TS val 976283164 ecr 416045], length 149
18:33:33.235030 IP sea15s07-in-f74.1e100.net.https > 192.168.1.10.39408: Flags [P.], seq 4017:4051, ack 1365, win 182, options [nop,nop,TS val 976283164 ecr 416045], length 34
18:33:33.256840 IP 192.168.1.10.39408 > sea15s07-in-f74.1e100.net.https: Flags [.], ack 4051, win 395, options [nop,nop,TS val 416090 ecr 976283164], length 0
18:33:33.273392 IP 192.168.1.10.47004 > sea15s07-in-f67.1e100.net.https: Flags [P.], seq 1215666491:1215666522, ack 3723495208, win 1154, options [nop,nop,TS val 416090 ecr 2241457031], length 31
18:33:33.273418 IP 192.168.1.10.47004 > sea15s07-in-f67.1e100.net.https: Flags [F.], seq 31, ack 1, win 1154, options [nop,nop,TS val 416091 ecr 2241457031], length 0
18:33:33.301179 IP sea15s07-in-f67.1e100.net.https > 192.168.1.10.47004: Flags [F.], seq 1, ack 32, win 175, options [nop,nop,TS val 2241503307 ecr 416090], length 0
18:33:33.304418 IP 192.168.1.10.47004 > sea15s07-in-f67.1e100.net.https: Flags [.], ack 2, win 1154, options [nop,nop,TS val 416105 ecr 2241503307], length 0
18:33:33.419570 IP 192.168.1.10.39408 > sea15s07-in-f74.1e100.net.https: Flags [P.], seq 1365:2305, ack 4051, win 395, options [nop,nop,TS val 416139 ecr 976283164], length 940
18:33:33.449074 IP sea15s07-in-f74.1e100.net.https > 192.168.1.10.39408: Flags [.], ack 2305, win 189, options [nop,nop,TS val 976283378 ecr 416139], length 0
18:33:33.549774 IP sea15s07-in-f74.1e100.net.https > 192.168.1.10.39408: Flags [P.], seq 4051:4601, ack 2305, win 189, options [nop,nop,TS val 976283479 ecr 416139], length 550
18:33:33.550201 IP sea15s07-in-f74.1e100.net.https > 192.168.1.10.39408: Flags [P.], seq 4601:4829, ack 2305, win 189, options [nop,nop,TS val 976283479 ecr 416139], length 228
18:33:33.550304 IP sea15s07-in-f74.1e100.net.https > 192.168.1.10.39408: Flags [P.], seq 4829:4863, ack 2305, win 189, options [nop,nop,TS val 976283479 ecr 416139], length 34
18:33:33.563957 IP 192.168.1.10.39408 > sea15s07-in-f74.1e100.net.https: Flags [.], ack 4863, win 416, options [nop,nop,TS val 416182 ecr 976283479], length 0
18:33:34.203768 IP 192.168.1.10.39408 > sea15s07-in-f74.1e100.net.https: Flags [P.], seq 2305:3249, ack 4863, win 416, options [nop,nop,TS val 416374 ecr 976283479], length 944
18:33:34.233484 IP sea15s07-in-f74.1e100.net.https > 192.168.1.10.39408: Flags [.], ack 3249, win 197, options [nop,nop,TS val 976284162 ecr 416374], length 0
18:33:34.340263 IP sea15s07-in-f74.1e100.net.https > 192.168.1.10.39408: Flags [P.], seq 4863:5413, ack 3249, win 197, options [nop,nop,TS val 976284269 ecr 416374], length 550
18:33:34.340478 IP sea15s07-in-f74.1e100.net.https > 192.168.1.10.39408: Flags [P.], seq 5413:5576, ack 3249, win 197, options [nop,nop,TS val 976284269 ecr 416374], length 163
18:33:34.340585 IP sea15s07-in-f74.1e100.net.https > 192.168.1.10.39408: Flags [P.], seq 5576:5610, ack 3249, win 197, options [nop,nop,TS val 976284269 ecr 416374], length 34
18:33:34.348141 IP 192.168.1.10.39408 > sea15s07-in-f74.1e100.net.https: Flags [.], ack 5610, win 437, options [nop,nop,TS val 416418 ecr 976284269], length 0
18:33:34.486235 IP 192.168.1.10.39408 > sea15s07-in-f74.1e100.net.https: Flags [P.], seq 3249:4193, ack 5610, win 437, options [nop,nop,TS val 416459 ecr 976284269], length 944
18:33:34.515740 IP sea15s07-in-f74.1e100.net.https > 192.168.1.10.39408: Flags [.], ack 4193, win 204, options [nop,nop,TS val 976284445 ecr 416459], length 0
18:33:34.613424 IP sea15s07-in-f74.1e100.net.https > 192.168.1.10.39408: Flags [P.], seq 5610:6160, ack 4193, win 204, options [nop,nop,TS val 976284542 ecr 416459], length 550
18:33:34.613980 IP sea15s07-in-f74.1e100.net.https > 192.168.1.10.39408: Flags [P.], seq 6160:6476, ack 4193, win 204, options [nop,nop,TS val 976284543 ecr 416459], length 316
18:33:34.614091 IP sea15s07-in-f74.1e100.net.https > 192.168.1.10.39408: Flags [P.], seq 6476:6510, ack 4193, win 204, options [nop,nop,TS val 976284543 ecr 416459], length 34
18:33:34.633886 IP 192.168.1.10.39408 > sea15s07-in-f74.1e100.net.https: Flags [.], ack 6510, win 459, options [nop,nop,TS val 416504 ecr 976284542], length 0
18:33:37.992413 IP 192.168.1.10.39408 > sea15s07-in-f74.1e100.net.https: Flags [P.], seq 4193:5144, ack 6510, win 459, options [nop,nop,TS val 417510 ecr 976284542], length 951
18:33:38.022012 IP sea15s07-in-f74.1e100.net.https > 192.168.1.10.39408: Flags [.], ack 5144, win 211, options [nop,nop,TS val 976287951 ecr 417510], length 0
18:33:38.128114 IP sea15s07-in-f74.1e100.net.https > 192.168.1.10.39408: Flags [P.], seq 6510:7060, ack 5144, win 211, options [nop,nop,TS val 976288057 ecr 417510], length 550
18:33:38.129319 IP sea15s07-in-f74.1e100.net.https > 192.168.1.10.39408: Flags [P.], seq 7060:7309, ack 5144, win 211, options [nop,nop,TS val 976288058 ecr 417510], length 249
18:33:38.129476 IP sea15s07-in-f74.1e100.net.https > 192.168.1.10.39408: Flags [P.], seq 7309:7343, ack 5144, win 211, options [nop,nop,TS val 976288058 ecr 417510], length 34
18:33:38.139726 IP 192.168.1.10.39408 > sea15s07-in-f74.1e100.net.https: Flags [.], ack 7343, win 480, options [nop,nop,TS val 417554 ecr 976288057], length 0
18:33:40.073904 IP 192.168.1.10.46482 > sea15s07-in-f78.1e100.net.https: Flags [S], seq 1623087418, win 65535, options [mss 1460,sackOK,TS val 418136 ecr 0,nop,wscale 8], length 0
18:33:40.104095 IP sea15s07-in-f78.1e100.net.https > 192.168.1.10.46482: Flags [S.], seq 80175625, ack 1623087419, win 42408, options [mss 1360,sackOK,TS val 403868945 ecr 418136,nop,wscale 8], length 0
18:33:40.109875 IP 192.168.1.10.46482 > sea15s07-in-f78.1e100.net.https: Flags [.], ack 1, win 343, options [nop,nop,TS val 418146 ecr 403868945], length 0
18:33:40.111241 IP 192.168.1.10.46482 > sea15s07-in-f78.1e100.net.https: Flags [P.], seq 1:186, ack 1, win 343, options [nop,nop,TS val 418147 ecr 403868945], length 185
18:33:40.141486 IP sea15s07-in-f78.1e100.net.https > 192.168.1.10.46482: Flags [.], ack 186, win 170, options [nop,nop,TS val 403868982 ecr 418147], length 0
18:33:40.150083 IP sea15s07-in-f78.1e100.net.https > 192.168.1.10.46482: Flags [.], seq 1:1349, ack 186, win 170, options [nop,nop,TS val 403868991 ecr 418147], length 1348
18:33:40.150212 IP sea15s07-in-f78.1e100.net.https > 192.168.1.10.46482: Flags [.], seq 1349:2697, ack 186, win 170, options [nop,nop,TS val 403868991 ecr 418147], length 1348
18:33:40.150243 IP sea15s07-in-f78.1e100.net.https > 192.168.1.10.46482: Flags [P.], seq 2697:2888, ack 186, win 170, options [nop,nop,TS val 403868991 ecr 418147], length 191
18:33:40.154510 IP 192.168.1.10.46482 > sea15s07-in-f78.1e100.net.https: Flags [.], ack 1349, win 353, options [nop,nop,TS val 418159 ecr 403868991], length 0
18:33:40.154527 IP 192.168.1.10.46482 > sea15s07-in-f78.1e100.net.https: Flags [.], ack 2697, win 364, options [nop,nop,TS val 418159 ecr 403868991], length 0
18:33:40.154548 IP 192.168.1.10.46482 > sea15s07-in-f78.1e100.net.https: Flags [.], ack 2888, win 374, options [nop,nop,TS val 418160 ecr 403868991], length 0
18:33:40.198273 IP 192.168.1.10.46482 > sea15s07-in-f78.1e100.net.https: Flags [P.], seq 186:279, ack 2888, win 374, options [nop,nop,TS val 418173 ecr 403868991], length 93
18:33:40.228927 IP sea15s07-in-f78.1e100.net.https > 192.168.1.10.46482: Flags [P.], seq 2888:3172, ack 279, win 170, options [nop,nop,TS val 403869070 ecr 418173], length 284
18:33:40.241154 IP 192.168.1.10.46482 > sea15s07-in-f78.1e100.net.https: Flags [P.], seq 279:612, ack 3172, win 385, options [nop,nop,TS val 418184 ecr 403869070], length 333
18:33:40.280921 IP sea15s07-in-f78.1e100.net.https > 192.168.1.10.46482: Flags [P.], seq 3172:3842, ack 612, win 175, options [nop,nop,TS val 403869122 ecr 418184], length 670
18:33:40.284989 IP 192.168.1.10.39393 > sea15s07-in-f74.1e100.net.https: Flags [P.], seq 2995025257:2995025288, ack 3252122448, win 385, options [nop,nop,TS val 418199 ecr 728506209], length 31
18:33:40.285016 IP 192.168.1.10.39393 > sea15s07-in-f74.1e100.net.https: Flags [F.], seq 31, ack 1, win 385, options [nop,nop,TS val 418199 ecr 728506209], length 0
18:33:40.316979 IP sea15s07-in-f74.1e100.net.https > 192.168.1.10.39393: Flags [F.], seq 1, ack 32, win 175, options [nop,nop,TS val 728555135 ecr 418199], length 0
18:33:40.326791 IP 192.168.1.10.39393 > sea15s07-in-f74.1e100.net.https: Flags [.], ack 2, win 385, options [nop,nop,TS val 418209 ecr 728555135], length 0
18:33:40.328530 IP 192.168.1.10.46482 > sea15s07-in-f78.1e100.net.https: Flags [.], ack 3842, win 395, options [nop,nop,TS val 418211 ecr 403869122], length 0
18:33:40.461535 IP 192.168.1.10.46482 > sea15s07-in-f78.1e100.net.https: Flags [P.], seq 612:1358, ack 3842, win 395, options [nop,nop,TS val 418251 ecr 403869122], length 746
18:33:40.499482 IP sea15s07-in-f78.1e100.net.https > 192.168.1.10.46482: Flags [P.], seq 3842:4256, ack 1358, win 180, options [nop,nop,TS val 403869340 ecr 418251], length 414
18:33:40.516137 IP 192.168.1.10.46482 > sea15s07-in-f78.1e100.net.https: Flags [.], ack 4256, win 406, options [nop,nop,TS val 418264 ecr 403869340], length 0
18:34:08.817629 IP 192.168.1.10.38219 > sea15s07-in-f68.1e100.net.https: Flags [S], seq 991308383, win 65535, options [mss 1460,sackOK,TS val 426759 ecr 0,nop,wscale 8], length 0
18:34:08.817657 IP 192.168.1.10.38708 > sea15s07-in-f67.1e100.net.www: Flags [S], seq 2232064691, win 65535, options [mss 1460,sackOK,TS val 426759 ecr 0,nop,wscale 8], length 0
18:34:08.824592 IP sea15s07-in-f67.1e100.net.www > 192.168.1.10.38708: Flags [S.], seq 3728221209, ack 2232064692, win 26960, options [mss 1360,sackOK,TS val 3173277313 ecr 426759,nop,wscale 7], length 0
18:34:08.826511 IP 192.168.1.10.49585 > pg-in-f188.1e100.net.5228: Flags [S], seq 3590412267, win 65535, options [mss 1460,sackOK,TS val 426761 ecr 0,nop,wscale 8], length 0
18:34:08.827895 IP 192.168.1.10.38708 > sea15s07-in-f67.1e100.net.www: Flags [.], ack 1, win 343, options [nop,nop,TS val 426762 ecr 3173277313], length 0
18:34:08.827920 IP 192.168.1.10.38708 > sea15s07-in-f67.1e100.net.www: Flags [P.], seq 1:233, ack 1, win 343, options [nop,nop,TS val 426762 ecr 3173277313], length 232: HTTP: GET /generate_204 HTTP/1.1
18:34:08.834658 IP sea15s07-in-f67.1e100.net.www > 192.168.1.10.38708: Flags [.], ack 233, win 219, options [nop,nop,TS val 3173277316 ecr 426762], length 0
18:34:08.845331 IP sea15s07-in-f68.1e100.net.https > 192.168.1.10.38219: Flags [S.], seq 462151724, ack 991308384, win 42408, options [mss 1360,sackOK,TS val 3497833058 ecr 426759,nop,wscale 8], length 0
18:34:08.846556 IP pg-in-f188.1e100.net.5228 > 192.168.1.10.49585: Flags [S.], seq 1739162462, ack 3590412268, win 42408, options [mss 1360,sackOK,TS val 2916375181 ecr 426761,nop,wscale 8], length 0
18:34:08.894016 IP sea15s07-in-f67.1e100.net.www > 192.168.1.10.38708: Flags [P.], seq 1:227, ack 233, win 219, options [nop,nop,TS val 3173277331 ecr 426762], length 226: HTTP: HTTP/1.1 204 No Content
18:34:08.955882 IP 192.168.1.10.38219 > sea15s07-in-f68.1e100.net.https: Flags [.], ack 1, win 343, options [nop,nop,TS val 426776 ecr 3497833058], length 0
18:34:08.955895 IP 192.168.1.10.49585 > pg-in-f188.1e100.net.5228: Flags [.], ack 1, win 343, options [nop,nop,TS val 426776 ecr 2916375181], length 0
18:34:08.955906 IP 192.168.1.10.38219 > sea15s07-in-f68.1e100.net.https: Flags [P.], seq 1:518, ack 1, win 343, options [nop,nop,TS val 426776 ecr 3497833058], length 517
18:34:08.955948 IP 192.168.1.10.49585 > pg-in-f188.1e100.net.5228: Flags [P.], seq 1:518, ack 1, win 343, options [nop,nop,TS val 426777 ecr 2916375181], length 517
18:34:08.958482 IP 192.168.1.10.38708 > sea15s07-in-f67.1e100.net.www: Flags [.], ack 227, win 347, options [nop,nop,TS val 426801 ecr 3173277331], length 0
18:34:08.976391 IP pg-in-f188.1e100.net.5228 > 192.168.1.10.49585: Flags [.], ack 518, win 170, options [nop,nop,TS val 2916375311 ecr 426777], length 0
18:34:08.976604 IP pg-in-f188.1e100.net.5228 > 192.168.1.10.49585: Flags [P.], seq 1:148, ack 518, win 170, options [nop,nop,TS val 2916375311 ecr 426777], length 147
18:34:08.983754 IP sea15s07-in-f68.1e100.net.https > 192.168.1.10.38219: Flags [.], ack 518, win 170, options [nop,nop,TS val 3497833197 ecr 426776], length 0
18:34:09.001468 IP sea15s07-in-f68.1e100.net.https > 192.168.1.10.38219: Flags [P.], seq 1:163, ack 518, win 170, options [nop,nop,TS val 3497833214 ecr 426776], length 162
18:34:09.075920 IP 192.168.1.10.49585 > pg-in-f188.1e100.net.5228: Flags [.], ack 148, win 347, options [nop,nop,TS val 426807 ecr 2916375311], length 0
18:34:09.075938 IP 192.168.1.10.49585 > pg-in-f188.1e100.net.5228: Flags [P.], seq 518:569, ack 148, win 347, options [nop,nop,TS val 426807 ecr 2916375311], length 51
18:34:09.078133 IP 192.168.1.10.38219 > sea15s07-in-f68.1e100.net.https: Flags [.], ack 163, win 347, options [nop,nop,TS val 426837 ecr 3497833214], length 0
18:34:09.078160 IP 192.168.1.10.38219 > sea15s07-in-f68.1e100.net.https: Flags [P.], seq 518:569, ack 163, win 347, options [nop,nop,TS val 426837 ecr 3497833214], length 51
18:34:09.135351 IP pg-in-f188.1e100.net.5228 > 192.168.1.10.49585: Flags [.], ack 569, win 170, options [nop,nop,TS val 2916375431 ecr 426807], length 0
18:34:09.145739 IP sea15s07-in-f68.1e100.net.https > 192.168.1.10.38219: Flags [.], ack 569, win 170, options [nop,nop,TS val 3497833319 ecr 426837], length 0
18:34:09.192370 IP 192.168.1.10.49585 > pg-in-f188.1e100.net.5228: Flags [P.], seq 569:906, ack 148, win 347, options [nop,nop,TS val 426871 ecr 2916375431], length 337
18:34:09.192396 IP 192.168.1.10.38219 > sea15s07-in-f68.1e100.net.https: Flags [P.], seq 569:815, ack 163, win 347, options [nop,nop,TS val 426871 ecr 3497833319], length 246
18:34:09.212577 IP pg-in-f188.1e100.net.5228 > 192.168.1.10.49585: Flags [.], ack 906, win 175, options [nop,nop,TS val 2916375547 ecr 426871], length 0
18:34:09.212767 IP pg-in-f188.1e100.net.5228 > 192.168.1.10.49585: Flags [P.], seq 148:178, ack 906, win 175, options [nop,nop,TS val 2916375547 ecr 426871], length 30
18:34:09.215158 IP pg-in-f188.1e100.net.5228 > 192.168.1.10.49585: Flags [P.], seq 178:292, ack 906, win 175, options [nop,nop,TS val 2916375550 ecr 426871], length 114
18:34:09.216314 IP pg-in-f188.1e100.net.5228 > 192.168.1.10.49585: Flags [P.], seq 292:417, ack 906, win 175, options [nop,nop,TS val 2916375551 ecr 426871], length 125
18:34:09.220142 IP sea15s07-in-f68.1e100.net.https > 192.168.1.10.38219: Flags [.], ack 815, win 175, options [nop,nop,TS val 3497833433 ecr 426871], length 0
18:34:09.221629 IP sea15s07-in-f68.1e100.net.https > 192.168.1.10.38219: Flags [P.], seq 163:426, ack 815, win 175, options [nop,nop,TS val 3497833435 ecr 426871], length 263
18:34:09.325571 IP 192.168.1.10.49585 > pg-in-f188.1e100.net.5228: Flags [.], ack 178, win 347, options [nop,nop,TS val 426890 ecr 2916375547], length 0
18:34:09.463291 IP 192.168.1.10.38219 > sea15s07-in-f68.1e100.net.https: Flags [P.], seq 569:815, ack 163, win 347, options [nop,nop,TS val 426953 ecr 3497833319], length 246
18:34:09.490904 IP sea15s07-in-f68.1e100.net.https > 192.168.1.10.38219: Flags [.], ack 815, win 175, options [nop,nop,TS val 3497833704 ecr 426953,nop,nop,sack 1 {569:815}], length 0
18:34:09.571009 IP 192.168.1.10.49585 > pg-in-f188.1e100.net.5228: Flags [.], ack 292, win 347, options [nop,nop,TS val 426985 ecr 2916375550], length 0
18:34:09.571036 IP 192.168.1.10.49585 > pg-in-f188.1e100.net.5228: Flags [.], ack 417, win 347, options [nop,nop,TS val 426985 ecr 2916375551], length 0
18:34:09.610050 IP 192.168.1.10.38219 > sea15s07-in-f68.1e100.net.https: Flags [.], ack 426, win 351, options [nop,nop,TS val 426997 ecr 3497833435], length 0
18:34:09.633200 IP sea15s07-in-f68.1e100.net.https > 192.168.1.10.38219: Flags [P.], seq 163:426, ack 815, win 175, options [nop,nop,TS val 3497833846 ecr 426953], length 263
18:34:09.700969 IP 192.168.1.10.38219 > sea15s07-in-f68.1e100.net.https: Flags [.], ack 426, win 351, options [nop,nop,TS val 427004 ecr 3497833846,nop,nop,sack 1 {163:426}], length 0
18:34:09.700983 IP 192.168.1.10.49585 > pg-in-f188.1e100.net.5228: Flags [P.], seq 906:1011, ack 417, win 347, options [nop,nop,TS val 427004 ecr 2916375551], length 105
18:34:09.721636 IP pg-in-f188.1e100.net.5228 > 192.168.1.10.49585: Flags [P.], seq 417:529, ack 1011, win 175, options [nop,nop,TS val 2916376056 ecr 427004], length 112
18:34:09.902572 IP 192.168.1.10.49585 > pg-in-f188.1e100.net.5228: Flags [.], ack 529, win 347, options [nop,nop,TS val 427055 ecr 2916376056], length 0
18:34:13.085269 IP 192.168.1.10.49585 > pg-in-f188.1e100.net.5228: Flags [P.], seq 1011:1107, ack 529, win 347, options [nop,nop,TS val 428038 ecr 2916376056], length 96
18:34:13.146210 IP pg-in-f188.1e100.net.5228 > 192.168.1.10.49585: Flags [.], ack 1107, win 175, options [nop,nop,TS val 2916379440 ecr 428038], length 0
18:34:14.124966 IP 192.168.1.10.42447 > sea15s11-in-f10.1e100.net.https: Flags [S], seq 867272118, win 65535, options [mss 1460,sackOK,TS val 428346 ecr 0,nop,wscale 8], length 0
18:34:14.155265 IP sea15s11-in-f10.1e100.net.https > 192.168.1.10.42447: Flags [S.], seq 220799464, ack 867272119, win 42408, options [mss 1360,sackOK,TS val 1687014831 ecr 428346,nop,wscale 8], length 0
18:34:14.171012 IP 192.168.1.10.42447 > sea15s11-in-f10.1e100.net.https: Flags [.], ack 1, win 343, options [nop,nop,TS val 428361 ecr 1687014831], length 0
18:34:14.199335 IP 192.168.1.10.42447 > sea15s11-in-f10.1e100.net.https: Flags [P.], seq 1:167, ack 1, win 343, options [nop,nop,TS val 428367 ecr 1687014831], length 166
18:34:14.229548 IP sea15s11-in-f10.1e100.net.https > 192.168.1.10.42447: Flags [.], ack 167, win 170, options [nop,nop,TS val 1687014905 ecr 428367], length 0
18:34:14.237007 IP sea15s11-in-f10.1e100.net.https > 192.168.1.10.42447: Flags [.], seq 1:1349, ack 167, win 170, options [nop,nop,TS val 1687014912 ecr 428367], length 1348
18:34:14.237117 IP sea15s11-in-f10.1e100.net.https > 192.168.1.10.42447: Flags [.], seq 1349:2697, ack 167, win 170, options [nop,nop,TS val 1687014912 ecr 428367], length 1348
18:34:14.237150 IP sea15s11-in-f10.1e100.net.https > 192.168.1.10.42447: Flags [P.], seq 2697:3263, ack 167, win 170, options [nop,nop,TS val 1687014912 ecr 428367], length 566
18:34:14.247943 IP 192.168.1.10.42447 > sea15s11-in-f10.1e100.net.https: Flags [.], ack 1349, win 353, options [nop,nop,TS val 428386 ecr 1687014912], length 0
18:34:14.247959 IP 192.168.1.10.42447 > sea15s11-in-f10.1e100.net.https: Flags [.], ack 2697, win 364, options [nop,nop,TS val 428386 ecr 1687014912], length 0
18:34:14.247980 IP 192.168.1.10.42447 > sea15s11-in-f10.1e100.net.https: Flags [.], ack 3263, win 374, options [nop,nop,TS val 428386 ecr 1687014912], length 0
18:34:14.539854 IP 192.168.1.10.42447 > sea15s11-in-f10.1e100.net.https: Flags [P.], seq 167:260, ack 3263, win 374, options [nop,nop,TS val 428466 ecr 1687014912], length 93
18:34:14.570241 IP sea15s11-in-f10.1e100.net.https > 192.168.1.10.42447: Flags [P.], seq 3263:3314, ack 260, win 170, options [nop,nop,TS val 1687015246 ecr 428466], length 51
18:34:14.596478 IP 192.168.1.10.42447 > sea15s11-in-f10.1e100.net.https: Flags [.], ack 3314, win 374, options [nop,nop,TS val 428485 ecr 1687015246], length 0
18:34:14.612982 IP 192.168.1.10.42447 > sea15s11-in-f10.1e100.net.https: Flags [.], seq 260:1608, ack 3314, win 374, options [nop,nop,TS val 428493 ecr 1687015246], length 1348
18:34:14.613000 IP 192.168.1.10.42447 > sea15s11-in-f10.1e100.net.https: Flags [.], seq 1608:2956, ack 3314, win 374, options [nop,nop,TS val 428493 ecr 1687015246], length 1348
18:34:14.613013 IP 192.168.1.10.42447 > sea15s11-in-f10.1e100.net.https: Flags [.], seq 2956:4304, ack 3314, win 374, options [nop,nop,TS val 428493 ecr 1687015246], length 1348
18:34:14.613025 IP 192.168.1.10.42447 > sea15s11-in-f10.1e100.net.https: Flags [.], seq 4304:5652, ack 3314, win 374, options [nop,nop,TS val 428493 ecr 1687015246], length 1348
18:34:14.613048 IP 192.168.1.10.42447 > sea15s11-in-f10.1e100.net.https: Flags [.], seq 5652:7000, ack 3314, win 374, options [nop,nop,TS val 428493 ecr 1687015246], length 1348
18:34:14.615438 IP 192.168.1.10.42447 > sea15s11-in-f10.1e100.net.https: Flags [P.], seq 7000:7628, ack 3314, win 374, options [nop,nop,TS val 428498 ecr 1687015246], length 628
18:34:14.643389 IP sea15s11-in-f10.1e100.net.https > 192.168.1.10.42447: Flags [.], ack 2956, win 192, options [nop,nop,TS val 1687015319 ecr 428493], length 0
18:34:14.644733 IP sea15s11-in-f10.1e100.net.https > 192.168.1.10.42447: Flags [.], ack 5652, win 213, options [nop,nop,TS val 1687015320 ecr 428493], length 0
18:34:14.646353 IP sea15s11-in-f10.1e100.net.https > 192.168.1.10.42447: Flags [.], ack 7628, win 234, options [nop,nop,TS val 1687015322 ecr 428493], length 0
18:34:14.716117 IP sea15s11-in-f10.1e100.net.https > 192.168.1.10.42447: Flags [P.], seq 3314:3861, ack 7628, win 234, options [nop,nop,TS val 1687015392 ecr 428493], length 547
18:34:14.716275 IP sea15s11-in-f10.1e100.net.https > 192.168.1.10.42447: Flags [P.], seq 3861:3895, ack 7628, win 234, options [nop,nop,TS val 1687015392 ecr 428493], length 34
18:34:14.809275 IP sea15s11-in-f10.1e100.net.https > 192.168.1.10.42447: Flags [P.], seq 3861:3895, ack 7628, win 234, options [nop,nop,TS val 1687015485 ecr 428493], length 34
18:34:14.900523 IP 192.168.1.10.42447 > sea15s11-in-f10.1e100.net.https: Flags [.], ack 3895, win 385, options [nop,nop,TS val 428562 ecr 1687015392], length 0
18:34:14.905469 IP 192.168.1.10.42447 > sea15s11-in-f10.1e100.net.https: Flags [.], ack 3895, win 385, options [nop,nop,TS val 428584 ecr 1687015485,nop,nop,sack 1 {3861:3895}], length 0
18:34:15.803492 IP 192.168.1.10.47401 > sea15s01-in-f10.1e100.net.https: Flags [S], seq 3201485801, win 65535, options [mss 1460,sackOK,TS val 428853 ecr 0,nop,wscale 8], length 0
18:34:15.832916 IP sea15s01-in-f10.1e100.net.https > 192.168.1.10.47401: Flags [S.], seq 1110450017, ack 3201485802, win 42408, options [mss 1360,sackOK,TS val 1769917420 ecr 428853,nop,wscale 8], length 0
18:34:15.835243 IP 192.168.1.10.47401 > sea15s01-in-f10.1e100.net.https: Flags [.], ack 1, win 343, options [nop,nop,TS val 428864 ecr 1769917420], length 0
18:34:15.840990 IP 192.168.1.10.47401 > sea15s01-in-f10.1e100.net.https: Flags [P.], seq 1:180, ack 1, win 343, options [nop,nop,TS val 428866 ecr 1769917420], length 179
18:34:15.870292 IP sea15s01-in-f10.1e100.net.https > 192.168.1.10.47401: Flags [.], ack 180, win 170, options [nop,nop,TS val 1769917458 ecr 428866], length 0
18:34:15.877922 IP sea15s01-in-f10.1e100.net.https > 192.168.1.10.47401: Flags [.], seq 1:1349, ack 180, win 170, options [nop,nop,TS val 1769917465 ecr 428866], length 1348
18:34:15.878166 IP sea15s01-in-f10.1e100.net.https > 192.168.1.10.47401: Flags [.], seq 1349:2697, ack 180, win 170, options [nop,nop,TS val 1769917465 ecr 428866], length 1348
18:34:15.878218 IP sea15s01-in-f10.1e100.net.https > 192.168.1.10.47401: Flags [P.], seq 2697:3277, ack 180, win 170, options [nop,nop,TS val 1769917465 ecr 428866], length 580
18:34:15.880710 IP 192.168.1.10.47401 > sea15s01-in-f10.1e100.net.https: Flags [.], ack 1349, win 353, options [nop,nop,TS val 428878 ecr 1769917465], length 0
18:34:15.880725 IP 192.168.1.10.47401 > sea15s01-in-f10.1e100.net.https: Flags [.], ack 2697, win 364, options [nop,nop,TS val 428878 ecr 1769917465], length 0
18:34:15.880744 IP 192.168.1.10.47401 > sea15s01-in-f10.1e100.net.https: Flags [.], ack 3277, win 374, options [nop,nop,TS val 428878 ecr 1769917465], length 0
18:34:15.994611 IP 192.168.1.10.47401 > sea15s01-in-f10.1e100.net.https: Flags [P.], seq 180:306, ack 3277, win 374, options [nop,nop,TS val 428911 ecr 1769917465], length 126
18:34:16.024334 IP sea15s01-in-f10.1e100.net.https > 192.168.1.10.47401: Flags [P.], seq 3277:3561, ack 306, win 170, options [nop,nop,TS val 1769917612 ecr 428911], length 284
18:34:16.024533 IP sea15s01-in-f10.1e100.net.https > 192.168.1.10.47401: Flags [P.], seq 3561:3630, ack 306, win 170, options [nop,nop,TS val 1769917612 ecr 428911], length 69
18:34:16.029611 IP 192.168.1.10.47401 > sea15s01-in-f10.1e100.net.https: Flags [.], ack 3561, win 385, options [nop,nop,TS val 428922 ecr 1769917612], length 0
18:34:16.029625 IP 192.168.1.10.47401 > sea15s01-in-f10.1e100.net.https: Flags [.], ack 3630, win 385, options [nop,nop,TS val 428922 ecr 1769917612], length 0
18:34:16.029644 IP 192.168.1.10.47401 > sea15s01-in-f10.1e100.net.https: Flags [P.], seq 306:359, ack 3630, win 385, options [nop,nop,TS val 428922 ecr 1769917612], length 53
18:34:16.032724 IP 192.168.1.10.47401 > sea15s01-in-f10.1e100.net.https: Flags [P.], seq 359:397, ack 3630, win 385, options [nop,nop,TS val 428923 ecr 1769917612], length 38
18:34:16.045859 IP 192.168.1.10.47401 > sea15s01-in-f10.1e100.net.https: Flags [P.], seq 397:805, ack 3630, win 385, options [nop,nop,TS val 428925 ecr 1769917612], length 408
18:34:16.048990 IP 192.168.1.10.47401 > sea15s01-in-f10.1e100.net.https: Flags [P.], seq 805:848, ack 3630, win 385, options [nop,nop,TS val 428928 ecr 1769917612], length 43
18:34:16.061974 IP sea15s01-in-f10.1e100.net.https > 192.168.1.10.47401: Flags [.], ack 397, win 170, options [nop,nop,TS val 1769917649 ecr 428922], length 0
18:34:16.062164 IP sea15s01-in-f10.1e100.net.https > 192.168.1.10.47401: Flags [P.], seq 3630:3668, ack 397, win 170, options [nop,nop,TS val 1769917649 ecr 428922], length 38
18:34:16.078185 IP sea15s01-in-f10.1e100.net.https > 192.168.1.10.47401: Flags [.], ack 848, win 175, options [nop,nop,TS val 1769917666 ecr 428925], length 0
18:34:16.103245 IP 192.168.1.10.47401 > sea15s01-in-f10.1e100.net.https: Flags [.], ack 3668, win 385, options [nop,nop,TS val 428945 ecr 1769917649], length 0
18:34:16.126143 IP sea15s01-in-f10.1e100.net.https > 192.168.1.10.47401: Flags [P.], seq 3668:3869, ack 848, win 175, options [nop,nop,TS val 1769917714 ecr 428925], length 201
18:34:16.126333 IP sea15s01-in-f10.1e100.net.https > 192.168.1.10.47401: Flags [P.], seq 3869:3963, ack 848, win 175, options [nop,nop,TS val 1769917714 ecr 428925], length 94
18:34:16.126474 IP sea15s01-in-f10.1e100.net.https > 192.168.1.10.47401: Flags [P.], seq 3963:4009, ack 848, win 175, options [nop,nop,TS val 1769917714 ecr 428925], length 46
18:34:16.132854 IP 192.168.1.10.47401 > sea15s01-in-f10.1e100.net.https: Flags [.], ack 3869, win 395, options [nop,nop,TS val 428952 ecr 1769917714], length 0
18:34:16.132869 IP 192.168.1.10.47401 > sea15s01-in-f10.1e100.net.https: Flags [.], ack 3963, win 395, options [nop,nop,TS val 428952 ecr 1769917714], length 0
18:34:16.132891 IP 192.168.1.10.47401 > sea15s01-in-f10.1e100.net.https: Flags [.], ack 4009, win 395, options [nop,nop,TS val 428952 ecr 1769917714], length 0
18:34:16.134250 IP 192.168.1.10.47401 > sea15s01-in-f10.1e100.net.https: Flags [P.], seq 848:894, ack 4009, win 395, options [nop,nop,TS val 428953 ecr 1769917714], length 46
18:34:16.203663 IP sea15s01-in-f10.1e100.net.https > 192.168.1.10.47401: Flags [.], ack 894, win 175, options [nop,nop,TS val 1769917751 ecr 428953], length 0
