tcpdump: verbose output suppressed, use -v or -vv for full protocol decode
listening on wlan0, link-type EN10MB (Ethernet), capture size 262144 bytes
18:32:29.468505 IP 192.168.1.10.38144 > sea15s07-in-f68.1e100.net.https: Flags [S], seq 3419428623, win 65535, options [mss 1460,sackOK,TS val 396954 ecr 0,nop,wscale 8], length 0
18:32:29.468529 IP 192.168.1.10.38633 > sea15s07-in-f3.1e100.net.www: Flags [S], seq 988068212, win 65535, options [mss 1460,sackOK,TS val 396954 ecr 0,nop,wscale 8], length 0
18:32:29.475124 IP sea15s07-in-f3.1e100.net.www > 192.168.1.10.38633: Flags [S.], seq 189705449, ack 988068213, win 26960, options [mss 1360,sackOK,TS val 3173252476 ecr 396954,nop,wscale 7], length 0
18:32:29.479056 IP 192.168.1.10.38633 > sea15s07-in-f3.1e100.net.www: Flags [.], ack 1, win 343, options [nop,nop,TS val 396957 ecr 3173252476], length 0
18:32:29.479083 IP 192.168.1.10.38633 > sea15s07-in-f3.1e100.net.www: Flags [P.], seq 1:233, ack 1, win 343, options [nop,nop,TS val 396957 ecr 3173252476], length 232: HTTP: GET /generate_204 HTTP/1.1
18:32:29.484773 IP 192.168.1.10.49510 > pg-in-f188.1e100.net.5228: Flags [S], seq 2429063858, win 65535, options [mss 1460,sackOK,TS val 396959 ecr 0,nop,wscale 8], length 0
18:32:29.485588 IP sea15s07-in-f3.1e100.net.www > 192.168.1.10.38633: Flags [.], ack 233, win 219, options [nop,nop,TS val 3173252479 ecr 396957], length 0
18:32:29.497626 IP sea15s07-in-f68.1e100.net.https > 192.168.1.10.38144: Flags [S.], seq 2458219271, ack 3419428624, win 42408, options [mss 1360,sackOK,TS val 982918402 ecr 396954,nop,wscale 8], length 0
18:32:29.500150 IP 192.168.1.10.38144 > sea15s07-in-f68.1e100.net.https: Flags [.], ack 1, win 343, options [nop,nop,TS val 396964 ecr 982918402], length 0
18:32:29.501504 IP 192.168.1.10.38144 > sea15s07-in-f68.1e100.net.https: Flags [P.], seq 1:182, ack 1, win 343, options [nop,nop,TS val 396964 ecr 982918402], length 181
18:32:29.505736 IP pg-in-f188.1e100.net.5228 > 192.168.1.10.49510: Flags [S.], seq 1192201899, ack 2429063859, win 42408, options [mss 1360,sackOK,TS val 811850147 ecr 396959,nop,wscale 8], length 0
18:32:29.530723 IP sea15s07-in-f68.1e100.net.https > 192.168.1.10.38144: Flags [.], ack 182, win 170, options [nop,nop,TS val 982918435 ecr 396964], length 0
18:32:29.539750 IP sea15s07-in-f68.1e100.net.https > 192.168.1.10.38144: Flags [.], seq 1:1349, ack 182, win 170, options [nop,nop,TS val 982918444 ecr 396964], length 1348
18:32:29.539802 IP sea15s07-in-f68.1e100.net.https > 192.168.1.10.38144: Flags [.], seq 1349:2697, ack 182, win 170, options [nop,nop,TS val 982918444 ecr 396964], length 1348
18:32:29.539814 IP sea15s07-in-f68.1e100.net.https > 192.168.1.10.38144: Flags [P.], seq 2697:3192, ack 182, win 170, options [nop,nop,TS val 982918444 ecr 396964], length 495
18:32:29.554708 IP 192.168.1.10.49510 > pg-in-f188.1e100.net.5228: Flags [.], ack 1, win 343, options [nop,nop,TS val 396966 ecr 811850147], length 0
18:32:29.554728 IP 192.168.1.10.49510 > pg-in-f188.1e100.net.5228: Flags [P.], seq 1:168, ack 1, win 343, options [nop,nop,TS val 396967 ecr 811850147], length 167
18:32:29.559401 IP 192.168.1.10.38144 > sea15s07-in-f68.1e100.net.https: Flags [.], ack 1349, win 353, options [nop,nop,TS val 396981 ecr 982918444], length 0
18:32:29.559426 IP 192.168.1.10.38144 > sea15s07-in-f68.1e100.net.https: Flags [.], ack 2697, win 364, options [nop,nop,TS val 396982 ecr 982918444], length 0
18:32:29.563645 IP 192.168.1.10.38144 > sea15s07-in-f68.1e100.net.https: Flags [.], ack 3192, win 374, options [nop,nop,TS val 396982 ecr 982918444], length 0
18:32:29.575869 IP pg-in-f188.1e100.net.5228 > 192.168.1.10.49510: Flags [.], ack 168, win 170, options [nop,nop,TS val 811850217 ecr 396967], length 0
18:32:29.576228 IP pg-in-f188.1e100.net.5228 > 192.168.1.10.49510: Flags [.], seq 1:1349, ack 168, win 170, options [nop,nop,TS val 811850217 ecr 396967], length 1348
18:32:29.576279 IP pg-in-f188.1e100.net.5228 > 192.168.1.10.49510: Flags [.], seq 1349:2697, ack 168, win 170, options [nop,nop,TS val 811850217 ecr 396967], length 1348
18:32:29.576311 IP pg-in-f188.1e100.net.5228 > 192.168.1.10.49510: Flags [.], seq 2697:4045, ack 168, win 170, options [nop,nop,TS val 811850217 ecr 396967], length 1348
18:32:29.576336 IP pg-in-f188.1e100.net.5228 > 192.168.1.10.49510: Flags [P.], seq 4045:4112, ack 168, win 170, options [nop,nop,TS val 811850217 ecr 396967], length 67
18:32:29.581779 IP 192.168.1.10.49510 > pg-in-f188.1e100.net.5228: Flags [.], ack 1349, win 353, options [nop,nop,TS val 396988 ecr 811850217], length 0
18:32:29.581794 IP 192.168.1.10.49510 > pg-in-f188.1e100.net.5228: Flags [.], ack 2697, win 364, options [nop,nop,TS val 396988 ecr 811850217], length 0
18:32:29.581805 IP 192.168.1.10.49510 > pg-in-f188.1e100.net.5228: Flags [.], ack 4045, win 374, options [nop,nop,TS val 396988 ecr 811850217], length 0
18:32:29.581824 IP 192.168.1.10.49510 > pg-in-f188.1e100.net.5228: Flags [.], ack 4112, win 374, options [nop,nop,TS val 396988 ecr 811850217], length 0
18:32:29.583968 IP sea15s07-in-f3.1e100.net.www > 192.168.1.10.38633: Flags [P.], seq 1:227, ack 233, win 219, options [nop,nop,TS val 3173252503 ecr 396957], length 226: HTTP: HTTP/1.1 204 No Content
18:32:29.587419 IP 192.168.1.10.38633 > sea15s07-in-f3.1e100.net.www: Flags [.], ack 227, win 347, options [nop,nop,TS val 396990 ecr 3173252503], length 0
18:32:29.600158 IP 192.168.1.10.38144 > sea15s07-in-f68.1e100.net.https: Flags [P.], seq 182:308, ack 3192, win 374, options [nop,nop,TS val 396993 ecr 982918444], length 126
18:32:29.621050 IP 192.168.1.10.49510 > pg-in-f188.1e100.net.5228: Flags [P.], seq 168:261, ack 4112, win 374, options [nop,nop,TS val 397000 ecr 811850217], length 93
18:32:29.629794 IP sea15s07-in-f68.1e100.net.https > 192.168.1.10.38144: Flags [P.], seq 3192:3476, ack 308, win 170, options [nop,nop,TS val 982918534 ecr 396993], length 284
18:32:29.631999 IP 192.168.1.10.38144 > sea15s07-in-f68.1e100.net.https: Flags [P.], seq 308:554, ack 3476, win 385, options [nop,nop,TS val 397003 ecr 982918534], length 246
18:32:29.642175 IP pg-in-f188.1e100.net.5228 > 192.168.1.10.49510: Flags [P.], seq 4112:4396, ack 261, win 170, options [nop,nop,TS val 811850283 ecr 397000], length 284
18:32:29.644500 IP 192.168.1.10.49510 > pg-in-f188.1e100.net.5228: Flags [.], ack 4396, win 385, options [nop,nop,TS val 397007 ecr 811850283], length 0
18:32:29.661477 IP sea15s07-in-f68.1e100.net.https > 192.168.1.10.38144: Flags [P.], seq 3476:3739, ack 554, win 175, options [nop,nop,TS val 982918566 ecr 397003], length 263
18:32:29.729462 IP 192.168.1.10.38144 > sea15s07-in-f68.1e100.net.https: Flags [.], ack 3739, win 395, options [nop,nop,TS val 397025 ecr 982918566], length 0
18:32:29.729483 IP 192.168.1.10.49510 > pg-in-f188.1e100.net.5228: Flags [P.], seq 261:561, ack 4396, win 385, options [nop,nop,TS val 397025 ecr 811850283], length 300
18:32:29.750906 IP pg-in-f188.1e100.net.5228 > 192.168.1.10.49510: Flags [P.], seq 4396:4426, ack 561, win 175, options [nop,nop,TS val 811850392 ecr 397025], length 30
18:32:29.754439 IP pg-in-f188.1e100.net.5228 > 192.168.1.10.49510: Flags [P.], seq 4426:4540, ack 561, win 175, options [nop,nop,TS val 811850396 ecr 397025], length 114
18:32:29.756627 IP 192.168.1.10.49510 > pg-in-f188.1e100.net.5228: Flags [.], ack 4426, win 385, options [nop,nop,TS val 397040 ecr 811850392], length 0
18:32:29.758859 IP 192.168.1.10.49510 > pg-in-f188.1e100.net.5228: Flags [.], ack 4540, win 385, options [nop,nop,TS val 397041 ecr 811850396], length 0
18:32:29.759088 IP pg-in-f188.1e100.net.5228 > 192.168.1.10.49510: Flags [P.], seq 4540:4665, ack 561, win 175, options [nop,nop,TS val 811850400 ecr 397025], length 125
18:32:29.761594 IP 192.168.1.10.49510 > pg-in-f188.1e100.net.5228: Flags [.], ack 4665, win 385, options [nop,nop,TS val 397042 ecr 811850400], length 0
18:32:29.871503 IP 192.168.1.10.46412 > sea15s07-in-f14.1e100.net.https: Flags [S], seq 2893330461, win 65535, options [mss 1460,sackOK,TS val 397075 ecr 0,nop,wscale 8], length 0
18:32:29.899746 IP sea15s07-in-f14.1e100.net.https > 192.168.1.10.46412: Flags [S.], seq 2249192243, ack 2893330462, win 42408, options [mss 1360,sackOK,TS val 1406273363 ecr 397075,nop,wscale 8], length 0
18:32:29.902024 IP 192.168.1.10.46412 > sea15s07-in-f14.1e100.net.https: Flags [.], ack 1, win 343, options [nop,nop,TS val 397084 ecr 1406273363], length 0
18:32:29.904640 IP 192.168.1.10.46412 > sea15s07-in-f14.1e100.net.https: Flags [P.], seq 1:174, ack 1, win 343, options [nop,nop,TS val 397085 ecr 1406273363], length 173
18:32:29.932889 IP sea15s07-in-f14.1e100.net.https > 192.168.1.10.46412: Flags [.], ack 174, win 170, options [nop,nop,TS val 1406273396 ecr 397085], length 0
18:32:29.940750 IP sea15s07-in-f14.1e100.net.https > 192.168.1.10.46412: Flags [.], seq 2697:4045, ack 174, win 170, options [nop,nop,TS val 1406273404 ecr 397085], length 1348
18:32:29.940806 IP sea15s07-in-f14.1e100.net.https > 192.168.1.10.46412: Flags [P.], seq 4045:4139, ack 174, win 170, options [nop,nop,TS val 1406273404 ecr 397085], length 94
18:32:29.940972 IP sea15s07-in-f14.1e100.net.https > 192.168.1.10.46412: Flags [.], seq 1:1349, ack 174, win 170, options [nop,nop,TS val 1406273404 ecr 397085], length 1348
18:32:29.941019 IP sea15s07-in-f14.1e100.net.https > 192.168.1.10.46412: Flags [.], seq 1349:2697, ack 174, win 170, options [nop,nop,TS val 1406273404 ecr 397085], length 1348
18:32:29.944994 IP 192.168.1.10.46412 > sea15s07-in-f14.1e100.net.https: Flags [.], ack 1, win 353, options [nop,nop,TS val 397097 ecr 1406273396,nop,nop,sack 1 {2697:4045}], length 0
18:32:29.945009 IP 192.168.1.10.46412 > sea15s07-in-f14.1e100.net.https: Flags [.], ack 1, win 357, options [nop,nop,TS val 397097 ecr 1406273396,nop,nop,sack 1 {2697:4139}], length 0
18:32:29.945018 IP 192.168.1.10.46412 > sea15s07-in-f14.1e100.net.https: Flags [.], ack 1349, win 368, options [nop,nop,TS val 397097 ecr 1406273404,nop,nop,sack 1 {2697:4139}], length 0
18:32:29.945037 IP 192.168.1.10.46412 > sea15s07-in-f14.1e100.net.https: Flags [.], ack 4139, win 378, options [nop,nop,TS val 397097 ecr 1406273404], length 0
18:32:29.962868 IP 192.168.1.10.46412 > sea15s07-in-f14.1e100.net.https: Flags [P.], seq 174:267, ack 4139, win 378, options [nop,nop,TS val 397102 ecr 1406273404], length 93
18:32:29.991248 IP sea15s07-in-f14.1e100.net.https > 192.168.1.10.46412: Flags [P.], seq 4139:4190, ack 267, win 170, options [nop,nop,TS val 1406273454 ecr 397102], length 51
18:32:30.057285 IP 192.168.1.10.46412 > sea15s07-in-f14.1e100.net.https: Flags [P.], seq 267:825, ack 4190, win 378, options [nop,nop,TS val 397131 ecr 1406273454], length 558
18:32:30.125154 IP sea15s07-in-f14.1e100.net.https > 192.168.1.10.46412: Flags [.], ack 825, win 175, options [nop,nop,TS val 1406273549 ecr 397131], length 0
18:32:30.163911 IP sea15s07-in-f14.1e100.net.https > 192.168.1.10.46412: Flags [P.], seq 4190:4702, ack 825, win 175, options [nop,nop,TS val 1406273627 ecr 397131], length 512
18:32:30.164149 IP sea15s07-in-f14.1e100.net.https > 192.168.1.10.46412: Flags [P.], seq 4702:4981, ack 825, win 175, options [nop,nop,TS val 1406273627 ecr 397131], length 279
18:32:30.164232 IP sea15s07-in-f14.1e100.net.https > 192.168.1.10.46412: Flags [P.], seq 4981:5015, ack 825, win 175, options [nop,nop,TS val 1406273627 ecr 397131], length 34
18:32:30.177356 IP 192.168.1.10.47328 > sea15s01-in-f10.1e100.net.https: Flags [S], seq 1639662466, win 65535, options [mss 1460,sackOK,TS val 397167 ecr 0,nop,wscale 8], length 0
18:32:30.177375 IP 192.168.1.10.47329 > sea15s01-in-f10.1e100.net.https: Flags [S], seq 4006759297, win 65535, options [mss 1460,sackOK,TS val 397167 ecr 0,nop,wscale 8], length 0
18:32:30.178601 IP 192.168.1.10.46412 > sea15s07-in-f14.1e100.net.https: Flags [.], ack 5015, win 400, options [nop,nop,TS val 397167 ecr 1406273627], length 0
18:32:30.204791 IP sea15s01-in-f10.1e100.net.https > 192.168.1.10.47328: Flags [S.], seq 4211120797, ack 1639662467, win 42408, options [mss 1360,sackOK,TS val 464529354 ecr 397167,nop,wscale 8], length 0
18:32:30.206562 IP sea15s01-in-f10.1e100.net.https > 192.168.1.10.47329: Flags [S.], seq 2819594674, ack 4006759298, win 42408, options [mss 1360,sackOK,TS val 4291466491 ecr 397167,nop,wscale 8], length 0
18:32:30.208034 IP 192.168.1.10.47328 > sea15s01-in-f10.1e100.net.https: Flags [.], ack 1, win 343, options [nop,nop,TS val 397176 ecr 464529354], length 0
18:32:30.209778 IP 192.168.1.10.47329 > sea15s01-in-f10.1e100.net.https: Flags [.], ack 1, win 343, options [nop,nop,TS val 397177 ecr 4291466491], length 0
18:32:30.211527 IP 192.168.1.10.47328 > sea15s01-in-f10.1e100.net.https: Flags [P.], seq 1:185, ack 1, win 343, options [nop,nop,TS val 397177 ecr 464529354], length 184
18:32:30.211551 IP 192.168.1.10.47329 > sea15s01-in-f10.1e100.net.https: Flags [P.], seq 1:185, ack 1, win 343, options [nop,nop,TS val 397177 ecr 4291466491], length 184
18:32:30.239013 IP sea15s01-in-f10.1e100.net.https > 192.168.1.10.47328: Flags [.], ack 185, win 170, options [nop,nop,TS val 464529388 ecr 397177], length 0
18:32:30.240843 IP sea15s01-in-f10.1e100.net.https > 192.168.1.10.47329: Flags [.], ack 185, win 170, options [nop,nop,TS val 4291466525 ecr 397177], length 0
18:32:30.246667 IP sea15s01-in-f10.1e100.net.https > 192.168.1.10.47328: Flags [.], seq 1:1349, ack 185, win 170, options [nop,nop,TS val 464529396 ecr 397177], length 1348
18:32:30.246717 IP sea15s01-in-f10.1e100.net.https > 192.168.1.10.47328: Flags [.], seq 1349:2697, ack 185, win 170, options [nop,nop,TS val 464529396 ecr 397177], length 1348
18:32:30.246731 IP sea15s01-in-f10.1e100.net.https > 192.168.1.10.47328: Flags [P.], seq 2697:3251, ack 185, win 170, options [nop,nop,TS val 464529396 ecr 397177], length 554
18:32:30.256051 IP sea15s01-in-f10.1e100.net.https > 192.168.1.10.47329: Flags [.], seq 1:1349, ack 185, win 170, options [nop,nop,TS val 4291466540 ecr 397177], length 1348
18:32:30.256104 IP sea15s01-in-f10.1e100.net.https > 192.168.1.10.47329: Flags [.], seq 1349:2697, ack 185, win 170, options [nop,nop,TS val 4291466540 ecr 397177], length 1348
18:32:30.256121 IP sea15s01-in-f10.1e100.net.https > 192.168.1.10.47329: Flags [P.], seq 2697:3251, ack 185, win 170, options [nop,nop,TS val 4291466540 ecr 397177], length 554
18:32:30.286537 IP 192.168.1.10.47328 > sea15s01-in-f10.1e100.net.https: Flags [.], ack 1349, win 353, options [nop,nop,TS val 397199 ecr 464529396], length 0
18:32:30.286554 IP 192.168.1.10.47328 > sea15s01-in-f10.1e100.net.https: Flags [.], ack 2697, win 364, options [nop,nop,TS val 397199 ecr 464529396], length 0
18:32:30.286571 IP 192.168.1.10.47328 > sea15s01-in-f10.1e100.net.https: Flags [.], ack 3251, win 374, options [nop,nop,TS val 397199 ecr 464529396], length 0
18:32:30.295369 IP 192.168.1.10.47329 > sea15s01-in-f10.1e100.net.https: Flags [.], ack 1349, win 353, options [nop,nop,TS val 397202 ecr 4291466540], length 0
18:32:30.295380 IP 192.168.1.10.47329 > sea15s01-in-f10.1e100.net.https: Flags [.], ack 2697, win 364, options [nop,nop,TS val 397202 ecr 4291466540], length 0
18:32:30.295394 IP 192.168.1.10.47329 > sea15s01-in-f10.1e100.net.https: Flags [.], ack 3251, win 374, options [nop,nop,TS val 397202 ecr 4291466540], length 0
18:32:30.310402 IP sea15s01-in-f10.1e100.net.https > 192.168.1.10.47328: Flags [P.], seq 2697:3251, ack 185, win 170, options [nop,nop,TS val 464529460 ecr 397177], length 554
18:32:30.314483 IP 192.168.1.10.47328 > sea15s01-in-f10.1e100.net.https: Flags [.], ack 3251, win 374, options [nop,nop,TS val 397208 ecr 464529460,nop,nop,sack 1 {2697:3251}], length 0
18:32:30.322505 IP sea15s01-in-f10.1e100.net.https > 192.168.1.10.47329: Flags [P.], seq 2697:3251, ack 185, win 170, options [nop,nop,TS val 4291466607 ecr 397177], length 554
18:32:30.324978 IP 192.168.1.10.47329 > sea15s01-in-f10.1e100.net.https: Flags [.], ack 3251, win 374, options [nop,nop,TS val 397211 ecr 4291466607,nop,nop,sack 1 {2697:3251}], length 0
18:32:30.376400 IP 192.168.1.10.47328 > sea15s01-in-f10.1e100.net.https: Flags [P.], seq 185:278, ack 3251, win 374, options [nop,nop,TS val 397226 ecr 464529460], length 93
18:32:30.388491 IP 192.168.1.10.47329 > sea15s01-in-f10.1e100.net.https: Flags [P.], seq 185:278, ack 3251, win 374, options [nop,nop,TS val 397230 ecr 4291466607], length 93
18:32:30.404023 IP sea15s01-in-f10.1e100.net.https > 192.168.1.10.47328: Flags [P.], seq 3251:3535, ack 278, win 170, options [nop,nop,TS val 464529553 ecr 397226], length 284
18:32:30.418878 IP sea15s01-in-f10.1e100.net.https > 192.168.1.10.47329: Flags [P.], seq 3251:3535, ack 278, win 170, options [nop,nop,TS val 4291466703 ecr 397230], length 284
18:32:30.463478 IP 192.168.1.10.47328 > sea15s01-in-f10.1e100.net.https: Flags [P.], seq 278:1299, ack 3535, win 385, options [nop,nop,TS val 397250 ecr 464529553], length 1021
18:32:30.463482 IP 192.168.1.10.47329 > sea15s01-in-f10.1e100.net.https: Flags [P.], seq 278:1272, ack 3535, win 385, options [nop,nop,TS val 397250 ecr 4291466703], length 994
18:32:30.528990 IP sea15s01-in-f10.1e100.net.https > 192.168.1.10.47328: Flags [P.], seq 3535:4883, ack 1299, win 178, options [nop,nop,TS val 464529678 ecr 397250], length 1348
18:32:30.529125 IP sea15s01-in-f10.1e100.net.https > 192.168.1.10.47328: Flags [P.], seq 4883:6231, ack 1299, win 178, options [nop,nop,TS val 464529678 ecr 397250], length 1348
18:32:30.529238 IP sea15s01-in-f10.1e100.net.https > 192.168.1.10.47328: Flags [.], seq 6231:7579, ack 1299, win 178, options [nop,nop,TS val 464529678 ecr 397250], length 1348
18:32:30.529259 IP sea15s01-in-f10.1e100.net.https > 192.168.1.10.47328: Flags [P.], seq 7579:7990, ack 1299, win 178, options [nop,nop,TS val 464529678 ecr 397250], length 411
18:32:30.529319 IP sea15s01-in-f10.1e100.net.https > 192.168.1.10.47328: Flags [P.], seq 7990:9338, ack 1299, win 178, options [nop,nop,TS val 464529679 ecr 397250], length 1348
18:32:30.529371 IP sea15s01-in-f10.1e100.net.https > 192.168.1.10.47328: Flags [P.], seq 9338:10686, ack 1299, win 178, options [nop,nop,TS val 464529679 ecr 397250], length 1348
18:32:30.529451 IP sea15s01-in-f10.1e100.net.https > 192.168.1.10.47328: Flags [.], seq 10686:12034, ack 1299, win 178, options [nop,nop,TS val 464529679 ecr 397250], length 1348
18:32:30.529468 IP sea15s01-in-f10.1e100.net.https > 192.168.1.10.47328: Flags [P.], seq 12034:12212, ack 1299, win 178, options [nop,nop,TS val 464529679 ecr 397250], length 178
18:32:30.529518 IP sea15s01-in-f10.1e100.net.https > 192.168.1.10.47328: Flags [P.], seq 12212:13560, ack 1299, win 178, options [nop,nop,TS val 464529679 ecr 397250], length 1348
18:32:30.529592 IP sea15s01-in-f10.1e100.net.https > 192.168.1.10.47328: Flags [.], seq 13560:14908, ack 1299, win 178, options [nop,nop,TS val 464529679 ecr 397250], length 1348
18:32:30.529608 IP sea15s01-in-f10.1e100.net.https > 192.168.1.10.47328: Flags [P.], seq 14908:16256, ack 1299, win 178, options [nop,nop,TS val 464529679 ecr 397250], length 1348
18:32:30.531854 IP sea15s01-in-f10.1e100.net.https > 192.168.1.10.47328: Flags [P.], seq 16256:16538, ack 1299, win 178, options [nop,nop,TS val 464529679 ecr 397250], length 282
18:32:30.531925 IP sea15s01-in-f10.1e100.net.https > 192.168.1.10.47328: Flags [P.], seq 16538:17886, ack 1299, win 178, options [nop,nop,TS val 464529679 ecr 397250], length 1348
18:32:30.532694 IP sea15s01-in-f10.1e100.net.https > 192.168.1.10.47329: Flags [.], ack 1272, win 178, options [nop,nop,TS val 4291466777 ecr 397250], length 0
18:32:30.533637 IP sea15s01-in-f10.1e100.net.https > 192.168.1.10.47329: Flags [P.], seq 3535:4883, ack 1272, win 178, options [nop,nop,TS val 4291466818 ecr 397250], length 1348
18:32:30.533721 IP sea15s01-in-f10.1e100.net.https > 192.168.1.10.47329: Flags [P.], seq 4883:6231, ack 1272, win 178, options [nop,nop,TS val 4291466818 ecr 397250], length 1348
18:32:30.533869 IP sea15s01-in-f10.1e100.net.https > 192.168.1.10.47329: Flags [.], seq 6231:7579, ack 1272, win 178, options [nop,nop,TS val 4291466818 ecr 397250], length 1348
18:32:30.533890 IP sea15s01-in-f10.1e100.net.https > 192.168.1.10.47329: Flags [P.], seq 7579:7954, ack 1272, win 178, options [nop,nop,TS val 4291466818 ecr 397250], length 375
18:32:30.534382 IP sea15s01-in-f10.1e100.net.https > 192.168.1.10.47328: Flags [.], seq 17886:19234, ack 1299, win 178, options [nop,nop,TS val 464529679 ecr 397250], length 1348
18:32:30.535163 IP sea15s01-in-f10.1e100.net.https > 192.168.1.10.47329: Flags [P.], seq 7954:9302, ack 1272, win 178, options [nop,nop,TS val 4291466820 ecr 397250], length 1348
18:32:30.535293 IP sea15s01-in-f10.1e100.net.https > 192.168.1.10.47329: Flags [.], seq 9302:10650, ack 1272, win 178, options [nop,nop,TS val 4291466820 ecr 397250], length 1348
18:32:30.535313 IP sea15s01-in-f10.1e100.net.https > 192.168.1.10.47329: Flags [P.], seq 10650:11998, ack 1272, win 178, options [nop,nop,TS val 4291466820 ecr 397250], length 1348
18:32:30.535427 IP sea15s01-in-f10.1e100.net.https > 192.168.1.10.47329: Flags [.], seq 11998:13346, ack 1272, win 178, options [nop,nop,TS val 4291466820 ecr 397250], length 1348
18:32:30.535446 IP sea15s01-in-f10.1e100.net.https > 192.168.1.10.47329: Flags [.], seq 13346:14694, ack 1272, win 178, options [nop,nop,TS val 4291466820 ecr 397250], length 1348
18:32:30.537954 IP sea15s01-in-f10.1e100.net.https > 192.168.1.10.47329: Flags [.], seq 14694:16042, ack 1272, win 178, options [nop,nop,TS val 4291466820 ecr 397250], length 1348
18:32:30.538004 IP sea15s01-in-f10.1e100.net.https > 192.168.1.10.47329: Flags [P.], seq 16042:17390, ack 1272, win 178, options [nop,nop,TS val 4291466820 ecr 397250], length 1348
18:32:30.538150 IP sea15s01-in-f10.1e100.net.https > 192.168.1.10.47329: Flags [.], seq 17390:18738, ack 1272, win 178, options [nop,nop,TS val 4291466820 ecr 397250], length 1348
18:32:30.538171 IP sea15s01-in-f10.1e100.net.https > 192.168.1.10.47329: Flags [.], seq 18738:20086, ack 1272, win 178, options [nop,nop,TS val 4291466820 ecr 397250], length 1348
18:32:30.540390 IP sea15s01-in-f10.1e100.net.https > 192.168.1.10.47329: Flags [.], seq 20086:21434, ack 1272, win 178, options [nop,nop,TS val 4291466822 ecr 397250], length 1348
18:32:30.561006 IP 192.168.1.10.47328 > sea15s01-in-f10.1e100.net.https: Flags [.], ack 6231, win 406, options [nop,nop,TS val 397282 ecr 464529678], length 0
18:32:30.561028 IP 192.168.1.10.47328 > sea15s01-in-f10.1e100.net.https: Flags [.], ack 7990, win 427, options [nop,nop,TS val 397282 ecr 464529678], length 0
18:32:30.567125 IP 192.168.1.10.47328 > sea15s01-in-f10.1e100.net.https: Flags [.], ack 10686, win 448, options [nop,nop,TS val 397283 ecr 464529679], length 0
18:32:30.567140 IP 192.168.1.10.47328 > sea15s01-in-f10.1e100.net.https: Flags [.], ack 12212, win 469, options [nop,nop,TS val 397283 ecr 464529679], length 0
18:32:30.567150 IP 192.168.1.10.47328 > sea15s01-in-f10.1e100.net.https: Flags [.], ack 14908, win 490, options [nop,nop,TS val 397283 ecr 464529679], length 0
18:32:30.567160 IP 192.168.1.10.47328 > sea15s01-in-f10.1e100.net.https: Flags [.], ack 16538, win 511, options [nop,nop,TS val 397283 ecr 464529679], length 0
18:32:30.567169 IP 192.168.1.10.47329 > sea15s01-in-f10.1e100.net.https: Flags [.], ack 6231, win 406, options [nop,nop,TS val 397283 ecr 4291466818], length 0
18:32:30.567178 IP 192.168.1.10.47329 > sea15s01-in-f10.1e100.net.https: Flags [.], ack 7954, win 427, options [nop,nop,TS val 397283 ecr 4291466818], length 0
18:32:30.567187 IP 192.168.1.10.47328 > sea15s01-in-f10.1e100.net.https: Flags [.], ack 19234, win 532, options [nop,nop,TS val 397283 ecr 464529679], length 0
18:32:30.567196 IP 192.168.1.10.47329 > sea15s01-in-f10.1e100.net.https: Flags [.], ack 10650, win 448, options [nop,nop,TS val 397283 ecr 4291466820], length 0
18:32:30.567205 IP 192.168.1.10.47329 > sea15s01-in-f10.1e100.net.https: Flags [.], ack 13346, win 469, options [nop,nop,TS val 397283 ecr 4291466820], length 0
18:32:30.568501 IP 192.168.1.10.47329 > sea15s01-in-f10.1e100.net.https: Flags [.], ack 16042, win 490, options [nop,nop,TS val 397284 ecr 4291466820], length 0
18:32:30.568514 IP 192.168.1.10.47329 > sea15s01-in-f10.1e100.net.https: Flags [.], ack 18738, win 511, options [nop,nop,TS val 397284 ecr 4291466820], length 0
18:32:30.568532 IP 192.168.1.10.47329 > sea15s01-in-f10.1e100.net.https: Flags [.], ack 21434, win 532, options [nop,nop,TS val 397284 ecr 4291466820], length 0
18:32:30.588636 IP sea15s01-in-f10.1e100.net.https > 192.168.1.10.47328: Flags [.], seq 19234:20582, ack 1299, win 178, options [nop,nop,TS val 464529738 ecr 397282], length 1348
18:32:30.588747 IP sea15s01-in-f10.1e100.net.https > 192.168.1.10.47328: Flags [.], seq 20582:21930, ack 1299, win 178, options [nop,nop,TS val 464529738 ecr 397282], length 1348
18:32:30.588817 IP sea15s01-in-f10.1e100.net.https > 192.168.1.10.47328: Flags [.], seq 21930:23278, ack 1299, win 178, options [nop,nop,TS val 464529738 ecr 397282], length 1348
18:32:30.588851 IP sea15s01-in-f10.1e100.net.https > 192.168.1.10.47328: Flags [.], seq 23278:24626, ack 1299, win 178, options [nop,nop,TS val 464529738 ecr 397282], length 1348
18:32:30.589780 IP sea15s01-in-f10.1e100.net.https > 192.168.1.10.47328: Flags [.], seq 24626:25974, ack 1299, win 178, options [nop,nop,TS val 464529738 ecr 397282], length 1348
18:32:30.589832 IP sea15s01-in-f10.1e100.net.https > 192.168.1.10.47328: Flags [.], seq 25974:27322, ack 1299, win 178, options [nop,nop,TS val 464529738 ecr 397282], length 1348
18:32:30.592191 IP sea15s01-in-f10.1e100.net.https > 192.168.1.10.47328: Flags [.], seq 27322:28670, ack 1299, win 178, options [nop,nop,TS val 464529738 ecr 397282], length 1348
18:32:30.592244 IP sea15s01-in-f10.1e100.net.https > 192.168.1.10.47328: Flags [.], seq 28670:30018, ack 1299, win 178, options [nop,nop,TS val 464529738 ecr 397282], length 1348
18:32:30.594657 IP sea15s01-in-f10.1e100.net.https > 192.168.1.10.47328: Flags [.], seq 30018:31366, ack 1299, win 178, options [nop,nop,TS val 464529744 ecr 397283], length 1348
18:32:30.594699 IP sea15s01-in-f10.1e100.net.https > 192.168.1.10.47328: Flags [.], seq 31366:32714, ack 1299, win 178, options [nop,nop,TS val 464529744 ecr 397283], length 1348
18:32:30.596540 IP sea15s01-in-f10.1e100.net.https > 192.168.1.10.47329: Flags [.], seq 21434:22782, ack 1272, win 178, options [nop,nop,TS val 4291466881 ecr 397283], length 1348
18:32:30.596585 IP sea15s01-in-f10.1e100.net.https > 192.168.1.10.47329: Flags [.], seq 22782:24130, ack 1272, win 178, options [nop,nop,TS val 4291466881 ecr 397283], length 1348
18:32:30.596718 IP sea15s01-in-f10.1e100.net.https > 192.168.1.10.47329: Flags [.], seq 24130:25478, ack 1272, win 178, options [nop,nop,TS val 4291466881 ecr 397283], length 1348
18:32:30.596756 IP sea15s01-in-f10.1e100.net.https > 192.168.1.10.47329: Flags [.], seq 25478:26826, ack 1272, win 178, options [nop,nop,TS val 4291466881 ecr 397283], length 1348
18:32:30.597162 IP sea15s01-in-f10.1e100.net.https > 192.168.1.10.47328: Flags [.], seq 32714:34062, ack 1299, win 178, options [nop,nop,TS val 464529744 ecr 397283], length 1348
18:32:30.597202 IP sea15s01-in-f10.1e100.net.https > 192.168.1.10.47328: Flags [.], seq 34062:35410, ack 1299, win 178, options [nop,nop,TS val 464529744 ecr 397283], length 1348
18:32:30.597845 IP sea15s01-in-f10.1e100.net.https > 192.168.1.10.47329: Flags [.], seq 26826:28174, ack 1272, win 178, options [nop,nop,TS val 4291466881 ecr 397283], length 1348
18:32:30.597883 IP sea15s01-in-f10.1e100.net.https > 192.168.1.10.47329: Flags [.], seq 28174:29522, ack 1272, win 178, options [nop,nop,TS val 4291466881 ecr 397283], length 1348
18:32:30.599608 IP sea15s01-in-f10.1e100.net.https > 192.168.1.10.47328: Flags [.], seq 35410:36758, ack 1299, win 178, options [nop,nop,TS val 464529744 ecr 397283], length 1348
18:32:30.599655 IP sea15s01-in-f10.1e100.net.https > 192.168.1.10.47328: Flags [.], seq 36758:38106, ack 1299, win 178, options [nop,nop,TS val 464529744 ecr 397283], length 1348
18:32:30.600461 IP sea15s01-in-f10.1e100.net.https > 192.168.1.10.47329: Flags [.], seq 29522:30870, ack 1272, win 178, options [nop,nop,TS val 4291466881 ecr 397283], length 1348
18:32:30.600500 IP sea15s01-in-f10.1e100.net.https > 192.168.1.10.47329: Flags [.], seq 30870:32218, ack 1272, win 178, options [nop,nop,TS val 4291466881 ecr 397283], length 1348
18:32:30.602037 IP sea15s01-in-f10.1e100.net.https > 192.168.1.10.47328: Flags [.], seq 38106:39454, ack 1299, win 178, options [nop,nop,TS val 464529747 ecr 397283], length 1348
18:32:30.602078 IP sea15s01-in-f10.1e100.net.https > 192.168.1.10.47328: Flags [.], seq 39454:40802, ack 1299, win 178, options [nop,nop,TS val 464529747 ecr 397283], length 1348
18:32:30.602188 IP sea15s01-in-f10.1e100.net.https > 192.168.1.10.47328: Flags [.], seq 40802:42150, ack 1299, win 178, options [nop,nop,TS val 464529749 ecr 397283], length 1348
18:32:30.602226 IP sea15s01-in-f10.1e100.net.https > 192.168.1.10.47328: Flags [.], seq 42150:43498, ack 1299, win 178, options [nop,nop,TS val 464529749 ecr 397283], length 1348
18:32:30.603055 IP sea15s01-in-f10.1e100.net.https > 192.168.1.10.47329: Flags [.], seq 32218:33566, ack 1272, win 178, options [nop,nop,TS val 4291466882 ecr 397284], length 1348
18:32:30.603075 IP sea15s01-in-f10.1e100.net.https > 192.168.1.10.47329: Flags [.], seq 33566:34914, ack 1272, win 178, options [nop,nop,TS val 4291466882 ecr 397284], length 1348
18:32:30.603393 IP 192.168.1.10.47328 > sea15s01-in-f10.1e100.net.https: Flags [.], ack 21930, win 553, options [nop,nop,TS val 397294 ecr 464529738], length 0
18:32:30.604548 IP sea15s01-in-f10.1e100.net.https > 192.168.1.10.47328: Flags [.], seq 43498:44846, ack 1299, win 178, options [nop,nop,TS val 464529751 ecr 397283], length 1348
18:32:30.604583 IP sea15s01-in-f10.1e100.net.https > 192.168.1.10.47328: Flags [.], seq 44846:46194, ack 1299, win 178, options [nop,nop,TS val 464529751 ecr 397283], length 1348
18:32:30.604747 IP 192.168.1.10.47328 > sea15s01-in-f10.1e100.net.https: Flags [.], ack 24626, win 574, options [nop,nop,TS val 397294 ecr 464529738], length 0
18:32:30.605643 IP sea15s01-in-f10.1e100.net.https > 192.168.1.10.47329: Flags [.], seq 34914:36262, ack 1272, win 178, options [nop,nop,TS val 4291466885 ecr 397284], length 1348
18:32:30.605666 IP sea15s01-in-f10.1e100.net.https > 192.168.1.10.47329: Flags [.], seq 36262:37610, ack 1272, win 178, options [nop,nop,TS val 4291466885 ecr 397284], length 1348
18:32:30.606994 IP sea15s01-in-f10.1e100.net.https > 192.168.1.10.47328: Flags [.], seq 46194:47542, ack 1299, win 178, options [nop,nop,TS val 464529751 ecr 397283], length 1348
18:32:30.607046 IP sea15s01-in-f10.1e100.net.https > 192.168.1.10.47328: Flags [.], seq 47542:48890, ack 1299, win 178, options [nop,nop,TS val 464529751 ecr 397283], length 1348
18:32:30.608208 IP sea15s01-in-f10.1e100.net.https > 192.168.1.10.47329: Flags [.], seq 37610:38958, ack 1272, win 178, options [nop,nop,TS val 4291466887 ecr 397284], length 1348
18:32:30.608295 IP sea15s01-in-f10.1e100.net.https > 192.168.1.10.47329: Flags [.], seq 38958:40306, ack 1272, win 178, options [nop,nop,TS val 4291466887 ecr 397284], length 1348
18:32:30.609498 IP sea15s01-in-f10.1e100.net.https > 192.168.1.10.47328: Flags [.], seq 48890:50238, ack 1299, win 178, options [nop,nop,TS val 464529754 ecr 397283], length 1348
18:32:30.609516 IP sea15s01-in-f10.1e100.net.https > 192.168.1.10.47328: Flags [.], seq 50238:51586, ack 1299, win 178, options [nop,nop,TS val 464529754 ecr 397283], length 1348
18:32:30.609880 IP 192.168.1.10.47328 > sea15s01-in-f10.1e100.net.https: Flags [.], ack 27322, win 595, options [nop,nop,TS val 397296 ecr 464529738], length 0
18:32:30.610880 IP sea15s01-in-f10.1e100.net.https > 192.168.1.10.47329: Flags [.], seq 40306:41654, ack 1272, win 178, options [nop,nop,TS val 4291466890 ecr 397284], length 1348
18:32:30.610906 IP sea15s01-in-f10.1e100.net.https > 192.168.1.10.47329: Flags [.], seq 41654:43002, ack 1272, win 178, options [nop,nop,TS val 4291466890 ecr 397284], length 1348
18:32:30.611006 IP sea15s01-in-f10.1e100.net.https > 192.168.1.10.47329: Flags [.], seq 43002:44350, ack 1272, win 178, options [nop,nop,TS val 4291466893 ecr 397284], length 1348
18:32:30.611025 IP sea15s01-in-f10.1e100.net.https > 192.168.1.10.47329: Flags [.], seq 44350:45698, ack 1272, win 178, options [nop,nop,TS val 4291466893 ecr 397284], length 1348
18:32:30.613472 IP sea15s01-in-f10.1e100.net.https > 192.168.1.10.47329: Flags [.], seq 45698:47046, ack 1272, win 178, options [nop,nop,TS val 4291466895 ecr 397284], length 1348
18:32:30.613522 IP sea15s01-in-f10.1e100.net.https > 192.168.1.10.47329: Flags [.], seq 47046:48394, ack 1272, win 178, options [nop,nop,TS val 4291466895 ecr 397284], length 1348
18:32:30.614245 IP 192.168.1.10.47328 > sea15s01-in-f10.1e100.net.https: Flags [.], ack 30018, win 616, options [nop,nop,TS val 397298 ecr 464529738], length 0
18:32:30.614264 IP 192.168.1.10.47328 > sea15s01-in-f10.1e100.net.https: Flags [.], ack 32714, win 638, options [nop,nop,TS val 397298 ecr 464529744], length 0
18:32:30.616055 IP sea15s01-in-f10.1e100.net.https > 192.168.1.10.47329: Flags [.], seq 48394:49742, ack 1272, win 178, options [nop,nop,TS val 4291466895 ecr 397284], length 1348
18:32:30.616093 IP sea15s01-in-f10.1e100.net.https > 192.168.1.10.47329: Flags [.], seq 49742:51090, ack 1272, win 178, options [nop,nop,TS val 4291466895 ecr 397284], length 1348
18:32:30.618651 IP sea15s01-in-f10.1e100.net.https > 192.168.1.10.47329: Flags [.], seq 51090:52438, ack 1272, win 178, options [nop,nop,TS val 4291466898 ecr 397284], length 1348
18:32:30.618695 IP sea15s01-in-f10.1e100.net.https > 192.168.1.10.47329: Flags [.], seq 52438:53786, ack 1272, win 178, options [nop,nop,TS val 4291466898 ecr 397284], length 1348
18:32:30.621250 IP sea15s01-in-f10.1e100.net.https > 192.168.1.10.47329: Flags [.], seq 53786:55134, ack 1272, win 178, options [nop,nop,TS val 4291466900 ecr 397284], length 1348
18:32:30.621268 IP sea15s01-in-f10.1e100.net.https > 192.168.1.10.47329: Flags [.], seq 55134:56482, ack 1272, win 178, options [nop,nop,TS val 4291466900 ecr 397284], length 1348
18:32:30.629476 IP 192.168.1.10.47329 > sea15s01-in-f10.1e100.net.https: Flags [.], ack 24130, win 553, options [nop,nop,TS val 397299 ecr 4291466881], length 0
18:32:30.629495 IP 192.168.1.10.47329 > sea15s01-in-f10.1e100.net.https: Flags [.], ack 26826, win 574, options [nop,nop,TS val 397299 ecr 4291466881], length 0
18:32:30.630767 IP sea15s01-in-f10.1e100.net.https > 192.168.1.10.47328: Flags [.], seq 51586:52934, ack 1299, win 178, options [nop,nop,TS val 464529780 ecr 397294], length 1348
18:32:30.630816 IP sea15s01-in-f10.1e100.net.https > 192.168.1.10.47328: Flags [.], seq 52934:54282, ack 1299, win 178, options [nop,nop,TS val 464529780 ecr 397294], length 1348
18:32:30.631986 IP sea15s01-in-f10.1e100.net.https > 192.168.1.10.47328: Flags [.], seq 54282:55630, ack 1299, win 178, options [nop,nop,TS val 464529780 ecr 397294], length 1348
18:32:30.632026 IP sea15s01-in-f10.1e100.net.https > 192.168.1.10.47328: Flags [.], seq 55630:56978, ack 1299, win 178, options [nop,nop,TS val 464529780 ecr 397294], length 1348
18:32:30.633858 IP 192.168.1.10.47328 > sea15s01-in-f10.1e100.net.https: Flags [.], ack 35410, win 659, options [nop,nop,TS val 397299 ecr 464529744], length 0
18:32:30.633870 IP 192.168.1.10.47329 > sea15s01-in-f10.1e100.net.https: Flags [.], ack 29522, win 595, options [nop,nop,TS val 397300 ecr 4291466881], length 0
18:32:30.634028 IP 192.168.1.10.47328 > sea15s01-in-f10.1e100.net.https: Flags [.], ack 38106, win 680, options [nop,nop,TS val 397300 ecr 464529744], length 0
18:32:30.634040 IP 192.168.1.10.47329 > sea15s01-in-f10.1e100.net.https: Flags [.], ack 32218, win 616, options [nop,nop,TS val 397300 ecr 4291466881], length 0
18:32:30.634060 IP 192.168.1.10.47328 > sea15s01-in-f10.1e100.net.https: Flags [.], ack 40802, win 701, options [nop,nop,TS val 397302 ecr 464529747], length 0
18:32:30.634070 IP 192.168.1.10.47328 > sea15s01-in-f10.1e100.net.https: Flags [.], ack 43498, win 722, options [nop,nop,TS val 397302 ecr 464529749], length 0
18:32:30.634079 IP 192.168.1.10.47329 > sea15s01-in-f10.1e100.net.https: Flags [.], ack 34914, win 638, options [nop,nop,TS val 397303 ecr 4291466882], length 0
18:32:30.634089 IP 192.168.1.10.47328 > sea15s01-in-f10.1e100.net.https: Flags [.], ack 46194, win 743, options [nop,nop,TS val 397303 ecr 464529751], length 0
18:32:30.634103 IP 192.168.1.10.47329 > sea15s01-in-f10.1e100.net.https: Flags [.], ack 37610, win 659, options [nop,nop,TS val 397303 ecr 4291466885], length 0
18:32:30.634630 IP sea15s01-in-f10.1e100.net.https > 192.168.1.10.47328: Flags [.], seq 56978:58326, ack 1299, win 178, options [nop,nop,TS val 464529781 ecr 397294], length 1348
18:32:30.634696 IP sea15s01-in-f10.1e100.net.https > 192.168.1.10.47328: Flags [.], seq 58326:59674, ack 1299, win 178, options [nop,nop,TS val 464529781 ecr 397294], length 1348
18:32:30.637016 IP sea15s01-in-f10.1e100.net.https > 192.168.1.10.47328: Flags [.], seq 59674:61022, ack 1299, win 178, options [nop,nop,TS val 464529781 ecr 397294], length 1348
18:32:30.637094 IP sea15s01-in-f10.1e100.net.https > 192.168.1.10.47328: Flags [.], seq 61022:62370, ack 1299, win 178, options [nop,nop,TS val 464529781 ecr 397294], length 1348
18:32:30.637255 IP sea15s01-in-f10.1e100.net.https > 192.168.1.10.47328: Flags [.], seq 62370:63718, ack 1299, win 178, options [nop,nop,TS val 464529787 ecr 397296], length 1348
18:32:30.637275 IP sea15s01-in-f10.1e100.net.https > 192.168.1.10.47328: Flags [.], seq 63718:65066, ack 1299, win 178, options [nop,nop,TS val 464529787 ecr 397296], length 1348
18:32:30.639415 IP sea15s01-in-f10.1e100.net.https > 192.168.1.10.47328: Flags [.], seq 65066:66414, ack 1299, win 178, options [nop,nop,TS val 464529787 ecr 397296], length 1348
18:32:30.639463 IP sea15s01-in-f10.1e100.net.https > 192.168.1.10.47328: Flags [.], seq 66414:67762, ack 1299, win 178, options [nop,nop,TS val 464529787 ecr 397296], length 1348
18:32:30.641850 IP sea15s01-in-f10.1e100.net.https > 192.168.1.10.47328: Flags [.], seq 67762:69110, ack 1299, win 178, options [nop,nop,TS val 464529791 ecr 397298], length 1348
18:32:30.641894 IP sea15s01-in-f10.1e100.net.https > 192.168.1.10.47328: Flags [.], seq 69110:70458, ack 1299, win 178, options [nop,nop,TS val 464529791 ecr 397298], length 1348
18:32:30.644332 IP sea15s01-in-f10.1e100.net.https > 192.168.1.10.47328: Flags [.], seq 70458:71806, ack 1299, win 178, options [nop,nop,TS val 464529791 ecr 397298], length 1348
18:32:30.644370 IP sea15s01-in-f10.1e100.net.https > 192.168.1.10.47328: Flags [.], seq 71806:73154, ack 1299, win 178, options [nop,nop,TS val 464529791 ecr 397298], length 1348
18:32:30.646789 IP sea15s01-in-f10.1e100.net.https > 192.168.1.10.47328: Flags [.], seq 73154:74502, ack 1299, win 178, options [nop,nop,TS val 464529791 ecr 397298], length 1348
18:32:30.646827 IP sea15s01-in-f10.1e100.net.https > 192.168.1.10.47328: Flags [.], seq 74502:75850, ack 1299, win 178, options [nop,nop,TS val 464529791 ecr 397298], length 1348
18:32:30.649312 IP sea15s01-in-f10.1e100.net.https > 192.168.1.10.47328: Flags [.], seq 75850:77198, ack 1299, win 178, options [nop,nop,TS val 464529794 ecr 397298], length 1348
18:32:30.649351 IP sea15s01-in-f10.1e100.net.https > 192.168.1.10.47328: Flags [.], seq 77198:78546, ack 1299, win 178, options [nop,nop,TS val 464529794 ecr 397298], length 1348
18:32:30.658727 IP sea15s01-in-f10.1e100.net.https > 192.168.1.10.47329: Flags [.], seq 56482:57830, ack 1272, win 178, options [nop,nop,TS val 4291466943 ecr 397299], length 1348
18:32:30.658804 IP sea15s01-in-f10.1e100.net.https > 192.168.1.10.47329: Flags [.], seq 57830:59178, ack 1272, win 178, options [nop,nop,TS val 4291466943 ecr 397299], length 1348
